[
    {
        "user_input":"Jaké byly důsledky zavedení říšského zákona ze dne 10. prosince 1863 na chudé venkovské obce a jaké problémy tento zákon způsobil v souvislosti s pohyblivými třídami obyvatelstva a jejich právem domovským?",
        "retrieved_contexts":[
            "Paragrafy 8., 9. a 10. zákona ze dne 3. prosince 1863 říš. zák. čís. 105 byly změněny zákonem ze dne 5. prosince 1896 ř. z. čís. 222, jejž zde klademe doslovně na místě původních ustanovení. Připomínáme k tomu následovní: Společenské a hospodářské poměry obyvatelstva království a zemí v radě říšské zastoupených změnily od roku 1863 celou svou tvářnost, a jelikož se dotýká domovské právo velice těchto poměrů, pociťovala se živěji a živěji potřeba, aby byl zákon o domovském právu, který byl sdělán na základě oněch poměrů, přizpůsoben poměrům novým.  Společenské a hospodářské poměry měnily se hlavně vývojem průmyslové výroby a ruchem, který nastal ve přecházení jednotlivců z místa na místo. To mělo za následek, že tvořily se obce veliké a upadaly obce, z nichž odcházeli lidé, aby si vyhledali jinde výživy a výdělku.",
            "ských způsobené nevhodnou úpravou nabývání práva domovského, jež zavedeno bylo říšským zákonem ze dne 10. prosince 1863. Zákonem tím poškozeny byly namnoze chudé obce venkovské na prospěch zámožných a rostoucích měst a míst průmysloobyvatelům svým, pocházejícím z obcí cizích; tito bývají pak následkem toho nuceni v době nedělnosti a nedostatku hledati pomoci u své obce domovské, které ničím neprospěli, jsouce tam pravidelně úplně neznámi. Nový zákon dle názoru zemského výboru neodstraní tyto nedostatky úplně, neboť nepřetržitý pobyt 10 let je příliš dlouhý pro pohyblivé třídy obyvatelstva, jež následkem nynějších poměrů kospodářských a sociálních jsou nuceny zdržovati se mimo obec domovskou. Další vada nynějšího chudinství veřejdinských obcím dosud ponechaných přesahují síly a možnosti jednotlivých obcí domovských, které i při nejlepší vůlí nejsou s to, aby úkoly ty řádně a úspěšně obstarávaly. K úkolům těm náleží zejména zaopatřování osob chorých, dále ošetřování a výchova slabomyslných, slepých a hlucho-",
            "podal nyní sněmu zprávu, v níž zevrubně probírá otázku chudinskou a naznačuje cesty k jejímu rozřešení. Především poukazuje zem. výbor k nestejnoměrnému rozdělení břemen chudinských způsobené nevhodnou úpravou nabývání práva domovského, jež zavedeno bylo říšským zákonem ze dne 10. prosince 1863. Zákonem tím poškozeny byly namnoze chudé obce venkovské na prospěch zámožných a rostoucích měst a míst průmyslových, jež odpírala udělení práva domovského obyvatelům svým, pocházejícím z obcí cizích; tito bývají pak následkem toho nuceni v době nedělnosti a nedostatku hledati pomoci u své obce domovské, které ničím neprospěli, jsouce tam pravidelně úplně neznámi. Nový zákon dle názoru zemského výboru neodstraní tyto nedostatky úplně, neboť nepřetržitý pobyt 10 let je příliš",
            "Zákon ze dne 5. prosince 1896 ř. z. čís. 222 zní: S přisvědčením obojí sněmovny rady říšské vidí Mi se naříditi takto:  Článek I. Paragrafy 8., 9. a 10. zákona ze dne 3. prosince 1863, z. ř. čís. 105, kterým byly uspořádány záležitosti domovské, tímto se zrušují a na jejich místo mají nastoupiti ustanovení tato: §. 1. Práva domovského nabývá se výslovným přijetím do svazku domovského.  Praví-li tento §., že se nabývá práva domovského výslovným přijetím do svazku obecního, sluší tomu rozuměti tak, že se nenabývá práva toho mlčky, jako to bylo za platnosti zatím. obecního zákona z roku 1849, kde nabyl toho práva každý, o němž se prokázalo, že se zdržoval v obci nepřetrženě bez domovského listu nebo s prošlým již domovským listem. Nyní musí se o to usnésti po každé obecní výbor, nechť si udílí domovské právo z vlastní vůle, jako to bylo posud, nebo udílí je na základě desítiletého dobrovolného a nepřerušeného pobytu v obci k žádosti toho, jehož se týče. V tomto druhém případu náleží mu zkoumati, jsou-li splněny zákonní podmínky pro nabytí domovského práva a podle toho, co shledá, rozhodnouti.",
            "bylo v §. 30. instrukce pro okresní politické úřady ze dne 14. září 1852 vydávati příslušníkům obecním domovské listy, slyševše dříve obce, kteréžto opatření provádělo se až do té chvíle, kdy nynější domovský zákon platnosti nabyl, t. j. do dne 25. ledna 1864. Již tedy, vylíčivše takto poměry, ve kterých nacházela se příslušnost k obci za dob právě minulých, přistupujeme k ustanovením zákona o právu domovském, který platí nyní a zní takto:  Zákon, daný dne 3. prosince 1863, jímžto se pořádají záležitosti domovské.  Má platnost v Čechách, v Dalmátsku, v Haliči, v Krakovsku, v Rakousích pod Enží a nad Enží, Solnohradsku, Štýrsku, Korutanech, Krajině, v Bukovině, v Moravě, Slezsku, Tyrolsku, Vorarlbersku, Gorici a Gradištsku, v Istriansku a městě Trstě i v okršku Trstském. (Obsaž. v XLIII. částce zákonníka říšského č. 105 str. 368, vydané dne 10. prosince 1863.)"
        ],
        "response":"Říšský zákon ze dne 10. prosince 1863, který zavedl nové uspořádání záležitostí domovských, poškodil namnoze chudé venkovské obce na prospěch zámožných a rostoucích měst a průmyslových míst. [doc2, doc3] Tento zákon způsoboval, že obyvatelé pocházející z jiných obcí byli odmítáni při udělování práva domovského, což je nutilo v době nedostatku hledat pomoc u obce domovské, které nic neprospěli a byly jim neznámé. [doc2, doc3]\n\nNový zákon dle názoru zemského výboru neodstranil tyto nedostatky úplně, neboť desetiletý nepřetržitý pobyt pro nabytí práva domovského byl příliš dlouhý pro pohyblivé třídy obyvatelstva, které byly nuceny zdržovat se mimo obec domovskou kvůli hospodářským a sociálním poměrům. [doc2, doc3] Dále, břemena chudinských byly nerovnoměrně rozděleny, což přesahovalo síly a možnosti jednotlivých obcí domovských. [doc2, doc3]",
        "reference":"Zavedení říšského zákona ze dne 10. prosince 1863 poškozovalo chudé venkovské obce na prospěch zámožných a rostoucích měst a míst průmyslových, protože obyvatelé pocházející z cizích obcí byli nuceni hledat pomoc u své obce domovské, kde byli neznámí a ničím neprospěli. Nový zákon neodstranil tyto nedostatky úplně, protože požadavek nepřetržitého pobytu 10 let byl příliš dlouhý pro pohyblivé třídy obyvatelstva, které byly nuceny zdržovat se mimo obec domovskou kvůli ekonomickým a sociálním poměrům.",
        "faithfulness":1.0,
        "answer_relevancy":0.8297981591,
        "answer_correctness":0.8586184714,
        "context_precision":1.0,
        "context_recall":1.0,
        "context_sufficiency":1.0
    },
    {
        "user_input":"Jaké byly důsledky odhalení pomníku Josefa Dobrovského v Praze na vnímání jeho odkazu a jak se to projevilo ve veřejném prostoru města?",
        "retrieved_contexts":[
            "sti příslušnou zprávu. * Odhalení pomníku Wilsonova v Praze. Američané československého původu za součinnosti Národní rady československé v Praze a za protektorátu presidenta Čsl. republiky T. G. Masaryka pořádají slavnost odhalení pomníku presidenta Woodrow Wilsona před Wilsonovým nádražím v Praze v den amerického národního svátku ve středu 4. července dopoledne. Na betonových základech, postavených péčí hlav. města Prahy, počíná kamenická továrna Cingrošova z Plzně osazovati obrovské kvádry z jihočeské žuly, na něž bude umí stěn bronzový pomník Wilsonův, ulitý v atelieru Anýžově podle modelu česko-amerického sochaře Albína Poláška. *Oslavy založení Klubu čsl. Turistů. Slavnostní shromáždění turistické na pamět 40. výročí založení KčsIT. konalo se v sobotu dopoledne v Obecním",
            "slice ukazují, nezbývá nám nic jiného, než pěkně platit — a zas platit. Pomník věhlasného učence českého Josefa Dobrovského odhalen byl v den sv. Petra a Pavla o půl 11 hod. dopoledne ve městském sadě blíže musea království českého v Praze. Pomníkem tímto bude počet veřejných pomníků, kterými se máti českých měst Praha honosí, opět rozmnožen. Těšíme se z toho velice, že pomník tento platí křísiteli národa našeho, který mu mimo tento pomník zachová ještě jiný, a to věčnou pamět v srdcích svých. Dle učení Tolstého. „Nový kult“ v 9. svém čísle v překladu má tento zajímavý dopis. Bývalý vojenský lékař dr. Skarvan byv vyzván obecní radou v Locarnu ve Švýcarsku, aby zaplatil daně, odpověděl následujícím listem. „Obecní radě v Locarnu! Dne 24. t. m. přišel do mého bytu jeden",
            "škol Velké Prahy uspořádá spolek „Středoškolská sociální péče“ v neděli dne 27. t. m. v Praze I.—VIII. Netřeba zajisté líčiti, jak těžko se bydlí nemajetnému studentu v Praze a jak často nevhodným bydlením trpí mravně a zhusta i na zdraví. Proto je jistě velmi záslužné přispěti ke zlepšení bytových poměrů jeho. Přispějte tudíž každý dle možnosti na tento podnik! * Odhalení pomníku italským vojínům na vojenském hřbitově v Milovicích. Dne 24. května u příležitosti 8. výročí vstupu Italie do války koná se o 10. hod. dopol. slavnost odhalení pomníku italským vojínům na vojenském hřbitově v Milovicích. Pomník, bronzový věnec na umělecky řešeném žulovém kvádru, je dílem italského sochaře Cianiho. Slavnosti zúčastní se italský vyslanec baron Bordonaro, vojenský attaché",
            "láskou a nadšením sbíral po všech koutech Evropy. A dole v Praze, kde bije srdce národa, budiž mu věnován pomník. Nemusí to býti pomník velkolepý — tichá a skromná byla jeho činnost, tichý a skromný může býti jeho památník. Pamětní desky na jeho bydlištích sotva bude lze upevniti: hrabě Nostic nechává svůj palác žloutnouti německými tabulkami, pozdější bydliště Dobrovského stalo se generálním velitelstvím, — ale snad by se v Museu, o které se tak staral a pečoval, mohla zříditi — po spůsobu jiných knihoven veřejných — jedna síň na památku jeho, tam by mohly býti přeneseny i jeho rukopisy, tam by mohlo býti postaveno jeho poprsí, a pověšen jeho obraz. Nynější deska se zlatým jeho jmenem ztracena je v zadu budovy musejní — jen nějaký zbloudilý chodec, přicházející z tiché",
            "velikánu a knězi buditeli Josefu Dobrovskému. Mistrovské dílo nadějného umělce Žďárského, jehož v rozpuku vývinu jeho umělecké tvorby povolal Nejvyšší do svých nevyzpytatelných končin, náleží k nejlepším a nejzdařilejším výtvorům jeho velikého umění a bude zajisté chloubou a ozdobou nejen naší matičky Prahy, nýbrž celého českého národa. Den 29. června 1902 bude opravdovým svátkem všeho českého lidu a velikému učenci Josefu Dobrovskému projevena bude tímto pomníkem nezměrná úcta a láska, s níž český lid na svého buditele s vděkem pohlíží. Aby oslava odhalení pomníku Josefu Dobrovskému byla opravdovým svátkem celého národa a důstojnou representací naši Besedy, vyzýváme tímto co nejlaskavěji všechny p. t. dámy a pány, kteří bývali před lety horlivými členy naší"
        ],
        "response":"Odhalení pomníku Josefa Dobrovského v Praze bylo vnímáno jako významná událost pro český národ. Den 29. června 1902 byl označen za \"opravdový svátek všeho českého lidu\" a projevem \"nezměrné úcty a lásky\" k učenci [doc5]. Pomník, mistrovské dílo umělce Žďárského, měl být \"chloubou a ozdobou nejen naší matičky Prahy, nýbrž celého českého národa\" [doc5].\n\nPomník byl umístěn ve městském sadě, blíže musea království českého [doc2], a měl být součástí počtu veřejných pomníků, kterými se Praha honosí [doc2]. Odkaz Josefa Dobrovského byl posílen tím, že pomník byl vnímán jako symbol jeho přínosu pro český národ a jeho role \"buditele\" [doc5]. Vnímání jeho odkazu bylo dále umocněno výzvami k účasti na oslavě odhalení pomníku, které byly adresovány všem členům Besedy [doc5].",
        "reference":"Pomník Josefa Dobrovského v Praze přispěl k rozmnožení počtu veřejných pomníků, kterými se město Praha honosí, a zároveň slouží jako pocta křísiteli národa, jehož odkaz bude zachován nejen tímto pomníkem, ale i věčnou pamětí v srdcích lidí.",
        "faithfulness":1.0,
        "answer_relevancy":0.8982168813,
        "answer_correctness":0.5362445151,
        "context_precision":0.5333333333,
        "context_recall":1.0,
        "context_sufficiency":0.0
    },
    {
        "user_input":"Jaké jsou důsledky nesprávného použití nástrojů při odstraňování ušního mazu a jaké preventivní opatření je doporučeno k minimalizaci rizika infekce?",
        "retrieved_contexts":[
            "minálních infekcí je pak závažná infekce anaerobní (39). Pooperační infekce ran provázejí v USA 1—3 % chirurgických zákroků a asi u 5% osob přijatých do nemocnice lze očekávat, že se u nich během pobytu vyvine infekce některého druhu. Výskyt infekcí operační rány do 1% je považován za normální, od 1 do 2 % za přijatelný, nad 2 % za znepokojivý (4). Užití antibiotik k profylaxi v porodnictví a gynekologii je v boji proti pooperační infekci nepochybně cenné, především pro pacientku samotnou. Má ale i ekonomické důsledky: vede ke snížení doby hospitalizace, ke snížení počtu řady laboratorních vyšetření, která jsou nutná v případech zánětlivé pooperační komplikace a nakonec šetří práci sester i lékařů. Na druhé straně použití antibiotik ve smyslu profylaxe nese s sebou nebezpečí jisté selekce mikrobů, ale hlavně možnosti vzniku",
            "propracována Jírovcem a Peterem a jejich spolupracovníky. Znalost jejich základních prací má být samozřejmostí pro každého gynekologa. 2. Rozpoznání, příznakosloví a léčba trichomoniasy muže, který je článkem v přenosu infekce a zdrojem recidiv při konjugální formě trichomoniasy. 3. Preventivní opatření vlastní. Má-li dojít k likvidaci trichomoniasy jako choroby sociální, je třeba se řídit obdobnými zásadami, které jsou běžné při ošetřování kapavky a příjice, t. j. zjištění zdroje nákazy, zde aktivní vyhledávání bezpříznakových nosičů. Trichomoniasa je chorobou pohlavní, ne sice ve smyslu právním, leč nesporně ve smyslu biologickém. Řešení preventivních opatření proti trichomoniase je však daleko svízelkaře sám. Při ošetřování mužské trichomonádové urethritis je nám vyšetření a",
            "len, welche selbst für den Ohrenarzt mit geeigneten Instrumenten nicht immer leicht zu entfernen sind; der Laie, der mit Haarnadeln und dergleichen ohne Hilfe des Ohrenspiegels und ohne die nötige Sachkenntnis im Gehörgang bohrt, wird im günstigsten Fall den Fremdkörper tiefer hineinstoßen; gar zu leicht aber wird er Unglück anrichten, den Gehörgang zerkratzen und zerquetschen, das Trommelfell zerreißen, die Gehörknöchelchen verletzen oder gar den Gegenstand in die Trommelhöhle drücken. Auf diese Weise, mit den besten Absichten, hat schon mancher eine schwere; das Gehör vernichtende Eiterung zuwege gebracht. Es sind sogar Fälle verzeichnet, welche infolge derartiger Hilfsversuche mit dem Tod geendet haben. Ein Fremdkörper im Gehörgang bringt zunächst keinerlei Gefahr mit sich, sofern",
            "häuslichen Instrumenten. In diese Rubrik gehören auch die infolge des Unfugs des Ohrringstechens sich entwickelnden Rothläufe, denen schon etliche hoffnungsfreudige junge Menschenleben zum Opfer gefallen sind. Weiter sind es dann die mit meist ziemlich intensivem Juckreiz combinirten Hauterkrankungen, welche die Infection vermitteln helfen; in erster Linie ist hier zu nennen das chronische, mit Infiltration und leichter Schuppung einhergehende so häufige Eczem der Muschel und des Meatus, dann der rein nervöse oder auf dyskrasischer Basis beruhende Pruritus, sowie seltener die Pityriasis und Psoriasis. Ebenso kann sich unter Umständen an die einfache und scheinbar so harmlose Evacuation eines Cerumenpfropfes, wie dies durch die Beobachtung Wagenhäuser’s erhärtet ist, ein Rothlauf anschlies-",
            "aktivity pankreatických enzymů v séru a moči (amyláza, lipáza) za 24 a 48 hodin po výkonu byly u 59 osob (37,5 % všech kanylací) zachyceny zvýšené hodnoty. Při naplnění pankreatického vývodu (110krát) došlo k přechodnému zvýšení enzymů trvajícímu 1—2 dny v 50 %, při naplnění žlučových cest pouze v 8,5 % (4 ze 47 náplní). — Akutní pankreatitida komplikovala vypšetření u 7 osob, tj. v 4,45% všech kanylací, resp. zvýšení teploty do 38 °C. Komplikace jiného rázu, zejména projevy sepse, alergie a kardiovaskulární příhody nebyly pozorovány. Ve všech případech byla akutní pankreatitida zvládnuta konzervativní léčbou antibiotiky, Trasylolem a parenterální výživou. — Je upozorněno na možné příčiny vzniku vedlejších reakcí při ERCP a jsou doporučena metodická i preventivní a léčebná opatření při výkonu a po něm ke zmenšení rizika komplikací."
        ],
        "response":"Pokusy o odstranění ušního mazu s pomocí laických nástrojů, jako jsou jehlice, mohou vést k vážným následkům [doc3]. Může dojít k zhoršení stavu, poškrábání a rozdrcení zvukovodu, protržení bubínku, poranění sluchových kůstek nebo vniknutí cizího tělesa do dutiny bubínku [doc3]. V extrémních případech mohou takovéto pokusy vést až k sepse a smrti [doc3]. Podobné komplikace mohou být způsobeny i nesprávným ošetřením piercingu ucha [doc4]. K minimalizaci rizika infekce je doporučeno se vyhnout neodbornému zásahu a vyhledat odbornou pomoc [doc4].",
        "reference":"Nesprávné použití nástrojů při odstraňování ušního mazu může vést k poranění kůže a vniknutí nákazy z mazu chovajícího spousty bakterií do rány, což může mít za následek otitis externa, furunculi atd. Doporučuje se používat stříkačku, která je konstruována tak, aby se dala co nejpřísněji sterilizovat, a měla by být opatřena měkkou trubicí kaučukovou.",
        "faithfulness":1.0,
        "answer_relevancy":0.9219527513,
        "answer_correctness":0.7898823458,
        "context_precision":0.4166666666,
        "context_recall":0.5,
        "context_sufficiency":0.0
    },
    {
        "user_input":"Jaké jsou důvody pro použití různých léčebných metod u novorozenců a dospělých s očními infekcemi, a jaké jsou potenciální důsledky nesprávného použití těchto metod?",
        "retrieved_contexts":[
            "vrhnutí neb aspoň nucení k němu. Zkrátka obraz, který za dřívějších časů dostával diagnostickou etiketu — zánět pobřišnice neb aspoň „podráždění pobřišnice“. Pod tutéž diagnosu dříve vůbec — a nyní někdy následkem nedostatečné diagnosy zařaďována apendicitis, ba i peritubární hematom nebo retrouterinní hematokela, ježto i při nich příznaky od pobřišnice nejvíce bijí do očí. Ač při těchto stavech mnohé příznaky jsou si podobné, ač v mnohém i léčba se kryje, přece nutno, pokud možno, diagnosu přesně stanoviti vždyť o jak široké pole patologické anatomie jde: parametritis, pelveoperitonitis, salpingitis, adnexální tumor, apendicitis a tubární gravidita. Jak osudné následky mohla by na př. míti nevhodná terapie masáží při pyosalpinx nebo retrouterinní hematokele. Je tedy naším dalším úkolem vytknouti klinické přesné příznaky, podle nichž uvedené patologické stavy můžeme rozlišiti.",
            "stigmin, jenž se vkapává v 1\/40 roztoku několikráte denně. Mimo to lze vkapovati každou hodinu aq. chlorat. (1: 2 až 1:3 aq. destill.). Prognosticky jest důležito, že obrat k lepšímu nastává súžením se zorničky. Ku vyjasnění jizev rohovkových, kteréž ovšem lze konati teprve po úplném přestání sekrece, používá se zprvu tinct opiová, každodenně dopoledne. Jelikož novorozenec jest velmi citlivý oproti opiu, nesmí se přenechati podávání jeho lidem domácím. Důležito jest sesíliti zároveň celkový stav dítěte. Mnohem obtížnější jest léčiti gonnorrhoický zánět spojivky u dospělého, jelikož tu i zdánlivě lehký případ může končiti přes nejpečlivější léčení oslepnutím. Tu jest nutno bez výjimky poslati nemocného do nemocnice k ošetřování. (Münch. Med. Woch. 1896, č. 7.) z—.",
            "8.1 8.1.1 8.1.2 8.2 8.3 8.4 8.4.1 8.4.2 8.4.3  9.1 9.2 9.3 9.3.1 9.3.2 9.4 9.5 9.6  Transfuzní přípravky Transfuze a její dokumentace Indikace k transfuzi Komplikace při a po transfuzi Povinnosti sestry při transfuzi Znecitlivění  Anestezie místní Anestezie celková Narkotizační přístroj Anestetika celková Anestetika inhalační Anestetika nitrožilní Záněty Nespecifické záněty Průběh zánětu Typy zánětu Specifické záněty Anaerobní infekce Léčba zánětu Preventivní opatření .... Chirurgické ošetření a léčba Medikamentózní léčba  Nádory benigní Nádory maligní . Dělení nádorů podle původu Nádory mezenchymální Nádory epiteliální Léčba nádorů Prevence a depistáž nádorů Ošetřování a psychologický přístup k onkologicky nemocným  41 41 41 . 42 .. 42 ... 43  45 45 .. 45 .. 46 .. 47 .. 47 ... . ... 47",
            "Obr. 159. Salpingitis nodosa.  Všechny tři uvedené případy mají mnohé klinické symptomy společné. Náhlý vznik, bolest v životě, spontánní i při doteku, zvýšenou teplotu, vrhnutí neb aspoň nucení k němu. Zkrátka obraz, který za dřívějších časů dostával diagnostickou etiketu — zánět pobřišnice neb aspoň „podráždění pobřišnice“. Pod tutéž diagnosu dříve vůbec — a nyní někdy následkem nedostatečné diagnosy zařaďována apendicitis, ba i peritubární hematom nebo retrouterinní hematokela, ježto i při nich příznaky od pobřišnice nejvíce bijí do očí. Ač při těchto stavech mnohé příznaky jsou si podobné, ač v mnohém i léčba se kryje, přece nutno, pokud možno, diagnosu přesně stanoviti vždyť o jak široké pole patologické anatomie jde: parametritis, pelveoperitonitis, salpingitis, adnexální tumor, apendicitis a tubární gravidita. Jak osudné následky mohla by na př. míti nevhodná terapie masáží při pyosalpinx nebo retrouterinní hematokele. Je tedy naším dalším úkolem vytknouti klinické přesné příznaky, podle nichž uvedené patologické stavy můžeme rozlišiti.",
            "Návštěva zástupců Rockefellerovy nadace v Praze 71. Nefrolithiasy, therapie 123. Nefrosy dětí 200. Německá říše, výcvik lékařů ve veř. zdrav. 30. Nemoci, boj proti nim 261, 337. Nemoc, invalidita 310, 326. Nemoc nížinová 473. Nemocnice Něm. Brod, zpráva 357. — v Pelhřimově, zpráva 12. — v Semilech, zpráva 12. Nervosní lidé, léčení 197. Neschopnost pracovní, amputace prstů 482. Neštovice plané 54. Neurasthenie, koupele bylinné 88. Neuritis ulironová 41. Neurologie, léčba teplem 416. Nikotin, škodlivost 262. Nitrosové plyny, následky otrav 396. Nohy ploché, příčina 14. — — těžkého stupně 146. Nosní kapky, preskripce 320. — plastika 340. Novorozenci, fysiologie a pathologie 74.  Obilí, fysiologie 15. Obrna dolních končetin dětí po spirocidu 85. Obstipace spastická 460."
        ],
        "response":"U novorozenců a dospělých se liší léčebné metody při očních infekcích, a to kvůli odlišné citlivosti a potenciálním důsledkům. Léčba gonorrhoické zánětu spojivek u dospělých je obtížnější, protože i zdánlivě lehký případ může vést k oslepnutí i přes pečlivou léčbu [doc2]. Proto je nutné ošetřování v nemocnici [doc2]. U novorozenců je důležitý sesílení celkového stavu dítěte a opatrnost při podávání opiu, jelikož jsou velmi citliví [doc2].",
        "reference":"U novorozenců je důležité sesílit celkový stav dítěte a opium nesmí být podáváno lidem domácím kvůli citlivosti novorozence. U dospělých je léčba gonnorrhoického zánětu spojivky obtížnější, protože i zdánlivě lehký případ může končit oslepnutím, a proto je nutné poslat nemocného do nemocnice k ošetřování. Potenciální důsledky nesprávného použití léčebných metod zahrnují oslepnutí u dospělých a riziko pro novorozence kvůli citlivosti na opium.",
        "faithfulness":0.7142857143,
        "answer_relevancy":0.9438186015,
        "answer_correctness":0.6401547881,
        "context_precision":0.9166666666,
        "context_recall":1.0,
        "context_sufficiency":0.0
    },
    {
        "user_input":"Jaké byly důvody pro vyloučení komunistické revoluce v Německu a jakou roli v tom hrála organizace občanstva a politická situace v zemi?",
        "retrieved_contexts":[
            "Nic nového u imperialistů Dne 9. listopadu 1918 vznikla německá republika, nazývaná také výmarská podle sídla své vlády, anebo Ebertova podle svého prvniho říšského presidenta, pravicového sociálního demokrata Eberta. Je velmi poučné vzpomenout si na tyto doby z konce první světové války. Německá republika vznikla tehdy z revolučního pozdvižení německého lidu proti imperialistické válce kaisrovského Německa. Lid podle vzoru ruského proletariátu ustavoval revoluční dělnické a vojenské rady, žádal okamžitou socialisaci a volal po potrestáni válečných zločinců. Porýnšti a westfálští dělníci zatkli Fritze Thyssena, obsadili uhelný syndikát v Essenu a žádali okamžitou socialisaci uhelných dolů. V té době první vláda (pravicového sociálního demokrata Scheidemanna) německé republiky, zro-",
            "dové povstání proti monarchii — hlavní agentuře německého imperialismu — proti vládnoucí kapitalistické třídě, která využívala války k loupení a obohacování se. Kdyby byla strana tehdy razila heslo za mír a za lidovou demokratickou republiku, mohla sjednotit — o tom není pochyby — ohromnou masu pracujících měst i venkova. Spolupráce mezi naší stranou a Zemědělským svazem by zajistila úspěch povstání. Jedno vítězné lidové povstání ve jménu lidové republiky v r. 1918 mohlo změnit celý směr vývoje země a Balkánu v zájmu ohromné většiny našeho lidu. Hlavní příčina, proč se naše strana nepostavila v čelo povstalých vojenských mas na podzim roku 1918, spočívá v jejím doktrinářství, nebolševických názorech, v metodách a přežitcích těsného socialismu. Naší straně chybělo leninské pochopení svéráznosti revolučního procesu v různých zemích, chyběl jí poměr a organisační spojení boje za demokracii s bojem za socialismus, naše strana myslela, že nastala epocha socialistické revoluce a že marxistická strana nemůže razit heslo lidové demokracie jako heslo ne specificky socialistické. Chybělo jí leninské chá-",
            "až 1919. Především je sledována činnost dělnických rad, které vystupovaly tehdy velmi aktivně, žádaly socialisaci továren a dolů i prosazovaly různá sociální zlepšení, zvýšení mezd, zkrácení pracovní doby apod. Všechny tyto akce měly však živelný charakter a nenacházely podporu u vedení sociální demokracie, jejíž předáci Ebert, Noske a jiní zůstali i po převzetí moci věrnými služebníky kapitalistů. Stejné stanovisko zastávali i přední ideologičtí činitelé německé sociální demokracie Kautský, Bernstein a Hilferding, kteří rovněž dokazovali dělníkům, že doba není ještě »zralá« pro provádění socialisace. Přes tyto nepříznivé okolnosti nabyly akce za uskutečnění socialisa ce velkých rozměrů a ovlivnily celý rozvoj revolučního hnutí v Německu. Při zpracování této stati používal autor",
            "zené z revolučního pozdvižení lidu, si rychle našla odlehlý Výmar už předem s úmyslem uniknout tam revolučnímu tlaku mas. Už dne 10. listopadu — 24 hodiny po té, kdy se posadil do křesla z titulu lidové revoluce - Ebert si vyjednal s Hindenburgem deset císařských divisi s ostrou munici pro Berlin, aby vyrval moc z rukou dělnických a vojenských rad. Němečtí pravicovi sociální demokraté měli svou dávnou odpornou tradici zrady. Jejich „theoretik“ Bernsteln jim „zrevidoval“ marxismus v „pokojné vzrůstáni kapitalismu do socialismu“ a pravicovi vůdcové volali po koloniích,  odhlasovali válečné úvěry a hned po revoluci ujali se katovské práce ve službách imperialistů, s úkolem zmařit uskutečněni cílů revoluce. Už dne 15. listopadu se dožili Stinnes, Thyssen a",
            "šovinismus a velmocenské ambice, které zajišťovaly německému militarismu podporu velkoburžoazie, většiny středních vrstev a nakonec i části proletariátu. To napomohlo k zesílení významu a vlivu monopolního kapitálu a růstu jeho zisků. Vedlo to i k polarizaci sil v dělnickém hnutí, vzniku revizionismu na jedné straně a revolučně orientovaných levicových sil na straně druhé. Tento rozpor výrazně manifestoval jejich rozdílný postoj při vypuknutí války v roce 1914. V další části je ukázán podíl německé sociální demokracie na dezorientaci proletariátu během válečných let a úsilí levice o obnovení třídního vědomí pracujících. Podstatný vliv v tomto směru měla však až Říjnová revoluce r. 1917 v Rusku, která podnítila i nový rozmach třídních bojů v Německu, jehož vy-"
        ],
        "response":"V Německu po první světové válce vznikla německá republika, známá také jako výmarská republika, v důsledku revolučního pozdvižení německého lidu proti imperialistické válce [doc1]. Dělníci zřizovali revoluční dělnické a vojenské rady a požadovali socializaci [doc1]. Nicméně, podle dokumentu [doc2], hlavní příčinou, proč se strana nepostavila v čele povstání, bylo její doktrinářství, nebolševické názory a přežitky těsného socialismu [doc2]. Strana postrádala leninské pochopení svéráznosti revolučního procesu a spojení boje za demokracii s bojem za socialismus [doc2].\n\nDále, podle dokumentu [doc3], akce za uskutečnění socializace nabyly velkých rozměrů a ovlivnily rozvoj revolučního hnutí, ale nenacházely podporu vedení sociální demokracie, které zůstalo věrné kapitalistům [doc3]. Dokument [doc4] uvádí, že němečtí pravicoví sociální demokraté měli „odpornou tradici zrady“ a jejich „theoretik“ Bernstein „zrevidoval“ marxismus [doc4].\n\nDokument [doc5] zmiňuje šovinismus a velmocenské ambice, které zajišťovaly německému militarismu podporu velkoburžoazie a části proletariátu [doc5].",
        "reference":"Komunistická revoluce v Německu byla vyloučena, protože občanstvo bylo příliš silné a dobře organizované, což by umožnilo potlačit každé takové hnutí.",
        "faithfulness":1.0,
        "answer_relevancy":0.0,
        "answer_correctness":0.5942336057,
        "context_precision":0.5333333333,
        "context_recall":0.0,
        "context_sufficiency":1.0
    },
    {
        "user_input":"Jaké byly důsledky kritické situace stavebních živnostníků, na kterou poukázali řečníci jako stavitel Havlena a tajemník Pekárek, a jak tato situace souvisí s politickými změnami v Rumunsku a Ukrajině, které jsou zmíněny v textu?",
        "retrieved_contexts":[
            "prý již takřka učiněna dohoda o 300.000 tunách. Maďaři žádají ještě dalších 100.000 starý systém politické moci v Rumunsku, kde tun slezského uhlí. — Protestní schůze stavebních živnostníků vláda bývala v rukou šlechty, která býla téměř konala se včera večer v sále Měšťanské Bejediným živlem v parlamentu. Směr celé vlády sedy v Praze, kdež promluvili jako hlavní řečurčovala osoba ministerského předsedy, resp. níci stavitel Havlena a tajemník Pekárek a závůle panovníkova. stupci 26 společenstev, zejména za zámečníky Dnes trvá sice v Rumunsku království, avšak p. Payer, za elektrotechniky p. Vondřich a za strojní průmysl p. Káš, kteří poukázali na kri značně. Zavedení všeobecného, přímého, tajného tickou situaci svého stavu, jíž zaviňuje nedopráva hlasovacího do poslanecké sněmovny a",
            "dr. Šlemr obchodně politický referát, finační rada Wagner podal referát finanční a promluvil o nových daňových předlohách, dr. Verunáč zmínil se pak o mzdové situaci ve stavebním průmyslu, jakož i o všeobecných sociálně politických otázkách. Sekretář Ing. Beneš přednesl pak ku konci schůze návrh resoluce, jež byla jednomyslně přijata. V této resoluci se m. j. praví: „Průmysl staviv ocitá se nyní vlivem neutěšených poměrů výrobních i odbytových v těžké krisi. Naprostá stagnace ve stavebnictví zaviňuje houfné omezování a zastavování práce v našich továrnách a přivádí průmyslu staviv, dělnictvu i státu nenahraditelné škody materielní. Průmysl staviv žádá v otázkách výrobních: 1. Zlevnění životních potřeb, aby větší měrou umožněno bylo dělnictvu snížení mzdo-",
            "dokonalost ještě zvětšovalo před níky při udržovacích pracích v záúnorem rozvratné působení souvodech. Na stavbách ČSZ je nekromých podnikatelů. Jiným nedodostatek dělníků. Odstranění čerstatkem stavebnictví před únorem ných mezd zjevných i skrytých, bylo, že o plánování v závodech které stále ještě rozvracejí proi na stavbách nebylo v naprosté covní morálku a odvádějí dělníky většině potuchy, a konečně další ze staveb, je úkolem nezbytným a závadou bylo, že se stavební manaléhavým. Rovněž většího porozteriál dostával a do značné míry umění pro potřeby znárodněného ještě dnes se dostává na stavbu stavebního průmyslu při spolutak složitými cestami, že v celých práci s jinými výrobními obory, svazcích nepřehledných právních i mezi soukromým řemeslným sekto-",
            "dokonalost ještě zvětšovalo před níky při udržovacích pracích v záúnorem rozvratné působení souvodech. Na stavbách ČSZ je nekromých podnikatelů. Jiným nedodostatek dělníků. Odstranění čerstatkem stavebnictví před únorem ných mezd zjevných i skrytých, bylo, že o plánování v závodech které stále ještě rozvracejí proi na stavbách nebylo v naprosté covní morálku a odvádějí dělníky většině potuchy, a konečně další ze staveb, je úkolem nezbytným a závadou bylo, že se stavební manaléhavým. Rovněž většího porozteriál dostával a do značné míry umění pro potřeby znárodněného ještě dnes se dostává na stavbu stavebního průmyslu při spolutak složitými cestami, že v celých práci s jinými výrobními obory, svazcích nepřehledných právních i mezi soukromým řemeslným sekto-",
            "Textilní velkoobchodníci nejsou bohužel sami, a je proto nevyhnutelně třeba, aby stejný osud stihl také všechny ostatní rozvratnické živly, které maří budovatelské úsilí zdrcující většiny národa. Jedním z nejpřednějších úkolů bude nyní zavedení pořádku do stavebnictví, abychom letos nekončili s takovým výsledkem, jako loni. Cementárny o cihelny pracují, ale cementu a cihel  je málo. Velice málo! Chyba není v plánu, nýbrž v tom, že stavební materiál kdesimizí. Není tajemstvím, kde: na černých a t. zv. šedých stavbách. Jsou lidé, kteří již dnes mají dost peněz, aby mohli stavět „rodinné domy“ s šesti i více pokoji. Aby dostali stavební povolení mimo dvouletý plán, podepíší místopřísežné prohlášení, že mají stavební materiál (úřady se nezeptají,"
        ],
        "response":"Stavitel Havlena a tajemník Pekárek poukázali na kritickou situaci stavebních živnostníků. Průmysl staviv se ocitl vlivm neutěšených poměrů výrobních i odbytových v těžké krizi [doc2]. Tato stagnace ve stavebnictví vedla k omezování a zastavování práce v továrnách a přiváděla průmyslu, dělnictvu i státu materiální škody [doc2].\n\nText zmiňuje politické změny v Rumunsku, kde dříve vládla šlechta, která byla \"téměř bejediným živlem v parlamentu\" [doc1]. Text dále uvádí, že v Rumunsku trvá království [doc1]. O změnách na Ukrajině text nic neříká.",
        "reference":"Důsledky kritické situace stavebních živnostníků, na kterou poukázali řečníci jako stavitel Havlena a tajemník Pekárek, nejsou v textu přímo uvedeny, a jejich souvislost s politickými změnami v Rumunsku a Ukrajině není explicitně zmíněna. Text se zaměřuje na různé problémy a politické situace v různých zemích, ale přímé propojení mezi těmito událostmi a situací stavebních živnostníků v textu chybí.",
        "faithfulness":0.875,
        "answer_relevancy":0.8478349628,
        "answer_correctness":0.2354446095,
        "context_precision":0.5,
        "context_recall":1.0,
        "context_sufficiency":0.0
    },
    {
        "user_input":"Jaké byly hlavní překážky, kterým čelil státní film v Československu před únorem 1948, a jak únorové události přispěly k jejich odstranění a následné konsolidaci filmového průmyslu?",
        "retrieved_contexts":[
            "1) Od oficiálního prohlášení britské, americké a francouzské vlády ze 27. II. 1948 (Times 27. II. 1948), které odsuzovaly řešení vládní krise v Československu, byly v uplynulých deseti letech až po poslední zasedání NATO v Paříži minulého roku v různých prohlášeních imperialistických vlád a politiků za příčinu studené války mimo jiné udávány únorové události v Československu.  hledání chyb jednotlivců, např. presidenta Beneše, dr. Zenkla aj., nemluvě již o různých smyšlenkách o zasahování Sovětského svazu a pod.2) Zřejmě dodnes nepochopili, že za svou porážku mohou v prvé řadě děkovat okolnosti, že přisluhovali třídě odsouzené dějinami k zániku, že opomíjeli ve své praktické politice dbát přání a zájmů pracujícího lidu, k čemuž se dokonce slavnostně zavázali.",
            "váno ve stavu, který bránil jeho zdravému rozvoji a pokroku a který zachovával reakčním silám naději na zvrat zestátňovacího procesu. Tvůrčí činnost byla uváděna ve zmatek prosazováním komerčních hledisek na jedné straně a rozvratnou kritikou na straně druhé. Únor 1948 zlikvidoval tyto uměle udržované nepříznivé podmínky a všechny podvratné snahy a umožnil tak rychlou a cílevědomou konsolidaci státního filmu. Ministr informací zrušil výnosem z 26. února 1948 opatření, jež poskytovala jednotlivým zplnomocněncům a úsekovým ředitelům samostatnou právní subjektivitu, a rozhodl, že jediným nositelem právní subjektivity v oblasti filmu je zestátněné filmové podnikání. Zrušil instituci zmocněnců a přenesl jejich úkoly na náměstky ústředního ředitele a ředitele úseků Československé filmové společnosti. Tím byl dán základní",
            "předpoklad sjednocení a jednotného řízení veškeré činnosti v oblasti filmu. Současně byl učiněn první krok k přípravě systematického plánování v oblasti filmu jmenováním náměstka ústředního ředitele pro plánování a výzkum a pronikavou reorganisací osobní vytvořeny nezbytné podmínky pokrokového vývoje ve filmové výrobě a distribuci. Vláda pak v jednom z prvních zasedání po únoru schvaluje ustavení státního podniku Československý státní film pro celou oblast státu jako jediného nositele veškeré činnosti v oboru filmu. Tím se odstraňuje nezdravý dualismus, pěstovaný odstředivými silami na Slovensku, který bránil stejnoměrnému vývoji filmu v celé republice. Zestátnění filmu je zabezpečeno ústavou. Státní film dostává vládním nařízením ze dne 13. dubna 1948 č. 72 Sb. pevnou právní základnu, na níž je možno vybudovati jeho řádnou organisaci a zdravý vývoj. Je možno přistoupiti k systematickému uspořádání jeho hospodářstvi, filmové výroby a distribuce a k plánovitému řízení jeho rozvoje v celé oblasti státu.",
            "razně projevilo. Zestátněný film byl před únorem 1948 předmětem soustavných, podvratných útoků. Připravovaným návrhem zákona o vynětí sokolských a některých jiných kin ze zestátnění měla býti rozrušena zásada výlučného provozování filmu státem. Štvavé pomluvy v tisku, zákulisní politické zásahy a zlovolné interpelace v Národním shromáždění ohrožovaly samu existenci státního filmu a bránily rozvinutí možností daných filmů znárodněním. Státní film odolával těmto útokům dík zdravé hospodářské základně, kterou se podařilo vytvořiti přes všechny překážky a dík významným úspěchům, kterých dosáhli jeho pokrokoví tvůrčí pracovníci nejen doma, ale i v mezinárodních soutěžích, hlavně však zásluhou pevné linie a cílevědomé politiky ministra informací Václava Kopeckého, jenž dovedl proti",
            "filmů je zaměřena bezvýhradně k plnění vysokého kulturního poslání. Únor 1948 umožnil, aby hospodářské a technické kvantity a početné a významné prostředky filmu byly cílevědomě zapojeny do úsilí o vybudování lepšího světa, aby byly postaveny do služeb lidu a pokroku a aby se proměnily ve skutečné kulturní hodnoty. Československý státní film nastoupil cestu, na níž bude sloužiti lidu.  Při provádění zahraničního obchodu s kulturními statky jest koordinační referát pověřen výhradním obstaráváním styku s ministerstvem zahraničního obchodu, zajišťuje kultur. ně-politické zájmy v oboru zahraničního obchodu, pečuje o koordinaci zájmů mezi úseky v oboru působnosti ministerstva informací a osvěty a spolupůsobí při projednávání zahraničních obchodů s výsadními společnostmi. Při své činnosti řídí se koordinační referát všeobecně platnými směrnicemi pro zahraniční obchod."
        ],
        "response":"Před únorem 1948 čelil státní film v Československu soustavným podvratným útokům [doc4]. Tyto útoky zahrnovaly připravovaný návrh zákona o vynětí sokolských a některých jiných kin ze zestátnění, štěvavé pomluvy v tisku, zákulisní politické zásahy a zlovolné interpelace v Národním shromáždění [doc4]. Tyto snahy ohrožovaly samotnou existenci státního filmu a bránily rozvoji možností, které mu znárodnění přineslo [doc4].\n\nÚnorové události přispěly k odstranění těchto překážek a následné konsolidaci filmového průmyslu několika způsoby [doc2, doc3, doc5]. Bylo zrušeno opatření, které poskytovalo jednotlivým zplnomocněncům a úsekovým ředitelům samostatnou právní subjektivitu, a rozhodlo se, že jediným nositelem právní subjektivity v oblasti filmu je zestátněné filmové podnikání [doc2]. Dále bylo učiněno první kroky k přípravě systematického plánování v oblasti filmu jmenováním náměstka ústředního ředitele pro plánování a výzkum [doc3]. Vláda schválila zřízení státního podniku Československý státní film, čímž byl odstraněn nezdravý dualismus a byla zajištěna jednotná správa veškeré činnosti v oblasti filmu [doc3]. Státní film obdržel pevnou právní základnu vládním nařízením ze dne 13. dubna 1948 č. 72 Sb. [doc3].",
        "reference":"Hlavní překážky, kterým čelil státní film v Československu před únorem 1948, zahrnovaly nedostatečnou a nedokonalou právní úpravu, která vedla k odporu některých držitelů provozních prostředků proti jejich předání, popírání účinnosti dekretu o zestátnění filmu na Slovensku, nemožnost převodu nemovitostí v pozemkových knihách, právní nejistotu, snahy o vynětí některých kin ze zestátnění, organizační nejednotnost a nesoulad mezi složkami státního filmu, které bránily řádnému plánování investic a vývoje. Únor 1948 tyto nepříznivé podmínky a podvratné snahy zlikvidoval, což umožnilo rychlou a cílevědomou konsolidaci státního filmu.",
        "faithfulness":1.0,
        "answer_relevancy":0.9120248833,
        "answer_correctness":0.4028915477,
        "context_precision":1.0,
        "context_recall":1.0,
        "context_sufficiency":1.0
    },
    {
        "user_input":"Jaké byly důsledky zrušení právní subjektivity jednotlivých zplnomocněnců a úsekových ředitelů na konsolidaci a jednotné řízení filmového průmyslu v Československu po únoru 1948?",
        "retrieved_contexts":[
            "váno ve stavu, který bránil jeho zdravému rozvoji a pokroku a který zachovával reakčním silám naději na zvrat zestátňovacího procesu. Tvůrčí činnost byla uváděna ve zmatek prosazováním komerčních hledisek na jedné straně a rozvratnou kritikou na straně druhé. Únor 1948 zlikvidoval tyto uměle udržované nepříznivé podmínky a všechny podvratné snahy a umožnil tak rychlou a cílevědomou konsolidaci státního filmu. Ministr informací zrušil výnosem z 26. února 1948 opatření, jež poskytovala jednotlivým zplnomocněncům a úsekovým ředitelům samostatnou právní subjektivitu, a rozhodl, že jediným nositelem právní subjektivity v oblasti filmu je zestátněné filmové podnikání. Zrušil instituci zmocněnců a přenesl jejich úkoly na náměstky ústředního ředitele a ředitele úseků Československé filmové společnosti. Tím byl dán základní",
            "předpoklad sjednocení a jednotného řízení veškeré činnosti v oblasti filmu. Současně byl učiněn první krok k přípravě systematického plánování v oblasti filmu jmenováním náměstka ústředního ředitele pro plánování a výzkum a pronikavou reorganisací osobní vytvořeny nezbytné podmínky pokrokového vývoje ve filmové výrobě a distribuci. Vláda pak v jednom z prvních zasedání po únoru schvaluje ustavení státního podniku Československý státní film pro celou oblast státu jako jediného nositele veškeré činnosti v oboru filmu. Tím se odstraňuje nezdravý dualismus, pěstovaný odstředivými silami na Slovensku, který bránil stejnoměrnému vývoji filmu v celé republice. Zestátnění filmu je zabezpečeno ústavou. Státní film dostává vládním nařízením ze dne 13. dubna 1948 č. 72 Sb. pevnou právní základnu, na níž je možno vybudovati jeho řádnou organisaci a zdravý vývoj. Je možno přistoupiti k systematickému uspořádání jeho hospodářstvi, filmové výroby a distribuce a k plánovitému řízení jeho rozvoje v celé oblasti státu.",
            "Knihovna filmového ústavu upozorňuje na tyto nové knihy: Mejlach: Lenin a kultura, Praha MF 1948 (sign. 1883), Pudovkin: Akter v filme. Leningrad 1934 (sign. 1872). Kak my rabotajem nad kinoscenariem. Moskva 1936 (sign. 1873), Huff: An Index to the Films of Ch. Chaplin. London, Filminstitut 1944 (sign. 1878), Haas: The Prepariation of Visual Aids. New York 1948 (sign. 1890), Falconer: Filmstrips. New York, Mc Graw-Hull 1948 (sign. 1891). Ve sbírce přednášek Filmového ústavu byl vydán první svazek: K. Vilímek — Obsluha kinematografické kamery.  Divadlo Filmového studia  V měsíci únoru 1949 bylo uspořádáno DFS 16 večerních představení Pogodinovy hry Aristokrati. V různých částech Prahy bylo provedeno 110 kulturních večerů. Byly prováděny denní i noční zkoušky na hry Želez-",
            "nad Nisou dochází ke sloučení dne 8. července 1948. Například v Lučanech a v Proseči vstoupili do KSČ všichni členové sociální demokracie. Květnové volby přinesly velké vítězství jednotné kandidátky obrozené Národní fronty, pro kterou hlasovalo v celé republice 89,3 % voličů. V okrese Jablonec n. N. bylo z 27 433 platných lístků odevzdáno pro kandidátku Národní fronty 25719 hlasů, tj. 93,75 %. Výsledky voleb potvrdily, že většina lidu podporuje linti vytyčenou KSČ - budování socialismu v těsné spolupráci se Sovětským svazem. Po únoru 1948 dochází na Jablonecku k řešení problémů jabloneckého průmyslu. V procesu znárodnění sklářských závodů byly postupně zřízeny tyto národní podniky: Sklárny a rajinérie Dolní Polubný. Spojené sklárny jablonecké, Jablonecký sklářský průmysl, Skleněná bižuterie, Kovová bižuterie, Preciosa, Krystalerie a Železnobrodské sklo. V složitých podmínkách probíhal na Jablonecku také boj o monopol zahraničního obchodu. Počátkem roku 1949 bylo v Jablonci nad Nisou vytvořeno ředitelství pobočky Skloexportu a v roce 1952 byl zřízen PZO Jablonex.",
            "Kompotenční spory Píše-li plzeňský »Nový den« o hochštaplerství v našem FN filmu, uraž se, kdo to na sebe vztahuješ. Je to tak — aneb novinář se informoval o zrušení atelieců v Radlicích Tak prý se budou v Posázaví stavět pomocné filmové ateliery, jak píší Svobodné noviny. — To je tak, když FN se novinář nemůže nikde informovati  OČs. spolek v Kalkutě dokončuje natáčení a sestřih prvního českého zvukového filmu, který byl natočen v Indii. Vyjednává ze o smlouvu a představiteli indického filmového průmyslu na roční dodávání dvou nejlepších indických filmů, které by ropresentovaly indické filmové umění v Československu. (Jan Baroš v knize »Čechoslováci na březích Ganguc.) Britské filmy skončily co do počtu svých premiér v Československu v r. 1946 na prvém místě. Obsadily 40"
        ],
        "response":"Zrušení právní subjektivity jednotlivých zplnomocněnců a úsekových ředitelů v oblasti filmu bylo provedeno výnosem ministra informací z 26. února 1948 [doc1]. Tímto krokem byl dán základ pro sjednocení a jednotné řízení veškeré činnosti v oblasti filmu [doc2]. Úkoly zmocněnců byly přeneseny na náměstky ústředního ředitele a ředitele úseků Československé filmové společnosti [doc1]. Tímto opatřením byl dán předpoklad pro konsolidaci státního filmu a jeho řádnou organisaci a zdravý vývoj [doc2].",
        "reference":"Zrušení právní subjektivity jednotlivých zplnomocněnců a úsekových ředitelů umožnilo sjednocení a jednotné řízení veškeré činnosti v oblasti filmu, což vedlo k rychlé a cílevědomé konsolidaci státního filmu v Československu po únoru 1948.",
        "faithfulness":1.0,
        "answer_relevancy":0.8871957812,
        "answer_correctness":0.9100725698,
        "context_precision":1.0,
        "context_recall":1.0,
        "context_sufficiency":1.0
    },
    {
        "user_input":"Jaké byly důsledky změn ve složení stromového patra Boubínského pralesa mezi lety 1972 a 1996, zejména s ohledem na pokles zastoupení jedle a nárůst buku, a jaké managementové kroky byly navrženy pro budoucí obnovu populace jedle bělokoré a smrku?",
        "retrieved_contexts":[
            "plochu pralesa, a to přesto, že na řadě míst došlo k náhlým rozpadům stávajícího porostu, dochází k výraznému stárnutí a odumírání populace jedle bělokoré apod. Tato skutečnost potvrzuje jedinečnost Boubínského pralesa a dokazuje životaschopnost a stabilitu pralesovitých útvarů, ponechaných samovolnému vývoji na dostatečně velké souvislé ploše. Došlo k výraznému poklesu zastoupení jedle a tento úbytek byl nahrazen zvýšenou účastí buku. Dominantní postavení si v pralese udržel smrk. Počet živých stromů mírně klesl. Naopak stoupl objem kmenů živých stromů, což svědčí o celkovém stárnutí pralesa. Celkem 30 % plochy je však pokryto souvislým nárostem s dominancí buku. Tyto nárosty jsou zatím pod registrační hranicí dendrometrických šetření, v budoucnu však dojde k větší",
            "strukturální diferenciaci pralesa a k vyrovnání některých ukazatelů (počet stromů versus jejich objem apod.). Na vhodných místech mimo bukové nárosty se úspěšně zmlazuje jedle i smrk s doprovodem dalších vtroušených dřevin. Lze předpokládat, že postupně dojde k obnově populace jedle bělokoré i k obnově smrku zdejšího horského ekotypu. Na základě výsledků opakovaných šetření je doporučeno: - I přes všechny diskutabilní důsledky, které přináší úplné oplocení pralesa, je to v současné době jediné řešení,  zajišťující jeho relativně přirozený samovolný vývoj. Proto je třeba trvale udržovat oplocení v provozuschopném stavu a podle možností lovit či vytlačovat ven zvěř, která se do pralesa dostane. V pralese by neměly být prováděny žádné úmyslné zásahy. Do bezzásahového režimu je možné zařadit porosty nad",
            "Received 17 June 2001  Boubínský prales po 24 letech (1972-1996) — vývoj stromového patra  T. VRŠKA', L. HORT2, P. ODEHNALOVÁ?, D. HORAL2, D. ADAM2  Správa Národního parku Podyjí, Znojmo, Česká republika 2Agentura ochrany přírody a krajiny ČR, detašované pracoviště Brno, Česká republika  ABSTRAKT: V roce 1996 byla provedena opakovaná měření taxačních, typologických a porostních charakteristik v národní přírodní rezervaci Boubínský prales. Tyto úkony následovaly po výzkumu provedeném v roce 1972 s použitím stejné metodiky a následným vyhodnocením změn, k nimž ve sledované oblasti došlo. Došlo k výraznému poklesu zastoupení jedle a tento úbytek byl nahrazen zvýšenou účastí buku. Dominantní postavení si v pralese udržel smrk. Počet živých stromů mírně klesl, naopak stoupl objem kmenů živých stromů. Celkem 30 % plochy pralesa je pokryto souvislým nárostem s dominancí buku. Na vhodných místech mimo bukové nárosty se úspěšně zmlazuje jedle i smrk s doprovodem dalších vtroušených dřevin. Lze předpokládat, že postupně dojde k obnově populace jedle bělokoré i k obnově smrku. Je navržen další management rezervace.",
            "porostem převažuje smrk, kdežto na světlině převažuje buk. Možnosti nasemenění byly s ohledem na rozmístění semenných jedinců pro obě dřeviny na obou plochách zhruba rovnocenné. Obnova smrku a buku je tedy ve zkoumaném porostu oddělena v prostoru, a to uspořádáním zápoje stromového patra. Na ploše 1 ovšem nelze za daných poměrů počítat do budoucna s neomezeným přežíváním, což se zatím projevuje nejvýrazněji u jeřábu poklesem vitality a prosýcháním. Vztahy smrku a jedle v průběhu obnovy jsou vyjádřeny plochami 4 až 7. Plochu 3 nelze považovat v tomto směru za dostatečně reprezentativní, jelikož možnosti nasemenění jedle jsou na této ploše podstatně slabší než na ostatních plochách. Absolutní i relativní podíl jedle ve vztahu k smrku zřetelně klesá se zrychlujícím se růstem jedle — na ploše 4 nabývá převahy smrk. Jedle je proti",
            "Rychlost postupu 2 až 3 m, někdy 4 až 5 m ročně, jak uvádí např. Köstler (1955), představuje odsun porostní stěny o 30 m za 15 až 10 let, popř. již za 7 až 6 let. Tato doba je však příliš krátká, než aby mohla zajistit nejen zastoupení jedle, ale i předpoklady jejího dalšího vývoje v konkurenci rychle odrůstajícího smrku. Pomalejší okrajový postup však na druhé straně není dosti dobře možný s ohledem na ekonomické a výnosové momenty, zvláště ve stejnověkých porostech. Pro studium vzájemných vztahů jedle a buku v průběhu obnovy se ve zkoumané oblasti nepodařilo nalézt vhodný objekt. Šetření ve středoslovenských poměrech (Korpel, Vinš 1965) i v Jeseníkách (Kadlus 1966a) však ukázalo, že i ve vztahu k buku je jedle znevýhodňována nadměrně silným a rychlým prosvětlováním mateřského porostu."
        ],
        "response":"Mezi lety 1972 a 1996 došlo v Boubínském pralese k výraznému poklesu zastoupení jedle a zvýšené účasti buku [doc1, doc3]. Dominantní postavení si v pralese udržel smrk [doc1, doc3]. Počet živých stromů mírně klesl, zatímco objem kmenů živých stromů stoupl, což svědčí o celkovém stárnutí pralesa [doc1, doc3]. Celkem 30 % plochy pralesa je pokryto souvislým nárostem s dominancí buku [doc1, doc3]. Na vhodných místech mimo bukové nárosty se úspěšně zmlazuje jedle i smrk s doprovodem dalších dřevin [doc2, doc3]. Lze předpokládat, že postupně dojde k obnově populace jedle bělokoré i k obnově smrku [doc2, doc3].\n\nPro budoucí obnovu populace jedle bělokoré a smrku byl navržen management rezervace [doc2, doc3]. Je doporučeno trvale udržovat oplocení pralesa a podle možností lovit či vytlačovat zvěř, která se do pralesa dostane [doc2]. V pralese by neměly být prováděny žádné úmyslné zásahy [doc2].",
        "reference":"Důsledkem změn ve složení stromového patra Boubínského pralesa mezi lety 1972 a 1996 byl výrazný pokles zastoupení jedle, který byl nahrazen zvýšenou účastí buku, přičemž dominantní postavení si udržel smrk. Počet živých stromů mírně klesl, ale objem kmenů živých stromů stoupl. Celkem 30 % plochy pralesa je pokryto souvislým nárostem s dominancí buku, zatímco na vhodných místech mimo bukové nárosty se úspěšně zmlazuje jedle i smrk s doprovodem dalších vtroušených dřevin. Pro budoucí obnovu populace jedle bělokoré a smrku byl navržen další management rezervace.",
        "faithfulness":1.0,
        "answer_relevancy":0.9099065781,
        "answer_correctness":0.9231264446,
        "context_precision":1.0,
        "context_recall":1.0,
        "context_sufficiency":1.0
    },
    {
        "user_input":"Jaké jsou důsledky výrazného poklesu zastoupení jedle bělokoré a zvýšené účasti buku na strukturu a stabilitu Boubínského pralesa, a jaké opatření bylo navrženo k zajištění jeho přirozeného vývoje?",
        "retrieved_contexts":[
            "plochu pralesa, a to přesto, že na řadě míst došlo k náhlým rozpadům stávajícího porostu, dochází k výraznému stárnutí a odumírání populace jedle bělokoré apod. Tato skutečnost potvrzuje jedinečnost Boubínského pralesa a dokazuje životaschopnost a stabilitu pralesovitých útvarů, ponechaných samovolnému vývoji na dostatečně velké souvislé ploše. Došlo k výraznému poklesu zastoupení jedle a tento úbytek byl nahrazen zvýšenou účastí buku. Dominantní postavení si v pralese udržel smrk. Počet živých stromů mírně klesl. Naopak stoupl objem kmenů živých stromů, což svědčí o celkovém stárnutí pralesa. Celkem 30 % plochy je však pokryto souvislým nárostem s dominancí buku. Tyto nárosty jsou zatím pod registrační hranicí dendrometrických šetření, v budoucnu však dojde k větší",
            "strukturální diferenciaci pralesa a k vyrovnání některých ukazatelů (počet stromů versus jejich objem apod.). Na vhodných místech mimo bukové nárosty se úspěšně zmlazuje jedle i smrk s doprovodem dalších vtroušených dřevin. Lze předpokládat, že postupně dojde k obnově populace jedle bělokoré i k obnově smrku zdejšího horského ekotypu. Na základě výsledků opakovaných šetření je doporučeno: - I přes všechny diskutabilní důsledky, které přináší úplné oplocení pralesa, je to v současné době jediné řešení,  zajišťující jeho relativně přirozený samovolný vývoj. Proto je třeba trvale udržovat oplocení v provozuschopném stavu a podle možností lovit či vytlačovat ven zvěř, která se do pralesa dostane. V pralese by neměly být prováděny žádné úmyslné zásahy. Do bezzásahového režimu je možné zařadit porosty nad",
            "pokládaného zastoupení dřevin v lesích ČR po uplynutí 10 a 50 let. Výsledky dokládají, že během deseti let nemůže dojít ke zřetelným změnám proti současnému zastoupení dřevin, ať již podle koncepce modelů, nebo SLHP 1993. Výraznější, ale ne příliš razantní změny se projevují až po uplynutí 50 let, ale pouze podle modelů hospodářských opatření (1991), a to jen u jedle bělokoré a buku lesního. U jedle by se zastoupení proti současnému stavu zvýšilo asi čtyřnásobně, tj. na 4,1 %, podíl buku téměř na dvojnásobek, tj. na 10,3 %. Zastoupení smrku by podle obou koncepcí pokleslo za 50 let (ve srovnání se současným stavem) jen málo, asi o 4,5 %. S ohledem na tyto skutečnosti byla v rámci prací spojených s prognózami vývoje stavu lesů a lesního hospodářství zpracována jako etapa řešení studie Mož-",
            "Rychlost postupu 2 až 3 m, někdy 4 až 5 m ročně, jak uvádí např. Köstler (1955), představuje odsun porostní stěny o 30 m za 15 až 10 let, popř. již za 7 až 6 let. Tato doba je však příliš krátká, než aby mohla zajistit nejen zastoupení jedle, ale i předpoklady jejího dalšího vývoje v konkurenci rychle odrůstajícího smrku. Pomalejší okrajový postup však na druhé straně není dosti dobře možný s ohledem na ekonomické a výnosové momenty, zvláště ve stejnověkých porostech. Pro studium vzájemných vztahů jedle a buku v průběhu obnovy se ve zkoumané oblasti nepodařilo nalézt vhodný objekt. Šetření ve středoslovenských poměrech (Korpel, Vinš 1965) i v Jeseníkách (Kadlus 1966a) však ukázalo, že i ve vztahu k buku je jedle znevýhodňována nadměrně silným a rychlým prosvětlováním mateřského porostu.",
            "Received 17 June 2001  Boubínský prales po 24 letech (1972-1996) — vývoj stromového patra  T. VRŠKA', L. HORT2, P. ODEHNALOVÁ?, D. HORAL2, D. ADAM2  Správa Národního parku Podyjí, Znojmo, Česká republika 2Agentura ochrany přírody a krajiny ČR, detašované pracoviště Brno, Česká republika  ABSTRAKT: V roce 1996 byla provedena opakovaná měření taxačních, typologických a porostních charakteristik v národní přírodní rezervaci Boubínský prales. Tyto úkony následovaly po výzkumu provedeném v roce 1972 s použitím stejné metodiky a následným vyhodnocením změn, k nimž ve sledované oblasti došlo. Došlo k výraznému poklesu zastoupení jedle a tento úbytek byl nahrazen zvýšenou účastí buku. Dominantní postavení si v pralese udržel smrk. Počet živých stromů mírně klesl, naopak stoupl objem kmenů živých stromů. Celkem 30 % plochy pralesa je pokryto souvislým nárostem s dominancí buku. Na vhodných místech mimo bukové nárosty se úspěšně zmlazuje jedle i smrk s doprovodem dalších vtroušených dřevin. Lze předpokládat, že postupně dojde k obnově populace jedle bělokoré i k obnově smrku. Je navržen další management rezervace."
        ],
        "response":"Výrazný pokles zastoupení jedle bělokoré a zvýšená účast buku vedly k výraznému stárnutí a odumírání populace jedle bělokoré [doc1, doc5]. Celkem 30 % plochy pralesa je pokryto souvislým nárostem s dominancí buku [doc1, doc5]. Dominantní postavení si v pralese udržel smrk [doc1, doc5]. Počet živých stromů mírně klesl, naopak stoupl objem kmenů živých stromů [doc1, doc5].\n\nK zajištění přirozeného vývoje Boubínského pralesa bylo doporučeno trvale udržovat oplocení v provozuschopném stavu a podle možností lovit či vytlačovat ven zvěř, která se do pralesa dostane [doc2]. V pralese by neměly být prováděny žádné úmyslné zásahy [doc2].",
        "reference":"Výrazný pokles zastoupení jedle bělokoré a zvýšená účast buku vedly k tomu, že dominantní postavení si v pralese udržel smrk, a došlo k celkovému stárnutí pralesa, což se projevilo mírným poklesem počtu živých stromů, ale zvýšením objemu kmenů živých stromů. K zajištění přirozeného vývoje Boubínského pralesa bylo navrženo trvale udržovat oplocení v provozuschopném stavu a podle možností lovit či vytlačovat ven zvěř, která se do pralesa dostane, a v pralese by neměly být prováděny žádné úmyslné zásahy.",
        "faithfulness":0.7777777778,
        "answer_relevancy":0.833066947,
        "answer_correctness":0.9445726359,
        "context_precision":1.0,
        "context_recall":1.0,
        "context_sufficiency":1.0
    },
    {
        "user_input":"Jaké byly důvody a možné důsledky odporu knížete Bedřicha Schwarzenberga a Řiditelstva Ústřední společnosti hospodářské proti zamýšlené stavbě vodních drah, a jak tento odpor souvisí s ekonomickými zájmy velkostatkářů a průmyslových kapitalistů?",
        "retrieved_contexts":[
            "— je jisto, že původní rozpočty budou jako obyčejně značně překročeny — se nechá velice mnoho vydělat. Sumy ty velice zúrodní vypráhlé lány průmyslu. Ale nad radostnou náladou pánů kapitalistů stahují se černé mraky. Vedle kapitalistů průmyslových máme ještě jiné kapitalisty. A tito jsou mnohem mocnější, než ti různí komínoví baroni. Jsou to naši počestní velkostatkáři. První blesk již vyslali. Byl to sice prozatím jen blesk papírový, ale je na něm podepsán kníže Schwarzenberg a proto bude míti dalekosáhlé účinky. Dost možná, že ochromení celé akce. Řiditelstvo Ústřední společnosti hospodářské, jejímž předsedou je kníže Bedřich Schwarzenberg rozeslalo hospodářským spolkům provolání, v němž se rozhodně staví proti zamýšlené stavbě vodních drah. Nečiní",
            "dářské, jejímž předsedou je kníže Bedřich Schwarzenberg rozeslalo hospodářským spolkům provolání, v němž se rozhodně staví proti zamýšlené stavbě vodních drah. Nečiní to arciť přímo, ale to na věci nic nemění V provolání se praví: „Ačkoli nutno návrh zákona na zřízení průplavů pokládati za prospěšný veškeré výrobě a tržbě, má Ústřední společnost hospodářská za to, že nelze odlučovati stavbu těchto kanálů vůbec od celkové úpravy našeho vodního hospodářství a že projektované průplavy nabyly by pravého významu pro domácí výrobu a tržbu teprve po předcházející soustavně provedené úpravě řek a toků a řádném provedení všech úkolů a potřeb melioračních.“ A že úkol tento nebude snadným, to se přiznává v provolání bez obalu: „Organisace  LIDU Redakce a administrace nalézá se",
            "Tomáši Štěpánkovi z Nezamyslic. — Schůze konány budou na Kanovsku, v Kokorách a v Kojetíně. Z Ústřední společnosti hospodářské. Řiditelstvo Ústřední společnosti hospodářské konalo schůzi svou za předsednictví J. J. dra Bedřicha knížete Schwarzenberga dne 18. ledna t. r., řiditelstva podán byl sněmu pamětní spis o krisi zemědělské se žádostí, aby sněm uvážil příčiny tísně zemědělské, vyšetřil poměry a potřeby obyvatelstva zemědělského a připravil podrobný hospodářský program pro nastávající šestileté období činnosti sněmovní. Současně rozeslán byl pamětní spis všem hosp. spolkům s vyzváním, aby se k němu připojily. Ku sjezdu rolnickému v Pardubicích delegováni byli jako zástupci společnosti pánové J Markalous, statkář v Třebosicích a F. Udržal, starosta v Dol. Rovni. C. k. finančnímu mini-",
            "Z Ústřední společnosti hospodářské pro král. České. Řiditelstvo Ústřední společnosti hospodářské konalo schůzi svou dne 17. března za předsednictví JUDra Bedřicha knížete Schwarzenberga a u přítomnosti 23 členů. Předseda zahájiv schůzi, vyslovil politování své nad různými zprávami o pokusech s ječmeny, kterými se jakost ječmene i pokusů v Čechách podnikaných z jisté strany zlehčuje, jakož i záslužná působnost zem. insp. Dra Sitenského tendenčně posuzuje. Společnost je povinna ohraditi se proti tendenčnímu tvrzení, jako by kvalita ječmene se zhoršila a to na základě výzkumů a výsledků pokusů přesně vědecky vykonaných. S vývody předsedovými vyslovují plný souhlas pp. R. Jahn a St. Kubr, kteří odmítají neodůvodněné útoky, kterými se pracuje cizině do rukou a zároveň ostře kritisují lehkovážné jednání, kterým",
            "z prací a agitačních statí dr. Russa a jiných. Varovného hlasu v té příčině pozdvihla (14. dubna) v Praze Ústřední hospodářská společnost, kde kníže Bedřich Schwarzenberg hájil prospěchů zemských v ten rozum, aby především zamezeny byly škody, které rozvodňováním přítoků Vltavy a Labe každého roku zemědělství se způsobují, a pak teprve aby se přikročilo k zřizování velkých průplavů. Ohromný kapitál má býti vložen do průplavů těch, a není dnes jisto, zda by nesloužily jen prospěchům kapitalistickým, neotevřely příchod cizozemské výrobě a nezaplavovaly naše země hospodářskými plodinami z Uher a zemí Balkánských. Napřed regulování řek a meliorace, potom průplavy, v tom smyslu přijata byla jednomyslně resoluce. Z důvodů, aby přítomnost něčeho získala, ujednalo české poselstvo na říšské radě trojí junctim s vládou, jak z projevu dr. Pa-"
        ],
        "response":"Kníže Bedřich Schwarzenberg a Řiditelstvo Ústřední společnosti hospodářské se stavěli proti zamýšlené stavbě vodních drah z obavy o škody, které by mohly vznikat zemědělství rozvodňováním přítoků Vltavy a Labe [doc 5]. Kníže Schwarzenberg hájil prospěchů zemských a navrhoval, aby se nejprve zaměřilo na regulaci řek a meliorace, a teprve poté na zřizování vodních drah [doc 5]. Obával se, že by průplavy mohly sloužit pouze prospěchu kapitalistů, otevřít cestu cizozemské výrobě a zaplavit české země levnými hospodářskými plodinami z Uher a zemí Balkánských [doc 5].\n\nÚstřední společnost hospodářská se stavěla proti stavbě vodních drah, protože se domnívala, že nelze stavbu kanálů oddělit od celkové úpravy vodního hospodářství a že by získaly pravý význam teprve po předcházející soustavně provedené úpravě řek a toků a řádném provedení všech melioračních úkolů [doc 2].\n\nKníže Schwarzenberg byl velkostatkář [doc 3], a proto jeho odpor proti stavbě vodních drah souvisel s ekonomickými zájmy velkostatkářů, kteří se obávali negativních dopadů na zemědělství. Zároveň se společnost stavěla proti akcím, které by mohly prospět průmyslovým kapitalistům na úkor zemědělství [doc 5]. Řiditelstvo Ústřední společnosti hospodářské konalo schůzi, kde se zabývalo krizí zemědělské a žádalo sněm o přípravu hospodářského programu pro nastávající období [doc 3].",
        "reference":"Odpor knížete Bedřicha Schwarzenberga a Řiditelstva Ústřední společnosti hospodářské proti zamýšlené stavbě vodních drah byl motivován ekonomickými zájmy velkostatkářů, kteří jsou považováni za mocnější než průmysloví kapitalisté. Tento odpor souvisí s obavami, že stavba vodních drah by mohla ohrozit jejich ekonomické zájmy, zatímco průmysloví kapitalisté vidí v projektu příležitost k zisku. Schwarzenbergův podpis na provolání proti stavbě naznačuje, že odpor může mít dalekosáhlé účinky a potenciálně ochromit celou akci.",
        "faithfulness":0.7894736842,
        "answer_relevancy":0.9051828923,
        "answer_correctness":0.6115925345,
        "context_precision":0.8666666666,
        "context_recall":1.0,
        "context_sufficiency":1.0
    },
    {
        "user_input":"Jaké byly důvody a možné důsledky nesouhlasu Ústřední společnosti hospodářské, vedené knížetem Bedřichem Schwarzenbergem, se zamýšlenou stavbou vodních drah, a jak tento nesouhlas ovlivnil politickou situaci a reakce kapitalistů v kontextu plánů vlády Körbrovy?",
        "retrieved_contexts":[
            "formace o otázce vodních drah: „Dle tvrzení několika orgánů lze se domýšleti, že usnesení Kola polského v otázce vodních drah má charakter politické sensace. To jest však nesprávné! Nutno v tomto případě činiti přesně rozdíly mezi převládajícími náladami v Kole polském a mezi formou usnesení, jež v otázce vodních drah dlužno učiniti. Kolo polské má příliš dobrou politickou školu a mnoho zkušeností, nežli aby někomu prokázalo laskavost, svým usnesenín, se připraviti o volnost pohybu a ocitnouti se ve slepé uličce. Usnesení Kola polského v otázce vodních drah nebude pravděpodobně lišiti se od usnesení, učiněného 19. t. m. ve valné hromadě polských stran na haličském zemském sněmě ve Lvově. Ve smyslu tohoto usnesení trvá Kolo polské na stavbě vodních drah, Haliči zákonem z r. 1901 zajištěných. Resoluce Kola polského však parlamentní situaci rozhodně nebude komplikovat a nezpůsobí také nových potíží. Kolo polské nemá pražádného zájmu na tom, aby svými usneseními v otázce vodních drah pro kohokoliv se zvláště exponovalo. Bude v nich dán pouze projev nálady převládající v celé zemi.",
            "formace o otázce vodních drah: „Dle tvrzení několika orgánů lze se domýšleti, že usnesení Kola polského v otázce vodních drah má charakter politické sensace. To jest však nesprávné! Nutno v tomto případě činiti přesně rozdíly mezi převládajícími náladami v Kole polském a mezi formou usnesení, jež v otázce vodních drah dlužno učiniti. Kolo polské má příliš dobrou politickou školu a mnoho zkušeností, nežli aby někomu prokázalo laskavost, svým usnesenín, se připraviti o volnost pohybu a ocitnouti se ve slepé uličce. Usnesení Kola polského v otázce vodních drah nebude pravděpodobně lišiti se od usnesení, učiněného 19. t. m. ve valné hromadě polských stran na haličském zemském sněmě ve Lvově. Ve smyslu tohoto usnesení trvá Kolo polské na stavbě vodních drah, Haliči zákonem z r. 1901 zajištěných. Resoluce Kola polského však parlamentní situaci rozhodně nebude komplikovat a nezpůsobí také nových potíží. Kolo polské nemá pražádného zájmu na tom, aby svými usneseními v otázce vodních drah pro kohokoliv se zvláště exponovalo. Bude v nich dán pouze projev nálady převládající v celé zemi.",
            "V Praze, v úterý dne 30. dubna 1901.  Vodní dráhy. Vláda Körbrova má velikou potíž s na cionálními štvanicemi. Na místě, aby veřejný život náš demokratisováním připravila na cestu zdravého vývoje, chytla věc z jiného konce. Slíbila žíznivému kapitalismu velikou kořisť, celých 750 mil. K! Dílo, jež zamýšlí vláda Körbrova, je rozsahu přímo obrovského. Čtyři veliké vodní dráhy mají býti vystavěny, jež by říši naši z jihu na sever, od východu na západ spojovaly. Kapitalisté také se již ozvali. V prvé řadě arciť z rakouského Manchestru — z Brna — aby zapálili vládě Körbrově kadidlo a zapěli jí své chvalozpěvy. Sjeli se, aby přijali resoluci, jíž vítají vládní předlohu o vodních drahách jakožto počátek splnění vládních slibů a vyslovují povděk, že v první řadě je položeno provedení ka-",
            "z prací a agitačních statí dr. Russa a jiných. Varovného hlasu v té příčině pozdvihla (14. dubna) v Praze Ústřední hospodářská společnost, kde kníže Bedřich Schwarzenberg hájil prospěchů zemských v ten rozum, aby především zamezeny byly škody, které rozvodňováním přítoků Vltavy a Labe každého roku zemědělství se způsobují, a pak teprve aby se přikročilo k zřizování velkých průplavů. Ohromný kapitál má býti vložen do průplavů těch, a není dnes jisto, zda by nesloužily jen prospěchům kapitalistickým, neotevřely příchod cizozemské výrobě a nezaplavovaly naše země hospodářskými plodinami z Uher a zemí Balkánských. Napřed regulování řek a meliorace, potom průplavy, v tom smyslu přijata byla jednomyslně resoluce. Z důvodů, aby přítomnost něčeho získala, ujednalo české poselstvo na říšské radě trojí junctim s vládou, jak z projevu dr. Pa-",
            "ležité by bylo založení kmenové stádní knihy. Bohužel, že zakládání již před desíti lety se strany bývalé c. k. vlastenecké společnosti začaté se zanedbalo a zničilo, jak společnost ta rozpustila se k největší škodě zemědělství v Čechách. Krmný dobytek, zvláště Jeho Jasností knížetem Adolfem Jos. Schwarzenbergem vystavený, byl vskutku překrásný. Jak se vyplácí, krmí-li se dobytek do takové tučnosti, nejsem sto souditi, o tom však jsem se osobně přesvědčil, že řezník z Vídně přicestoval, aby všechen tento knížecí dobytek zakoupil, a že tento řezník neobyčejně vysokou cenu podal, aby se mu jistě prodal. Výrobky, jako: mléko, máslo a sýr, neviděl jsem vystaveny. Myslím, že stalo se tak úplným právem, poněvadž výrobky ty jen v jakosti střední, nikdy však tak vyráběti se nedají, aby v obchodu světovém"
        ],
        "response":"Ústřední hospodářská společnost, vedená knížetem Bedřichem Schwarzenbergem, nesouhlasila se zamýšlenou stavbou vodních drah z obavy o škody, které by rozvodňováním přítoků Vltavy a Labe mohly způsobit zemědělství [doc4]. Obávali se také, že by průplavy sloužily pouze prospěchu kapitalistů, otevřely by cestu cizozemské výrobě a zaplavily by české země hospodářskými plodinami z Uher a zemí Balkánských [doc4]. Společnost navrhovala, aby se nejprve regulovaly řeky a prováděla meliorace, a teprve poté se přikročilo ke stavbě průplavů [doc4].\n\nTento nesouhlas ovlivnil politickou situaci tím, že upozornil na potenciální negativní dopady plánů vlády Körbrovy na zemědělství a upozornil na možné nerovnoměrné rozdělení prospěchu z vodních drah [doc4]. Kapitalisté se naopak ozvali s podporou vládní předlohy o vodních drahách a vyjadřovali povděk za to, že je v první řadě kladeno provedení této stavby [doc3].",
        "reference":"Ústřední společnost hospodářská, vedená knížetem Bedřichem Schwarzenbergem, nesouhlasila se zamýšlenou stavbou vodních drah, protože se domnívala, že tyto kanály nelze oddělit od celkové úpravy vodního hospodářství a že by měly pravý význam pro domácí výrobu a tržbu až po předcházející soustavně provedené úpravě řek a toků a řádném provedení všech úkolů a potřeb melioračních. Tento nesouhlas mohl ochromit celou akci a ovlivnil politickou situaci tím, že vláda Körbrova čelila potížím s národními štvanicemi, zatímco kapitalisté, zejména z Brna, vyjádřili podporu vládnímu plánu a přijali resoluci, která vítala vládní předlohu o vodních drahách jako počátek splnění vládních slibů.",
        "faithfulness":0.7272727273,
        "answer_relevancy":0.9130309038,
        "answer_correctness":null,
        "context_precision":1.0,
        "context_recall":1.0,
        "context_sufficiency":0.0
    },
    {
        "user_input":"Jaké byly důvody a důsledky znovuzavedení krajkářství ve Vamberku a okolních oblastech na konci 19. století, a jakou roli v tomto procesu hrály místní instituce a jednotlivci jako Ant. Selichar?",
        "retrieved_contexts":[
            "vání krajek vedle Vamberka provádí se v osadách Potštýnu, Doudlebách, Zámělu, Pekle, Bystré, Lupenici, Merklovicích, Křivicích a Kostelci n. O. Založením odborné školy krajkářské ve Vamberku zachována zde sice domácí tato industrie, než v sousedním okresu žambereckém poklesla nadobro. Teprve v r. 1897, kdy po několika neúrodných letech bída těžce doléhala na ubohý horský lid a hrozila částečným vylidněním nejchudších obcí, v nichž obyvatelé celých domků opouštěli na celé léto osady, hledajíce zaměstnání v sousedních okresích, po společné úradě usneseno na návrh p. Ant. Selichara, náj. statku, znovuzavedením krajkářství zjednati lidu nový pramen výživy za zaniklé domácké tkaní a vysilující výrobu nítěných knoflíků. Za pomoci učitelstva a za hmotné podpory státní, zemské",
            "historiky jiných zemí. Velká část závěrů, obecnější platnosti i konkretních, je více méně přesvědčivě prokázána. Shrňme stručně alespoň některé z nich. Při zkoumání zdrojů akumulace kapitálu v Polsku dochází Kolodziejczyk k závěru, že po celou první polovinu 19. století převládal nad vlastní kapitalistickou akumulací proces »původní akumulace«, započatý v druhé polovině 18. století (je zde chápán časově v užším slova smyslu jako vytváření bezprostředních předpokladů rozvoje kapitalistické výroby). V tomto procesu hrály rozhodující úlohu vnitřní zdroje — masové vyvlastňování rolníků pomocí státních opatření, činnost obchodního a lichvářského kapitálu, daňový systém a podpůrná úvěrová i obchodní politika státu, systém dodávek pro vojsko a státní administrativy. Podíl cizího kapitálu byl do poloviny století nevelký. Kapitalistická akumulace začala hrát větší roli až od 20. let a nabyla rozhodujícího významu od 40. let 19. století.",
            "cují výrobci krajek - o Hostouni v Českém lese. V roce 1642 se objevuje krajkářství jako doplňběhem tohoto století se paličkovaná krajka stává běžným výzdobným prvkem oděvních a zvykoslovných lidových textilií. Rozvoj krajkářství, jež poskytovalo obživu mnoha tisícům krajkářek, byl podporován státními akcemi i soukromníky. V roce 1751 bylo krajkářství prohlášeno svobodnou živností, v roce 1767 byla zřízena krajkářská škola v Praze, na počátku 19. století ve Vídni a ve čtrnácti místech v Krušných horách a na Novojičínsku. Středisky krajkářství byla stále především oblast Krušnohoří, pak oblast Orlických hor, Českého lesa a Šumavy. Středisky obchodu s krajkami z těchto posledně jmenovaných míst byly Klatovy a České Budějovice. Mnoho krajek se spotřebovalo",
            "ketském kraji na 12 000 paličkujících žen. V polovině 19. století odhadovala chebská obchodní komora počet pracovnic v krajkářství na 50000. Těsně po roce 1900 bylo v Krušných horách již jen asi 14 000 krajkářek. Koncem století se v souvislosti s rostoucími snahami o zachránění ruční výroby, které byly všeobecné v celé západní a střední Evropě, nově organizuje řada státních a soukromých (o několik let později zestátňovaných) škol a kursů. Některé z nich byly společné berku, 1892 v Praze, 1896 ve Strážově, 1899 v Sedlici, 1909 v Hradci Králové aj.). Vedle metrokrývky aj. Současně se zakládají i drobná místní družstva, jejichž střediskem měl být rakouský státní ústav pro domácí krajkářský průmysl; družstva měla být spojena v jakýsi svaz společnou prodejnou. Největší zásluhu o odbyt českých krajek doma i v zahraničí si získalo především",
            "horského okolí, kam znenáhla rozšířilo se z Vamberka paličkování krajek, nosil vyrobené krajky několika místním obchodníkům (ve Vamberku), kteří značně zbohatli jedině vysilující prací tohoto chudého lidu. Tento stav věci s malými změnami trval až do r. 1888, kdy vznikly zde první mechanické tkalcovny. Lid, zvláště mladší, počal houfně opouštěti své podušky a hrnul se do továren, kde sobě více vydělal. Následkem toho počala výroba krajek nápadně klesati, ba v mnohých krajinách dokonce opuštěna na dobro. Aby zamezeno bylo úplnému úpadku této domácí industrie, založena v r. 1889 městským zastupitelstvem odborná škola krajkářská, která zdárně prospívá a valně přispěla k udržení a zvelebení krajkářství v krajině vamberecké. V době založení odborné školy krajkářské napočítáno ve"
        ],
        "response":"Na konci 19. století došlo ve Vamberku a okolních oblastech ke znovuzavedení krajkářství. Hlavním důvodem byla bída, která těžce dopadla na horské obyvatelstvo po několika neúrodných letech a hrozilo částečné vylidnění nejchudších obcí. Lidé opouštěli osady a hledali zaměstnání v sousedních okresech. Znovuzavedení krajkářství bylo navrženo Ant. Selicharem, nájemným statkářem, a mělo lidem zajistit nový zdroj výživy za zaniklé domácké tkaní a vysilující výrobu nítěných knoflíků. [doc1]\n\nV roce 1889 založilo městské zastupitelstvo odbornou školu krajkářskou, která přispěla k udržení a zvelebení krajkářství v oblasti. [doc1] Předtím, v roce 1888, vznikly první mechanické tkalcovny, které vedly k tomu, že lidé, zejména mladší, opouštěli podušky a začali pracovat ve továrnách. [doc5] Tím došlo k poklesu výroby krajek, v některých oblastech byla dokonce opuštěna. [doc5]",
        "reference":"Důvody znovuzavedení krajkářství ve Vamberku a okolních oblastech na konci 19. století zahrnovaly těžkou bídu, která doléhala na horský lid po několika neúrodných letech, a hrozbu částečného vylidnění nejchudších obcí, kde obyvatelé opouštěli své domovy hledajíce zaměstnání jinde. Důsledkem znovuzavedení krajkářství bylo vytvoření nového pramene výživy pro místní obyvatele, kteří dříve spoléhali na zaniklé domácké tkaní a výrobu nítěných knoflíků. Místní instituce a jednotlivci, jako Ant. Selichar, hráli klíčovou roli v tomto procesu tím, že navrhli znovuzavedení krajkářství a za pomoci učitelstva a státní i zemské podpory se snažili oživit tuto tradiční řemeslnou činnost.",
        "faithfulness":1.0,
        "answer_relevancy":0.9195909404,
        "answer_correctness":0.7236183971,
        "context_precision":0.8041666666,
        "context_recall":1.0,
        "context_sufficiency":1.0
    },
    {
        "user_input":"Jaké byly důsledky zavedení ústřední tržnice krajek v Hradci Králové na rozvoj krajkářství v Žamberku a jaké překážky musely být překonány, aby se zajistil kvalitní materiál pro výrobu?",
        "retrieved_contexts":[
            "místní výrobní družstvo krajkářské, usneseno, aby další vedení celé akce podpůrné převzalo městské průmyslové museum v Hradci Králové. Účele mělo býti dosaženo: 1. Dodáváním nových vzorů moderních a zejména národních (tím přispěti se mělo ku svérázu domácí výroby žamberecké). 2. Dodáváním materiálu v cenách továrních. 3. Péčí o rozšíření odbytu prostředkováním prodeje, hledáním nových pramenův odbytových i nákupních. 4. Péčí o dokonalé technické provádění a zvelebování výroby pořádáním občasných kursů. 5. Zřízením ústřední tržnice krajek v Hradci Králové. 6. Vydáváním plastického vzorníku původních krajek žambereckých a rozšířením jeho v kruzích odběratelů. Zkrátka využiti všeho, co by přispělo k rozšíření odbytu krajek, pokud to v mezích stanov průmyslového musea jest",
            "Řízení a zastupování tržnice od jejího založení v únoru 1904 ochotně a se zdarem vede pí M. Klumparová. Do konce roku 1904 odebráno od krajkářek krajek za K 9431.70; v téže době prodáno za K 5206.30. Krajkářkám většinou na úvěr dodáno a jimi zpracováno materiálu (příze a hedvábí) za 780 K. Měly-li výrobky vyhověti po každé stránce, bylo nutno užívati ku zpracování i dobrého materiálu. Upotřebeno tudíž krajky i švýcarského a francouzského hedvábí. Veškeré pokusy nahraditi potřebu tohoto materiálu doma, ukázaly se dosud bezvýslednými. Ústřední tržnice zaměstnává nyní na 80 krajkářek, poskytujíc jim slušný výdělek. Ovšem že musel býti prodej nutně rozšířen. Největším odbytištěm byla Vídeň (Ústřední kurs krajkářský a Spolek ku podporování krajkářství v Rakousku), dále Karlovy Vary, Olomouc,",
            "rázu národního ornamentu v řadě první. Šířka krajky i vložky neměla přesahovati 3—10 cm a neměla býti dražší než 1 metr za K 5.—. Na povzbuzenou vypsány dvě ceny. První K 50.—, druhá K 30.—. Soutěž končila 15. únorem 1904. Aby však ostatní stále stoupající agenda musejní nebyla nově předsevzatou podpůrnou akcí krajkářskou zdržována, který se měl starati výhradně o prodej krajek, obstarávati styky s výrobci, nakupovati suroviny a pod.  V lednu 1904 na nové schůzi interessentů v Něm. Rybné, hojně navštívené, usneseno založiti družstvo krajkářské. Ježto však vlivem poměrů k ustavení se výrobního, prodejního a nákupního družstva krajkářského nedošlo, založil krajkářský odbor musejní ústřední tržnici krajek žambereckých v Hradci Králové a navázal přímé styky s výrobci.",
            "vzhledem k nedostatečným finančAkce krajkářská ním prostředkům musejním připadla v r. 1910 téměř cele na tržnici palíčkovaných krajek orlických v Hradci Králové. Není úmyslem docílený úspěch podpůrné akce zdejší tržnice, řízené neúnavnou pí. M. Klumparovou, připisovati museu, zmíníme-li se na tomto místě o jejím působení. Tržnice zřízena byla na popud musea v r. 1903 po nezdařeném pokusu sdružovacím v Žamberku. Zprvu umístěna byla prodejna v soukromém bytě, následkem stoupajícího odbytu a pro snadnější příležitost k nakoupení přenesena do krámu nejprvé v ulici Palackého a nyní do útulného a vkusně upraveného krámu na Velké podsíni. Výkladní skříně svým obsahem jsou stálou výstavkou krajek i jiných uměleckých ženských ručních prací. Předměty ve skříních stále novými vzory doplňované a",
            "dáváno nejvíce do Vamberka, kde se nalézají velké zasílatelské obchody. Vedle toho i po Čechách a Moravě, do Německa i Ameriky. Prodej děl se přímo neb prostřednictvím sl. Topinkové, sl. Sokolové, ind. učitelek a říd. učitele p. J. Březiny. Nastala ale vážná otázka o udržení a zvelebení domáckého průmyslu tohoto kraje. Pouhým zavedením krajkářství pomoženo chudému lidu horskému jen pro první čas, neboť neměla-li vzniklá výroba býti ohrožena nadprodukcí, bylo potřebí starati se o odbyt a zdokonalování výroby. Svoláni tudíž na podzim r. 1903 dosavadní činitelé v podpůrné akci ku společné schůzi s výborem městského průmyslového musea v Hradci Králové, ve které konána úrada  o dalších krocích na udržení a zvelebení této domácké výroby.“ Jelikož nebylo v tu dobu naděje, že by bylo možno utvořiti"
        ],
        "response":"Zavedení ústřední tržnice krajek v Hradci Králové bylo reakcí na nezdařený pokus o sdružování v Žamberku [doc4]. Po neúspěchu pokusu o utvoření výrobního, prodejního a nákupního družstva krajkářského, založil krajkářský odbor musejního v Hradci Králové ústřední tržnici žambereckých krajek a navázal přímé styky s výrobci [doc3].\n\nPro zajištění kvalitního materiálu pro výrobu bylo nutné užívat i dobrý materiál, konkrétně švýcarské a francouzské hedvábí [doc2]. Pokusy nahradit tuto potřebu domácím materiálem byly dosud bezvýsledné [doc2].",
        "reference":"Zavedení ústřední tržnice krajek v Hradci Králové vedlo k zaměstnání přibližně 80 krajkářek, kterým poskytovala slušný výdělek, a rozšíření prodeje, přičemž největším odbytištěm byla Vídeň. Překážkou bylo zajištění kvalitního materiálu pro výrobu, protože pokusy nahradit švýcarské a francouzské hedvábí domácími zdroji byly bezvýsledné, což znamenalo nutnost používat dovážené materiály.",
        "faithfulness":1.0,
        "answer_relevancy":0.8740686537,
        "answer_correctness":0.7359847969,
        "context_precision":1.0,
        "context_recall":1.0,
        "context_sufficiency":1.0
    },
    {
        "user_input":"Jaké byly důvody a důsledky snahy polských úřadů vyjít vstříc české menšině na Volyňsku v oblasti školství a kultury, a jak to souvisí s demografickými změnami a politickými aktivitami v regionu?",
        "retrieved_contexts":[
            "O čem se píše. „Venkovu“ zaslal vyslanec Polské republiky hrabě Lasocki přípis, v němž vzhledem k zprávám o útisku na Volyňsku zdůrazňuje, že na Volyni za ruské vlády byly pouze školy ruské, kdežto v září 1924 bylo tam 22 škol českých, dvě polsko-české a řada škol s češtinou jako vyučovacím předmětem. Ruská statistika napočítala na celé Volyni asi 20.000 Čechů, statistika polská udává již 25.000 v části Volyně, která připadla Polsku. Rozhodně vyslanectví musí zdůrazniti, že na straně úřadů polských je zřejmá tendence vyjíti vstříc poměrně nepatrné české menšině na Volyňsku jak v ohledu školském, tak i kulturním. Není nejmenší pochybnosti, že v nejbližší době věc ta udělá pokroky.  Král. Srbů, Chorvatů a Slovinců. Ljuba Jovanovič vyvrací obvinění známé ne-",
            "demokratisaci volebních řádů, jež by většině zem. sněmu, vládě i slovanské minoritě důrazným způsobem tlumočila přání širokých vrstev lidových. Za polské součinnosti byla loni zřízena v Rychvaldě německá škola. Stalo se to v tom domnění, že společnému úsilí polských a německé školy se podaří ubíti české školy matiční. Jak z posledního našeho dopisu jest patrno, zklamalo toto očekávání pány Poláky i Němce na celé čáře. Českým školám dětí neubylo, ani nepřešly do školy německé. Za to přešly tam děti polské a které nepřešly dobrovolně, byly k tomu i donucovány. Stalo se to na př. v Bohumíně, kdež německá radnice odmítla polské matce, v Rychvaldě bydlící, vyplatit chudinský příspěvek na dítě, dokud je nedá do německé školy. Tento a jiné ještě případy přiměly polský tisk k protiněmeckému útoku, v němž vyčítá se rychvaldským Němcům, že s Poláky uzavřenou „zgodu“ tak špatně dodržují a hrozí se přerušením dalšího přátelského poměru. Podivno, s Čechy o dohodě ani slyšet nechtějí, s Němci „zgodu“ mají a litují, že ji nemohou míti dále. Opravdu, podivné jsou cesty slezských Poláků.",
            "to vliv dvora prostřednictvím těšínské komory nebo vlády prostřednictvím zaměstnanců státních úřadů a podniků? Moravské školy se změnily v polské, utrakvistické nebo německé. Teprve státní samostatnost a likvidace otázky těšínské umožnily v našem kraji národní obrození, jež v západních zemích našeho státu — až na pohraniční okresy — již v předchozích generacích právě na poli práce školské svůj úkol takřka splnily. Lid na Jablunkovsku byl západně orientován, starší pamatovali původní moravské školy, volání po zřízení českých škol bylo spontánní.  Tak není divu, že za poměrně krátkou dobu patnácti let národní školství na Jablunkovsku bylo vybudováno tak, že síť 32 škol obecných a 2 škol měšťanských nezbytně vyžadovalo doplnění školou střední. Myšlenkou tou se zabývala Slezská Matice osvěty lidové. Šlo o to, aby také hraničářskému území se dostalo těch kulturních možností, jež si šťastnější kraje Moravy a Čech zabezpečily většinou již v dobách před světovou válkou. Šlo o to, aby dětem hraničářů bylo zabezpečeno právo na vyšší vzdělání stejnou měrou jako dětem vnitrozemí. Šlo o to, aby děti",
            "a nesmí být přáním nás, ba ani ne českých buržoasních stran. Naopak, jejich samostatnosti a kulturnímu vývoji musí býti všemožně napomáháno. Nedělo-li se tak dosud, bylo to chybou, která musí býti odčiněna. Na obce na Ostravsku musí býti působeno, by zvýšily roční podporu, již dávají polským soukromým školám, stejně jako obec přívozská tamější školu polskou musí vydatně podporovati. České Marianské Hory musí však docela jinak prokázati porozumění pro kulturní potřeby polských dělníků, obec obývajících. Ne pouze prodat »levněji« pozemek na budovu polské školy, nýbrž vydatnou stálou podporou polské škole měli by na Mar. Horách dokázat, že dovedou prakticky projevovat smysl pro slovanskou vzájemnost. To jsou úkoly nejbližší doby, později se ukáže, jak se věci dále vyvinou.«",
            "64) J. M. Sokolcov, Ruskaja škola v Polšče, Ruská škola, kniha 2—3, 123.  J. Rubin, Der Kampf für die Muttersprache in der Schule und das Märtyrertum der modernen jüdischen Schule, NE 1926 ,605. 66) LN 2\/8 1924. 67) Stan. Sobinski, L'enseignement public en Petite Pologne Orientale au point de vue national 1923. O rusínských stížnostech v rozpravě rozpočtové komise polského sejmu viz LN 3\/3, 36.  Nepochybně utrpěly pod vládou polskou i české školy na bývalém ruském území ve Volyni a Podolí.68) Školy ty trpí nedostatkem kvalifikovaných učitelů, zvláště pro český jazyk. Všude se pozoruje nepochybná nepřízeň vlády od r. 1923 a rozhodný obrat k horšímu z důvodů sice nepochopitelných, ale vždy politování hodných. Sami Poláci mají ovšem své školy menšinové v cizích"
        ],
        "response":"V roce 1924 zdůrazňoval vyslanec Polské republiky hrabě Lasocki, že na Volyňsku existuje tendence polských úřadů vyjít vstříc české menšině v oblasti školství a kultury [doc1]. Důvodem bylo, že na Volyňsku byly v minulosti pouze školy ruské, zatímco v září 1924 zde fungovalo 22 českých škol, dvě polsko-české a řada škol s češtinou jako vyučovacím předmětem [doc1]. Polská statistika uváděla 25 000 Čechů v části Volyně, která připadla Polsku [doc1].\n\nTato situace souvisela s demografickými změnami. Ruská statistika napočítala na celé Volyni asi 20 000 Čechů [doc1]. Politické aktivity v regionu byly ovlivněny historickými a etnickými složitostmi, které se projevily v politickém tlaku na podporu české menšiny.\n\nV dokumentu [doc5] se uvádí, že české školy na bývalém ruském území ve Volyni a Podolí utrpěly pod vládou polskou, a trpí nedostatkem kvalifikovaných učitelů, zejména pro český jazyk [doc5].",
        "reference":"Polské úřady se snažily vyjít vstříc české menšině na Volyňsku v oblasti školství a kultury, protože na Volyni za ruské vlády existovaly pouze ruské školy, zatímco v září 1924 tam bylo 22 českých škol, dvě polsko-české a řada škol s češtinou jako vyučovacím předmětem, což ukazuje na snahu polských úřadů podporovat kulturní a vzdělávací potřeby české menšiny. Tato snaha souvisí s demografickými změnami, kdy polská statistika uvádí nárůst počtu Čechů na Volyni z 20.000 na 25.000, a s politickými aktivitami, které ukazují tendenci polských úřadů podporovat menšiny v regionu.",
        "faithfulness":0.8,
        "answer_relevancy":0.873443466,
        "answer_correctness":0.9927758408,
        "context_precision":1.0,
        "context_recall":1.0,
        "context_sufficiency":1.0
    },
    {
        "user_input":"Jaké byly důsledky nedostatečné právní úpravy a organizační nejednotnosti na rozvoj československého státního filmu před únorem 1948 a jak únor 1948 přispěl k jejich odstranění?",
        "retrieved_contexts":[
            "váno ve stavu, který bránil jeho zdravému rozvoji a pokroku a který zachovával reakčním silám naději na zvrat zestátňovacího procesu. Tvůrčí činnost byla uváděna ve zmatek prosazováním komerčních hledisek na jedné straně a rozvratnou kritikou na straně druhé. Únor 1948 zlikvidoval tyto uměle udržované nepříznivé podmínky a všechny podvratné snahy a umožnil tak rychlou a cílevědomou konsolidaci státního filmu. Ministr informací zrušil výnosem z 26. února 1948 opatření, jež poskytovala jednotlivým zplnomocněncům a úsekovým ředitelům samostatnou právní subjektivitu, a rozhodl, že jediným nositelem právní subjektivity v oblasti filmu je zestátněné filmové podnikání. Zrušil instituci zmocněnců a přenesl jejich úkoly na náměstky ústředního ředitele a ředitele úseků Československé filmové společnosti. Tím byl dán základní",
            "předpoklad sjednocení a jednotného řízení veškeré činnosti v oblasti filmu. Současně byl učiněn první krok k přípravě systematického plánování v oblasti filmu jmenováním náměstka ústředního ředitele pro plánování a výzkum a pronikavou reorganisací osobní vytvořeny nezbytné podmínky pokrokového vývoje ve filmové výrobě a distribuci. Vláda pak v jednom z prvních zasedání po únoru schvaluje ustavení státního podniku Československý státní film pro celou oblast státu jako jediného nositele veškeré činnosti v oboru filmu. Tím se odstraňuje nezdravý dualismus, pěstovaný odstředivými silami na Slovensku, který bránil stejnoměrnému vývoji filmu v celé republice. Zestátnění filmu je zabezpečeno ústavou. Státní film dostává vládním nařízením ze dne 13. dubna 1948 č. 72 Sb. pevnou právní základnu, na níž je možno vybudovati jeho řádnou organisaci a zdravý vývoj. Je možno přistoupiti k systematickému uspořádání jeho hospodářstvi, filmové výroby a distribuce a k plánovitému řízení jeho rozvoje v celé oblasti státu.",
            "Organisační řád  K provedení tohoto opatření a k zajištění řádného chodu činnosti všech složek Československého státního filmu bude vydán organisační řád, který blíže určí jednotlivé organisační útvary Československého státního filmu, vymezí jejich působnost a vzájemné vztahy, stanoví složení a působnost poradních sborů a určí blíže rozsah pravomoci a odpovědnosti jednotlivých vedoucích.  Filmová distribuce  Závěrečné ustanovení  1. Oběh filmů je obstaráván Správou distribuce, jíž přísluší rozdělování a půjčování filmů, dovoz, vývoz, jazyková úprava a ústřední propagace. 2. Zřizování, správu a provoz kin obstarává Správa kinofikace.  Prozatímní instrukce o ústředním ředitelství podniku Československý státní film, vydaná ministrem informací a osvěty dne 28. září 1948 č. j. 85771\/1948-V\/1, se ruší. Ministr: Kopecký V. v. r.",
            "nenávistným útokům a mocným snahám reakce obhájiti cestu pokroku a rozvoje československého filmu. Státní film musel zápasit v tomto období s největšími obtížemi. Nedostatečná a nedokonalá právní úprava jeho poměrů měla za následek, že někteří držitelé provozních prostředků se bránili jejich předání a na Slovensku i úřední místa popírala účinnost dekretu o zestátnění filmu. Převod nemovitostí sloužících filmu nebylo možno provésti v pozemkových knihách. Právní nejistota a snahy o vynětí některých kin ze zestátnění znemožňovaly konstituování stabilní základny filmového podnikání. Organisační nejednotnost a nesoulad mezi jednotlivými složkami státního filmu, udržované různými politickými tendencemi, zabraňovaly řádnému plánování investic a vývoje. Filmové podnikání bylo udržo-",
            "filmů je zaměřena bezvýhradně k plnění vysokého kulturního poslání. Únor 1948 umožnil, aby hospodářské a technické kvantity a početné a významné prostředky filmu byly cílevědomě zapojeny do úsilí o vybudování lepšího světa, aby byly postaveny do služeb lidu a pokroku a aby se proměnily ve skutečné kulturní hodnoty. Československý státní film nastoupil cestu, na níž bude sloužiti lidu.  Při provádění zahraničního obchodu s kulturními statky jest koordinační referát pověřen výhradním obstaráváním styku s ministerstvem zahraničního obchodu, zajišťuje kultur. ně-politické zájmy v oboru zahraničního obchodu, pečuje o koordinaci zájmů mezi úseky v oboru působnosti ministerstva informací a osvěty a spolupůsobí při projednávání zahraničních obchodů s výsadními společnostmi. Při své činnosti řídí se koordinační referát všeobecně platnými směrnicemi pro zahraniční obchod."
        ],
        "response":"Nedostatečná a nedokonalá právní úprava a organizační nejednotnost bránily rozvoji československého státního filmu. Někteří držitelé provozních prostředků se bránili jejich předání a na Slovensku se popírala účinnost dekretu o zestátnění filmu [doc4]. Převod nemovitostí sloužících filmu nebylo možno provést v pozemkových knihách a právní nejistota znemožňovala konstituování stabilní základny filmového podnikání [doc4]. Organizační nejednotnost a nesoulad mezi jednotlivými složkami, udržované různými politickými tendencemi, zabraňovaly řádnému plánování investic a vývoje [doc4].\n\nÚnor 1948 zlikvidoval nepříznivé podmínky a podvratné snahy, které bránily rozvoji filmu [doc1]. Výnosem z 26. února 1948 ministr informací zrušil opatření, která poskytovala samostatnou právní subjektivitu jednotlivým zplnomocněncům a úsekovým ředitelům, a rozhodl, že jediným nositelem právní subjektivity je zestátněné filmové podnikání [doc1]. Tím byl dán základ pro sjednocení a jednotné řízení veškeré činnosti v oblasti filmu [doc2]. Vláda schválila zřízení Československého státního filmu jako jediného nositele veškeré činnosti v oboru filmu, čímž byl odstraněn nezdravý dualismus na Slovensku [doc2].",
        "reference":"Nedostatečná právní úprava a organizační nejednotnost vedly k právní nejistotě, bránily konstituování stabilní základny filmového podnikání a znemožňovaly řádné plánování investic a vývoje, což udržovalo filmové podnikání ve stavu, který bránil jeho zdravému rozvoji a pokroku. Únor 1948 zlikvidoval tyto nepříznivé podmínky a podvratné snahy, což umožnilo rychlou a cílevědomou konsolidaci státního filmu.",
        "faithfulness":1.0,
        "answer_relevancy":0.8762522203,
        "answer_correctness":0.5390014152,
        "context_precision":1.0,
        "context_recall":1.0,
        "context_sufficiency":1.0
    },
    {
        "user_input":"Jaké byly důsledky zrušení právní subjektivity jednotlivých zplnomocněnců a úsekových ředitelů pro konsolidaci a jednotné řízení filmového průmyslu v Československu po únoru 1948?",
        "retrieved_contexts":[
            "předpoklad sjednocení a jednotného řízení veškeré činnosti v oblasti filmu. Současně byl učiněn první krok k přípravě systematického plánování v oblasti filmu jmenováním náměstka ústředního ředitele pro plánování a výzkum a pronikavou reorganisací osobní vytvořeny nezbytné podmínky pokrokového vývoje ve filmové výrobě a distribuci. Vláda pak v jednom z prvních zasedání po únoru schvaluje ustavení státního podniku Československý státní film pro celou oblast státu jako jediného nositele veškeré činnosti v oboru filmu. Tím se odstraňuje nezdravý dualismus, pěstovaný odstředivými silami na Slovensku, který bránil stejnoměrnému vývoji filmu v celé republice. Zestátnění filmu je zabezpečeno ústavou. Státní film dostává vládním nařízením ze dne 13. dubna 1948 č. 72 Sb. pevnou právní základnu, na níž je možno vybudovati jeho řádnou organisaci a zdravý vývoj. Je možno přistoupiti k systematickému uspořádání jeho hospodářstvi, filmové výroby a distribuce a k plánovitému řízení jeho rozvoje v celé oblasti státu.",
            "váno ve stavu, který bránil jeho zdravému rozvoji a pokroku a který zachovával reakčním silám naději na zvrat zestátňovacího procesu. Tvůrčí činnost byla uváděna ve zmatek prosazováním komerčních hledisek na jedné straně a rozvratnou kritikou na straně druhé. Únor 1948 zlikvidoval tyto uměle udržované nepříznivé podmínky a všechny podvratné snahy a umožnil tak rychlou a cílevědomou konsolidaci státního filmu. Ministr informací zrušil výnosem z 26. února 1948 opatření, jež poskytovala jednotlivým zplnomocněncům a úsekovým ředitelům samostatnou právní subjektivitu, a rozhodl, že jediným nositelem právní subjektivity v oblasti filmu je zestátněné filmové podnikání. Zrušil instituci zmocněnců a přenesl jejich úkoly na náměstky ústředního ředitele a ředitele úseků Československé filmové společnosti. Tím byl dán základní",
            "Knihovna filmového ústavu upozorňuje na tyto nové knihy: Mejlach: Lenin a kultura, Praha MF 1948 (sign. 1883), Pudovkin: Akter v filme. Leningrad 1934 (sign. 1872). Kak my rabotajem nad kinoscenariem. Moskva 1936 (sign. 1873), Huff: An Index to the Films of Ch. Chaplin. London, Filminstitut 1944 (sign. 1878), Haas: The Prepariation of Visual Aids. New York 1948 (sign. 1890), Falconer: Filmstrips. New York, Mc Graw-Hull 1948 (sign. 1891). Ve sbírce přednášek Filmového ústavu byl vydán první svazek: K. Vilímek — Obsluha kinematografické kamery.  Divadlo Filmového studia  V měsíci únoru 1949 bylo uspořádáno DFS 16 večerních představení Pogodinovy hry Aristokrati. V různých částech Prahy bylo provedeno 110 kulturních večerů. Byly prováděny denní i noční zkoušky na hry Želez-",
            "nad Nisou dochází ke sloučení dne 8. července 1948. Například v Lučanech a v Proseči vstoupili do KSČ všichni členové sociální demokracie. Květnové volby přinesly velké vítězství jednotné kandidátky obrozené Národní fronty, pro kterou hlasovalo v celé republice 89,3 % voličů. V okrese Jablonec n. N. bylo z 27 433 platných lístků odevzdáno pro kandidátku Národní fronty 25719 hlasů, tj. 93,75 %. Výsledky voleb potvrdily, že většina lidu podporuje linti vytyčenou KSČ - budování socialismu v těsné spolupráci se Sovětským svazem. Po únoru 1948 dochází na Jablonecku k řešení problémů jabloneckého průmyslu. V procesu znárodnění sklářských závodů byly postupně zřízeny tyto národní podniky: Sklárny a rajinérie Dolní Polubný. Spojené sklárny jablonecké, Jablonecký sklářský průmysl, Skleněná bižuterie, Kovová bižuterie, Preciosa, Krystalerie a Železnobrodské sklo. V složitých podmínkách probíhal na Jablonecku také boj o monopol zahraničního obchodu. Počátkem roku 1949 bylo v Jablonci nad Nisou vytvořeno ředitelství pobočky Skloexportu a v roce 1952 byl zřízen PZO Jablonex.",
            "mentu je poznámka z 13. 7. 1972, že: „Po projednání s vedoucí kádrového útvaru (...) není námitek k jejich jmenování do resortní komise.“ Dne 22. 6. 1972 byl z Ministerstva kultury odeslán dopis, kterým byl jmenován ředitel ZK-ÚVI ČSAV členem Ústřední meziresortní komise. Dopis říkal toto: „Vážený soudruhu, s přihlédnutím k § 8 odst. 2 zákona ze dne 9. června 1959, č. 53 Sb. o jednotné soustavě knihoven jmenuji Vás členem ústřední (meziresortní) komise pro řízení prověrky knihovních fondů knihoven jednotné soustavy.“ 12 Ředitelem ústřední (meziresortní) komise Ministerstva kultury byl Jaroslav Lipovský a to až do té doby, kdy tato komise byla nahrazena „Ústřední meziresortní komisí pro řízení prověrky knihovních fondů při Státní knihovně ČSR“, v roce 1973, jejímž ředitelem se stal ředitel Státní knihovny ČSR. Složení komise však zůstalo téměř nezměněno, bylo pouze doplněno. Dne 16. 6. 1972 byly do některých ústavů ČSAV, na adresu ředitelů či „dočasných“ ředitelů zaslány dopisy tohoto znění:"
        ],
        "response":"Po únoru 1948 ministr informací výnosem z 26. února 1948 zrušil opatření, která poskytovala jednotlivým zplnomocněncům a úsekovým ředitelům samostatnou právní subjektivitu [doc2]. Rozhodl, že jediným nositelem právní subjektivity v oblasti filmu je zestátněné filmové podnikání [doc2]. Tímto zrušením byla přenesena úkoly zmocněnců na náměstky ústředního ředitele a ředitele úseků Československé filmové společnosti [doc2]. Tento krok položil základ pro konsolidaci státního filmu a jednotné řízení v oblasti filmu [doc2].",
        "reference":"Zrušení právní subjektivity jednotlivých zplnomocněnců a úsekových ředitelů umožnilo sjednocení a jednotné řízení veškeré činnosti v oblasti filmu, což vedlo k rychlé a cílevědomé konsolidaci státního filmu a vytvoření nezbytných podmínek pro pokrokový vývoj ve filmové výrobě a distribuci.",
        "faithfulness":1.0,
        "answer_relevancy":0.8849201526,
        "answer_correctness":0.7784318932,
        "context_precision":0.9166666666,
        "context_recall":1.0,
        "context_sufficiency":1.0
    },
    {
        "user_input":"Jakým způsobem ovlivnila první francouzská republika a Napoleon I. vojenské strategie Prusů, zejména generála Moltkeho, a jaké důsledky to mělo pro vojenskou kulturu a přístup k válce v Prusku?",
        "retrieved_contexts":[
            "ních vítězů u Jeny a Borodina, „Viva Italia, viva Garibaldi“ garibaldistů a „Urá“ Rusů nebo Prusů. — Republika francouzská vyměnila záhy frygickou čepici svobody za vojenský klobouk, stala se státem vojenským, jakým nyní Prusko. Pravým zástupcem jejím byl tedy vojin, a proto mohla na něm vymáhati, by věděl vše, čeho u válce věděti třeba, by se pokládal za šťastna, že smí vše, co mu uloží, vykonávati. Ona však mu vštípila jen přesvědčení, že vše dovede, dadouc mu do pole toto naučení: „Ničemu nezvykej, leda tomu, bys ničemu neuvyknul a žádné překážky se nehrozil. Jen nevoják, zbabělec a zrádce vlastí zná a miluje slovo: „nemožné!“ První francouzská republika a Napoleon I. naučil Prusy, a zvláště generála Moltkeho velmi mnohému; předce však bylo by lze, od obou ještě více",
            "Moltke über die neue französische Taktik und Strategie. Man schreibt dem Lyoner „Salut Publik“ aus Paris: Man muthet Mac Mahon eine durchaus nicht neue Taktik zu; seine Absicht wäre hauptsächlich mit der Artillerie, die sehr zahlreich sein soll, zu arbeiten und die Soldaten wo möglich zu schonen. Napoleon I., dessen Schüler Moltke ist, handelte nie anders. Napoleon war es, der die Konzentration großer Truppenmassen auf einem Punkte durch rasche Märsche erfand. Moltke, welcher zu den Bewunderern Napoleons zählt, hat auf die neue französische Taklik und Strategie stets wenig gehalten. Der berühmte preußische General soll vor wenigen Monaten an einen in spezieller Mission eben in Berlin weilenden französischen Offizier in dieser Beziehung folgende Bemerkungen ausgesprochen haben: „Sprechen Sie mir nicht von",
            "den entscheidenden Wert der Schlacht im Kriege ein. Und hohe Schätzung des wirklichen Waffenerfolges, die man im 18. Jahrhundert nicht gekannt hatte, wird von Moltte zum Prinzip erhoben, wenn er sagt: „Der moralische Wert aines Sieges wirkt weiter über das Schlachtfeld hinaus; er trägt seine Bedeutung in sich.“ Das Hindrängen auf einen Sieg mit allen Kräften, das ist der Grundgedanke der Moltkeschen Strategie, aus der sich dann die von ihm geschaffenen Formen des Gefechtes notwendig entwickelten. Friedrich des Großen berühmter schräger Flügelangriff, der so lange in der preußischen Armee als das Universalmittel des Sieges erschienen war, hatte bei den großen Heeren. die schon Napoleon aufstellte, keinen Sinn mehr. Der Korse bevorzugte in seinen Angriffen den Hauptstoß gegen das Zentrum des",
            "zkvalitnění. Autor vyzdvihuje i osobní podíl některých vedoucích vojenských činitelů — velitele pruského generálního štábu generála von Moltkeho, ministra obrany von Roona, stejně jako v politice von Bismarcka — kteří přizpůsobovali koncepci vojenské politiky kapitalistické ekonomice a společenským podmínkám kapitalismu vůbec. Jejich zásluhou začaly do nižších a středních pruských důstojnických kádrů pronikat měšťanské živly, jejichž iniciativa se v rozhodujících bojích 1866 a 1870\/71 velmi osvědčila Autor nezakrývá ani záporné rysy těchto změn, neboť přijetí racionálního kapitalistického ducha v řízení armády se odráželo ve sledování ofenzívní taktiky a v hájení principů preventivní války. Autor, jakkoli plně uznává historické právo německého národa na politické",
            "mit einer starken Armee eine gefährliche Bedrohung der deutschen Flanke. Aber diese Generäle und die anderen dazu verstanden von Strategie so wenig wie Bazaine. „Die französischen Generäle von 1870\", schreibt Bonnal, „waren alle noch durchdrungen vom Kriegsgeisie des 18. Jahrhunderts. Eine solche Rückständigkeit wäre unerklärlich, wenn man nicht wüßte, daß Napoleon und seine Generäle keine Doktrin hinterlassen haben, während die Kriege Napoleons durch Clausewitz für den König von Preußen und seine Armee nutzbar gemacht worden sind. Es gab eine ganze Kategorie von Generälen, die ihre Laufbahn nicht bei den Truppen machten und die ein aktives Kommando erhielten, um sich die praktischen Kenntnisse zu erwerben, die ihnen fehlten, und manche lernten auch etwas, aber meist auf Kosten der"
        ],
        "response":"První francouzská republika a Napoleon I. naučili Prusy mnohému [doc1]. Generál Moltke, který byl Napoleonem obdivovatelem [doc2], se inspiroval Napoleonovými strategiemi, zejména jeho preferencí pro koncentraci velkých vojsk rychlými pochody [doc2]. Nicméně, Moltke na novou francouzskou taktiku a strategii obecně příliš nezajímal [doc2].\n\nNapoleonův přístup k válce, včetně koncentrace sil a útoků do středu nepřátelského vojska [doc3], ovlivnil vojenskou kulturu v Prusku. Friedrich Veliký a jeho schodný křídlový útok, dříve považovaný za univerzální prostředek vítězství, ztratil smysl ve srovnání s Napoleonovými strategiemi [doc3].\n\nMoltkeho strategie kladla důraz na morální hodnotu vítězství, která se promítala i mimo bojiště [doc3]. Přijetí racionálního kapitalistického ducha v řízení armády se odráželo ve sledování ofenzivní taktiky a v hájení principů preventivní války [doc4]. Francouzští generálové z roku 1870 byli stále ovlivněni válkou z 18. století, což bylo způsobeno tím, že Napoleon a jeho generálové nenechali po sobě žádnou doktrínu, zatímco Napoleonovy války byly využity pro Prusko Clausewitzem [doc5].",
        "reference":"První francouzská republika a Napoleon I. naučili Prusy, a zvláště generála Moltkeho, velmi mnohému, což mělo za následek, že Prusko se stalo vojenským státem, kde voják byl pravým zástupcem státu a bylo na něm vymáháno, aby věděl vše potřebné k válce a vykonával vše, co mu bylo uloženo, s přesvědčením, že vše dovede.",
        "faithfulness":1.0,
        "answer_relevancy":0.9268125249,
        "answer_correctness":0.2969271549,
        "context_precision":1.0,
        "context_recall":1.0,
        "context_sufficiency":1.0
    },
    {
        "user_input":"Jaké byly důsledky slavnosti, které se účastnil velkokníže Nikolaj Nikolajevič, na vztahy mezi českými účastníky a ruskými důstojníky a generály, a jak se tato událost odrazila na vnímání českého národa?",
        "retrieved_contexts":[
            "nili. Tím přirozeně mohla býti tato událost ukončena. Kdo chtěl paňácovat v jemu jednotou zaplaceném kroji, dobrá. Ale nyní ozve se žvanivý plátek konopišťského zámku. Všichni, kteří súčastnili se slavnosti a veřejně hájili národní požadavky českého národa, jsou praví velikáni, sláva jim; ti pak, kteří nepřišli v základech shnilý »Sokol« zdejší ohraditi, nesúčastnili se na tak významné slavnosti, jsou špatní vlastenci, ven s nimi z národa. Dnes každý rozumný člověk vidí, že zdejší »Sokol« přiznaně národněsociální, jest pro každou opravdovou práci nemožný jistě ještě tak dlouho, dokavad jeho členové (a zvláště výbor) nepochopí rozdíl mezi skutečnou prácí národní a mezi duchaprázdným fángličkářstvím! Jaké právo má tedy odsuzovati pisatel ty, kteří viděli v slav-",
            "starodružiníků a Ústředního sdružení Čechů a Slováků z Ruska konala se včera po 17. hod. v ruském kostele svatého Mikuláše na Staroměstském náměstí panichyda k uctění památky velkokníž. Nikolaje Nikolajeviče. Přítomni byli m. j. četné význačné osobnosti ruské, žijící v Praze. Za kancelář presidenta republiky byl přítomen náčelník vojenské kanceláře gen. čeček, za min. zahraničí vyslanec dr. Wellner, za min. nár. obrany gen. Syrový. Dále se jí zúčastnili šéf francouzské vojenské mise generál Faucher a četní čsl. vysocí důstojníci a velmi četné význačné osobnosti v čele s posl. drem Kramářem. * Společenský čaj Sdružení posluchačů novinářské školy. Dne 17. ledna pořádalo Sdružení posluchačů novinářské školy vstupní společenský čaj o 20. hodině v Národním domě na Smíchově, jenž měl zdařilý prů-",
            "velikého carství. Po uplynulé hodině odebrali se do zadních místností továrny k banketu, jenž připraven byl v jednom oddělení pro pozvané a v druhém sousedním pro dělnictvo. Síně byly slavnostně ozdobeny, a carská hudba, přišedší schválně z hradu, hrála ruské, české a jihoslovanské písně. Také mezi banketem musil přijímati p. Krnka nesčíslná blahopřání (slavnost celá zvána vůbec jeho jmenovinami) a když za šumotu šampaňského pronešen byl přípitek císaři a císařské rodině, vstal velkokníže Nikolaj Nikolajevič, a  podav ruku p. Krnkovi, děkoval mu jménem císaře za výtečné pušky a náboje, jež on Čech celému ruskému carstvu daroval, a pil potom na jeho zdraví a na krnkovky. Přípitek velkoknížete Nikolaje byl nekonečným „Urá“ a voláním „Sláva“ opětován. Hned potom vmísilo se do",
            "Volkszeitungu Moravců. okresu ratibořského podél starých rakouských hranic žijí nepatrné zbytky zvláštního kmene, který v základních vrstvách je skutečně moravský. — Dopisovatel praví: To není pravda. Nežijí tam jen nepatrné zbytky, nýbrž přes 60.000 a jejich kraj jde podél hranice 9—17 km do šířky. Nesprávné je, že lid jen v základních vrstvách je moravský, na Ratiboř ku jsou všechny vrstvy moravské. Moodtrženou větví slovanského kmene, českého národa. Moravská řeč není de tvrzení memoranda české řeči příbuzná, nýbrž českým nářečím. Tím Nikolaj Nikolajevič pokusí se o převrat v Rusku. Z Berlína, 26. srpna. Čtk. Gorriere dela Sera uveřejňuje anglické zprávy, dle nichž není vyloučeno, že velkokníže Nikolaj Nikolajevič, jehož příjezd očekává se tyto dny v Londýně, pokusí se v Rusku o podobný převrat jako arcivévoda Josef v Pešti.",
            "a vědomí kmenové souvislosti živě se probudilo u všech národů slovanských. V Čechách pobyt vojsk ruských způsobil rozhodný obrat ve prospěch národa českého. Lid český rozuměl vojínům ruským a tito rozuměli lidu českému. V Praze, kdo jen trochu uměl česky, snažil se dorozuměti se s vojíny a důstojníky ruskými. Od Němců v Praze Rusové se odvraceli a jen společnosť českou vyhledávali. To nejen českému lidu lichotilo, nýbrž dodávalo mu i odvahy, když viděl, že vítězové nad Napoleonem a věrní spojenci císaře rakouského a krále pruského, jej vyznamenávali, aby vážil si svého jazyka a věnoval pěstování své národnosti větší než dosud pozornost. Že styků Čechů s Rusy vytryskla na půdě české vzájemnosť slovanská, která k obrození českému přispěla více, než dosud se uznává. Marek byl nad-"
        ],
        "response":"Podle dostupných pramenů se slavnost, na které se účastnil velkokníže Nikolaj Nikolajevič, promítla do pozitivního vnímání vztahů mezi českými účastníky a ruskými vojáky a důstojníky. Vojáci ruskí rozuměli lidu českému a Češi rozuměli vojákům [doc 5]. Čeští účastníci se snažili dorozumět se s ruskými důstojníky a vojáky, a Rusové se odvraceli od Němců a vyhledávali společnost českou [doc 5]. Tato vzájemnost slovanská přispěla k obrození českého národa a dodala mu odvahy, když viděl, že vítězové nad Napoleonem jej vyznamenovali a oceňovali jeho jazyk a národnost [doc 5]. Velkokníže Nikolaj Nikolajevič podal p. Krnkovi ruku a poděkoval mu jménem císaře za pušky a náboje, které Čech daroval celému ruskému carství, a pil na jeho zdraví [doc 3].",
        "reference":"Slavnost, které se účastnil velkokníže Nikolaj Nikolajevič, posílila vztahy mezi českými účastníky a ruskými důstojníky a generály, neboť došlo k přátelským gestům, jako bylo tisknutí rukou a přípitky na zdar českého národa, což vedlo k nadšení a uznání českého národa, jak bylo patrné z volání „Urá“ a „Sláva“ na jeho počest.",
        "faithfulness":0.8571428571,
        "answer_relevancy":0.9558374764,
        "answer_correctness":0.7171120107,
        "context_precision":0.95,
        "context_recall":1.0,
        "context_sufficiency":0.0
    },
    {
        "user_input":"Jaké byly důsledky touhy tvůrčího Geniuse stát se tvůrcem a vyrovnat se bohu, a jak se tato touha projevila v jeho interakci s lidmi a jejich následném chování?",
        "retrieved_contexts":[
            "Člověk pozbyl tvůrčího ducha, zbloudil na scestí a hyne; žíti pak mohou pouze ti, jichž duše jsou uchváceny touhou po Bohu, kterýž bude s nimi a je oživí, neboť Bůh jest nekonečná touha po dokonalosti. K otázce, kdo jest jeho Bůh, spisovatel odpověděti neumí a smutně přemítá o tom, jak srdce jeho jest chladno, ba mrtvo, jak rozum jeho spí, obrazotvornost děsí se přízraků a celé nitro jest zmítáno pochybnostmi, že tam jen časem sálá hněv zářným plamenem, ač jest přeplněno nenávistí, která tam stále doutná. „A takto, jsa slep, něm a hluch, trávím dlouhé dni a noci, po ničem netouže, ničemu nerozuměje; tehdy se mně zdá, že jsem už mrtvolou ... Hrůza takého života ještě se zvyšuje přesvědčením, že musím žíti, neboť ve smrti jest ještě méně smyslu, ještě více tmy.“ Potom čtenář porovnává současné spisovatele s dřívějšími: „Kdysi v našem středu žili velicí mistři slova, jemní znalci života a lidské",
            "nemoc, pro kterou není ani nemocnic ani lékařů. I v blázinci jsou zdravější lidé, než ubohá tato zvěř. A když jsou i výjimky, neznamenají mnoho. Bývají obyčejně bez síly, bez talentu a vlivu. Proto míjím skoro generaci přítomnou a obracím se k příští, dosud snad neporušené části. Co na přítomnosti upraviti se dá, dá, co nedá — nedá Bůh s ní. Ale starost o tu příští je na prvním místě.  Nejen jednotlivci, ale celému národu nic tak nesluší jako touha: relativní cenu člověka mezi lidmi a národa mezi národy hnát k absolutní výši. Absolutního snad nikdy dosaženo nebude a dosaženo býti nemůže —; proto důraz položen na slovo touha a ne slovo absolutní. Dosíci absolutního není snad dopřáno nikomu, ale touhy po absolutním může se stát účastným každý, nechybí-li mu jinak potřebného — na-",
            "vaným mečem jal se zabíjet bratra svého, dar Geniův změnil se v kletbu pro člověka. Poznav tak krutou bolest, šel dál Genius a spatřil, jak lidé stvořili si modly, bludy, prázdnou víru a tu chtěje vésti je ku spáse ve znamení kříže dal jim učení čisté lásky. Co však zbylo z něho po krátké době? Ve jmenu lásky začali se vražditi lidé, křížem hubiti nepřátelé, ve jménu učení zapalovali hranice a ničili požáry města. Vyhledal tedy Genius lidi, kteří ne znali ještě nenávisti a přinesl jim čistou lásku. Ale láska zvrhla se v osudnou kletbu, člověk opil se vášní a ubíjel dar Geniův v pustých orgiích těla. V bídě a lopotování podal Genius lidem zlato a zase vše se počalo pro dar jeho navzájem vražditi. Zklamán Genius vrátil se do bývalého ráje, leč marně tloukl na brány jeho",
            "Přátelství a osobnost . . . . . . . . . . . . 57 Touha po ženě . . . . . Jak se vyvíjí cítění v pudu pohlavním . . . . 69 Původ a užívání pohlaví . . . . . . . . . . 78 Láska a vášeň . . . . . . . . . . . . . . . 87 Monogamie a povaha . . . . . . . . . . . 89 Sebedráždění . . . . . . . . . . . . . . . . 95 Touha po dětech . . . . . . . . . . . . . 105 Láska otcovská a mateřská . . . . . . . . . 107 V čem záleží dobrý otec . . . . . . . . . . 115 Touha po bohu . . . . . . . . . . . . . . 119  DVA VYŠŠÍ MOTIVY.  s ☞ .l . z — 8. . a . s ☞  HLAD ŽALUDKU A HLAD SRDCE. Touhy, nebo žádosti, lze zhruba rozděliti do dvou tříd: 1. Ony, jež vyhledávají prospěchu vlastního já — říká se jim někdy potřeby žaludku — nebo Hlad, a 2. ony, jež vyhledávají prospěchu bližních —",
            "TOUHA PO BOHU.  2 ☞ ž ☞ . 2 . ☞ s l . 8 5  TOUHA PO BOHU.  Výrazem touha po bohu rozumím touhu přijíti ve styk se skutečností, která je za věcmi a vysvětluje osobnost, touhu býti s to sepnouti svůj život s velikým plánem, touhu dosáhnouti osobního spojení s nejvyšší osobností. Tato touha projevuje se také láskou ke kráse, k pořádku a pokroku. Nebudu se zabývati rozvojem této lásky tolik, jako ostatními náklonnostmi, protože tolik lidí je v pochybnostech o tom, je-li bůh, jejž možno osobně poznati, čili nic. Skoro všichni lidé, jež slyším mluviti o bohu, dovolávají se kohosi jiného; málo lidí zdá se mluviti z vlastní zkušenosti. A přece bez této osobní zkušenosti není opravdové poznání možno, a těm, kdo mají takovou zkušenost, není potřebí důkazu, jim život a svět jsou rozdílné od toho, čím byly dříve. Pomyslete, co to je, seznámíte-li se osobně s jediným, jenž řídí svět, a dovedeteli vědomě vniknouti v souhru s ním a v přátelství a ve vzájemný rozhovor. Přeji si přiměti"
        ],
        "response":"Genius se pokusil darovat lidem lásku a zlato, což vedlo k násilným konfliktům a vraždám [doc3]. Dar Geniův se změnil v kletbu pro člověka, kdy se lidé navzájem zabíjeli [doc3]. Lidé začali ve jménu lásky vraždit, pálit hranice a ničili města [doc3]. I když Genius přinesl lidem čistou lásku, ta se zvrhla v osudnou kletbu a lidé se opíjeli vášní [doc3].",
        "reference":"Touha tvůrčího Geniuse stát se tvůrcem a vyrovnat se bohu vedla k tomu, že odešel od andělů k člověku, kterému daroval meč ze železa, aby mu pomohl v boji. Tento dar se však změnil v kletbu, protože člověk začal zabíjet svého bratra. Genius se snažil vést lidi ke spáse učením čisté lásky, ale lidé začali ve jménu lásky a kříže vraždit, hubit nepřátele a ničit města požáry.",
        "faithfulness":1.0,
        "answer_relevancy":0.8343608746,
        "answer_correctness":0.4244261465,
        "context_precision":0.95,
        "context_recall":1.0,
        "context_sufficiency":0.0
    },
    {
        "user_input":"Jaké byly důsledky toho, že Genius přinesl lidem čistou lásku a zlato, a jak se tyto dary proměnily v negativní jevy, které vedly k jeho zklamání a návratu do bývalého ráje?",
        "retrieved_contexts":[
            "vaným mečem jal se zabíjet bratra svého, dar Geniův změnil se v kletbu pro člověka. Poznav tak krutou bolest, šel dál Genius a spatřil, jak lidé stvořili si modly, bludy, prázdnou víru a tu chtěje vésti je ku spáse ve znamení kříže dal jim učení čisté lásky. Co však zbylo z něho po krátké době? Ve jmenu lásky začali se vražditi lidé, křížem hubiti nepřátelé, ve jménu učení zapalovali hranice a ničili požáry města. Vyhledal tedy Genius lidi, kteří ne znali ještě nenávisti a přinesl jim čistou lásku. Ale láska zvrhla se v osudnou kletbu, člověk opil se vášní a ubíjel dar Geniův v pustých orgiích těla. V bídě a lopotování podal Genius lidem zlato a zase vše se počalo pro dar jeho navzájem vražditi. Zklamán Genius vrátil se do bývalého ráje, leč marně tloukl na brány jeho",
            "lesti, kterou již ukrotit nemohl a na kterou musí být republika právem hrda: bolesti nad tím, že se zahraniční nátlak dotýká hranic jeho státu a že je to republika, které se má díti křivda a která má trpět. Republika měla v těchto okamžicích živelně vzrušené davy na svých ulicích, ale davy, které vášnivě projevovaly svoji nesmírnou lásku k svému státu a k své národní svobodě. Smíme jistě tyto projevy představit cizině jako příkladný a varovný náznak toho, jaká nezlomná síla žije v československém lidu, jaké nesmírně vžité živelné základy má tento stát, jaké nezměřitelné resistenční síly v tomto českoslov. lidu se skrývají a jakou by vydaly obranu, kdyby k ní byly donuceny nebo vyzvány. Nebylo by v československém lidu rozdílu mezi mladými a starými, mezi muži a ženami,",
            "„Sláva! Teď jsem šťasten!“ zvolal nemoudrý a pospíchal domů. Klasy obilní u cesty, jak se jich dotkl, i jablka se stromů i brána, na kterou sáhl vcházeje do paláce, vše bylo zlatem. „Není člověka nade mne,“ uvažoval a dal si připraviti dobrou večeři. S chutí zasedl k zlatým misám. Vezme do ruky chléb, — a chléb jest tvrdým zlatem; vezmě pohár, — a v poháru místo vína zlato. „Tak by z toho nebylo nic,“ povídá; „proč bych sám svou rukou jedl, dám se krmiti!“ Ale jak mu podali kousek masa do úst, zuby zaskřípaly o tvrdé zlato. Tu teprve poznal, že je zle. Radost v žalost se mu proměnila. Tak se ulekl, že se mu nohy třásly, jakoby mu žily přeťal. Vzpamatovav se vyskočil na vůz a tryskem jel k Dionysovi. Tam padl na zemi a úpěnlivě prosil, aby ho bůh zbavil tak hrozného neštěstí, že by mu u prostřed zlata bylo zhynouti hladem. Bůh se slitoval a řekl: „Jdi a vykoupej se v řece Paktolu, a budeš prost záhubné milosti, jíž jsi sobě sám vyžádal.“ Midas uposlechl ovšem, a od té doby řeka ta jest zlatonosná.",
            "přiznati si neuměl a nechtěl. Nespokojenost a neklid učinily z Lubína postavu komicky nejapnou. Pocit přání po něčem novém zvrhl se jako by trestem v zhnusení se všeho. Sotva přijel, byl na odchodu. Mramory a pestré mosaiky, zlato, bronzy, křišťály zevšedněly rázem a tak neočekávaně, že litoval kouzla, jež mu zmizelo. Prazvláštní proměna poutala mu duši: pláň tichá, tam na severu ve vlasti, holá cesta širými poli v pozdním soumraku a chladný vítr, v jehož vírech zmítá se babí léto. Jak divně po tom zatoužil! Zvláštní a spontanní tato touha rostla v nejvášnivější přání, kdykoliv se rozhlédl kolem po rozpáleném mramoru a zelené vodě v úpalu sluneční záře. Omamný ráz těchto míst měl svoje východiště v nekonečnosti pláně mořské. Moře bylo slyšeti a cítiti všude jako vládce a pána,",
            "Marně Jiřík bratra chlácholil a sliboval, že mu všichni zajisté odpustí tajný jeho útěk; nevěděl arci, pro jakou ještě jinou, horší vinu Lorek na domov pomýšlel jako na ztracený ráj, z něhož jej anděl vyháněl plamenným mečem zlého svědomí. Takž se bratři rozešli ještě zarmoucenější, než se potkali. Ach, již to věděl Lorek s jistotou, že sídlelo kdysi v chudé chaloupce otcovské pravé štěstí, které on, vlastní, nehodný syn, se zlatým ptákem na vždy urval těm, které na světě nejvíce miloval! Teprv nyní,  když věděl, jak se rozvadila ta svorná rodina, jak se rozprchla do cizího světa, jak zpustnul utěšený domov, kde jindy bývalo tak útulno: nyní cítil, jak velká byla vina, kterou spáchal, a jak šeredné bylo sobectví, kterým se svésti dal k osudné loupeži."
        ],
        "response":"Genius, který přinesl lidem čistou lásku, spatřil, jak se tato láska zvrhla v násilí a vraždění. Lidé začali vraždit ve jménu lásky, hubit nepřátele křížem, pálit hranice a ničít města požáry [doc1]. Následně Genius lidem přinesl zlato, což vedlo k dalšímu násilí a sobectví, kdy lidé navzájem vraždili pro zlato [doc1]. Zklamán touto proměnou se Genius vrátil do bývalého ráje, avšak marně [doc1].\n\nPodobný motiv proměny daru v negativní jev se objevuje i v příběhu o Midasovi, který získal schopnost proměnit vše, na co se dotkne, ve zlato. Tato schopnost, původně vnímána jako dar, se stala prokletím, protože Midas nemohl jíst ani pít, a uvědomil si, že je v ohrožení života [doc3].\n\nMotiv proměny daru v negativní jev se objevuje i v příběhu o Lubínovi, který se zpočátku radoval z bohatství a luxusu, ale nakonec se zhnusil a zatoužil po prostotě a chladném větru [doc4].",
        "reference":"Láska, kterou Genius přinesl lidem, se zvrhla v osudnou kletbu, kdy se člověk opil vášní a ubíjel dar Geniův v pustých orgiích těla, zatímco zlato vedlo k tomu, že se lidé začali pro tento dar navzájem vraždit, což vedlo ke zklamání Geniuse a jeho návratu do bývalého ráje.",
        "faithfulness":1.0,
        "answer_relevancy":0.8434987835,
        "answer_correctness":0.5006067718,
        "context_precision":0.8041666666,
        "context_recall":1.0,
        "context_sufficiency":1.0
    },
    {
        "user_input":"Jaké byly důsledky napětí mezi českou a německou komunitou ve Vídni na konci 19. století, a jak se toto napětí projevovalo v politických a společenských rozhodnutích, jako bylo usnesení poslanecké sněmovny z roku 1883 a usnesení českého sněmu?",
        "retrieved_contexts":[
            "K podobné změně vztahuje se usnesení poslanecké sněmovny z roku 1883 a usnesení českého sněmu z posledního zasedání. Na své poradě uznal klub toho potřebu, aby vychování a vzdělání mládeže na obecné škole hovělo stejnou měrou požadavkům náboženským, národním a časovým. Z četných vážných projevů je vůbec známo, že duchovenstvo nechce školství podrobiti takovému vlivu duchovenských úřadů, jak tomu druhdy bývalo a tím méně mohla by činnost českých poslanců k tomu směřovati. Vláda posud nevyhověla požadavku rady říšské a sněmu českého a nepodala žádné předlohy, která by se týkala nového upravení školství a kterou by se v duchu ústavy ponechalo sněmům, co jim náleží; za nynějších poměrů nelze pak předvídati, kdy se k takovému kroku odhodlá. Návrh knížete Liechtensteina, jenž v plné míře má na",
            "pocitující tlak české konkurence, viděly zajištění své existence pouze v zapojení rakouských a českých zemí do mocného Německa, vedeného vítězným Pruskem, a v potlačení českého národního hnutí. Již první »německý sjezd«, který se sešel v květnu 1870 ve Vídni, se postavil proti požadavkům české oposice a žádal zavedení přímých voleb do říšské rady. Německý národní spolek (Deutscher Volksverein), který sdružoval německé nacionalistické živly v Rakousku, vydal při zahájení prusko-francouzské války provolání, kde vyzýval k solidaritě všech Němců a ke společnému postupu Rakouska a Německa. Spolek vydal r. 1870 program, kde vyzýval k mocenskému boji Němců v Rakousku proti ostatním národům, žádal autonomii Haliče a připojení Dalmácie k Uhrám, aby tak ve zbývajícím Předlitavsku Rakušané a Němci získali převahu nad Slovany a aby se takto vzniklý nový státní útvar mohl co nejtěsněji přimknout k Německu. Německé listy",
            "Zprávy politické.  Dne 28. prosince 1893 bylo zahájeno jednání na sněmu království Českého. Němci si předsevzali, nezavdávat žádnou příčinu k nějakým bojům národním. Myslí si asi: Teď budeme zticha; k čemu teď se prát o drobty; až budeme sedět pevně, budeme míti celé bochníky. A ani pan Plener, nynější ministr financí a bývalý vůdce Němců v zemích českých, ani pan ministr předseda, historický šlechtic, pan hrabě Vindišgréc, nepřijdou do sněmovny. Ba tento mandát co poslanec zemský už složil. A tak snad bude toto zasedání sněmovní prázdno všech bojů národních a státoprávních. Ostatně prý má pan místodržitel v kapse rozpouštěcí dekret, jehož by užil v tom okamžiku, jakmile by se nějaké prudké hádky strhly. A pak bychom měli nové volby a to prý tak dlouho, až bychom měli většinu německou pomocí totiž velkostatkářů",
            "ale položil velkou váhu na to, kdyby ho levice volila. Slova Chlumeckého našla skutečně vyslyšení, Chronini byl přijat za kandidáta a zvolen jako kandidát ústavácký. Členům panské sněmovny rozeslána zpráva Wittmannova o usnesení výboru školského stran návrhu Lienbacherova. Zpráva odmítá usnešení poslanecké sněmnony z důvodů státoprávních a politických a navrhuje, aby se setrvalo na usnešení sněmovny panské ze dne 8. dubna 1881. Návrh menšiny hsjiti bude baron Helfert. Na denním pořádku příští schůze panské sněmovny jest návrh Lienbacherův a předloha o dráze západní. Jak známo již nařídila vláda turecká vyslanci svému ve Vídni, aby žádal ve Vídni, by provedení bosenského brannného zákona se odložilo. Žádost  tato byla ve Vídni rozhodným spůsobem zamítnuta; z",
            "Národnostní otázka byla rovněž na pořadu IV. sněmu vídeňských dělníků, který se konal za účasti asi 4000 osob v neděli 5. dubna 1868 v Universu. Někteří řečníci ji charakterizovali nesprávně jen jako projev zpátečnictví, zazněly zde však i jiné názory. Tak český dělník Lorič se veřejně přihlašoval k zásadám sociální demokracie a sliboval, že čeští dělníci se neodloučí od svých německých bratří. Na závěr jednání bylo schváleno usnesení vydat k dělníkům všech národů Rakouska manifest, který by vysvětlil sociálně demokratické zásady a varoval dělníky před národnostními rozbroji. Text manifestu měl připravit zvláštní devítičlenný výbor. O týden později 12. dubna se hovořilo o národnostní otázce na velkém táboru lidu pod širým nebem ve Vídeňském Novém Městě. Bylo to právě"
        ],
        "response":"Usnesení poslanecké sněmovny z roku 1883 a usnesení českého sněmu se týkají změn v oblasti výchovy a vzdělávání mládeže na obecné škole, kde se mělo hovořit o požadavcích náboženských, národních a časových [doc1]. Klub uznal potřebu, aby vychování a vzdělání mládeže odpovídalo těmto požadavkům [doc1].\n\nNěmecké listy a německý národní spolek vnímaly české národní hnutí jako hrozbu a usilovali o potlačení tohoto hnutí a o posílení německého vlivu v Rakousku [doc2]. Německý národní spolek vyzýval k mocenskému boji Němců v Rakousku proti ostatním národům a žádal autonomii Haliče a připojení Dalmácie k Uhrám, aby Rakušané a Němci získali převahu nad Slovany [doc2].\n\nV roce 1894 se německá komunita snažila vyhnout se národním bojům a čekala na příznivější podmínky, aby mohla prosadit své zájmy [doc3]. Místodržitel údajně měl v záloze dekret, který by mohl rozpustit sněmovnu v případě prudkých hádek [doc3].\n\nV roce 1868 se na sněmu vídeňských dělníků diskutovalo o národnostní otázce, přičemž někteří řečníci ji vnímali jako projev zpátečnictví, zatímco jiní, jako český dělník Lorič, se přihlásili k sociálně demokratickým zásadám a zdůraznili potřebu solidarity mezi českými a německými dělníky [doc5].",
        "reference":"Napětí mezi českou a německou komunitou ve Vídni na konci 19. století vedlo k tomu, že německé spolky a jednoty byly vyzývány, aby si hájily svého práva proti Čechům, což se projevovalo nepřátelskými postoji a akcemi vůči české menšině. Toto napětí se odráželo i v politických a společenských rozhodnutích, jako bylo usnesení poslanecké sněmovny z roku 1883 a usnesení českého sněmu, které se týkalo potřeby, aby vychování a vzdělání mládeže na obecné škole odpovídalo požadavkům náboženským, národním a časovým, což naznačuje snahu o posílení národní identity a ochranu českých zájmů.",
        "faithfulness":1.0,
        "answer_relevancy":0.8519785074,
        "answer_correctness":0.5105911498,
        "context_precision":1.0,
        "context_recall":0.3333333333,
        "context_sufficiency":0.0
    },
    {
        "user_input":"Jaké byly hlavní cíle a požadavky čsl. soc. dem. strany dělnické na župním sjezdu v západních Čechách, a jakým způsobem se tyto cíle a požadavky projevily v přijatých resolucích a ve volbě nového župního výkonného výboru?",
        "retrieved_contexts":[
            "domě „Peklo“ hlavní zasedání župního sjezdu čsl. soc. dem. strany dělnické v západních čechách za účasti 343 delegátů organisací stran v župě plzeňské a řady korporací strany, jakož i značného počtu hostí. Jednání sjezdové řídil ministr Gustav Habrman, který byl předmětem srdečných ovací účastníků. Když bylo vzpomenuto mrtvých činovníků a příslušníků strany doma i za hranicemi, byl odeslán sjezdem pozdravný telegram presidentu Masarykovi a senioru strany posl. Němci. Po té referoval posl. dr. Meissner o poměru strany ke koalici, dále posl. Pik o situaci politické a o věcech organisačních. V odpoledním zasedání promluvil posl. Remeš o pozemkové reformě a o situaci hospodářské. O každém bodu programu byla provedena rozprava. Bylo přijato několik resolucí, v nichž vytyčuje se kladný poměr strany ke státu a projevují se požadavky soc. dělnictva ve směru politickém, hospodářském, sociálním a kulturním. Byl zvolen nový župní výkonný výbor v čele s posl. Pikem a Remešem. Všechna usnesení sjezdu stala se v naprosté jednomyslnosti. Sjezd byl ukončen o 17. hodině projevem ministra Habrmana.",
            "lebních okresů v Čechách. Ministr, propustil deputaci s ujištěním, že všechen zájem bude věnovati otázce českých menšin. Požadavky Slovinců opětně byly prohlášeny v těchto dnech ve výkonném výboru pokrokové strany v Lublani. Strana tato bude miti na podzim schůzi důvěrníků, která se má zabývati reorganisací strany a program ve všech částech. Tento týden konala se schůze výkonného výboru, které súčastnil se také vzhledem na důležitost věci purkmistr Hribar, který, jak známo, vystoupil z výkonného výboru. Dle navrženého programu žádá strana jako hlavní postulát národnostní autonomii a za konečný cil strany spojené Slovinsko. Za podmínku prohlašuje dále zavedení slovinské vnitřní úřadní řeci ve všech zemích Slovinci obydlených, zřízení vrchního soudu v Lublani, jakož i slovinské university. K dosažení tohoto cíle jest třeba spojiti se s ostatními slovanskými národy v první řadě však s Chorvaty a Srby.",
            "ze sjezdu v Praze. Místní organisace československé soc.-demokratické strany dělnické jménem lidu zúčastněného na slavnosti odhalení pomníku presidenta republiky ve Vicenicích u Náměště n. Osl. Podpůrná jednota Karel Havlíček Borovský v Kutné Hoře ze slavnosti dvacetiletého jubilea. Účastníci osvětového sjezdu v Litomyšli. Odbor Č. O. B. v Benešově z jubilejní valné hromady na paměť 40tiletého trvání. Spolek „Vltavan“ v Praze ze slavnosti šedesátilétého trvání a rozvinutí nového spolkového praporu. Živnostníci a obchodníci shromáždění na župním sjezdu čsl. živnostensko- obchodnické strany středostavovské v Pardubicích. Tělocvičná jednota Sokol v Sokolnicích ze slavnosti otevření nové Sokolovny. Živnostnictvo a obchodnictvo živnostenské strany ze župního sjezdu",
            "Ze župního sjezdu naší strany v Plzni. zv. odborových poslanců a vyzval ony poslance, kteří dem. strany dělnické pokračoval dnes v jednán. Prena program strany byli zvoleni a nechtějí v klubu sidentu Masarykovi byl zaslán pozdravný telegram, strany setrvati, aby čestně se vzdali od strany získav němž vzpomenuto jeho osvoboditelských činů a záných mandátů. sluh. Jménem ústředního výkonného výboru strany ce. Za župní výkonný výbor německé soc. demokracie promluvil senátor Starck, jenž zdůraznil společnost zájmů dělnictva obou národností a mluvil pro společný postup, zejména proti snahám probouzející se reakce. Po té následoval referát posl. sodr. Pika a Habrmana o taktice a politice strany, posl. Hampla a senátora Petříka o socialisaci a pozemkové reformě. Kandidát-",
            "jedině říšský a zem. poslanec soudr. Prokeš, který se též ujal slova. Prohlásil všechny požadavky polského proletariátu za spravedlivé a za totožné s oněmi, za něž zápasí český dělník ve Vídni a jinde. Požadavky polského obyvatelstva setkají se se sympatiemi českého proletariátu, organisovaného v českoslovanské sociální demokracii. Jsouce pro výchovu v mateřském jazyku, jsme proti národnostní assimilaci (houřlivý souhlas a dlouhotrvající potlesk), která působí zhoubně na charakter i na celé hnutí proletářské. Českoslovanští sociálně demokratičtí poslanci na sněmu vykonají pro přednesené požadavky vše, co bude v jejich moci. Navržená resoluce byla přijata. V den sejití se sněmu bude vypravena do Brna deputace, která odevzdá zemskému hejtmanovi, náměstkům a předsedům sněmovních frakcí memorandum, obsahující odůvodnění požadavků polského obyvatelstva. Průběh tábora byl velice důstojný."
        ],
        "response":"Na župním sjezdu čsl. soc. dem. strany dělnické v západních Čechách, který se konal v Plzni, byly diskutovány a přijaty resoluce, které vytyčovaly kladný poměr strany ke státu a projevovaly požadavky soc. dělnictva ve směru politickém, hospodářském, sociálním a kulturním [doc1].\n\nMezi hlavní cíle a požadavky strany patřila podpora národnostní autonomie a spojení Slovinska [doc2]. Dále se řešila otázka socializace a pozemkové reformy [doc4].  Na sjezdu se projevila podpora výchovy v mateřském jazyku a odpor proti národnostní asimilaci [doc5].\n\nNový župní výkonný výbor byl zvolen v čele s posl. Pikem a Remešem [doc1]. Senátor Starck zdůraznil společnost zájmů dělnictva obou národností a promluvil o společném postupu proti probouzející se reakci [doc4]. Všechna usnesení sjezdu byla přijata jednomyslně [doc1].",
        "reference":"Hlavní cíle a požadavky čsl. soc. dem. strany dělnické na župním sjezdu v západních Čechách se týkaly kladného poměru strany ke státu a požadavků sociálního dělnictva ve směru politickém, hospodářském, sociálním a kulturním. Tyto cíle a požadavky se projevily v přijatých resolucích, které vytyčovaly tyto směry, a ve volbě nového župního výkonného výboru, v jehož čele byli zvoleni poslanci Pik a Remeš.",
        "faithfulness":1.0,
        "answer_relevancy":0.8897162585,
        "answer_correctness":0.7132265836,
        "context_precision":0.7,
        "context_recall":1.0,
        "context_sufficiency":1.0
    },
    {
        "user_input":"Jaké byly důvody a důsledky slavnostního kázání v chrámu Páně, které vedlo k modlitbám za císaře Františka Josefa I. a jeho rodinu, a jak to souviselo s vyjádřením věrnosti a vděčnosti vůči církvi a státu?",
        "retrieved_contexts":[
            "přibyli 4 žáci, vystoupilo 19 žáků. Třídy I., II., III. a IV. rozděleny byly v pobočky První běh ukončen byl dne 15. února 1913, druhý dne 5. července 1913 slavným »Te Deum« a rozdáním vysvědčení. 2. Slavnosti. a) Dne 18. srpna 1912 zúčastnil se ředitel s přítomnými členy sboru professorského slavných služeb Božích na oslavu Nejvyšších narozenin Jeho Veličenstva císaře a krále Františka Josefa I. v chrámu Páně sv. Ducha.  b) Dne 10. září 1912 zúčastnil se ředitel s prof. Fr. Hniličkou slavného rekviem za Její Veličenstvo zvěčnělou císařovnu a královnu v kathedrálním chrámu Páně. c) Dne 4. října 1912 konány byly k oslavě Nejvyšších jmenin Jeho Veličenstva císaře a krále Františka Josefa I. v kapli ústavu slavné služby Boží, jimž přítomen byl celý sbor professorský s veškerým žactvem katolickým. d) Dne 19. listopadu 1912 sloužena byla za J. Veličenstvo Nejjasnější zvěčnělou císařovnu Alžbětu slavná zádušní mše sv. v kapli ústavu za přítomnosti veškerého žactva i sboru professorského.",
            "Zprávy domácí. C. k. evang. vrchni círk. rada oznamuje: „Hledíc k srdečnému přání všech evangelických spoluvěřících obou vyznání svého obvodu vrchní církevní rada považovala to za svou povinnosť, z příčiny stoleté jubilejní slavnosti udělení tolerančního patentu prositi pro zákonní zástupce evangelické církve Rakouska za dovolení, aby k stupňům trůnu s slibem věrnosti se přiblížiti a Jeho Čís. a Král. Apošt. Veličenstvu za slavné rozšíření a korunování díla Jeho vznešeného předka, nejuctivější, nejvroucnější vděčnost evang. církve augšb. a helv. vyznání vysloviti a co viditelný výraz této vděčnosti exemplář slavnostního spisku „Toleranční patent císaře Josefa II.“ podati směli. Jeho Císařské Veličenstvo ráčilo k této prosbě nejlaskavěji svoliti a vrchní",
            "Slavným službám Božím o dni jmenovin J. V. Nejmilostivějšího našeho císaře a krále Františka Josefa I. a Jejího Veličenstva císařovny a královny Alžběty obcoval ústav ve školním chrámu Páně jsa veden sborem professorským, ana 4členná deputace professorů, majíc v čele ředitele, súčastnila se slavných služeb Božích konaných v děkanském chrámu Páně a pronesla jménem celého ústavu nejhlubší blahopřání do rukou pana c. k. okresního hejtmana. Mimo to obcovali žáci se sborem professorským zádušním službám Božím ve dni úmrtní J. J. V. V. císaře a krále Ferdinanda Dobrotivého a Jeho vznešené choti Marie Anny. A dvakráte ještě ve školním roce tomto projevil celý ústav nejhlubší oddanost k Nejjasnější dynastii Habsburské, ovšem u příležitosti naplňující všecky největším zármutkem a žalem. Prvně, když v Pánu zesnul",
            "Františka Josefa I. opět navrátil, že nad námi pozdvihnul milostivou tvář svou a dal nám viděti růžové jitro dnů těch, v nichžto se těšíme blahou nádějí, že se vrátí dávné časy oslavy Sionské. Tu jsme se před Bohem zavázali slibem svatým, že všickní společně, bez rozdílu stavu a povolání, chceme býti církevními staršími, chtíce starati se o zdar a prospěch sboru svého chtíce růsti v toho všelijak, kterýž jest hlava církve, pána a spasitele našeho Ježíše Krista! — Baronové Moric a Alexander z Bethmannů, synové výše jmenovaného pána, doprovodili otce svého k řečené chrámové nábožnosti, jakož i veškeré ctihodné úřednictvo jeho. Shromáždění bylo četné. — Kuratorem jestiť opět bratr František Zedník, o sbor Bošínský chvalně zasloužilý. Obřad zřízení církevních starších vykonal zástupce duchovních potřeb našich, dv. p. Jan Janata, ev. farář. z Chleb. Na to měl kázaní slova Božího z 1. Tessal 5, 18., jehožto hlavním obsahem: O vděčnosti, Krásné ctnosti, Káže tobě Boží hlas: Máš na lásku pamatovat, Lásku láskou odměňovat, A to činit s ochotností V každý čas! Zdař Bůh!! —",
            "život věčný obdržím?“ Mluvil o potřebě sv. víry, která jest nám, poutníkům zde na světě světlem ve tmách bludů, skýtá znaveným posilu, zvláště v modlitbě a sv. svátostech a leje balsám útěchy do srdcí žalem sklíčených. A proto hrdě ať každý hlásí se k své matce, církvi katolické, ať žádný nekulhá na obč strany, ať všichni volají, když potřeba káže: „Já jsem katolik!“ Kéž jeho v pravdě apoštolská slova probudí ospalé! Poněvadž se toho dne oslavovaly narozeniny Jeho Veličenstva císaře a krále Františka Josefa I., tu opět povzbudil ku konci mše sv. přítomné ku věrnosti trůnu a císaři, která však bude nejlepší, budeme-li věrni též oltáři. Zpíváno pak Te Deum. a sv. požehnáním krásná a dojemná slavnost skončena. J. M. poděkoval pak jménem všech vldp. děkan. Odpoledne navštívil"
        ],
        "response":"Slavnostní kázání v chrámu Páně, které vedlo k modlitbám za císaře Františka Josefa I. a jeho rodinu, bylo oslavou narozenin císaře a krále Františka Josefa I. [doc5]. Kázání zdůrazňovalo potřebu svaté víry, modlitby a svátostí, a zároveň vybízelo k věrnosti trůnu a císaři [doc5]. To souviselo s vyjádřením vděčnosti a věrnosti vůči církvi a státu, což bylo vyjádřeno modlitbami, zpěvem Te Deum a svatým požehnáním [doc5].\n\nPodobné projevy oddanosti Habsburské dynastii byly běžné i v jiných institucích. Veřejná městská Česká vyšší škola reálná v Pardubicích obcoval ústav ve školním chrámu Páně jsa veden sborem professorským a účastnila se slavných služeb Božích [doc3]. C. k. evang. vrchní církevní rada se obrátila na zákonné zástupce evangelické církve Rakouska s žádostí o svolení k vyjádření vděčnosti císaři za rozšíření práv evangelické církve [doc2].",
        "reference":"Slavnostní kázání v chrámu Páně vedlo k modlitbám za císaře Františka Josefa I. a jeho rodinu, protože vyjadřovalo vděčnost a věrnost vůči církvi a státu, což bylo zdůrazněno vroucím přáním a modlitbou za požehnání a zachování císaře, jeho rodiny, Rakouska, české země a evangelické církve.",
        "faithfulness":0.5833333333,
        "answer_relevancy":0.8993998311,
        "answer_correctness":0.4272639312,
        "context_precision":1.0,
        "context_recall":0.6666666667,
        "context_sufficiency":0.0
    },
    {
        "user_input":"Jaké byly důsledky toho, že tvůrčí Genius, který toužil po větší tvůrčí síle a odešel od andělů k člověku, daroval lidem meč a později učení čisté lásky, a jak se tyto dary proměnily v kletbu pro lidstvo?",
        "retrieved_contexts":[
            "vaným mečem jal se zabíjet bratra svého, dar Geniův změnil se v kletbu pro člověka. Poznav tak krutou bolest, šel dál Genius a spatřil, jak lidé stvořili si modly, bludy, prázdnou víru a tu chtěje vésti je ku spáse ve znamení kříže dal jim učení čisté lásky. Co však zbylo z něho po krátké době? Ve jmenu lásky začali se vražditi lidé, křížem hubiti nepřátelé, ve jménu učení zapalovali hranice a ničili požáry města. Vyhledal tedy Genius lidi, kteří ne znali ještě nenávisti a přinesl jim čistou lásku. Ale láska zvrhla se v osudnou kletbu, člověk opil se vášní a ubíjel dar Geniův v pustých orgiích těla. V bídě a lopotování podal Genius lidem zlato a zase vše se počalo pro dar jeho navzájem vražditi. Zklamán Genius vrátil se do bývalého ráje, leč marně tloukl na brány jeho",
            "sofování s laciným pesimismem, k němuž zesláblá ruka bez ohně, bez dramatického vzruchu a bez tvůrčí síly načrtla několik hubených. mdlých a neživotných ilustrací. Veršovec (B. Kaminský) doprovodil tyto mdlé listy studenými a bledými slokami. Po sedmi dnech díla Tvůrcova, kdy andělé pěli slávu a zněly modlitby prvních lidí, jediný jen duch vzpíral se slávě Onoho. Prvním nesouladem zachvěl se ráj, neboť on, tvůrčí Genius, zůstával nepohnut, touže po něčem větším, než aby s cheruby pěl hosanna jinému: sám chtěl býti tvůrcem, vyrovnat se bohu silou tvůrčí, ráj stvořit lidem. A proto odešel ze středu andělů, odešel k člověku právě vyhnanému z ráje. Našel člověka slabého v boji s dravci, a aby mu pomohl daroval mu meč ze železa. Leč čeho se dočkal! Člověk daro-",
            "známo každému, že změna, která se děje s ním při pohlavní dospělosti, znamená veliký duševní převrat, že znamená náhle obrácení sebe sama. Jest docela jiný poměr dospělého člověka ke skutečnosti, k lidem, k uměleckému tvoření, než jest poměr dítěte k těmto věcem. Jest otázka, do jaké míry tvůrčí umění závisí na pohlavní dospělosti. Vidíme, že jest nemyslitelno ono silné, velké tvůrčí umění bez dospělosti pohlavní. Vidíme ještě dále jistý zjev, který nasvědčujn tomu, že není bez síly pohlavní umění velkého a silného. Vidíme to na lidech, kteří tvoří ještě po dobu, kdy jsou starci; vidíme na nich jen šablonu a setrvačnost v práci. I to svědčí pro ono tvrzení, že umění velké, silné, tvůrčí není údělem dětí. Proti tomu stavěny bývají však jiné důvody. Jsou to virtuosové a skladatelé",
            "učit pravému umění darovat čistě; jejich dar (stejně jako dary slunce, vody, země, větru) není znečištěn neřestí žádosti zisku a lichevného úroku jako dary naše. Ony dávají, aby dávaly, nic nad to; ne jako my, abychom tím víc obdrželi; dostalo-li se jim pomoci roubu z ruky člověkovy, pomoci ošetření, zalévání, živení, vyléčení, očištění, dávají radostně víc, nikoliv aby dostaly více, nýbrž že člověk dal, a dar jejich je vždy větší daru člověkova. Ustavičně ukazují, kterak větší a krásnější je dávat nežli brát. Tak jejich moudrost jasných dárců stojí nadobro proti všedně-nízké lžimoudrosti naší, které bláznem je, kdo dává .. a v kolika jiných podlých formách bývá to vyjádřováno v tak zvaných moudrostech národních, které roztrušují do dětských slabikářů,",
            "hody, snad pod vlivem alkoholu. Později se však zjistilo, že Coedel nepil toho dne více než obvykle, takže okolnosti jeho smrti se stávají poafp někud záhadné. Emil Votoček pětasedmdesátníkem. Dne 5. října se dožívá 75 let v plně životní i tvůrčí síle inž. dr. h. c. Emil Votoček. Jubilant byl vynikajícím profesorem českého technického učení a jako chemik je autorem významných vědeckých prací. Naší veřejnosti bude však spíše znám jako hudební skladatel, oddaný propagátor Besedních úterků a autor skladeb, zejména komorního žánru, které byly právem vysoko oceněny kritikou i hudebním obecenstvem. Emil Votoček pracoval také jako expert-slovníkář a vydal v této funkci kromě několika slovníků chemických i výborný „Slovník hudební“. Bude založena Společnost Mikolá-"
        ],
        "response":"Genius, toužící po větší tvůrčí síle, odešel od andělů a daroval člověku meč ze železa [doc2]. Následně daroval lidem učení čisté lásky [doc1]. Dar meče se proměnil v násilí, neboť člověk začal vraždit [doc1]. Učení čisté lásky se také zvrhlo v kletbu, lidé začali vraždit ve jménu lásky, hubit nepřátele křížem a pálit hranice [doc1]. Dále se dar lásky proměnil v osudnou kletbu, lidé se opíjeli vášní a ubíjeli dar Geniův v orgiích [doc1]. Genius následně lidem daroval zlato, což vedlo k dalšímu násilí a vraždění [doc1]. Zklamaný se Genius vrátil do bývalého ráje, avšak marně [doc1].",
        "reference":"Tvůrčí Genius daroval lidem meč, aby jim pomohl v boji, ale lidé začali tímto mečem zabíjet své bratry, čímž se dar změnil v kletbu. Později, když Genius dal lidem učení čisté lásky, lidé ve jménu této lásky začali vraždit, hubit nepřátele křížem a zapalovat hranice, což vedlo k ničení měst požáry.",
        "faithfulness":1.0,
        "answer_relevancy":0.0,
        "answer_correctness":0.6123261645,
        "context_precision":0.9166666666,
        "context_recall":1.0,
        "context_sufficiency":0.0
    },
    {
        "user_input":"Jaké byly důsledky snahy Geniuse přinést lidem čistou lásku a zlato, a jak se tyto snahy proměnily v tragédii, kterou umělec původně zamýšlel zobrazit ve svém díle?",
        "retrieved_contexts":[
            "vaným mečem jal se zabíjet bratra svého, dar Geniův změnil se v kletbu pro člověka. Poznav tak krutou bolest, šel dál Genius a spatřil, jak lidé stvořili si modly, bludy, prázdnou víru a tu chtěje vésti je ku spáse ve znamení kříže dal jim učení čisté lásky. Co však zbylo z něho po krátké době? Ve jmenu lásky začali se vražditi lidé, křížem hubiti nepřátelé, ve jménu učení zapalovali hranice a ničili požáry města. Vyhledal tedy Genius lidi, kteří ne znali ještě nenávisti a přinesl jim čistou lásku. Ale láska zvrhla se v osudnou kletbu, člověk opil se vášní a ubíjel dar Geniův v pustých orgiích těla. V bídě a lopotování podal Genius lidem zlato a zase vše se počalo pro dar jeho navzájem vražditi. Zklamán Genius vrátil se do bývalého ráje, leč marně tloukl na brány jeho",
            "složitých stavů mají větší způsobilost a častější náladu než jiní. Umělecké dílo jest výraz, jehož pro složitost a nesnadnost jen velmi zřídka lze dosáhnouti. Hranice mezi uměním a neuměním jsou empirické, a nelze jich definovati. Umělecký genius liší se od obyčejného člověka jen kvantitativně. Místo poeta nascitur mělo by se říkat homo nascitur poëta; někdo se rodí malým, druhý velkým básníkem, ale básníkem je každý; geniálnost nesestoupila s nebes, nýbrž jest samotnou lidskostí. Genius, který se vydává nebo jehož líčí, jako by byl vzdálen lidskosti, jest trestán tím, že se stává směšným, jako jím byl genius romantické doby a nadčlověk našich dnů. Zároveň však dlužno vytknouti, že umělecká geniálnost jako každá forma lidské činosti duchovní jest vědomá, jinak by byla slepým mechanismem. Jenom vědomí reflektované, obohacené o historické",
            "dědičnosti, Krev rodu zkažena v předešlých generacích alkoholismem a pohlavními excessy, ukazuje se i na Claudiovi uměleckou jeho umíněností, šílenou až žízní po tvoření a neschopností, při všech geniálních nábězích podati dílo dokonalé. Claudius rve se se svým talentem a osudem, se svými obrazy, se salonem a přec koncem propadá osudu, jenž na základě disposicí, dědičností utvořených, jeví se neodvratným. Neschopen provésti v umění o čem sní, neschopen pro tvůrčí horečku, jež jej naprosto pohlcuje, cítiti lidsky se svou ženou a dítětem, ničí posléze život svůj i ženy, jež se mu zcela obětovala. Desný tento pochod dekadenční ve všech stadiích vystihuje péro Zolovo v celé ohromující jeho skutečnosti, se silou pravdy a umění, jakou honositi se může jen",
            "rakouské v roce 1866. Ve vypravování to mísí se krásné episody, jako život české vynikající pěvkyně na její dráze umělecké, dále nepřátelství mezi knězem katolickým a evangelickým, kteréžto později ustoupí opravdovému přátelství, když oba mužové na vzájem se seznají. Oba jsou vzornými lidmi, povinností svých co boženském činí vášnivými odpůrci — avšak později společná láska k drahé, zkoušené vlasti, když nebezpečí jest největší, dělá z nich upřímné přátely. V tomto románu vylíčeny jsou poměry maloměstské a venkovské tak dojemně a zaroveň dovedně, že se nám zdá, jako bychom osoby jednající měli před očima. Nepřeháníme tudíž v praničem, když tvrdíme, že „Zlato v ohni“ jest jedním z nejlepších českých románů, kterými naše novověká literatura vykázati se může. Nejnovější pak dílo Vlčkovo jest objemný, pětidílný román, na širokých základech založený „Samo-",
            "nosti, zákonnosti, hotovosti a prostoty, je genius. Býti poslušen svého genia, důvěřovati mu, milovati svůj osud, abych mluvil jazykem společným všem mudrcům od Marka Aurelia až po Goetha, Carlylea a Emersona — znamená blížiti se mu a přejíti v něj konečně. Všimněte si, že právě proto nemívá genius skoro biografie, rozumí-li se tím vnější historie. Největší geniové tratí se rychle ve tmě a všeobecnosti: všecko individuálné a jedinečné proměnili v ideu a symbol, a život jejich mluví odtud právě jen tímto orientálním jazykem. Pohleďte nyní s tohoto hlediska na kulturní dílo lásky na zemi. Dílo takové velikosti — a kde jsou ženy, které na něm pracovaly? Kde jejich jména? Větry donesly nám snad posvěcenou zpěvnost několika jejich pololegendárních, polohistorických jmen — ale to je výjimka. Stalo se to jen tehdy,"
        ],
        "response":"Genius se pokusil lidem přinést čistou lásku a zlato. Snaha o čistou lásku se zvrhla v osudnou kletbu, lidé začali vraždit ve jménu lásky, hubit nepřátele křížem, pálit hranice a ničít města [doc1]. Dar zlata, který Genius lidem podal, vedl k navzájemnému vraždění [doc1]. Zklamán se Genius vrátil do bývalého ráje, ale marně [doc1].",
        "reference":"Snahy Geniuse přinést lidem čistou lásku a zlato vedly k tomu, že láska se zvrhla v osudnou kletbu, lidé se opili vášní a ubíjeli dar Geniův v pustých orgiích těla, a zlato vedlo k vzájemnému vraždění. Tato tragédie, kterou umělec původně zamýšlel zobrazit ve svém díle jako velkou tragedii člověka filosoficky pojatou, se scvrkla v maličké diletantské filo.",
        "faithfulness":1.0,
        "answer_relevancy":0.8674040192,
        "answer_correctness":0.448509371,
        "context_precision":0.7555555555,
        "context_recall":1.0,
        "context_sufficiency":1.0
    },
    {
        "user_input":"Jaké byly důvody pro vyloučení komunistické revoluce v Německu a jaké politické síly a události přispěly k této situaci?",
        "retrieved_contexts":[
            "udělavší právě jednu revoluci, mohl než házet pumy. Celé hnutí je ovšem odvzbuzovati naději, že postoupí, jako se souzeno k žalostné porážce. Docílí jen to stalo v Rusku, ještě k revoluci druhé, toho, že posílí ideu Einwohnerwehren. důkladnější) Liebknecht a Rosa LuxemDělati za takových podmínek v Němeburgová vedli davy do ulic a sami našli cku revoluci, to je pokus tak frivolní, že v boji smrt; když na jaře r. 1920 byl odby skoro se mohlo zdát, že německá vláražen Kappův monarchistický puč široce da sama si toto hnutí objednala, aby založenou akcí proletariátu a říšská vlávyvolala dojem v dohodě, která trvá na da prchla z Berlína do Saska a ze Saska splnění pařížských podmínek reperačprchala dále na jih, když státní aparát, ních. V tom smyslu aspoň jistě nebude",
            "Liebknechtem a jeho rodinou (1874) až k porozumění si jeho syna Karla Liebknechta s V. I. Leninem na konferenci v Zimmerwaldě r. 1915, proběhla životní dráha Liebknechtů tak, že se stala neodmyslitelnou z historie mezinárodního dělnického hnutí. Způsob boje Karla Liebknechta proti imperialismu, válce a šovinismu svědčil o jeho odvaze i intelektu. To, co Engels i oba Liebknechtové předpokládali, se stalo v srpnu r. 1914 skutečností a Dr. K. Liebknecht byl 2. prosince r. 1914 jediným německým poslancem, který na říšském sněmu odmítl podepsat válečný rozpočet národního důchodu. Autor objasnil soudní procesy, které byly proti K. Liebknechtovi vedeny před válkou i za války, upozornil na ohlas Liebknechtova hrdinství v Barbussově románu Oheň a vyzdvihl historický význam levicového křídla německých sociálních demokratů, Spartakovců, vedených K. Liebknechtem a R. Luxemburgovou. Bartel osvětlil průběh německé revoluce r. 1919 a vraždy obou vůdců Spartakova klubu. Jejich zápasy i činnost jejich spolubojovníků i žáků typu Wilhelma Piecka, Ernsta Thälmanna a Waltera Ulbrichta vedly 30. prosince 1918 k založení Komunistické strany Německa.",
            "společníci úspěchu o jakém se jim ani nezdálo, když zrádni vůdcové německého všeodborového svazu s nimi uzavřeli „ústřední pracovní smlouvu“ a z válečných zločinců se stali smluvní partneři odborů. Scheidemann vyhlásil stav obleženi a pravicový sociální demokrat, ministr říšské obrany Noske, s cynickým výrokem: „Někdo tím krvavým psem být musi,“ poslal proti revolučnímu lidu císařské pluky s vrhačí min a děly. Kulomety kosily revolucionáře lidových námořnických divisi. Podle stanného práva jenom v Berlíně bylo popraveno 1200 lidi. Dne 15. ledna 1919 dala vláda zajmout a zavraždit neohrožené vůdce německého lidu Karla Liebknechta a Rosu Luxemburgovou, po jejichž boku hrstka poctivých vůdců s dnešním presidentem Německé demokratické republiky Pieckem, s Clarou Zetkinovou a",
            "Veliká Říjnová socialistická revoluce v Rusku rozbila starý, buržoasní státní aparát a vytvořila stát nového typu, stát diktatury proletariátu, stát sovětský. Carská armáda jako součást starého státního aparátu byla rozpuštěna a demobilisována. Ozbrojenou sílu revoluce tvořily dělnické rudé gardy, po jejichž boku bojovali v ozbrojených povstáních revoluční vojáci. Mladé Sovětské republice hrozilo od počátku nebezpečí, že imperialisté, kontrarevolucionáři, nepřátelé lidu se pokusí ozbrojenou silou svrhnout sovětskou moc a obnovit v Rusku kapitalistické pořádky. Bolševická strana, vedená Leninem a Stalinem, si byla dobře vědoma hrozícího nebezpečí. Byla činěna opatření, aby sovětská moc a vymoženosti Říjnové revoluce byly zabezpečeny a ubrá-",
            "Na pondělní schůzi dělnických a volenských rad v Berlíně měly umírněné živly většinu. Dvakráte se pokusili Spartakovci prosaditi, aby do schůze byli připuštěni Liebknecht a Luxemburgová, vždy tento pokus odmítnut. Proti připuštění hlasovala zdrcující většina. Mezi Spartakovci a neodvislými je prozatím třídění názorů: neodvislí přibližují se majoritě a skupina Spartakovců zůstává jaksi isolována Spartakovci se pokoušeli o demonstrace, Liebknecht pronesl plamennou řeč před ruským vyslanectvím, kde se přimlouval za obnovení styků s bolševickým Ruskem, prozatím však není známek, že by neodvislí a Spartakovci mohli určovati svoji vůli většině. Nejbližší úkoly německé vlády vyznačil Dittmann těmito slovy: »Potřebujeme předběžného míru a pak rychlého míru definitivního. To jest první předpoklad pro"
        ],
        "response":"Německá revoluce v roce 1919 byla potlačena a nevedla k uchování komunistické moci. Mezi faktory, které přispěly k této situaci, patřily následující:\n\n*   **Rozkol uvnitř levicových sil:** V dělnických a vojenských radách v Berlíně měly umírněné živly většinu a pokusy Spartakovců, vedených Karlem Liebknechtem a Rosou Luxemburgovou, o prosazení jejich názorů byly opakovaně odmítnuty [doc5]. Tato izolace Spartakovců oslabila jejich schopnost ovlivňovat dění.\n*   **Represe ze strany vlády:** Vláda, v reakci na revoluční dění, použila císařské pluky s vrhači min a děly proti revolučnímu lidu [doc3]. Během potlačování revoluce bylo v Berlíně popraveno 1200 lidí [doc3].\n*   **Vražda Liebknechta a Luxemburgové:** Dne 15. ledna 1919 byla vládou zajata a zavražděna Karl Liebknecht a Rosa Luxemburgová [doc3]. Tato událost vedla k oslabení levicových sil a zlomila odpor.\n*   **Válka a Kappův puč:** Německo se potýkalo s následky první světové války a následně Kappovým monarchistickým pučem [doc1]. Kappův puč byl potlačen proletářskou akcí, ale destabilizoval situaci.\n*   **„Ústřední pracovní smlouva“:** Německý všeodborový svaz uzavřel „ústřední pracovní smlouvu“ s revolučními silami, což vedlo ke ztrátě kontroly a oslabení revolučního hnutí [doc3].\n*   **Nezávislí a Spartakovci:** Mezi Spartakovci a neodvislými existovaly rozdílné názory, což vedlo k třídění a oslabení jednoty [doc5].",
        "reference":"Komunistická revoluce v Německu je vyloučena, protože občanstvo je příliš silné a dobře organizované, což umožňuje potlačení každého takového hnutí.",
        "faithfulness":0.95,
        "answer_relevancy":0.8252935479,
        "answer_correctness":0.2186380902,
        "context_precision":0.2,
        "context_recall":0.0,
        "context_sufficiency":0.0
    },
    {
        "user_input":"Jaký byl význam československého státu v mezinárodním kontextu po stránce politické a hospodářské, a jakou roli hrála Itálie v podpoře této vize v rámci protiněmecké bariéry?",
        "retrieved_contexts":[
            "CHORVATSKÁ OTÁZKA V ČESKÉ POLITICE 1860—1864  MIROSLAV ŠESTÁK  Zájem o jižní a balkánské Slovany byl složkou českého slovanství v 19. století. Toto konstatování — zejména co se týče praktické realizace české „slovanské“ politiky 60. let 19. století — vztahuje se zejména na Chorvaty, kteří žili v hranicích téhož státu jako Češi a měli do značné míry společné životní zájmy i podobné nástroje k jejich prosazování. V českém politickém životě nalézáme proto vedle obvykle studovaného aspektu polsko-ruského i výrazný aspekt chorvatský. V předkládané práci se pokusíme objasnit významnou roli, jakou sehrála v české buržoazně-liberální politice v letech 1860—1864 chorvatská otázka a podat v hlavních rysech obraz česko-chorvatské politické spolupráce v této době.1) Záměrem autorovým je sledovat vytváření českého",
            "může se státi hrází proti německému a maďarskému přívalu ve východní Evropě, posiluje tak souběžnou obrannou akci bloku anglo-francouzsko-italského proti témuž nebezpečenstvi na západě, i činnost, k níž především určena jest Italie na Balkáně v harmonické soutěži s obnovenou jednotou srbskou a rumunskou. Mimo to samostatné Československo může míti šťastný vliv na hospodářskou činnost jak vlastní tak italskou. Vskutku, abych mluvil jen o své zemi, nepřihlížeje ani k úvaze o politické výhodě úzkých styků v budoucnosti, skutečného spolku obou států, Italie měla by přímý zisk ze zrození nového státu i s hlediska vlastní expanse obchodní ve východní Evropě a neméně s hlediska vlastní emancipace z příliš tíživé poplatnosti Německu i Rakousku za dodávání surovin i produktů, které sice zčásti dostává z Čech, avšak cestou obchodní",
            "ovšem i velký význam vojenský. Proto je tento projekt přijímán mnoha politiky na obou stranách. Avšak koridor srbsko-český by byl užitečný nejenom oběma zúčastněným národům, nýbrž by měl význam širší a dalekosáhlejší s hlediska politiky spojenců. Tvořil by jakousi slovanskou bariéru proti německému pochodu na Cařihrad a Bagdad a vedle toho, že by překážel Německu v kolonisaci Balkánu a Malé Asie, zabraňoval by též Maďarům, aby tvořili jeho ochotný předvoj. Tato slovanská bariéra je tedy ve shodě se zájmy spojenců v Asii. Spojenci vůbec tím, že věnují svou ochranu balkánským národům, zejména slovanským, získávají při nejmenším stejně, ne-li více, než čeho získali patronancí Turecka, a při tom prospívají věci svobody a civilisace. Avšak nejenom ententa, nýbrž i Italie, a právě Italie, má zájem na zdravém vyřešení otázek slovanských a otázky jihoslovanské zvláště. Italie vážně chybuje svou politikou na Jadranu, projevující přehnané nároky na území srbochorvatské, touhu po držení chor-",
            "všechna monarchistická i feudální tradice od roku 1620 důkladně vykořeněna. Význam české šlechty v nešťastném státoprávním zápasu (české spíše zemskou příslušností nežli národním vědomím a cítěním) byl pouze episodní. Česká politika použila jen vlivu šlechtických činitelů, aby v konservativní periodě rakouské vlády domohla se úspěchu. Po nezdaru tohoto pokusu šlechta přestává hráti ve veřejném i společenském životě národa vůbec jakou roli, a celý úporný zápas o politické, kulturní i hospodářské sílení a nabývání moci v Rakousku nesen jest výhradně lidem samým a jeho intelektuálním i mravním výkvětem, jímž také v evropské krisi byl přiveden k vítězství. Jest nanejvýš příznačné, že náš národ nabyl své svobody ve spojenectví se světovou demokracií a povalením absoluti-",
            "evropská jednání další.“ Odmítnuv dále „pověsti, rozšiřované po 11. červenci namnoze s průhlednou tendencí, jako by se již již rodil před našimi zraky mocný a jednotný blok států, nám a státům nám blízkým zásadně nepřátelských,“ označil jsem za nesprávnou představu, „že poměr států, mezi nimiž právě nastalo sblížení, k státům ostatním musí býti nepřátelský a že by musil v dohledné době vést ke konfliktům.“ Naopak, vyslovil jsem naději, že sblížení nastalé mezi Německem a Italií mohlo by usnadnit budování hospodářské organisace středoevropské, jemuž dosud rivalita německoitalská stála v cestě. A dodal jsem ještě: „Československo, které nemělo a nemá vážných sporů ani s Německem, ani s Italií, ani s Rakouskem, by každý vážný a upřímný pokus o hospodářskou spolupráci ve Střední Evropě uvítalo s uspokojením, pokud by se děl v souhlase s celkovou politickou linií všech jeho spojenců a za jejich účasti.“ Sblížení italsko-německé, jež se projevilo společným"
        ],
        "response":"V letech 1860–1864 sehrála chorvatská otázka významnou roli v české buržoazně-liberální politice [doc1]. Po vzniku Československa v roce 1919 se zdůraznilo, že stát nabyl svobodu ve spojenectví se světovou demokracií [doc4].\n\nV mezinárodním kontextu se po vzniku Československa uvažovalo o jeho roli jako hráze proti německému a maďarskému vlivu ve východní Evropě [doc2]. Tato vize zahrnovala i vytvoření koridoru srbsko-českého, který by tvořil slovanskou bariéru proti německému pochodu na Cařihrad a Bagdad [doc3]. Tato bariéra by zabraňovala kolonisaci Balkánu a Malé Asie Maďary [doc3].\n\nItálie měla zájem na zdravém vyřešení otázek slovanských, zejména jihoslovanských, a její politika na Jadranu byla vnímána jako chybná kvůli přehnaným nárokům na srbochorvatské území [doc3]. V roce 1939 se vyjádřila naděje, že sblížení italsko-německé by mohlo usnadnit budování hospodářské organizace středoevropské [doc5]. Československo by takové sblížení uvítalo, pokud by bylo v souladu s politickou linií spojenců a za jejich účasti [doc5].",
        "reference":"Československý stát měl v mezinárodním kontextu politický a hospodářský význam jako bariéra proti německo-maďarskému imperialismu, a Itálie měla specifický zájem na této protiněmecké bariéře, kterou měly tvořit na severu stát československý a polský a na jihu stát jihoslovanský a Itálie, čímž měli být Němci definitivně oddáleni od Jaderského moře.",
        "faithfulness":0.9,
        "answer_relevancy":0.8680210651,
        "answer_correctness":0.4831154449,
        "context_precision":0.6791666666,
        "context_recall":0.75,
        "context_sufficiency":0.0
    },
    {
        "user_input":"Jaký byl účel referenda organizovaného inženýrem Karlem Veselým a jaký vliv mělo na uznání československé legie italskou vládou a na hnutí ve prospěch utlačených národností rakousko-uherských?",
        "retrieved_contexts":[
            "lze považovati za vážný projev části italské veřejnosti v době, jež předcházela hnutí ve prospěch utlačených národností rakouskouherských a Štefánikovu vydobytí uznání československé legie italskou vládou. Odpověď pochází od 9 senátorů, 13 poslanců, 11 novinářů a 5 osob jiného povolání. Kromě jednoho, jednostranně informovaného, referendum italské z roku 1917 vyznívá zásadně příznivě pro utvoření jednotného státu československého.17) Rozebereme-li odpovědi blíže, vidíme, že všichni mají historické a politické důvody, Benešem uvedené, za plně dostatečné k uznání nezávislého státu československého. Někteří prostě odkazují na Benešovy argumenty (Ciccarone, Rosadi). Jiní rozvádějí důvody historické, vytýkajíce hrdinnou obranu českého národa proti germánství, jeho mučednictví, jeho vysokou vzdě-",
            "tostí.« Kongres znamenal v Italii porážku této politiky Sonninovy, jež tak ztěžovala naši italskou akci za války a zabraňovala utvoření naší legie a jež se příkře stavěla proti Jihoslovanům, takže způsobovala trvalý hluboký rozpor mezi Italy a Jihoslovany a byla také příčinou toho, že velká část jihoslovanských vojáků v rakousko-uherské armádě bojovala z přesvědčení proti Italům. Kongres, o němž se zprávy dostaly do Rakouska-Uherska, měl velký vliv na »vnitřní frontu rakousko-uherskou« na posílení odbojového hnutí revolučních národů v tomto státě, zvláště na náš vnitřní odboj v zemích českých a na Slovensku — a s druhé strany na posílení protirakouského stanoviska v zemích spojeneckých, na uznání těchto snah a později na uznání samostatných států pro revoluční národy rakousko-",
            "Boemia), jejíž ředitel (incaricato d’affari in Italia) inž. Karel Veselý rozeslal 15. června 1917 řadě italských osobností výtisk Benešovy knihy s těmito dvěma otázkami: 1. »Domníváte se, že dostatečné důvody historické a politické mluví pro to, aby Čechové ze starého království českého spojili se se svými bratry Slováky ze severních Uher a utvořili jediný stát československý?« 2. »Jaké výhody přinese Evropě v celku a Italii zvláště utvoření zvětšených a samostatných Čech ve středu Evropy? «15) Seznam osob, jimž tyto dotazy byly předloženy, není zachován úplný, ale lze řici, že obsahoval řadu osob z kruhů parlamentárních a novinářských. Odpovědí uchovaných v archivu Kanceláře Nár. rady českosl. je celkem 48.16) Z nich sedm osob odpovědělo pouze poděkováním za zaslanou knihu, aniž by se vyjádřilo o věci — byli to členové vlády (ministr války Giardino, ministr ozbrojení Dallolio a jeho státní tajemník Alfieri, ministr obchodu de Nava, ministr kolonií Colosimo), dále předseda zajatecké komise gen. Spingardi a florentský vojenský velitel Lenchantin. Předseda sněmovny Marcora se omluvil, že vzhle-",
            "z něho speciální výhody po stránce hospodářské a morální; 3. že tímto jasným a citlivým pochopením důležitosti české státní otázky se strany poslanců, senátorů a novinářů (z nichž většina nebyla ani osobnostmi první linie) jest historicky vysvětlitelné ono obdivuhodné hnutí sympatie k Čechoslovákům, jež se v Italii hromadně projevilo po Caporettu a zvláště roku 1918, nejprve u příležitosti sjezdu potlačených národností rakousko-uherských na Kapitolu a potom u příležitosti ustavení, formování a vojenského působení československé divise. Tím konečně lze si poněkud vysvětliti vůbec ideový podklad přátelství československo-italského, jež osvobozenská akce zahraniční za promyšleného vůdcovství Benešova a za energického spolupůsobení Štefánikova v Italii byla založila a jež odkázala mírové době k dalšímu soustavnému prohlubování a utužování.",
            "Giuseppe Boselli, redaktor časopisu »La Provincia di Brescia«.  Jsa přesvědčeným stoupencem zásady, že státní řády musí se zakládati na národnostech, sympatisuji ovšem s každým hnutím, které sleduje takový účel. V daném případě směřuje takové hnutí k zmenšení Rakousko-Uherska, a již jen pro tuto skutečnost musí najíti příznivý ohlas v Italii. Tužby československé mají podkladem taková staletá utrpení, že není možno, aby nezískaly si sympatie každého, kdo vzpomene utlačovatele tohoto ubohého národa, utlačovatele našeho lidu. Nový stát tvořil by silnou hradbu na obranu východu proti výbojnosti německé. Pokud jde o Italii, jíž válka — jak musí být — přispěje k zajištění postavení, které jí příroda dala na Adrii, nelze jinak než očekávati veliký spád obchodu onoho nového státu k našim přístavům adriatickým a v důsledku toho"
        ],
        "response":"Inženýr Karel Veselý zaslal 15. června 1917 řadě italských osobností výtisk Benešovy knihy s dotazy týkající se historických a politických důvodů pro spojení Čechů a Slováků a výhod utvoření samostatného československého státu pro Evropu a Itálii [doc3]. Celkem bylo uchováno 48 odpovědí v archivu Kanceláře Národní rady československé [doc3].\n\nReferendum mělo vliv na uznání československé legie italskou vládou a na hnutí ve prospěch utlačených národností rakousko-uherských. Zprávy o kongresu, na kterém se referenda konala, se dostaly do Rakousko-Uherska a měly velký vliv na \"vnitřní frontu rakousko-uherskou\", posílily odbojové hnutí revolučních národů a posílily protirakouské stanovisko v zemích spojeneckých [doc2].  Kongres znamenal v Italii porážku politiky, která ztěžovala italskou akci za války a zabraňovala utvoření legie [doc2].  Referendum také vysvětlilo obdivuhodné hnutí sympatie k Čechoslovákům, které se v Italii projevilo po Caporettu a roku 1918 [doc4].",
        "reference":"Účel referenda organizovaného inženýrem Karlem Veselým byl získání většího zájmu politických osobností o přečtení knihy dr. Beneše, která byla rozesílána zároveň s dopisem obsahujícím dotazník. Referendum mělo vliv na uznání československé legie italskou vládou a na hnutí ve prospěch utlačených národností rakousko-uherských tím, že bylo považováno za vážný projev části italské veřejnosti v době, která předcházela těmto událostem.",
        "faithfulness":1.0,
        "answer_relevancy":0.8642238607,
        "answer_correctness":0.3860926788,
        "context_precision":1.0,
        "context_recall":1.0,
        "context_sufficiency":1.0
    },
    {
        "user_input":"Jaké byly důvody a očekávané důsledky zapojení svazáků a žen do žňových plánů na Liberecku, a jakou roli v tom hrály výzvy krajských výborů a provolání předsednictva Ústředního výboru Komunistické strany?",
        "retrieved_contexts":[
            "Žňové plány svazáků Liberecka Svazáci v našem kraji, kteří po získání velikých zkušeností z loňského roku, kdy si tak zdatně vedli v akci „Mládež Libereckého kraje v čele žní“, nechtějí ani letošního roku zůstati pozadu. Jak krajský výbor, tak okresní výbory i skupiny Československého svazu mládeže na Liberecku vypracovaly již ve většině případů žňové plány s konkrétními úkoly pro každou skupinu na vesnici nebo na státní strojní stanici a Československých státních statcích. Opravdu vzorný plán si vypracovali členové místní skupiny ČSM v Lukách, na okrese Doksy. V obci je jednotné zemědělské družstvo, jehož členy jsou všichni rolníci v obci. Místní svazáci po po Se svazáckým elánem nastoupíme ke sklizni letošní úrod Liberec — Provolání předsednictva Ústředního výboru Komunistické strany",
            "Přímá účast na sklizni Československa vytyčilo před všechen pracující lid naší republiky jako prvořaDalším bodem žňového plánu svazáků dý úkol úspěšné zvládnutí letošní sklizně a tím zajištění a další zlepšení výživy Luk je sekání obilí. Letos budou žně pracujícího lidu. V provolání je mimo jiné také výzva k mládeži a k ženám, aby v Lukách provedeny společně, ve třech i ony se podílely na úspěšném průběhu letošních mírových žní. Krajský výbor pracovních skupinách. Svazáci se zaváČeskoslovenského svazu žen již několik dní po uveřejnění provolání předsedzali, že za pomoci jednotného traktoru nictva ÚV KSČ vydal ke všem ženám Libereckého kraje výzvu, aby při žních ze státní strojní stanice posekají všechno pomohly všude tam, kde toho bude zapotřebí. Také krajský výbor Českosloven-",
            "Rudé právo ročník 28 o Právo lidu (ročník 51) PÁTEK  Číslo 264 Kčs RUDÉ PRÁVU 1948 ÚSTŘEDNÍ ORGÁN KOMUNISTICKÉ STRANY ČESKOSLOVENSKA 1.50  Mohutný ohlas výzvy k „týdnu vzorné práce“  Závody a vesnice přijímají závazky ke stupňování budovatelského úsilí Vzornou prací zaručíme řádné splnění všech úkolů stranit dosavadní nedostatky a pracovat lépe. A aktivita V pondělí ráno začíná »týden vzorné práce«. Ohlas, organisací strany, odborů, výrobních výborů a j. je zárus jakým se provolání ústředního akčního výboru NF, Rekou, že v pondělí bude každý dělník i úředník vědět, jak volučního odborového hnutí a Jednotného svazu českých nejlépe přispěje ke krásnému daru presidentu Klementu zemědělců setkalo všude na závodech, svědčí o tom, že Gottwaldovi. k práci s pevnou snahou odv pondělí nastoupíme všichni",
            "Socialistické soutěžení ve 24 závodech  Rudé právo ročník 28 o Právo lidu (ročník 51) PÁTEK  Číslo 264 Kčs RUDÉ PRÁVU 1948 ÚSTŘEDNÍ ORGÁN KOMUNISTICKÉ STRANY ČESKOSLOVENSKA 1.50  Mohutný ohlas výzvy k „týdnu vzorné práce“  Závody a vesnice přijímají závazky ke stupňování budovatelského úsilí Vzornou prací zaručíme řádné splnění všech úkolů stranit dosavadní nedostatky a pracovat lépe. A aktivita V pondělí ráno začíná »týden vzorné práce«. Ohlas, organisací strany, odborů, výrobních výborů a j. je zárus jakým se provolání ústředního akčního výboru NF, Rekou, že v pondělí bude každý dělník i úředník vědět, jak volučního odborového hnutí a Jednotného svazu českých nejlépe přispěje ke krásnému daru presidentu Klementu zemědělců setkalo všude na závodech, svědčí o tom, že Gottwaldovi. k práci s pevnou snahou odv pondělí nastoupíme všichni",
            "3. STRANA O 12. DUBNA 1952 Cesta míru  Život a práce strany v našem kraji  Z okresní a městské konference Komunistické strany Československa v Liberci  Učíme se ze zkušeností VKS(b) Kolektivní řízení činnosti okresního výboru Všesvazové komunistické strany (bolševiků)  Usnesení předsednictva Ústředního výboru strany o vymezení působnosti městských výborů v krajském městě se projevilo i v rázu obou konferencí v Liberci. Zejména městská konference byla uspořádána již ve znamení vůle odstranit mnohé nedostatky, které vyplývaly z dřívější omezené činnosti městského výboru. Městský výbor v Liberci je nyní postaven na roveň okresnímu výboru a řídí práci všech základních organisací ve městě. Městský výbor podléhá přímo krajskému výboru strany. Obě konference byly významným mez-"
        ],
        "response":"Žňové plány na Liberecku byly vypracovány s cílem úspěšně zvládnout letošní sklizně a zajistit a zlepšit výživu pracujícího lidu [doc2]. Svazáci (Československý svaz mládeže) a ženy byly do těchto plánů zapojeny na základě výzvy k přímé účasti na sklizni, kterou vytyčil Ústřední akční výbor Národní fronty [doc2]. Krajský výbor Československého svazu žen vydal výzvu všem ženám Libereckého kraje, aby pomohly při žních [doc2]. Svazáci se zavázali, že s pomocí traktoru zemské strojní stanice posekají všechno obilí [doc2]. Očekávalo se, že zapojením svazáků a žen do žňových plánů bude sklizně úspěšná a přispěje ke zlepšení výživy obyvatel [doc2].",
        "reference":"Důvody zapojení svazáků a žen do žňových plánů na Liberecku spočívaly v úsilí o úspěšné zvládnutí sklizně a zajištění a zlepšení výživy pracujícího lidu. Očekávané důsledky zahrnovaly efektivní sklizeň a zachování vyrobených prostředků pro blaho společnosti. Výzvy krajských výborů a provolání předsednictva Ústředního výboru Komunistické strany hrály roli v mobilizaci mládeže a žen k aktivní účasti na žních, čímž se mělo zajistit, že sklizeň proběhne úspěšně a mírově.",
        "faithfulness":1.0,
        "answer_relevancy":0.9062815832,
        "answer_correctness":0.6323305591,
        "context_precision":1.0,
        "context_recall":1.0,
        "context_sufficiency":0.0
    },
    {
        "user_input":"Jaký byl význam a dopad akce inženýra Karla Veselého, který rozeslal dotazníky a výtisk knihy dr. Beneše italským osobnostem, na politické povědomí a zájem o československou samostatnost v Itálii, a jaké byly důvody pro volbu této formy komunikace?",
        "retrieved_contexts":[
            "14) Některé posudky zaznamenal Hlaváček, l. c., str. 353—355, věc však by zasluhovala zpracování. 15) Podle sdělení p. inž. Karla Veselého myšlenka referenda byla jeho a nedovede se již upamatovati, zda o té věci s dr. Benešem mluvil čili nic. Rovněž otázky pro referendum byly sestaveny od inž. Veselého za účelem získání většího zájmu politických osobností o přečtení knihy dr. Beneše, která byla rozesílána zároveň s dopisem obsahujícím dotazník. Všecky dotazníky byly podepsány vlastnoručně inž. Veselým. Tehdy byla podobná referenda v Římě oblíbena i u ostatních politických komitétů, které v Římě pracovaly. Akce Národní rady československé byla však rozsáhlejší, neboť bylo vytištěno asi 1000 dotazníků a tyto byly rozeslány všem senátorům a poslancům, všem bývalým ministrům a jiným vynikajícím osobnostem. Úspěch akce byl",
            "Boemia), jejíž ředitel (incaricato d’affari in Italia) inž. Karel Veselý rozeslal 15. června 1917 řadě italských osobností výtisk Benešovy knihy s těmito dvěma otázkami: 1. »Domníváte se, že dostatečné důvody historické a politické mluví pro to, aby Čechové ze starého království českého spojili se se svými bratry Slováky ze severních Uher a utvořili jediný stát československý?« 2. »Jaké výhody přinese Evropě v celku a Italii zvláště utvoření zvětšených a samostatných Čech ve středu Evropy? «15) Seznam osob, jimž tyto dotazy byly předloženy, není zachován úplný, ale lze řici, že obsahoval řadu osob z kruhů parlamentárních a novinářských. Odpovědí uchovaných v archivu Kanceláře Nár. rady českosl. je celkem 48.16) Z nich sedm osob odpovědělo pouze poděkováním za zaslanou knihu, aniž by se vyjádřilo o věci — byli to členové vlády (ministr války Giardino, ministr ozbrojení Dallolio a jeho státní tajemník Alfieri, ministr obchodu de Nava, ministr kolonií Colosimo), dále předseda zajatecké komise gen. Spingardi a florentský vojenský velitel Lenchantin. Předseda sněmovny Marcora se omluvil, že vzhle-",
            "Členové Dobrovolnického sboru uvěřili tomuto dobrodruhu a zklamání, které se dostavilo, dolehlo na ně potom velmi těžce. Dr. Pučálka se již neozval a krásné naděje pohasly nesplněny. Zajatci rozjížděli se na polní práce a zbytek jejich přestěhován v červenci do jižního cípu Italie do Certosa di Padula v provincii Salerno v okolí velmi nezdravém. V září přijel do Říma dr. Beneš, aby konferoval s členy italské vlády o československých zajatcích a organisoval československou akci v Italii. Už dříve navázal styky s některými vlivnými politiky italskými a snažil se přiblížiti italské veřejnosti cíle našeho revolučního hnutí jednak naší kanceláří v Římě, jednak italským překladem svého spisku »Boemia contro L’Austria-Ungheria«. Mnoho pro naši věc vykonal poslanec Andrea Torre, jenž znovu a znovu obra-",
            "Arturo Lancelotti, publicista v Římě.35) Pokládám za jisté, že tu jsou více než dostatečné důvody historické a politické pro příští ustavení jediného, nezávislého státu československého, a pokud se týče výhod, které z toho bude míti Evropa, jsou patrné již z pouhé úvahy, že takové spojení nemůže se státi bez rozdělení císařství rakousko-uherského, jehož neblahý vliv v Evropě jest zásadní. Pokud jde o hospodářský užitek, který vzejde zvláště Italii z rozšířených a samostatných Čech, shoduji se úplně s tím, co vykládá Eduard Beneš ve své odvážné a jasné knize »La Boemia contro l'Austria-Ungheria«.  Prof. Luigi Mangiagalli, ředitel porodnického ústavu v Miláně, senátor království.3*) Zdržel jsem se s odpovědí, poněvadž jsem chtěl dříve doplniti své vědomosti o dané otázce studiem a četbou, abych si obnovil a upevnil dojmy, získané",
            "*1) Inženýr Steno Sioli-Legnani narodil se roku 1862 v Miláně a od roku 1913 byl poslancem za volební okres Gorgonzola. Profesor Šmurlo, Rus, ztrávil dlouhá léta v Italii, studuje v ital*) ských archivech, hlavně ve Vatikáně a v Benátkách, historické styky ruskoitalské. Jeho referendum se uvádí na doklad, jak se dívali na otázku samostatného státu československého někteří Rusové, žijící v cizině.  nella famigerata Mittel-Europa, e liberebbe l'Europa per sempre da questo spauracchio. Quanto all'Italia il suo avvenire di grande potenza dipende dalla sua posizione nel Mediterraneo, e proprio per questa ragione essa deve coltivare le più strette ed amichevoli relazioni col Mondo Slavo: chè l'antagonismo e la concorrenza fra l'Italia e la Francia sulle coste dell'Africa Settentrionale non sono soffocati affatto, ma sono diventati secondarii solo per il momento attuale a causa di guerra, e risorgeranno più tardi con forza maggiore."
        ],
        "response":"Akce inženýra Karla Veselého, který rozeslal dotazníky a výtisk knihy Eduarda Beneše italským osobnostem, měla za cíl zvýšit politické povědomí a zájem o československou samostatnost v Itálii [doc2]. Inženýr Veselý, jako ředitel kanceláře Národní rady československé v Římě, rozeslal 15. června 1917 výtisk Benešovy knihy s dvěma otázkami o samostatném československém státu a jeho přínosech pro Evropu a Itálii [doc2]. Dotazníky byly podepsány vlastnoručně inženýrem Veselým [doc1].\n\nDůvodem pro volbu této formy komunikace bylo získání většího zájmu politických osobností o přečtení knihy dr. Beneše [doc1]. Akce byla rozsáhlá, vytiskl se přibližně 1000 dotazníků, které byly rozeslány senátorům, poslancům, bývalým ministrům a jiným vynikajícím osobnostem [doc1]. Z odpovědí, které byly uchovány v archivu Kanceláře Národní rady československé, se jich dochovalo 48 [doc2].\n\nAkce byla inspirována podobnými referendy, která byla v Římě oblíbená i u jiných politických komitétů [doc1].  Inženýr Veselý se snažil přiblížit italské veřejnosti cíle československého revolučního hnutí, a to jak prostřednictvím kanceláře v Římě, tak italským překladem Benešovy knihy \"Boemia contro L’Austria-Ungheria\" [doc3].  Někteří italští publicisté a osobnosti, jako Arturo Lancelotti a Luigi Mangiagalli, se k této iniciativě připojili a vyjádřili podporu samostatnému československému státu [doc4]. Inženýr Steno Sioli-Legnani, poslanec, se také vyjádřil k otázce [doc5].",
        "reference":"Akce inženýra Karla Veselého, který rozeslal dotazníky a výtisk knihy dr. Beneše italským osobnostem, měla za cíl získat větší zájem politických osobností o československou samostatnost a zvýšit povědomí o této otázce. Důvody pro volbu této formy komunikace zahrnovaly snahu o přímé oslovení významných politických a veřejných činitelů, což bylo v té době v Římě oblíbené i u ostatních politických komitétů. Akce byla rozsáhlá, neboť bylo vytištěno asi 1000 dotazníků, které byly rozeslány všem senátorům, poslancům, bývalým ministrům a jiným vynikajícím osobnostem, což svědčí o snaze dosáhnout co nejširšího politického povědomí a zájmu.",
        "faithfulness":0.8666666667,
        "answer_relevancy":0.9081816201,
        "answer_correctness":0.5406474314,
        "context_precision":1.0,
        "context_recall":0.75,
        "context_sufficiency":1.0
    },
    {
        "user_input":"Jaké historické a politické důvody byly považovány za dostatečné pro uznání nezávislého československého státu a jaké byly reakce italských politických a novinářských kruhů na tyto důvody v kontextu hnutí za podporu utlačených národností Rakousko-Uherska a uznání československé legie italskou vládou?",
        "retrieved_contexts":[
            "lze považovati za vážný projev části italské veřejnosti v době, jež předcházela hnutí ve prospěch utlačených národností rakouskouherských a Štefánikovu vydobytí uznání československé legie italskou vládou. Odpověď pochází od 9 senátorů, 13 poslanců, 11 novinářů a 5 osob jiného povolání. Kromě jednoho, jednostranně informovaného, referendum italské z roku 1917 vyznívá zásadně příznivě pro utvoření jednotného státu československého.17) Rozebereme-li odpovědi blíže, vidíme, že všichni mají historické a politické důvody, Benešem uvedené, za plně dostatečné k uznání nezávislého státu československého. Někteří prostě odkazují na Benešovy argumenty (Ciccarone, Rosadi). Jiní rozvádějí důvody historické, vytýkajíce hrdinnou obranu českého národa proti germánství, jeho mučednictví, jeho vysokou vzdě-",
            "Ing. Steno Sioli-Legnani, poslanec v parlamentě, Milán.“)  Již samotná raison d'être císařství rakousko-uherského, to jest popření zásady národnostní, je také historickým důvodem dnešního postavení Čech. Uplatnění této zásady a její úspěch, což jest nejvyšším cílem, pro nějž se bije Dohoda, musí tudíž přirozeně vésti k samostatnosti Čech a k zamýšlenému spojení s jejich bratry Slováky. Nebezpečí, v němž se octla Evropa, ukázalo nám metody i cíle centrálních mocností. Spojení národové chtějí postaviti silné hradby proti přepjatým choutkám německým. Silné a nezávislé Čechy poslouží úspěšně k tomu, aby na východě zadržely expansi německou. To jsou důvody, proč mám za to, že Italové musí s největší sympatií sledovati hnutí československé, které má takovou podobu s hnutím našeho risorgimenta.",
            "tostí.« Kongres znamenal v Italii porážku této politiky Sonninovy, jež tak ztěžovala naši italskou akci za války a zabraňovala utvoření naší legie a jež se příkře stavěla proti Jihoslovanům, takže způsobovala trvalý hluboký rozpor mezi Italy a Jihoslovany a byla také příčinou toho, že velká část jihoslovanských vojáků v rakousko-uherské armádě bojovala z přesvědčení proti Italům. Kongres, o němž se zprávy dostaly do Rakouska-Uherska, měl velký vliv na »vnitřní frontu rakousko-uherskou« na posílení odbojového hnutí revolučních národů v tomto státě, zvláště na náš vnitřní odboj v zemích českých a na Slovensku — a s druhé strany na posílení protirakouského stanoviska v zemích spojeneckých, na uznání těchto snah a později na uznání samostatných států pro revoluční národy rakousko-",
            "z něho speciální výhody po stránce hospodářské a morální; 3. že tímto jasným a citlivým pochopením důležitosti české státní otázky se strany poslanců, senátorů a novinářů (z nichž většina nebyla ani osobnostmi první linie) jest historicky vysvětlitelné ono obdivuhodné hnutí sympatie k Čechoslovákům, jež se v Italii hromadně projevilo po Caporettu a zvláště roku 1918, nejprve u příležitosti sjezdu potlačených národností rakousko-uherských na Kapitolu a potom u příležitosti ustavení, formování a vojenského působení československé divise. Tím konečně lze si poněkud vysvětliti vůbec ideový podklad přátelství československo-italského, jež osvobozenská akce zahraniční za promyšleného vůdcovství Benešova a za energického spolupůsobení Štefánikova v Italii byla založila a jež odkázala mírové době k dalšímu soustavnému prohlubování a utužování.",
            "u příležitosti cesty do Čech, podniknuté před mnoha lety, a neváhám dnes tvrditi, že utvoření státu československého je naprosto ospravedlněno důvody historickými a politickými, a že existence takového nezávislého státu a současné zřízení rovněž nezávislého státu polského byly by hrozivou hradbou s jedné strany proti rozmachu moci německé, s druhé strany proti každé případné pohlcovací snaze moci ruské, a v každém případě důležitým činitelem míru pro Evropu a rovnováhy pro Italii.  Dr. Edoardo Maragliano, senátor království, profesor university v Janově. 1. Spojení Čechů z království a Slováků jest historickým právem, jest politickou nutností. 2. Zvětšené a samostatné Čechy přinesou Evropě zisk, který při definitivní její úpravě jí vzejde ze zřízení stejnorodých států, vzniklých z uznání prin-"
        ],
        "response":"Podle dostupných dokumentů byly historické a politické důvody pro uznání nezávislého československého státu považovány za dostatečné. Mezi tyto důvody patřilo historické právo a politická nutnost spojení Čechů a Slováků [doc 5], hrdinská obrona českého národa proti germánství a jeho mučednictví [doc 1], a vytýkání politiky popírání národnostní zásady v Rakousko-Uhersku [doc 1, doc 2].\n\nItalské politické a novinářské kruhy projevily sympatií k hnutí československé, což bylo vysvětlitelné historickým pochopením důležitosti české státní otázky [doc 4]. Toto hnutí se hromadně projevilo po Caporettu a v roce 1918, zejména při sjezdu potlačených národností rakousko-uherských a při ustavení a vojenském působení československé divize [doc 4]. Podpora československého hnutí byla vnímána jako hradba proti rozmachu německé moci a případným pohlcovacím snahám ruské moci, a jako důležitý činitel míru pro Evropu a rovnováhy pro Itálii [doc 5].\n\nReakce italských kruhů byly také ovlivněny porážkou politiky Sonninovy, která ztěžovala italskou akci za války a zabraňovala utvoření italské legie [doc 3]. Podpora československého hnutí vedla k posílení odbojového hnutí revolučních národů v Rakousko-Uhersku a k protirakouskému postoji v zemích spojeneckých [doc 3].",
        "reference":"Historické a politické důvody považované za dostatečné pro uznání nezávislého československého státu zahrnovaly hrdinnou obranu českého národa proti germánství, jeho mučednictví a vysokou vzdělanost. Reakce italských politických a novinářských kruhů na tyto důvody byly zásadně příznivé, což se projevilo v referendu italském z roku 1917, které vyznělo ve prospěch utvoření jednotného státu československého. Odpovědi pocházely od senátorů, poslanců, novinářů a dalších osob, kteří považovali Benešem uvedené důvody za plně dostatečné k uznání nezávislého státu československého.",
        "faithfulness":1.0,
        "answer_relevancy":0.9531311219,
        "answer_correctness":0.5134458184,
        "context_precision":1.0,
        "context_recall":1.0,
        "context_sufficiency":1.0
    },
    {
        "user_input":"Jakým způsobem přispěla spolupráce s Poláky, Ukrajinci, Jihoslovany, Rumuny, Litevci, Lotyši, Finy, Řeky a Albánci k dosažení vítězství nad Rakouskem a Německem, a jakou roli v tomto procesu hrála podpora Spojených států a prezidenta Wilsona?",
        "retrieved_contexts":[
            "svěřil vládu vám a mně. Malí národové jsou osvobozeni, negativní úkol války dosažen, a Evropě nastává úkol organisovati Východ Evropy a tím Evropu a lidstvo vůbec. Jsme nejzápadnější slovanskou větví ve středu Evropy a odolali jsme poněmčovacímu náporu Němců na východ. Dnešní vítězství umožnila nám naše národní houževnatost a k tomu země od přírody bohatá. Naše vítězství je také vítězstvím ostatních malých národů, ohrožovaných Rakouskem a Německem. Podobný osud a stejné nebezpečí odkazují nás k úzkému přátelství s našimi sousedy na východě, resp. na jihovýchodě. Navázal jsem za hranicemi se všemi těmito národy, s Poláky, Ukrajinci, Jihoslovany, Rumuny, Litevci a Lotyši, Finy, Řeky a Albánci, přátelské styky. (Výborně! Potlesk.) Pokusili jsme se v Americe o utvoření »Unie středo-",
            "President Beneš píše ve své knize válečných vzpomínek o tom, že žádný ze spojenců nevstoupil do války s úmyslem zničiti habsburskou monarchii. Se strany dohody došlo dokonce k pokusům, uzavříti separátní mír s Rakousko-Uherskem. Že v této monarchii existují malé, utlačované národy, o tom se zmiňuje teprve president Wilson ve své notě z r. 1917. Ale evropští finančníci byli svými hospodářskými investicemi příliš vázáni na existenci Rakousko-Uherska, než aby si pro naši svobodu přáli jeho pád. Tak nachází náš zápas za svobodu teprve plné vzpruhy v proklamaci říjnové revoluce, kde jsou rušeny všechny závazky uzavřené carským Ruskem. Ale bylo to především vědomí, že na východě roste nová síla v podobě obrozeného slovanského Ruska, která dodala novou odvahu zápasu slovanských národů v Rakouko-Uhersku. Vidíme tedy ze zkušeností dvou válek, že to byl slovanský východ, Sovětský svaz, který znamenal historický mezník v našem zápase za svobodu.",
            "cům, zápas, jenž tvoří smysl a osnovu jich dějin po celých deset století. Neustali hlásiti se za spolubojovníky ve spojeneckém táboře jak doma tak všemi prostředky, jež byly v jejich moci, otevřeně za hranicemi, ať již ve Francii, Anglii Rusku, Americe nebo Italii. Manifestace, jež se odehrávaly za posledních měsíců v Čechách, byly cím dále tím významnější, od deklarace pražské konstituanty ze 6. ledna, až do kougresu utlačených národů z Rakousko-Uherska, který se konal dne 16. května v Praze, za účasti Čechoslováků, Jihoslovanů, Poláků, Rumunů a Italů. Byla to konečně Francie, jež vložila do noty adresované dne 10. ledna 1917 presidentu Wilsonovi, onu prostou větu »osvobození Čechoslovaků z cizí nadvlády«, větu, jež měla tak veliky ohlas v Čechách a v Rakousku. Jaký teprve bude míti ohlas dnes uznání Čech jako válečné ho spojence po našem boku a za naši věc. Bud to zasluhou vlády p. Clemenceaua a p. Pichona kterí dovedli úplně zužitkovati tuto silu a poznali že jest v nynějším okamžiku jednou z armad nejlepších a nejucinnějších.",
            "čestný oddíl československých a polských vojáků. Roosewelt našim raněným. Bývalý president americké republiky Teodor Roosewelt, který je nadšen statečností československých vojáků, věnoval ve prospěch jich raněných tisíc dolarů. („Sibířský Věstník“). Ukrajina a sousedi. (Dle jiskrových zpráv). Vyjednávání Ukrajiny se sovětským Ruskem přerušeno, očekává se přerušení diplomatických stya. Nač se také nutit do zbytečného vyjednávání na základě brestského míru, který samo Německo dnes předkládá k revisi. Za to Ukrajina pilně vyjednává s Rumunskem. Rakouská vojska opouštějí prý Ukrajinu, patrně jich bude potřeba jinde. Rovněž Němci vyklízejí Bílou Rus, která dle pověstí má být připojena k Ukrajině. Dle bolševických zpráv bunty německých vojáků stále rostou. Pracují mezi nimi bolševičtí agitátoři, rozhazující brožurky a letáčky. I ukrajinská vojska jsou prý slabou oporou hetmanštiny. Aspoň „Izvěstija“ se chlubí, že u Starodubu přešel ukrajinský pluk i se štábem demarkační čáru a dal se k disposici sovětské vládě.",
            "U přítomnosti nových vítězství nad Rakušany, zmiňuje se G. Hervé ve Victoire také o naší účasti na italské frontě a píše mezi jiným: »V rakousko-uherské armádě bojující proti Italii tři pětiny vojáků zatracují Rakousko, neboť dvě pětiny vojska, jež čelí armádě generála Diaza jsou Čechové, Jihoslované, sedmihradští Rumuni, tridenští a terstští Italové a haličtí Poláci, Představme si, jakou cenu by měla německá armáda, jež je na naši frontě, kdyby tři pětiny jejích sil se skládaly z Poláků přátelských Francii nebo z Elsasanů a Lotrinčanů. Je třeba tyto protiněmecké a protimaďarské Slovany a Latince dobře zařaditi mezi Němce a Maďary, aby nepřešli i se zbraní a zavazadly do řad, kde vidí vláti prapory Spojenců, kteří jim přinášejí svobodu a samostat-"
        ],
        "response":"Podle dostupných pramenů hrála spolupráce s národy východní a jihovýchodní Evropy významnou roli v boji za československou samostatnost. Dokument [doc1] uvádí, že se autor navázal na přátelské styky s Poláky, Ukrajinci, Jihoslovany, Rumuny, Litevci a Lotyši, Finy, Řeky a Albánci. Dokument [doc3] zmiňuje účast Čechoslováků, Jihoslovanů, Poláků, Rumunů a Italů na kongresu utlačených národů z Rakousko-Uherska.\n\nSpolupráce s těmito národy byla posílena i díky vnitřnímu odporu v rámci rakousko-uherské armády. Dokument [doc5] uvádí, že v rakousko-uherské armádě bojující proti Italii tři pětiny vojáků zatracovaly Rakousko, a tvořili je Češi, Jihoslované, sedmihradští Rumuni, tridenští a terstští Italové a haličtí Poláci.\n\nPodpora Spojených států a prezidenta Wilsona byla klíčová. Dokument [doc3] uvádí, že Francie vložila do noty adresované prezidentu Wilsonovi větu o \"osvobození Čechoslováků z cizí nadvlády\", což mělo velký ohlas. Dokument [doc4] zmiňuje finanční dar bývalého prezidenta Roosevelta ve prospěch raněných československých vojáků.",
        "reference":"Spolupráce s Poláky, Ukrajinci, Jihoslovany, Rumuny, Litevci, Lotyši, Finy, Řeky a Albánci přispěla k dosažení vítězství nad Rakouskem a Německem tím, že podobný osud a stejné nebezpečí odkazovaly k úzkému přátelství s těmito národy, což posílilo postavení proti nepřátelskému táboru. Podpora Spojených států a prezidenta Wilsona hrála v tomto procesu klíčovou roli tím, že Spojené státy poskytly vydatnou pomoc a určité sliby pro budoucnost, přičemž prezident Wilson věnoval otázce velikou a upřímnou pozornost.",
        "faithfulness":1.0,
        "answer_relevancy":0.9013108106,
        "answer_correctness":0.5151040803,
        "context_precision":0.95,
        "context_recall":1.0,
        "context_sufficiency":0.0
    },
    {
        "user_input":"Jaké jsou důsledky nízkého odhadování škody na možnost odepsání pozemkové daně a jakou roli hraje včasné oznámení škody v tomto procesu?",
        "retrieved_contexts":[
            "velních. Poněvadž zákon stran odpisování pozemkové daně při škodách živelních byl již dne 6. července t. r. potvrzen a tudíž i nabyl platnosti, upororňují se hospodáři, že dle § 1. zákona toho přivodí škody spůsobené době sklizně) neb ohněm odepsání daně pozemkové. Při všech poškozeních má se státi ohlášení do osmi dnů od škody spůsobené příslušnému hejtmanství, berní správě nebo místní komisi berní, jinak pozbude se práva na náhradu. Je-li pohromou stíženo několik rolníků, mohou podati ohlášení společně skrze zástupce, jemuž dají nekolkovanou plnou moc. Důležito jest každou škodu zjistit a lhůtu k podání žádosti nepromeškati. Letos naskytne se dojista mnohému rolníkovi příležitost použiti dobrodiní zákona toho, poněvadž trvalé deště působí při sklizni obilin škody veliké.",
            "katastrální plochy lesní. Odpis daně pro berní slevu rozhodný buď vyšetřen na hektar, počítajíc od roku škody zpět, pro počet let, přiměřených stáří zničeného dřevního porostu. Žádost za berní slevu (kolku prostá) podati jest písemně neb do protokolu nejpozději 8 dní po zpozorování škody u berní správy, v jejímž obvodu je větší část poškozeného komplexu lesů, a má obsahovati poškozené lesní parcely, příčinu škody a pokud možno, i rozsah škody. (U lesů tedy se nepodává napřed oznámení a pak žádost, nýbrž hned jen žádost.) Škodu zjistí berní správa na základě vyšetření, jež  bude konáno na místě samém a zpravidla úředně oprávněným lesním znalcem a jehož se může poškozený zúčastniti. Sleva daně pozemkové pro živelní pohromy zemědělským a lesním pozemkům poskytnutá nezpůsobuje žádné změny pro samosprávné přirážky a pro příspěvky",
            "od 1\/2 do 3\/4 50% od 3\/4 úrody 75% zničena-li celá úroda, odepíše se celá roční daň z postižené parcely. 4. Nároky na odepsání daně má jen ten, kdo do osmi dnů učiní o tom oznámení (bez kolku) okresnímu hejtmanství ode dne, kdy škoda se stala. 5. Kommissionální vyšetření škody předsevezme kommisse, do níž vyslal úřad jednoho delegáta a dva důvěrníky z dotyčné berní obce s přibráním dvou členů obecního zastupitelstva. Vyšetření jest bezplatné. Dočasné osvobození daně vyhrazuje čl. 3. zákona ze dne 24. května 1869, a zákon ř. ze dne 23. května 1883. Pusté pozemky nebo příhodami neplodnými učiněné, které zděláním stanou se plodnými, jsou osvobozeny na 10 let od daně, počítajíc od roku po nabyté plodivosti nejprve příštího; nově založené vysoké lesy osvobozeny jsou od daně",
            "Vých. Záp. měsíce  *) Pouze při škodě hmyzem, cizopasníky, plísní, námelem a mrazy žádá zákon k odpisu daně poškození jedné čtvrtiny výnosu z celého hospodářství.  Strana 334.  Hospodář českoslovanský.  Ročník XXXXII.  nízké odhadování škody by nárok na odpis vůbec mohlo zmařiti. Jelikož oznámení škody má za následek zastavení vybírání pozemkové daně, jest v zájmu hospodářů, aby s oznámením neotáleli. Nemoci mlékem přenášené. Píše inž. Jaroslav Dvořák v Piňovicích. Mléko jako jedna z nejdůležitějších a nejpřirozenějších potravin pro člověka i zvíře, první to potrava nově zrozeného organismu, může v určitých případech se státi příčinou nakažlivých nemocí, ba celých epidemií. Syrové mléko od podezřelých dojnic nebo nedojené s úzkostlivou čistotou může vždy obsa-",
            "nímu úřadu první instance. Poněvadž podle zákona ohlášení podáno býti má do osmi dnů po tom dni, kdy škoda byla zpozorována, není ovšem pro vypočtení této lhůty dán pevný podklad. Ježto však při jistých pohromách živelných, jako na příklad při krupobití, škodlivý účinek zpozorovati možno velmi záhy, tedy v takových případnostech podle doby, kdy pohroma nastala, bude lze posouditi, zdali ohlášení podáno bylo opozděně či ne. Při jiných pohromách, jejichž škodlivý účinek stane se znatelným teprve po delším působení, nastane nárok na odepis daně beztoho teprve pak, když poškození nabude větších rozměrův. O takových případnostech finanční úřad první instance nabude vědomosti z pravidla již odjinud, i bude mu tudíž možno, zjednati si o tom doklad, ve kterou dobu poškození již bylo lze znamenati. Vůbec však bude"
        ],
        "response":"Nízké odhadování škody může vést k tomu, že nárok na odepsání pozemkové daně bude zmařen [doc4]. Včasné oznámení škody je klíčové, protože podle zákona musí být ohlášení podáno do osmi dnů od zpozorování škody [doc3]. Pokud je oznámení podáno opožděně, může to vést ke ztrátě nároku na odepsání daně [doc5]. Finanční úřad si může ověřit, zda bylo ohlášení podáno včas, a posoudit to na základě doby, kdy pohroma nastala a kdy se její škodlivý účinek stal znatelným [doc5].",
        "reference":"Nízké odhadování škody by nárok na odpis vůbec mohlo zmařiti, a jelikož oznámení škody má za následek zastavení vybírání pozemkové daně, jest v zájmu hospodářů, aby s oznámením neotáleli.",
        "faithfulness":1.0,
        "answer_relevancy":0.8070000599,
        "answer_correctness":0.4449560701,
        "context_precision":1.0,
        "context_recall":1.0,
        "context_sufficiency":1.0
    },
    {
        "user_input":"Jaký je vztah mezi procesem redukce kysličníku uhličitého na formaldehyd v chlorofylových buňkách a potřebou drasla při pěstování cukrovky, a jaké důsledky má tento vztah na úrodnost půdy?",
        "retrieved_contexts":[
            "venčí či formaldehyd zkondensován (sražen, přeměněn) byl v cukr. Pochod probíhá tak, že působením kysličníku uhličitého utvořený dvojuhličitan draselnatý vodíkem u vzrodu*) jest redukován v cukr. Na základě tomto stal se jasným názor o tvoření se uhlohydrátů v buňkách rostlinných: Kyselina uhličitá atmosférická vniká v stomata či pichy a, jsouc od roztoků drasla pohlcována v buňkách chlorofyllových, přechází v bikarbonát, který odchází v protoplasmu**) až konečně jest změněn ve formaldehyd. Další chemickou změnou přechází v uhlohydrát cukr. Úlohou chlorofyllu pak jest pohlcování paprsků ultrafialových. V buňkách chlorofyllových tvoří se formaldehyd jednak redukcí***) kysličníku uhličitého vodíkem, povstalým spolupůsobením enzymů, jednak redukcí téhož kysličníku vodíkem, tvořícím se rozkladem vody. Pochody tyto probíhají parallelně†) vedle sebe a vytvářejí přechodnou formou uhlohydráty za vlivu paprsků ultrafialových.",
            "cukrovka nezklamávající plodinou, která zaručuje výnos a přiměřený, třeba v posledních letech hodně redukovaný zisk — lépe než obilniny a doporučované náhradní plodiny. Cukrovka má z našich kulturních rostlin největší plochu listovou a je v největší míře uzpůsobena přeměňovati energii záření slunečního v energii chemickou, roce jako semenačka k dalšímu vzrůstu. Tento cukr tvoří cukrovka v aparátu chlorofylovém z volných statků: kysličníku uhličitého a vody a vyrábí z nich podivuhodnou skladbou (syntésou) cukr a jiné organické látky. Nesmíme však zapomínati, že je úkolem cukrovarství vytěžiti toliko onen cukr, který vlastně povstal z jmenovaných volných statků (H,O, CO,), kdežto ostatní organické látky a prvky biogenní, které patří k půdní substanci a nesmí jí býti zcizovány, cukrovarství vrací řepaři,",
            "these, nýbrž pouze draslík. Musíme míti za to, že chlorofyl za účinku paprsků světelných intensivně spolupůsobí při rozkladu kyselého uhličitanu draselného a že se formaldehyd, tvořící se z kyseliny mravenčí, rychle kondensuje v uhlohydráty. Tím jest vysvětleno, proč v čerstvých listech možno dokázati formaldehyd jen v nepatrných množstvích. Tvorba kyseliny mravenčí z kyselého uhličitanu draselného jakož i její další rozklad na formaldehyd jsou procesy čistě endothermické, při nichž akkumulována jest energie slunečná v energii potentiální. Willstätter a Stoll*) uvádějí ve své práci »Uber die chemischen Einrichtungen des Assimilationsapparates« tuto theorii assimilační: Přístup kyseliny uhličité k chloroplastům sprostředkován jest absorbční substancí, jež působí jako akumulator kyseliny uhličité,",
            "Liebigův zákon minima. Kap. III. přechází ke vztahu draslíku k biologii cukrovky. Po vylíčení fysiologické funkce cukrovky v prvních stadiích vývoje zdůrazňuje se zejména, že vývoj organismu a množství produkovaného cukru není v přímém vztahu ku váze listů (plocha assimilační), nýbrž k obsahu chlorofylu v chlorenchymu; podle pozorování je nejvíce draslíku resorbováno kořínky z půdy v době největší tvorby chlorofylu, takže je zřejmo, že draslíku připadá důležitá úloha při výrobě cukru v organismu cukrovky processem fotosynthetickým. Podrobnější objasnění této úlohy a významu kalium-ionu při fotosynthese jest obsahem kapitoly IV., již vadním stavu bádání a hypothes na pochody fotosynthetické. Tato zkoumání jsou doplněna vlastními obšírnými pracemi, jež se zakládají na pokusech, provedených za",
            "rubidium v té míře jako draslík. Účinek paprsků 8 a v vyzařovaných draslíkem přichází zajisté k platnosti při biochemických pochodech v buňce chlorofylové i chlorofyluprosté, jelikož paprsky tyto podporují redukční pochody; draslík podmiňuje vyzařováním těchto paprsků jednak intracelulární dýchání, při němž se kyselina mléčná vzniklá z hexos redukuje na kysličník uhličitý a alkohol, který pak přechází oxydačními pochody až v konečné produkty, kysličník uhličitý a vodu. Na druhé straně spolupůsobí draslík, jak již bylo v jedné z dřívějších kapitol obšírně naznačeno, při pochodech fotosyntetických; vedle katalytického účinku uplatňují se při těchto pochodech rovněž paprsky 8 a v tím, že spolupůsobí při redukci kyselého uhličitanu draselného na kyselinu mravenčí a formaldehyd, který se kondensuje na cukry."
        ],
        "response":"Podle dostupných dokumentů je proces redukce kysličníku uhličitého na formaldehyd v chlorofylových buňkách úzce spjat s potřebou drasla při pěstování cukrovky. Formaldehyd se tvoří redukcí kysličníku uhličitého vodíkem, který vzniká jak redukcí kysličníku uhličitého vodíkem, povstalým spolupůsobením enzymů, tak rozkladem vody [doc1]. Dále se formaldehyd rychle kondenzuje v uhlohydráty [doc3].\n\nDraslík hraje klíčovou roli v tomto procesu, protože intenzivně spolupůsobí při rozkladu kyselého uhličitanu draselného [doc3].  Je resorbován kořínky z půdy v době největší tvorby chlorofylu [doc4].  Draslík také podmiňuje vyzařování paprsků, které podporují redukční pochody a jsou důležité pro biochemické procesy v buňce [doc5].  Tvorba kyseliny mravenčí z kyselého uhličitanu draselného a její další rozklad na formaldehyd jsou procesy, které vyžadují energii slunečná [doc3].\n\nZ hlediska úrodnosti půdy je důležité, aby půda obsahovala dostatek draslíku, protože jeho nedostatek může negativně ovlivnit tvorbu chlorofylu a následně i produkci cukru v cukrovce [doc4].  Draslík je také důležitý pro intracelulární dýchání a fotosyntetické pochody [doc5].",
        "reference":"Proces redukce kysličníku uhličitého na formaldehyd v chlorofylových buňkách je součástí fotosyntetických pochodů, které probíhají v rostlinách, zatímco potřeba drasla při pěstování cukrovky je spojena s nároky rostliny na živiny z půdy, což má za důsledek, že cukrovka odebírá z půdy značné množství drasla, což může ovlivnit úrodnost půdy, pokud není zajištěno řádné a bohaté hnojení.",
        "faithfulness":0.6666666667,
        "answer_relevancy":0.9365065834,
        "answer_correctness":0.5516398569,
        "context_precision":1.0,
        "context_recall":1.0,
        "context_sufficiency":1.0
    },
    {
        "user_input":"Jaké byly důsledky předvánočního shonu a pracovního nasazení prodavaček a pokladních na jejich pracovní podmínky a jak se to odráželo na jejich interakci se zákazníky?",
        "retrieved_contexts":[
            "ské rozdíly byly mezi některými oblastmi poměrně značné, což se projevuje v řadě ukazatelů. Důsledky hospodářské krize dopadly nejtíže právě na malovýrobu6) — drobného a středního rolníka. Nekončily ovšem vždy její likvidací, ale vzrůstem její finanční závislosti se všemi důsledky, jež toto břemeno přináší. Zemědělská krize, rychlý rozvoj zemědělské techniky a včleňování všech i drobných zemědělských závodů do tržního mechanismu se tvrdě odrážely v hospodaření těchto zemědělských závodů i v životě jejich majitelů. Zadlužený drobný a v mnohých případech i střední rolník stupňoval svou pracovní intenzitu často až do nemožnosti. To se bezprostředně odráželo i na poměrech námezdních pracovních sil, zaměstnávaných v této kategorii zemědělských závodů, kterých, jak dále uvidíme, nebyl právě malý počet. Hospodářská krize také ukázala zaostalost zemědělství proti průmyslu, zvláště techniky zemědělské výroby. Tento stav se právě v malovýrobě jen pozvolna lepšil. Bránila tomu řada",
            "ustále doplňování zboží, jeho předvádění zákazníkům, kterým je nutno někdy i poradit, bezpočet kroků od regálu k pultu a naopak, nečiní povolání prodavačky v předvánočním období nikterak lehké. A to ještě musí stihnout vlídný úsměv na tváři a snažit se skrýt únavu. Lidé přicházejí a odcházejí, jedni vycházejí z prodejny s baličkem, jiní s prázdnou, kolotoč předvánoční horečky se  točí na plné obrátky. A v tom shonu a ruchu leckdy zaniká drnčení pokladen, na které s bravurou markují pokladní utržené peníze. Na některé je radost se dívat, ruce jim po klávesách poletují rychlosti blesku, na jehož konci je prosté zazvonění, tečka za koupí. Připomíná to hru, jakýsi koncert pro dvě ruce a jednu pokladnu. Odvíjející se bílá kontrolní páska se téměř nezastaví a spolu s časem neúprosně",
            "žité doplňky a změny oproti dosavadním předpisům týkajícím se mzdové politiky a uskutečňuje další jejich přizpůsobení nařízením generálního zmocněnce pro pracovní nasazení, které platí v ostatním říšském území. Ve svém výkladu poukazuje ministr Dr. Bertsch na to, že smyslem této úpravy je další upevnění mzdové úrovně na výši k 15. lednu 1942. Ovšem to nijak neznamená, že se nemá také mzdově povzbuditi a odměniti zvýšení výkonnosti. Naopak, právě opatřením, která umožňují vystupňování pracovního výkonu, má býti ponechán široký rámec. Disciplinární a trestní ustanovení vyhlášky neslouží pouze k tomu, aby bylo zajištěno řádné plnění povinností se strany zaměstnanců, nýbrž chrání se jimi také pracovní čest zaměstnanců a zamezuje se jejich vykořis-",
            "telná buržoasním pojetím stávky, o které se statistika opírala. Stávka byla úzce chápána jako pracovní spor, jako porušení pracovního poměru s určitými hospodářskými důsledky. Při tom statistické šetření stávek bylo prováděno z hlediska ryze praktických potřeb t. zn. z hlediska jaké škody působily stávky v hospodářství země a jakému hospodářskému risiku byli podnikatelé vystaveni v důsledku stávek.6) Toto převážně praktické poslání se vyznačující se vesměs nízkým počtem prostávkovaných směn, často s nepatrnými hospodářskými důsledky, přestože byly politicky velmi významné, byly ze statistického šetření vypuštěny. Tak kupř. nebyly statisticky šetřeny demonstrační stávky v roce 1922 (kterých se zúčastnilo na 160 000 dělníků). Podobně tomu bylo s mohutnými demonstračními",
            "již v únoru na závěr internátního školení poo neochotě některých prodávajících. Proto vznikl slanců. Na této besedě se hovořilo o konkrétních nápad vytvořit vzor pro ostatní v prodejně vzornedostatcích, které ztěžují život pracujících žen ných služeb, kterou by měla být prodejna pod— ať se jedná o obchod, služby, nedostatek zaniku Seba v Gottwaldově ulici. O dobré práci řízení pro děti předškolního věku a jiné. Podkolektivu prodejny svědčí množství pochvalných něty a návrhy nezůstaly jen na papíře, ale pozápisů v knize přání a stížností od stovek spokostupně se realizují. Prvním konkrétním úspějených zákazníků z celé republiky. V této průchem je spolupráce komisí žen s komisemi ONV, zkumové prodejně se prodává zboží nejen z tankteré se zabývají otázkami bytové výstavby, roz-"
        ],
        "response":"Důsledky předvánočního shonu a pracovního nasazení se projevovaly na pracovních podmínkách prodavaček a pokladních. Z dokumentu [doc2] vyplývá, že předvánoční období bylo pro prodavačky náročné, charakterizované ustálým doplňováním zboží, poradám zákazníkům a neustálému pohybu mezi regálem a pultem. To vedlo k únavě, kterou se snažily skrývat. Z dokumentu [doc5] vyplývá, že se objevovala neochota některých prodávajících, což vedlo k internímu školení. Z dokumentu [doc5] vyplývá, že se objevovala neochota některých prodávajících, což vedlo k internímu školení.",
        "reference":"Předvánoční shon a pracovní nasazení prodavaček a pokladních činily jejich povolání nikterak lehkým, protože musely neustále doplňovat zboží, předvádět ho zákazníkům, radit jim, a přitom zvládat bezpočet kroků mezi regály a pultem. Navzdory únavě musely udržovat vlídný úsměv na tváři, což se odráželo na jejich interakci se zákazníky, kteří přicházeli a odcházeli v neustálém kolotoči předvánoční horečky.",
        "faithfulness":1.0,
        "answer_relevancy":0.9454236636,
        "answer_correctness":0.8330221447,
        "context_precision":0.45,
        "context_recall":1.0,
        "context_sufficiency":0.0
    },
    {
        "user_input":"Jaké byly důsledky napětí mezi českou a německou komunitou ve Vídni na konci 19. století, a jak se toto napětí projevovalo v politických rozhodnutích a společenských postojích?",
        "retrieved_contexts":[
            "Češi ve Vídni je označení české menšiny, žijící ve Vídni. Češi byli v době rakousko-uherské monarchie po německy hovořících národnostech druhou nejpočetnější národnostní skupinou ve Vídni. Hlavní říšské a sídelní město Vídeň tak bylo několik staletí po Praze městem s druhou největší českou populací.\nČeši a Víde ň, to je celá řada klišé; Češi ve Vídni byli cihlářští dělníci, kočí, kuchařky a kojné. Do jaké míry je to pravda? \"Dá se říct, že to pravda byla. Alespoň podle toho, co jsem já vybádal, to tak bylo. Ještě bych tam přidal hudebníky, abychom zařadili i jiné profese. Dost brzy se to ale začalo měnit a vylepšovat. Ve Vídni třeba působili i ...\nV časech monarchie byla Vídeň považována za „největší české město\". Na konci 19. století v ní žilo přibližně sto tisíc našich krajanů. Proč našinci do metropole na Dunaji přicházeli a jak je Vídeňané přijímali?\nČeši ve Vídni Říká se, že Praha je hezčí Vídeň a Vídeň je fungující Praha. Bývalé hlavní město monarchie má k českým a moravským zemím ze světových metropolí rozhodně nejblíž, takže bylo na čase zajet se podívat mezi Čechy ve Vídni a trochu toto téma prodebatovat.\nI tak byla Vídeň největším „českým\" městem - v Praze na přelomu století žilo jen kolem 200 000 obyvatel (tzv. Velká Praha vznikla připojením okolních obcí až v roce 1922). Nejdůležitější migrační vlny ve 20. století byly zaznamenány v roce 1948 a v roce 1968.\nJak mluví dnes vídeňstí Češi [Články] (pdf) - Ve Vídni, kdysi metropoli Rakouska-Uherska, našly obživu tisíce občanů také z českých zemí. Kolik Čechů se sem přistěhovalo, dnes už není možno zjistit. Podle oficiálního sčítání lidu se v r. 1880 hlásilo k české a moravské národnosti kolem 25 tisíc osob, za deset let už přes 60 tisíc, v r. 1900 přesáhl ...\nČeši ve Vídni je označení české menšiny žijící ve Vídni. Češi byli v době Rakousko-Uherské monarchie po německy hovořících národnostech druhou nejpočetnější národnostní skupinou ve Vídni. Hlavní říšské a sídelní město Vídeň tak bylo několik staletí po Praze městem s druhou největší českou populací.\nProhaska, Dworzak, Nowotny - jen namátkou vybraná jména z vídeňského telefonního seznamu. Podobných jmen jsou ve vídeňských \"Zlatých stránkách\" desetitisíce a připomínají, že ještě na počátku 20. století byla Vídeň druhým největším \"českým\" městem, hned po Praze. Žilo tu až 150 tisíc lidí českého původu. Dnešní česká krajanská komunita ve Vídni je ...\nOctober 15, 2025 - V západní polovině podunajské monarchie byly vyhlášeny dvě republiky s protichůdnými územními nároky: 21. října 1918 ve Vídni vyhlásilo republiku Německé Rakousko a 28. října v Praze Československo, ještě před uzavřením rakousko-italského příměří 3.\nAugust 26, 2023 - Běžně se objevuje téma odsunu nebo vyhnání sudetských Němců při politických veřejných debatách, zrovna tak se diskutuje o tzv. Benešových dekretech. Z české strany lze vypozorovat řadu mýtů, které mají historické kořeny ve vymezování se vůči němectví během formování národní identity během 19. století.\nOctober 11, 2025 - Postupné reformy a liberalizace však umožnily českým zástupcům hrát důležitější roli v politickém životě Rakouska-Uherska, byť národnostní třenice pokračovaly až do zániku monarchie (punktace, rozdělení pražské technické univerzity na českou a německou část roku 1869, obdobné rozdělení Karlo-Ferdinandovy univerzity roku 1882, Badeniho jazyková nařízení, nacionální nepokoje roku 1897, hilsneriáda apod.) Český politický život se ve 2. polovině století také diferencoval – roku 1874 se od Staročechů odštěpila „mladočeská“ Národní strana svobodomyslná (jejím tiskovým orgánem se staly vlivné Národní listy, založené Juliem Grégrem již roku 1861), roku 1878 pak byla založena Sociálně demokratická strana českoslovanská v Rakousku.\nMarch 9, 2025 - V Německu se volalo po odškodnění uprchlíků, které česká vláda odmítla, s odvoláním na německou okupaci, válečné nespravedlnosti, podporu německé menšiny nacistické straně, genocidní plány německé vlády a zvěrstva, jako jsou Lidický masakr. Po skončení studené války došlo k oteplování vztahů mezi znovusjednoceným Německem a nově demokratickou Českou republikou.\n1 month ago - Česká reprezentace se odmítla pohraničních území vzdát s odůvodněním, že nový československý stát nemůže ekonomicky, sociálně ani politicky existovat bez pohraničí českých zemí jinak, než jako koloniální protektorát Velkého Německa. Rozhodla se proto pro vojenské obsazení nárokovaného území. Toto obsazení proběhlo (kromě Mostu, kde se bojovalo) klidně, k větším střetům došlo až 4. března 1919, kdy se měl ve Vídni sejít nově zvolený německo-rakouský parlament.\n3 weeks ago - Začali usilovat o jazykové, kulturní a hlavně hospodářské výdobytky pro českou společnost. Jedním z výsledků této politiky bylo rozdělení Karlovy univerzity na českou a německou, rozšíření počtu českých středních a základních škol, zisk pozic v podnikatelských institucích či zavádění českého jazyka do státní správy.\nNovember 10, 2025 - Řešení komplikované národnostní skladby a z ní pramenících těžkých konfliktů a nepřekonatelných antagonismů, zejména ve střední a východní Evropě, mělo přinést „zjednodušení národnostního složení“. Jedním z prvních, kdo toto opatření propagoval, byl například francouzský sociolog Bernard Lavergne. Vysídlení bylo použito při řešení vztahů mezi Řeckem a Tureckem na Balkáně a v Malé Asii v letech 1922–1923 po řecko-turecké válce. V meziválečné Evropě se však jednalo o výjimečné řešení. Komplikované národnostní složení řešila také opatření versailleské konference. Politici zastupující německou menšinu se snažili o vytvoření „německého Rakouska a „Střední Evropy“. Usilovali o německý hegemonický stát.\nFebruary 8, 2026 - Česko-německé vztahy se prudce zhoršily ve 2. polovině 19. století v souvislosti s rozšiřováním volebního práva a volební agitace, kdy se jazyk stal politickým faktorem ."
        ],
        "response":"Na konci 19. století se česko-německé vztahy prudce zhoršily v souvislosti s rozšiřováním volebního práva a volební agitace, kdy se jazyk stal politickým faktorem [doc1]. Postupné reformy a liberalizace umožnily českým zástupcům hrát důležitější roli v politickém životě Rakousko-Uherska, i když národnostní třenice pokračovaly až do zániku monarchie [doc1]. Toto napětí se projevovalo například rozdělením Karlovy univerzity na českou a německou v roce 1882 [doc1]. Čeští politici usilovali o jazykové, kulturní a hospodářské výdobytky pro českou společnost, což vedlo k rozdělení Karlovy univerzity a rozšíření českých škol [doc1]. Německá menšina se snažila o vytvoření „německého Rakouska a „Střední Evropy“, usilující o německý hegemonický stát [doc1].",
        "reference":"Napětí mezi českou a německou komunitou ve Vídni na konci 19. století vedlo k tomu, že německé spolky, jednoty a společenstva byly vyzývány, aby si hájily svého práva domácího proti Čechům, a aby se bránily jejich přiblížení, což se projevovalo v neliberálním štvaní proti Čechům a v politických rozhodnutích, jako bylo usnesení poslanecké sněmovny z roku 1883 a usnesení českého sněmu, které reflektovaly potřebu vychování a vzdělání mládeže, aby odpovídalo náboženským, národním a časovým požadavkům.",
        "faithfulness":0.8888888889,
        "answer_relevancy":0.8495882283,
        "answer_correctness":0.7912132703,
        "context_precision":0.9999999999,
        "context_recall":0.6666666667,
        "context_sufficiency":0.0
    },
    {
        "user_input":"Jaké byly důvody a důsledky neochoty vlády vyhovět požadavkům rady říšské a sněmu českého ohledně nového upravení školství, a jak tato situace ovlivnila postoj českých poslanců vůči německému tlaku?",
        "retrieved_contexts":[
            "K podobné změně vztahuje se usnesení poslanecké sněmovny z roku 1883 a usnesení českého sněmu z posledního zasedání. Na své poradě uznal klub toho potřebu, aby vychování a vzdělání mládeže na obecné škole hovělo stejnou měrou požadavkům náboženským, národním a časovým. Z četných vážných projevů je vůbec známo, že duchovenstvo nechce školství podrobiti takovému vlivu duchovenských úřadů, jak tomu druhdy bývalo a tím méně mohla by činnost českých poslanců k tomu směřovati. Vláda posud nevyhověla požadavku rady říšské a sněmu českého a nepodala žádné předlohy, která by se týkala nového upravení školství a kterou by se v duchu ústavy ponechalo sněmům, co jim náleží; za nynějších poměrů nelze pak předvídati, kdy se k takovému kroku odhodlá. Návrh knížete Liechtensteina, jenž v plné míře má na",
            "dovat národnostní autonomii v té formě, jak o ni usilují Němci v Čechách. Krajské rozdělení na Moravě dopadlo by v jejich neprospěch. Na předním místě bude to školství, v němž budou žádat ústupky a záruky, zejména o kompetenci národnostních školních rad při přijímání dětí. Stížnosti Němců, že se při přijímání úřednictva a při dodávkách nedodržuje národnostní klíč, jak je uvádí dnešní N. F. Presse, jsou pouhou maskou, neboť v tom právě Čechové paktu na svou škodu nedodržují. V české většině bylo dosud jednáno hlavně o konkrétních otázkách sanace zemských finan cí. Požadavek Němců zatlačil tyto porady o sinaci úplně do pozadí. Na české straně nebude bezpochyby zásadního odporu proti zřízení stálého výboru vyrovnávacího, bude však také přirozeno, že budou do tohoto výboru vnesena také všechna desideria česká a že Čechové odmítnou jakoukoli závislost vyřizování zemských potřeb od vyřízení požadavků německých. Česká většina sněmu octla se před velmi vážnou otázkou, která vyžaduje naprosté jednoty v českém táboře. Nejde již o moravské finance, jde o moravský sněm.",
            "předstoupiti před své voliče. Na českých poslancích přece nemůže nikdo žádati, aby přistoupili na německý diktát, že požadavek zřízení české university v Brně je politický a nikoliv kulturní, že otázka universitní patří k vyrovnacím. My nikdy nemůžeme ustoupiti od stanoviska, že ve svých potřebách osvětových nezávisíme nijak na německých choutkách a že povinností vlády jest, aby jim vyhověla bez ohledu na Němce. To bychom smutně dopadli, kdybychom i v této věci přiznali Němcům právo rozhodování. Posl. Albrecht kázal minulou neděli v Olomouci, že české střední školy na Moravě jsou zbytečné, že jich není třeba, že nemají schopného žactva, že státní úřady jest třeba závorou opatřiti proti Čechům, aby německý dorost v nich měl plnou volnost. Udávají-li dnes",
            "byli účastni i zástupci němečtí. Když pak parlamentní komise Slovanské jednoty, pamětliva jsouc svých povinností a nepřízně nynější vládní soustavy, učinila usnesení, dané situaci přiměřené, v němž na to ukázala, že vláda od „pracovnich“ stran jen hrozbou rozpuštění rady říšské vynucuje půjčku, určenou k úhradě úvěrů delegacemi povolených, takže není pomyšlení na zdárné vyřízení svízelných reforem finančních, správních a ostatních velikých úkolů; a když dále čeští poslanci zvláště zdůraznili, že při naprosto bezdůvodné obstrukci německé na sněmích českém a moravském, podporované pasivitou vlády, nemají nižádné povinnosti — vyhověti výzvě vládní — a prohlásila, že „setrvá na svém rozhodně oposičním stanovisku, nemajíc nižádného důvodu, aby této vládě usnadnila vyřízení rozpočtové-",
            "Těžko se dohadovati. Němci sice vyjednávají s učitelstvem svým o umožnění zasedání jeho, resp. jediné schůze, ve které by mohla býti projednána otázka alespoň provisorní úpravy platů učitelských. Protože ale ani ti nejmírnější poslanci němečtí nechtějí dopustiti, aby zároveň vyřízen byl i rozpočet zemský a protože bez tohoto i bez řady nových dávek není myslitelno, že by se našla pro úpravu platů učitelských nějaká úhrada — porady a jednání ona vlastně jsou přivedeny ad absurdum. Němci navrhují také, aby sněm království Českého sešel se pouze za účelem odhlasování loyálního projevu, jak to učinily prý již poměry ve sněmu, který již po čtyři roky není schopen žádné práce, zdá se nám býti volání po sejití zákonodarné sbory jiné. Vzhledem na nevykvasené jeho za tímto formálním účelem nevhodnou sentimentálností, na kterou konečně také Němci po zpěvu známé velezrádné písničky v zasedací síni téhož sněmu mají jistě právo nejmenší."
        ],
        "response":"Vláda dosud nevyhověla požadavku rady říšské a sněmu českého a nepodala žádné předlohy, která by se týkala nového upravení školství a kterou by se v duchu ústavy ponechalo sněmům, co jim náleží [doc1]. To vedlo k tomu, že nelze předvídat, kdy se k takovému kroku vláda odhodlá [doc1].\n\nČeskému táboru se dostalo tlaku ze strany Němců, kteří požadovali národnostní autonomii a ústupky v oblasti školství, včetně kompetence národnostních školních rad při přijímání dětí [doc2]. Čeští poslanci odmítali přistoupit na \"německý diktát\" a trvali na nezávislosti v otázkách osvětových potřeb [doc3]. Posl. Albrecht dokonce tvrdil, že české střední školy na Moravě jsou zbytečné a státní úřady je třeba zabezpečit proti Čechům [doc3].\n\nTato situace vedla k tomu, že čeští poslanci se ocitli před otázkou jednoty v českém táboře a odmítali jakoukoli závislost vyřizování zemských potřeb od požadavků německých [doc2].",
        "reference":"Vláda dosud nevyhověla požadavku rady říšské a sněmu českého a nepodala žádné předlohy, která by se týkala nového upravení školství, což vedlo k tomu, že české poslance to nutilo k tomu, aby se postavili proti německému tlaku stejným tlakem a hájili své právo a postavení, aniž by zasahovali do německých kruhů, čímž se snažili zabezpečit vlastní národní rozvoj a ochránit svou existenci.",
        "faithfulness":0.9230769231,
        "answer_relevancy":0.0,
        "answer_correctness":0.4245383875,
        "context_precision":1.0,
        "context_recall":0.3333333333,
        "context_sufficiency":0.0
    },
    {
        "user_input":"Jaké byly důsledky opakovaných měření dendrometrických, typologických a porostních charakteristik v Boubínském pralese v roce 1996 na pochopení vlivu člověkem ovlivňovaných stavů spárkaté zvěře na vývoj pralesa mezi lety 1960 a 1996?",
        "retrieved_contexts":[
            "Klíčová slova: dynamika; sledování; prales  Boubínský prales lze na základě podrobných historických průzkumů považovat za ojedinělý příklad dochovanosti pralesovitého porostu. Jediným významným vlivem, působícím na vývoj pralesa, byly člověkem ovlivňované stavy spárkaté zvěře. V roce 1996 bylo na území původní pralesovité rezervace provedeno opakované šetření dendrometrických, ty pologických a porostních charakteristik. Práce navazují na původní šetření z roku 1972, byly provedeny stejnou metodikou a následně byly vyhodnoceny změny, ke kterým na sledovaném území došlo. Ve sledovaném období 1960-1972-1996 prakticky nedošlo k výraznějšímu výkyvu hlavních dendrometrických ukazatelů, vyjadřujících hodnoty za celou sledovanou  J. FOR. SCI., 47, 2001 (10): 439-459",
            "plochu pralesa, a to přesto, že na řadě míst došlo k náhlým rozpadům stávajícího porostu, dochází k výraznému stárnutí a odumírání populace jedle bělokoré apod. Tato skutečnost potvrzuje jedinečnost Boubínského pralesa a dokazuje životaschopnost a stabilitu pralesovitých útvarů, ponechaných samovolnému vývoji na dostatečně velké souvislé ploše. Došlo k výraznému poklesu zastoupení jedle a tento úbytek byl nahrazen zvýšenou účastí buku. Dominantní postavení si v pralese udržel smrk. Počet živých stromů mírně klesl. Naopak stoupl objem kmenů živých stromů, což svědčí o celkovém stárnutí pralesa. Celkem 30 % plochy je však pokryto souvislým nárostem s dominancí buku. Tyto nárosty jsou zatím pod registrační hranicí dendrometrických šetření, v budoucnu však dojde k větší",
            "do plošného zmlazení. Nové skupinky zmlazení přežily pouze ve středu S okraje rezervace a v ojedinělých případech roztroušeně po celé ploše. Jejich výměra (nepočítáme-li hloh) činí pouhých 0,30 ha, což lze klasifikovat jako absolutní nedostatek zmlazení, zvláště s přihlédnutím k vyhodnoceným změnám textury a struktury porostu (viz další text). Jednoznačný vliv má zařazení rezervace do obory na konci šedesátých let. Skupiny mapované v roce 1973  ještě stačily odrůst tlaku zvěře, nové se však téměř nevytvářely. Po oplocení rezervace v roce 1992 dochází naopak k obrovskému spontánnímu zmlazení všech zastoupených dřevin. V roce 1994 se jednalo o první skupiny jednoletých semenáčků; jako takové ještě nebyly mapovány. Ovšem při kontrole v červenci 1996 již bylo možné všude na prosvětlených místech pozorovat souvislé plochy nárostů vysokých 20-40 cm. Rychlost vývoje nové generace zmlazení si vyžádá kratší periodu mapování, než je standardem u opakovaných revizí dřevinného a bylinného patra.",
            "R POPULATION  Unlike in other important virgin forest reserves of our country the only anthropic impact in Boubín was an extremely fluctuating stock of red deer. The increasing game stock with the gradual killing of predators, the minimization of the game stock due to poaching in the 19th century, and the overpopulated game due to hunting passion on the other hand (particularly over the entire 20th century until fencing) were the main reasons to the present situation (a range of side factors being difficult to document exactly). The present situation is characteristic by the disturbance of cyclic regeneration of tree species in the typical beech-fir-spruce virgin forest. The popular model of alternating beech generations with generations of fir and spruce was presented in a simplified form as early as in 1883:",
            "strukturální diferenciaci pralesa a k vyrovnání některých ukazatelů (počet stromů versus jejich objem apod.). Na vhodných místech mimo bukové nárosty se úspěšně zmlazuje jedle i smrk s doprovodem dalších vtroušených dřevin. Lze předpokládat, že postupně dojde k obnově populace jedle bělokoré i k obnově smrku zdejšího horského ekotypu. Na základě výsledků opakovaných šetření je doporučeno: - I přes všechny diskutabilní důsledky, které přináší úplné oplocení pralesa, je to v současné době jediné řešení,  zajišťující jeho relativně přirozený samovolný vývoj. Proto je třeba trvale udržovat oplocení v provozuschopném stavu a podle možností lovit či vytlačovat ven zvěř, která se do pralesa dostane. V pralese by neměly být prováděny žádné úmyslné zásahy. Do bezzásahového režimu je možné zařadit porosty nad"
        ],
        "response":"Opakovaná šetření v roce 1996 navazovala na původní šetření z roku 1972 a byla provedena stejnou metodikou [doc1]. Zjistilo se, že v období 1960-1972-1996 prakticky nedošlo k výraznějšímu výkyvu hlavních dendrometrických ukazatelů [doc1]. Nicméně, na řadě míst došlo k náhlým rozpadům stávajícího porostu, stárnutí a odumírání populace jedle bělokoré [doc2].  Výsledky potvrzují jedinečnost Boubínského pralesa a dokazují životaschopnost a stabilitu pralesovitých útvarů [doc2].  Mezi hlavní vlivy na vývoj pralesa patřily člověkem ovlivňované stavy spárkaté zvěře [doc1, doc4].",
        "reference":"Opakovaná měření dendrometrických, typologických a porostních charakteristik v Boubínském pralese v roce 1996 ukázala, že ve sledovaném období 1960-1972-1996 prakticky nedošlo k výraznějšímu výkyvu hlavních dendrometrických ukazatelů, což naznačuje, že vliv člověkem ovlivňovaných stavů spárkaté zvěře na vývoj pralesa byl omezený.",
        "faithfulness":1.0,
        "answer_relevancy":0.8059794326,
        "answer_correctness":0.3715309596,
        "context_precision":1.0,
        "context_recall":1.0,
        "context_sufficiency":1.0
    },
    {
        "user_input":"Jaké byly důsledky změn v zastoupení dřevin v Boubínském pralese mezi lety 1972 a 1996 na strukturu a management rezervace, a jaké kroky byly navrženy k zajištění přirozeného vývoje pralesa?",
        "retrieved_contexts":[
            "Lukenskou cestou (v rámci stávající národní přírodní rezervace), které svou strukturou i dřevinnou skladbou splňují kritéria pro zařazení mezi porosty pralesovitého charakteru (porosty 134 A, 134C) a je u nich předpoklad dlouhodobé stability. Naopak do bezzásahového režimu nezařazovat ostatní porosty ve stávající NPR Boubínský prales, které nesplňují kritéria strukturální (a tedy i věkové) diferenciace, druhového zastoupení a ani genetického původu. V těchto porostech je žádoucí aktivně provádět zásahy vedoucí k větší strukturální diferenciaci porostů - aktivní vnášení chybějících cílových dřevin, příp. přítomných dřevin, ovšem vhodného původu. Jedná se zejména o porosty mezi Horní Basumskou cestou a Basumským hřebenem (oddělení 135 A-C, 134 B, D), v okolí vrcholu Boubína (oddělení 127) a loveckého zámečku (oddělení 129).",
            "strukturální diferenciaci pralesa a k vyrovnání některých ukazatelů (počet stromů versus jejich objem apod.). Na vhodných místech mimo bukové nárosty se úspěšně zmlazuje jedle i smrk s doprovodem dalších vtroušených dřevin. Lze předpokládat, že postupně dojde k obnově populace jedle bělokoré i k obnově smrku zdejšího horského ekotypu. Na základě výsledků opakovaných šetření je doporučeno: - I přes všechny diskutabilní důsledky, které přináší úplné oplocení pralesa, je to v současné době jediné řešení,  zajišťující jeho relativně přirozený samovolný vývoj. Proto je třeba trvale udržovat oplocení v provozuschopném stavu a podle možností lovit či vytlačovat ven zvěř, která se do pralesa dostane. V pralese by neměly být prováděny žádné úmyslné zásahy. Do bezzásahového režimu je možné zařadit porosty nad",
            "Received 17 June 2001  Boubínský prales po 24 letech (1972-1996) — vývoj stromového patra  T. VRŠKA', L. HORT2, P. ODEHNALOVÁ?, D. HORAL2, D. ADAM2  Správa Národního parku Podyjí, Znojmo, Česká republika 2Agentura ochrany přírody a krajiny ČR, detašované pracoviště Brno, Česká republika  ABSTRAKT: V roce 1996 byla provedena opakovaná měření taxačních, typologických a porostních charakteristik v národní přírodní rezervaci Boubínský prales. Tyto úkony následovaly po výzkumu provedeném v roce 1972 s použitím stejné metodiky a následným vyhodnocením změn, k nimž ve sledované oblasti došlo. Došlo k výraznému poklesu zastoupení jedle a tento úbytek byl nahrazen zvýšenou účastí buku. Dominantní postavení si v pralese udržel smrk. Počet živých stromů mírně klesl, naopak stoupl objem kmenů živých stromů. Celkem 30 % plochy pralesa je pokryto souvislým nárostem s dominancí buku. Na vhodných místech mimo bukové nárosty se úspěšně zmlazuje jedle i smrk s doprovodem dalších vtroušených dřevin. Lze předpokládat, že postupně dojde k obnově populace jedle bělokoré i k obnově smrku. Je navržen další management rezervace.",
            "plochu pralesa, a to přesto, že na řadě míst došlo k náhlým rozpadům stávajícího porostu, dochází k výraznému stárnutí a odumírání populace jedle bělokoré apod. Tato skutečnost potvrzuje jedinečnost Boubínského pralesa a dokazuje životaschopnost a stabilitu pralesovitých útvarů, ponechaných samovolnému vývoji na dostatečně velké souvislé ploše. Došlo k výraznému poklesu zastoupení jedle a tento úbytek byl nahrazen zvýšenou účastí buku. Dominantní postavení si v pralese udržel smrk. Počet živých stromů mírně klesl. Naopak stoupl objem kmenů živých stromů, což svědčí o celkovém stárnutí pralesa. Celkem 30 % plochy je však pokryto souvislým nárostem s dominancí buku. Tyto nárosty jsou zatím pod registrační hranicí dendrometrických šetření, v budoucnu však dojde k větší",
            "na Boubíně zůstává chráněn jako byl dříve. Na Boubíně zajištěna ministerstvem jedna světnička v Idině pile, aby měli badatelé v pralese pracující kde zůstávati. Tím také bude učiněn první krok k tomu, což jest vedle jiných důležitých úkolů reservací reservovaná území pralesová musí býti důkladně prostudována a v těchto studiích stále pokračováno, aby bylo zřejmo, jakým změnám podléhá život přírody, která sama sobě byla ponechána a může se dle svého vyvíjeti. — Bolavá stránka ochrany lesních porostů jsou tak zvané »pasienky« na Slovensku. Již za dob býv. Uher bylo dovoleno pásti dobytek v lesích, kteréž dovolení za republiky prodlouženo, ale způsobuje veliké škody lesním porostům. Tento zvyk učinil již nesmírné škody v nejkrásnějších porostech a škody tyto porostou do nedozírna."
        ],
        "response":"Mezi lety 1972 a 1996 došlo k výraznému poklesu zastoupení jedle a zvýšené účasti buku v Boubínském pralese [doc3, doc4]. Dominantní postavení si udržel smrk [doc3, doc4]. Počet živých stromů mírně klesl, zatímco stoupl objem kmenů živých stromů, což svědčí o celkovém stárnutí pralesa [doc4]. Celkem 30 % plochy pralesa je pokryto souvislým nárostem s dominancí buku [doc3, doc4].\n\nNa základě těchto změn a zjištění, že na řadě míst došlo k náhlým rozpadům stávajícího porostu a odumírání populace jedle bělokoré [doc4], byl navržen další management rezervace [doc3]. K zajištění přirozeného vývoje pralesa bylo doporučeno trvale udržovat oplocení v provozuschopném stavu a lovit či vytlačovat zvěř, která se do pralesa dostane [doc2]. V pralese by neměly být prováděny žádné úmyslné zásahy [doc2]. Současně bylo doporučeno aktivně provádět zásahy vedoucí k větší strukturální diferenciaci porostů, včetně vnášení chybějících cílových dřevin, zejména v porostech mezi Horní Basumskou cestou a Basumským hřebenem, v okolí vrcholu Boubína a loveckého zámečku [doc1]. Na vhodných místech mimo bukové nárosty se úspěšně zmlazuje jedle i smrk s doprovodem dalších vtroušených dřevin, což by mělo vést k obnově populace jedle bělokoré i smrku [doc2, doc3].",
        "reference":"Došlo k výraznému poklesu zastoupení jedle, který byl nahrazen zvýšenou účastí buku, přičemž dominantní postavení si udržel smrk. Počet živých stromů mírně klesl, ale objem kmenů živých stromů stoupl. Celkem 30 % plochy pralesa je pokryto souvislým nárostem s dominancí buku, a na vhodných místech mimo bukové nárosty se úspěšně zmlazuje jedle i smrk. Je navržen další management rezervace, který zahrnuje trvalé udržování oplocení v provozuschopném stavu a lov či vytlačování zvěře, která se do pralesa dostane, aby byl zajištěn relativně přirozený samovolný vývoj pralesa.",
        "faithfulness":1.0,
        "answer_relevancy":0.9053692303,
        "answer_correctness":0.7122142972,
        "context_precision":1.0,
        "context_recall":1.0,
        "context_sufficiency":1.0
    },
    {
        "user_input":"Jaké byly důvody a možné důsledky odporu knížete Bedřicha Schwarzenberga a velkostatkářů proti zamýšlené stavbě vodních drah, a jak tento odpor ovlivnil náladu a plány průmyslových kapitalistů?",
        "retrieved_contexts":[
            "— je jisto, že původní rozpočty budou jako obyčejně značně překročeny — se nechá velice mnoho vydělat. Sumy ty velice zúrodní vypráhlé lány průmyslu. Ale nad radostnou náladou pánů kapitalistů stahují se černé mraky. Vedle kapitalistů průmyslových máme ještě jiné kapitalisty. A tito jsou mnohem mocnější, než ti různí komínoví baroni. Jsou to naši počestní velkostatkáři. První blesk již vyslali. Byl to sice prozatím jen blesk papírový, ale je na něm podepsán kníže Schwarzenberg a proto bude míti dalekosáhlé účinky. Dost možná, že ochromení celé akce. Řiditelstvo Ústřední společnosti hospodářské, jejímž předsedou je kníže Bedřich Schwarzenberg rozeslalo hospodářským spolkům provolání, v němž se rozhodně staví proti zamýšlené stavbě vodních drah. Nečiní",
            "dářské, jejímž předsedou je kníže Bedřich Schwarzenberg rozeslalo hospodářským spolkům provolání, v němž se rozhodně staví proti zamýšlené stavbě vodních drah. Nečiní to arciť přímo, ale to na věci nic nemění V provolání se praví: „Ačkoli nutno návrh zákona na zřízení průplavů pokládati za prospěšný veškeré výrobě a tržbě, má Ústřední společnost hospodářská za to, že nelze odlučovati stavbu těchto kanálů vůbec od celkové úpravy našeho vodního hospodářství a že projektované průplavy nabyly by pravého významu pro domácí výrobu a tržbu teprve po předcházející soustavně provedené úpravě řek a toků a řádném provedení všech úkolů a potřeb melioračních.“ A že úkol tento nebude snadným, to se přiznává v provolání bez obalu: „Organisace  LIDU Redakce a administrace nalézá se",
            "chovsko-kladenský. Fakt tento potvrzují také neKu konci však se teprve přiznává pravá dělní „Nár. Listy“, jež o tom praví: „Ježto se příčina odporu proti zamýšleným stavbám při první volbě jednalo o společný postup vodních drah. „Ohromný kapitál má býti všeho národního voličstva této kuvěnován na zřízení průplavů, o nichž není rie proti sociální demokracii, zasadili se jisto, zda-li by sloužily jen zájmům kapitadůvěrníci národní strany svobodolistickým a zda-li by neumožnily Uhrám a myslné o to, aby v listině volitelů nalezli zemím pobalkánským, aby levnou vodní přiměřeného zastoupení také stoupenci národněcestou zaplavovaly naše země sociální strany a hlasy obou stran těchto sjednoceny byly na osobě svými hospodářskými plodinami.“ kandidáta, jmenovaného stranou národně-",
            "z prací a agitačních statí dr. Russa a jiných. Varovného hlasu v té příčině pozdvihla (14. dubna) v Praze Ústřední hospodářská společnost, kde kníže Bedřich Schwarzenberg hájil prospěchů zemských v ten rozum, aby především zamezeny byly škody, které rozvodňováním přítoků Vltavy a Labe každého roku zemědělství se způsobují, a pak teprve aby se přikročilo k zřizování velkých průplavů. Ohromný kapitál má býti vložen do průplavů těch, a není dnes jisto, zda by nesloužily jen prospěchům kapitalistickým, neotevřely příchod cizozemské výrobě a nezaplavovaly naše země hospodářskými plodinami z Uher a zemí Balkánských. Napřed regulování řek a meliorace, potom průplavy, v tom smyslu přijata byla jednomyslně resoluce. Z důvodů, aby přítomnost něčeho získala, ujednalo české poselstvo na říšské radě trojí junctim s vládou, jak z projevu dr. Pa-",
            "využitkovány byly vody k účelům melioračdočechů a proto také i tentokráte volají na ně, aby jim zase pomohli vyhrát mandát smíním i práce meliorační provedeny.“ chovsko-kladenský. Fakt tento potvrzují také neKu konci však se teprve přiznává pravá dělní „Nár. Listy“, jež o tom praví: „Ježto se příčina odporu proti zamýšleným stavbám při první volbě jednalo o společný postup vodních drah. „Ohromný kapitál má býti všeho národního voličstva této kuvěnován na zřízení průplavů, o nichž není rie proti sociální demokracii, zasadili se jisto, zda-li by sloužily jen zájmům kapitadůvěrníci národní strany svobodolistickým a zda-li by neumožnily Uhrám a myslné o to, aby v listině volitelů nalezli zemím pobalkánským, aby levnou vodní přiměřeného zastoupení také stoupenci národně-"
        ],
        "response":"Kníže Bedřich Schwarzenberg a velkostatkáři se stavěli proti zamýšlené stavbě vodních drah z obav o škody, které by rozvodňováním přítoků Vltavy a Labe mohly vznikat zemědělství [doc4]. Obávali se také, že by průplavy mohly sloužit prospěchu kapitalistů, otevřít cestu cizozemské výrobě a zaplavit české země hospodářskými plodinami z Uher a zemí Balkánských [doc4]. Ústřední hospodářská společnost, jejímž předsedou byl kníže Bedřich Schwarzenberg, navrhovala, aby se nejprve regulovaly řeky a provedly meliorace, a teprve poté se přikročilo ke stavbě průplavů [doc4].\n\nTento odpor ovlivnil náladu a plány průmyslových kapitalistů, protože původní rozpočty byly pravděpodobně značně překročeny a očekávali zisk [doc1]. Nicméně, odpor velkostatkářů a knížete Schwarzenberga mohl ochromit celou akci [doc1].",
        "reference":"Odpor knížete Bedřicha Schwarzenberga a velkostatkářů proti zamýšlené stavbě vodních drah byl motivován jejich mocenskými zájmy, které byly ohroženy průmyslovými kapitalisty. Tento odpor, vyjádřený prostřednictvím provolání rozeslaného hospodářským spolkům, měl potenciál ochromit celou akci, což vrhalo černé mraky nad radostnou náladu průmyslových kapitalistů, kteří očekávali značné zisky z projektu.",
        "faithfulness":0.7,
        "answer_relevancy":0.9387322076,
        "answer_correctness":0.501742933,
        "context_precision":1.0,
        "context_recall":1.0,
        "context_sufficiency":1.0
    },
    {
        "user_input":"Jaké byly důvody a potenciální důsledky nesouhlasu Ústřední společnosti hospodářské, vedené knížetem Bedřichem Schwarzenbergem, se zamýšlenou stavbou vodních drah, a jak tento postoj ovlivnil politickou situaci a reakce kapitalistů v kontextu plánů vlády Körbrovy?",
        "retrieved_contexts":[
            "formace o otázce vodních drah: „Dle tvrzení několika orgánů lze se domýšleti, že usnesení Kola polského v otázce vodních drah má charakter politické sensace. To jest však nesprávné! Nutno v tomto případě činiti přesně rozdíly mezi převládajícími náladami v Kole polském a mezi formou usnesení, jež v otázce vodních drah dlužno učiniti. Kolo polské má příliš dobrou politickou školu a mnoho zkušeností, nežli aby někomu prokázalo laskavost, svým usnesenín, se připraviti o volnost pohybu a ocitnouti se ve slepé uličce. Usnesení Kola polského v otázce vodních drah nebude pravděpodobně lišiti se od usnesení, učiněného 19. t. m. ve valné hromadě polských stran na haličském zemském sněmě ve Lvově. Ve smyslu tohoto usnesení trvá Kolo polské na stavbě vodních drah, Haliči zákonem z r. 1901 zajištěných. Resoluce Kola polského však parlamentní situaci rozhodně nebude komplikovat a nezpůsobí také nových potíží. Kolo polské nemá pražádného zájmu na tom, aby svými usneseními v otázce vodních drah pro kohokoliv se zvláště exponovalo. Bude v nich dán pouze projev nálady převládající v celé zemi.",
            "formace o otázce vodních drah: „Dle tvrzení několika orgánů lze se domýšleti, že usnesení Kola polského v otázce vodních drah má charakter politické sensace. To jest však nesprávné! Nutno v tomto případě činiti přesně rozdíly mezi převládajícími náladami v Kole polském a mezi formou usnesení, jež v otázce vodních drah dlužno učiniti. Kolo polské má příliš dobrou politickou školu a mnoho zkušeností, nežli aby někomu prokázalo laskavost, svým usnesenín, se připraviti o volnost pohybu a ocitnouti se ve slepé uličce. Usnesení Kola polského v otázce vodních drah nebude pravděpodobně lišiti se od usnesení, učiněného 19. t. m. ve valné hromadě polských stran na haličském zemském sněmě ve Lvově. Ve smyslu tohoto usnesení trvá Kolo polské na stavbě vodních drah, Haliči zákonem z r. 1901 zajištěných. Resoluce Kola polského však parlamentní situaci rozhodně nebude komplikovat a nezpůsobí také nových potíží. Kolo polské nemá pražádného zájmu na tom, aby svými usneseními v otázce vodních drah pro kohokoliv se zvláště exponovalo. Bude v nich dán pouze projev nálady převládající v celé zemi.",
            "z prací a agitačních statí dr. Russa a jiných. Varovného hlasu v té příčině pozdvihla (14. dubna) v Praze Ústřední hospodářská společnost, kde kníže Bedřich Schwarzenberg hájil prospěchů zemských v ten rozum, aby především zamezeny byly škody, které rozvodňováním přítoků Vltavy a Labe každého roku zemědělství se způsobují, a pak teprve aby se přikročilo k zřizování velkých průplavů. Ohromný kapitál má býti vložen do průplavů těch, a není dnes jisto, zda by nesloužily jen prospěchům kapitalistickým, neotevřely příchod cizozemské výrobě a nezaplavovaly naše země hospodářskými plodinami z Uher a zemí Balkánských. Napřed regulování řek a meliorace, potom průplavy, v tom smyslu přijata byla jednomyslně resoluce. Z důvodů, aby přítomnost něčeho získala, ujednalo české poselstvo na říšské radě trojí junctim s vládou, jak z projevu dr. Pa-",
            "— je jisto, že původní rozpočty budou jako obyčejně značně překročeny — se nechá velice mnoho vydělat. Sumy ty velice zúrodní vypráhlé lány průmyslu. Ale nad radostnou náladou pánů kapitalistů stahují se černé mraky. Vedle kapitalistů průmyslových máme ještě jiné kapitalisty. A tito jsou mnohem mocnější, než ti různí komínoví baroni. Jsou to naši počestní velkostatkáři. První blesk již vyslali. Byl to sice prozatím jen blesk papírový, ale je na něm podepsán kníže Schwarzenberg a proto bude míti dalekosáhlé účinky. Dost možná, že ochromení celé akce. Řiditelstvo Ústřední společnosti hospodářské, jejímž předsedou je kníže Bedřich Schwarzenberg rozeslalo hospodářským spolkům provolání, v němž se rozhodně staví proti zamýšlené stavbě vodních drah. Nečiní",
            "V Praze, v úterý dne 30. dubna 1901.  Vodní dráhy. Vláda Körbrova má velikou potíž s na cionálními štvanicemi. Na místě, aby veřejný život náš demokratisováním připravila na cestu zdravého vývoje, chytla věc z jiného konce. Slíbila žíznivému kapitalismu velikou kořisť, celých 750 mil. K! Dílo, jež zamýšlí vláda Körbrova, je rozsahu přímo obrovského. Čtyři veliké vodní dráhy mají býti vystavěny, jež by říši naši z jihu na sever, od východu na západ spojovaly. Kapitalisté také se již ozvali. V prvé řadě arciť z rakouského Manchestru — z Brna — aby zapálili vládě Körbrově kadidlo a zapěli jí své chvalozpěvy. Sjeli se, aby přijali resoluci, jíž vítají vládní předlohu o vodních drahách jakožto počátek splnění vládních slibů a vyslovují povděk, že v první řadě je položeno provedení ka-"
        ],
        "response":"Ústřední hospodářská společnost, vedená knížetem Bedřichem Schwarzenbergem, se stavěla proti zamýšlené stavbě vodních drah z obav o potenciální škody zemědělství způsobené rozvodňováním přítoků Vltavy a Labe [doc3]. Existovala také obava, že obrovský kapitál vložený do vodních drah by mohl sloužit pouze prospěchu kapitalistů, otevřít trh cizozemské výrobě a zaplavit země hospodářskými plodinami z Uher a zemí Balkánských [doc3].\n\nKníže Schwarzenberg a Ústřední hospodářská společnost rozeslali provolání hospodářským spolkům, v němž se rozhodně stavěli proti stavbě vodních drah [doc4]. Toto provolání mělo dalekosáhlé účinky a mohlo ochromit celou akci [doc4].\n\nPlány vlády Körbrovy, které zahrnovaly výstavbu čtyř velkých vodních drah, byly spojeny s finanční podporou ve výši 750 milionů korun [doc5]. Kapitalisté, včetně těch z Brna, se naopak vyjádřili podporou plánů vlády a přijali resoluci, ve které vítají vládní předlohu [doc5]. Politická situace byla tedy komplikovaná nesouhlasem hospodářských kruhů a podporou ze strany kapitalistů, což ovlivnilo realizaci plánů vlády Körbrovy [doc5].",
        "reference":"Ústřední společnost hospodářská, vedená knížetem Bedřichem Schwarzenbergem, nesouhlasila se zamýšlenou stavbou vodních drah, protože se domnívala, že nelze oddělit stavbu těchto kanálů od celkové úpravy vodního hospodářství a že by projektované průplavy měly pravý význam pro domácí výrobu a tržbu až po předcházející soustavně provedené úpravě řek a toků a řádném provedení všech melioračních úkolů a potřeb. Tento postoj mohl ochromit celou akci a ovlivnil politickou situaci tím, že vláda Körbrova čelila potížím s národními štvanicemi, zatímco kapitalisté, zejména z Brna, vítali vládní předlohu o vodních drahách jako počátek splnění vládních slibů a vyjádřili svůj povděk.",
        "faithfulness":1.0,
        "answer_relevancy":0.9127128278,
        "answer_correctness":0.5996157757,
        "context_precision":1.0,
        "context_recall":0.75,
        "context_sufficiency":1.0
    },
    {
        "user_input":"Jaké jsou důsledky rozporu mezi veřejně hlásaným bojem proti němectví a skutečným chováním předních českých národovců, jako je posílání jejich dětí do německých škol, na vnímání jejich důvěryhodnosti a autority v rámci českého národního hnutí?",
        "retrieved_contexts":[
            "a poslanci, jako dr. Podlipný a dr. Blažek, v Praze své děti posýlali do německých škol obecných, tu jest to čin, kterého sice „Národní Listy“ nevidí, ale popříti a ospravedlniti nedovedou. Toť zajisté daleko horší národní spustlost, než jakou „Národní Listy“ přičítají Moravě. A nevzpomínaje ani toho, v samém středisku českého života, v Praze, v Plzni atd. jsou tisíce českých dětí na školách německých, a to nejen děti rodičů chudobných, od Němců závislých, ale právě ponejvíce také děti bohatých, samostatných! Procenta dotyčná podávají o národní uvědomělosti tamní mnohem nepříznivější obraz než procenta ivančická! Proto by „Národní Listy“ dobře učinily, kdyby byly ve svém ostudném hrdopychu trochu skromnějšími, a to tím vice, že známo jest, že strana jejich dle vý-",
            "Následky takového školování jsou trapny již v příčině vychovatelské. Dítky české, chodíce do škol německých, zůstávají pozadu u svém vzdělání, u svém vychování mravním, poněvadž nemohou rozuměti a nerozumějí tomu, co se jim vykládá jazykem cizím. Když pak počaly chápati, k čemu je vedou jazykem německým, pozbývají vážnosti a úcty k vlastní své krvi národní, k tomu kmeni, z něhožto vyrostly, i k vlastním rodičům svým, učíce se jich sobě nevážiti, ano pohříchu i styděti se za ně a zapírati jich. A tak majíce rodičů svých a národa svého býti ozdobou a chloubou, bývají hanbou jejich a potupou. Následky takového školování jsou záhubné i v příčině národní. Ty tisíce a tisíce dětí českých, které každým rokem vždy znova vstupují do škol německých, ubývají a hynou",
            "mezi blízkých absolutní většině veškeré návštěvy německých veřejných ob. škol těchto. (R. 1901 bylo českých dětí na těchto školách 908 = 33.3%. r. 1904\/5 už 988 = 36. 30%. r. 1905\/6 dokonce 1034 = 38.53%, při čemž návštěva něm. dětí na německých školách stále klesala: 1938: 1724: 1634.) To se, bohudík, nestalo, přesně před mezi 40% klesl český nával do německých škol v Praze nazpět zase až na třetinu, jako r. 1901. Z toho možno souditi, že Praha bude už najisto ušetřena ohavnosti spuštění, jaké jí hrozilo a to v době blízko dozírné a zcela jistě, kdyby se nebylo proti úmoru českých dětí v něm. školách zdejších zakročilo tak důrazně, jako se to stalo letos. Zjišťujíce tento výsledek přičinění čestných českých mužů v národní organisaci, nemůžeme na to nepouká-",
            "nejhorších výstředností dopouštějí se školáci původem naši, ale ve škole německé, schulvereinské a jiné, odnárodnění, zkažení, v záští proti vlastnímu rodu svému vydresírovaní. Na takových případech nejlépe pozná český otec zhoubný vliv a účinek německé školy... syn jeho posléze proti němu samému se obrátí, jej samotného v nejdražších citech jeho pohaní, a domnělé požehnání, kteréž mu německé vychování synovo mělo přinésti, promění se mu v děsnou kletbu! Skutky národní nesnášelivosti, plemenného záští, jakýmž poslední dobou žáci německých škol, zejmena brněnských, proti žákům českých ústavů se smutně proslavují, zasluhují věru již bedlivého povšimnutí a uvážení. A to již se stanoviska mravního, neboť surovost má se neuprosně odsouditi a vypleniti i tenkráte, když se vykazuje ochrannou známkou němectví!",
            "(R. 1901 bylo českých dětí na těchto školách 908 = 33.3%. r. 1904\/5 už 988 = 36. 30%. r. 1905\/6 dokonce 1034 = 38.53%, při čemž návštěva něm. dětí na německých školách stále klesala: 1938: 1724: 1634.) To se, bohudík, nestalo, přesně před mezi 40% klesl český nával do německých škol v Praze nazpět zase až na třetinu, jako r. 1901. Z toho možno souditi, že Praha bude už najisto ušetřena ohavnosti spuštění, jaké jí hrozilo a to v době blízko dozírné a zcela jistě, kdyby se nebylo proti úmoru českých dětí v něm. školách zdejších zakročilo tak důrazně, jako se to stalo letos. Zjišťujíce tento výsledek přičinění čestných českých mužů v národní organisaci, nemůžeme na to nepoukázati, že patrný úspěch tento nemůže zastaviti další kroky české Prahy k úplnému očištění od"
        ],
        "response":"Podle dostupných pramenů rozpor mezi veřejně proklamovaným bojem proti němectví a chováním některých předních českých národovců, konkrétně posílání jejich dětí do německých škol, vedl k pochybám o jejich důvěryhodnosti a autoritě v rámci českého národního hnutí.\n\nMoravská orlice z roku 1892 poukazuje na to, že poslanci, jako dr. Podlipný a dr. Blažek, posílali své děti do německých škol, což „Národní Listy“ kritizují jako „národní spustlost“ [doc1]. Tato skutečnost zpochybňovala jejich národní uvědomělost a morální autoritu [doc1].\n\nDůsledky takového chování se projevovaly i v morální a národní rovině. Vlast z roku 1901 uvádí, že děti navštěvující německé školy ztrácejí respekt k vlastnímu národu a rodičům, a dokonce se za ně stydí [doc2]. Moravská orlice z roku 1884 popisuje, jak děti, které navštěvují německé školy, se dopouštějí „národního záští“ a „odnárodnění“ [doc4].\n\nZprávy z Národních listů z roku 1906 ukazují, že i přes snahy o omezení českého navštěvování německých škol, se situace v Praze zlepšovala pomalu a vyžadovala další úsilí [doc5].",
        "reference":"Rozpor mezi veřejně hlásaným bojem proti němectví a skutečným chováním předních českých národovců, jako je posílání jejich dětí do německých škol, může oslabit jejich důvěryhodnost a autoritu v rámci českého národního hnutí, protože jejich činy nejsou v souladu s jejich slovy, což může vést k pochybnostem o jejich skutečných úmyslech a závazcích vůči národnímu boji.",
        "faithfulness":0.5833333333,
        "answer_relevancy":0.0,
        "answer_correctness":0.5112513607,
        "context_precision":1.0,
        "context_recall":1.0,
        "context_sufficiency":1.0
    },
    {
        "user_input":"Jaké byly hlavní výtky vůči české sociální demokracii ze strany jiných politických stran a jak se k těmto výtkám stavěly pokrokové listy jako „Čas“ a „Osvěta Lidu“?",
        "retrieved_contexts":[
            "posvátnost majetku, který chceme zničit atd. Vlastenecká buržoasie, mladočeši, považuje sociální demokraty v parlamentě za pasivní živel, poněvadž nedělají positivní politiku, nechtějí vstoupiti do vlády, odmítají hlasovat pro rozpočet, v němž jsou obrovská vydání na věci škodlivé a malá vydání na věci užitečné. Pokroková inteligence, realisté, vystihuje nejsprávněji činnost i podstatu sociálnědemokratické politiky. Nejvážnější pokrokové listy „Čas“ a „Osvěta Lidu“ uvažují o výtkách, ostatními stranami sociální demokracii činěných, a docházejí k závěrům pro naše čtenáře zajímavým. „Čas“ mezi jiným píše: „Co „České Slovo“ vytýká sociální demokracii české, je nesprávné a neobstojí před žádným soudem, není-li rozvaha jeho zakalena předsudky a konkurencí. I my jsme někdy projevovali nesouhlas s postupem sociální demokracie; kdyby však se měli vyhledat a spočíst chyby, kterých nadělaly ve Vídni za čtyři léta české strany měšťácké, byla by jich nepoměrně",
            "rozpočet, v němž jsou obrovská vydání na věci škodlivé a malá vydání na věci užitečné. Pokroková inteligence, realisté, vystihuje nejsprávněji činnost i podstatu sociálnědemokratické politiky. Nejvážnější pokrokové listy „Čas“ a „Osvěta Lidu“ uvažují o výtkách, ostatními stranami sociální demokracii činěných, a docházejí k závěrům pro naše čtenáře zajímavým. „Čas“ mezi jiným píše: „Co „České Slovo“ vytýká sociální demokracii české, je nesprávné a neobstojí před žádným soudem, není-li rozvaha jeho zakalena předsudky a konkurencí. I my jsme někdy projevovali nesouhlas s postupem sociální demokracie; kdyby však se měli vyhledat a spočíst chyby, kterých nadělaly ve Vídni za čtyři léta české strany měšťácké, byla by jich nepoměrně  Inserty počítají se 10h za půlsloupcový petitový řádek. - Při dalším opakování značná sleva.",
            "POLITIKA. „Osvěta Lidu“ pojednávající o kandidatuře prof. Masaryka, dodává: „Došlo-li na voličské schůzi ve Zlíně ku konfliktu se sociálními demokraty, jistě toho být nemusilo, nebýti předchozího štvaní proti sociální demokracii v „Moravském Kraji“. Podpisujeme. Pan Svozil přivede pokrokové organisace k úplnému rozkladu, bude-li ještě dlouho za pokrokového člověka považován a pokrokovými organisacemi za jich předáka uznáván. Porada pokrokových důvěrníků konala se minulou sobotu v Přerově. Bylo jednáno o kompromisu se stranou lidovou. Za vzájemnou pomoc při volbách, byla by strana lidová ochotna uříznout „prostějovskou větev“ ze svého kmene. Na druhé straně jednalo se jednotlivým důvěrníkům pokrokovým o pomoc lidové strany na zajištění kandidatury prof.",
            "stěhoval se „Časopis pokrokového studentstva“ z Nového Bydžova za krátko do Hořic. Jeho redakce, sestávající z Fr. Tomáška, Kloudy, Hlaváčka, Čížka, Beneše, Preise atd., navazovala styky i s německými studenty: Otto Pohl, pozdější redaktor německé části socialistické „Akademie“, měl v „Časopise pokrokového studentstva“ článek „O sociálních proudech v německém studentstvu pražském.“ Postup k rozšíření pokrokových myšlenek učiněn takřka sedmimílovými botami založením krejcarových listů „Lidu“ a „Ruchu“. Oba časopisy, vydané v říjnu 1894, byly na svoji dobu záslužným dílem. Psány byly svěže a srozumitelně, čímž získaly si obliby nejširších vrstev a docílily značného rozšíření. Úřady však ihned postřehly, jak nebezpečný agitační i uvědomovací prostředek v nich",
            "boru volební leták českoslovanské sociální demokracie. „Čas“ zachoval se v tom daleko méně loyálně, než sám oficiální denník sociálně-demakratický, který arci ex offo musí státi za vším, co vydal a podepsal jeho výkonný výbor. „Čas“ nechce prý „dělati advokáta sociální demokracii,“ povídá včera. Jsou to očividně kyselé hrozny, poněvadž ve skutečnosti se o to sice pokouší, ale naprosto bezúspěšně. Roli advokáta zaměnil spíše za roli dobrovolného agenta, a sice agenta provokatéra, který se staví, hloupějším, než snad ve skutečnosti jest, chce-li vážně hájiti i takový volební bengál, jako je tato věta v socialistickém provolání; „Na jedné straně vše, co má zlato a moc, na druhé straně vše, co má v erbu mozoly a těžké upracované ruce.“ Co proti této sofistice dr. Kramář namítl, tomu rozumí každý myslící člověk. Náš řočník v Libni vyslovil se o této vyložené demagogii jistě velmi mírně. Kdyby býval chtěl být hodně kousavý, mohl jen vybídnouti svoje posluchače, aby si prohlédli ruce sociálně-demokratických kandidátů, mnoho-li na nich najdou těch mozolů."
        ],
        "response":"Česká sociální demokracie čelila kritice za pasivní politiku, včetně odmítání vstupu do vlády a nevolení pro rozpočet, který alokoval prostředky na škodlivé a naopak ne na užitečné věci [doc1, doc2]. Kritika se týkala i toho, že sociální demokraté nedělají \"positivní politiku\" [doc1].\n\nPokrokové listy „Čas“ a „Osvěta Lidu“ se k těmto výtkám stavěly různě. „Čas“ argumentoval, že kritika sociální demokracii ze strany „Českého Slova“ je nesprávná a neobstojí, pokud není zkreslená předsudky a konkurencí [doc1]. List se někdy projevoval neshodou s postupem sociální demokracie, ale zároveň zdůrazňoval, že kritika by měla být objektivní [doc1]. „Osvěta Lidu“ se zabývala konfliktem mezi sociálními demokraty a profesorem Masarykem [doc3].",
        "reference":"Hlavní výtky vůči české sociální demokracii ze strany jiných politických stran byly považovány za nesprávné a neobstojí před žádným soudem, pokud není rozvaha zakalena předsudky a konkurencí. Pokrokové listy jako „Čas“ a „Osvěta Lidu“ se k těmto výtkám stavěly kriticky a vyjadřovaly nesouhlas s postupem sociální demokracie, ale zároveň poukazovaly na to, že chyby českých měšťáckých stran ve Vídni by byly nepoměrně větší.",
        "faithfulness":0.9090909091,
        "answer_relevancy":0.9100040934,
        "answer_correctness":0.5887850916,
        "context_precision":0.95,
        "context_recall":0.6666666667,
        "context_sufficiency":1.0
    },
    {
        "user_input":"Jaký byl význam československého státu v mezinárodním kontextu a jaké specifické zájmy měla Itálie na vytvoření protiněmecké bariéry, kterou měly tvořit státy československý, polský a jihoslovanský, a jak to souviselo s italskými mazziniány a nacionalisty?",
        "retrieved_contexts":[
            "venským utrpením za války, nýbrž i tím, že prohlásila s největší rozhodností osvobození československého národa jako jeho politický postulát, jehož provedení náleží do společného programu Spojenců. Heslo italských mazziniánů a nacionalistů o zničení Rakouska bylo opakováno na konkrétním příkladě československém a podepřeno jak negativně líčením útisku národností rakousko-uherskou vládou, tak i positivně vytyčením mezinárodní důležitosti československého státu po stránce politické a hospodářské oproti německo-maďarskému imperialismu. Beneš podtrhl i specifický zájem Italie na této protiněmecké barieře, kterou měly tvořiti na severu stát československý a polský a na jihu stát jihoslovanský a Italie; touto jižní barierou měli býti Němci definitivně oddáleni od Jaderského moře, »ve kterém Italové a Slovani našli by jistý způsob usa-",
            "cipu národnostního a majících zájem o udržení míru a jeho obranu proti rušitelům, chtivým výboje ve svůj prospěch a ke škodě slabých. Italii přinese zřízení státu českého největší zadostiučinění, ježto bude v něm viděti triumf národního principu, který je základem naší státní existence. Politicky musí se Italie těšiti z toho, až uvidí, že rakouské tyranii odňati jsou ušlechtili národové, kteří se dělili s částí Italů o útrapy a utrpení cizího panství.  Ulderico Mazzolani, poslanec v Ravenně.30) Věřím a přeji si, aby Češi ze starého království českého utvořili jediný stát se Slováky z horních Uher. Uskutečnění těchto národních aspirací bude pro Evropu dalším činitelem budoucího klidu; uspokojujíc ne bezvýznamnou část veliké rodiny slovanské, přispěje k pořádku a klidu u těch nepokojných nacionalistických hnutí slovanských, z nichž leckteré v nedalekém zítřku mohlo by vyvolati konflikt s Italií.",
            "ovšem i velký význam vojenský. Proto je tento projekt přijímán mnoha politiky na obou stranách. Avšak koridor srbsko-český by byl užitečný nejenom oběma zúčastněným národům, nýbrž by měl význam širší a dalekosáhlejší s hlediska politiky spojenců. Tvořil by jakousi slovanskou bariéru proti německému pochodu na Cařihrad a Bagdad a vedle toho, že by překážel Německu v kolonisaci Balkánu a Malé Asie, zabraňoval by též Maďarům, aby tvořili jeho ochotný předvoj. Tato slovanská bariéra je tedy ve shodě se zájmy spojenců v Asii. Spojenci vůbec tím, že věnují svou ochranu balkánským národům, zejména slovanským, získávají při nejmenším stejně, ne-li více, než čeho získali patronancí Turecka, a při tom prospívají věci svobody a civilisace. Avšak nejenom ententa, nýbrž i Italie, a právě Italie, má zájem na zdravém vyřešení otázek slovanských a otázky jihoslovanské zvláště. Italie vážně chybuje svou politikou na Jadranu, projevující přehnané nároky na území srbochorvatské, touhu po držení chor-",
            "může se státi hrází proti německému a maďarskému přívalu ve východní Evropě, posiluje tak souběžnou obrannou akci bloku anglo-francouzsko-italského proti témuž nebezpečenstvi na západě, i činnost, k níž především určena jest Italie na Balkáně v harmonické soutěži s obnovenou jednotou srbskou a rumunskou. Mimo to samostatné Československo může míti šťastný vliv na hospodářskou činnost jak vlastní tak italskou. Vskutku, abych mluvil jen o své zemi, nepřihlížeje ani k úvaze o politické výhodě úzkých styků v budoucnosti, skutečného spolku obou států, Italie měla by přímý zisk ze zrození nového státu i s hlediska vlastní expanse obchodní ve východní Evropě a neméně s hlediska vlastní emancipace z příliš tíživé poplatnosti Německu i Rakousku za dodávání surovin i produktů, které sice zčásti dostává z Čech, avšak cestou obchodní",
            "bufferovými. Německý tlak na západ? Osvobozená a sjednocená Polska, osvobozené a sjednocené Čechy se Slovenskem, osvobození a sjednocení Jihoslované, žalují pangermáni, budou barrierou proti Němcům: Poláci přímo proti Prusku, Čechové se Slováky proti Prusům, Rakušanům a Maďarům, Jihoslované proti Rakušanům a Maďarům. V jistém smyslu je to správné — společný a odvěký nepřítel, tlačící se vší mocí na východ, přirozeně a nutně spojuje slovanské národy; avšak ta barriera má zjevně ráz obranný. Tato tak zv. barriera nebude státy bufferovými (nárazníkovými): Ten pojem v demokratické a mírné Evropě nemá smyslu, neboť národové všichni budou loyalními, dobrými sousedy. Ta barriera dána je historií a rozdělením národů v pásmu malých národů: ti tři slovanští národové"
        ],
        "response":"Československý stát měl v mezinárodním kontextu význam jako potenciální bariéra proti německému a maďarskému vlivu ve východní Evropě [doc4, doc5]. Měl posílit obranou akci anglo-francouzsko-italského bloku proti německému nebezpečí [doc4].\n\nItálie měla specifický zájem na vytvoření protiněmecké bariéry, kterou měly tvořit státy československý, polský a jihoslovanský [doc1, doc3]. Tato bariéra měla zabránit německému pochodu na Cařihrad a Bagdad, kolonisaci Balkánu a Malé Asie a maďarskému předvoji Němců [doc3]. Itálie měla také zájem na zdravém vyřešení slovanských otázek, zejména jihoslovanských, a kritizovala svou politiku na Jadranu, projevující přehnané nároky na území srbochorvatské [doc3].\n\nHeslo italských mazziniánů a nacionalistů o zničení Rakouska bylo opakováno v kontextu československého národa a podpořeno negativním líčením útlaku národností rakousko-uherskou vládou a pozitivním vytyčením mezinárodní důležitosti československého státu [doc1]. Itálie měla také zájem na tom, aby uviděla triumf národního principu v nově vzniklém českém státě [doc2].",
        "reference":"Československý stát měl mezinárodní důležitost po stránce politické a hospodářské jako protiklad německo-maďarskému imperialismu. Itálie měla specifický zájem na vytvoření protiněmecké bariéry, kterou měly tvořit státy československý, polský a jihoslovanský, spolu s Itálií, aby Němci byli definitivně oddáleni od Jaderského moře, což bylo v souladu s heslem italských mazziniánů a nacionalistů o zničení Rakouska.",
        "faithfulness":1.0,
        "answer_relevancy":0.9224596635,
        "answer_correctness":0.6410461479,
        "context_precision":1.0,
        "context_recall":1.0,
        "context_sufficiency":1.0
    },
    {
        "user_input":"Jaký byl účel referenda organizovaného inženýrem Karlem Veselým a jaký vliv mělo na uznání československé legie italskou vládou a na širší politické hnutí ve prospěch utlačených národností Rakousko-Uherska?",
        "retrieved_contexts":[
            "lze považovati za vážný projev části italské veřejnosti v době, jež předcházela hnutí ve prospěch utlačených národností rakouskouherských a Štefánikovu vydobytí uznání československé legie italskou vládou. Odpověď pochází od 9 senátorů, 13 poslanců, 11 novinářů a 5 osob jiného povolání. Kromě jednoho, jednostranně informovaného, referendum italské z roku 1917 vyznívá zásadně příznivě pro utvoření jednotného státu československého.17) Rozebereme-li odpovědi blíže, vidíme, že všichni mají historické a politické důvody, Benešem uvedené, za plně dostatečné k uznání nezávislého státu československého. Někteří prostě odkazují na Benešovy argumenty (Ciccarone, Rosadi). Jiní rozvádějí důvody historické, vytýkajíce hrdinnou obranu českého národa proti germánství, jeho mučednictví, jeho vysokou vzdě-",
            "tostí.« Kongres znamenal v Italii porážku této politiky Sonninovy, jež tak ztěžovala naši italskou akci za války a zabraňovala utvoření naší legie a jež se příkře stavěla proti Jihoslovanům, takže způsobovala trvalý hluboký rozpor mezi Italy a Jihoslovany a byla také příčinou toho, že velká část jihoslovanských vojáků v rakousko-uherské armádě bojovala z přesvědčení proti Italům. Kongres, o němž se zprávy dostaly do Rakouska-Uherska, měl velký vliv na »vnitřní frontu rakousko-uherskou« na posílení odbojového hnutí revolučních národů v tomto státě, zvláště na náš vnitřní odboj v zemích českých a na Slovensku — a s druhé strany na posílení protirakouského stanoviska v zemích spojeneckých, na uznání těchto snah a později na uznání samostatných států pro revoluční národy rakousko-",
            "Boemia), jejíž ředitel (incaricato d’affari in Italia) inž. Karel Veselý rozeslal 15. června 1917 řadě italských osobností výtisk Benešovy knihy s těmito dvěma otázkami: 1. »Domníváte se, že dostatečné důvody historické a politické mluví pro to, aby Čechové ze starého království českého spojili se se svými bratry Slováky ze severních Uher a utvořili jediný stát československý?« 2. »Jaké výhody přinese Evropě v celku a Italii zvláště utvoření zvětšených a samostatných Čech ve středu Evropy? «15) Seznam osob, jimž tyto dotazy byly předloženy, není zachován úplný, ale lze řici, že obsahoval řadu osob z kruhů parlamentárních a novinářských. Odpovědí uchovaných v archivu Kanceláře Nár. rady českosl. je celkem 48.16) Z nich sedm osob odpovědělo pouze poděkováním za zaslanou knihu, aniž by se vyjádřilo o věci — byli to členové vlády (ministr války Giardino, ministr ozbrojení Dallolio a jeho státní tajemník Alfieri, ministr obchodu de Nava, ministr kolonií Colosimo), dále předseda zajatecké komise gen. Spingardi a florentský vojenský velitel Lenchantin. Předseda sněmovny Marcora se omluvil, že vzhle-",
            "Giuseppe Boselli, redaktor časopisu »La Provincia di Brescia«.  Jsa přesvědčeným stoupencem zásady, že státní řády musí se zakládati na národnostech, sympatisuji ovšem s každým hnutím, které sleduje takový účel. V daném případě směřuje takové hnutí k zmenšení Rakousko-Uherska, a již jen pro tuto skutečnost musí najíti příznivý ohlas v Italii. Tužby československé mají podkladem taková staletá utrpení, že není možno, aby nezískaly si sympatie každého, kdo vzpomene utlačovatele tohoto ubohého národa, utlačovatele našeho lidu. Nový stát tvořil by silnou hradbu na obranu východu proti výbojnosti německé. Pokud jde o Italii, jíž válka — jak musí být — přispěje k zajištění postavení, které jí příroda dala na Adrii, nelze jinak než očekávati veliký spád obchodu onoho nového státu k našim přístavům adriatickým a v důsledku toho",
            "z něho speciální výhody po stránce hospodářské a morální; 3. že tímto jasným a citlivým pochopením důležitosti české státní otázky se strany poslanců, senátorů a novinářů (z nichž většina nebyla ani osobnostmi první linie) jest historicky vysvětlitelné ono obdivuhodné hnutí sympatie k Čechoslovákům, jež se v Italii hromadně projevilo po Caporettu a zvláště roku 1918, nejprve u příležitosti sjezdu potlačených národností rakousko-uherských na Kapitolu a potom u příležitosti ustavení, formování a vojenského působení československé divise. Tím konečně lze si poněkud vysvětliti vůbec ideový podklad přátelství československo-italského, jež osvobozenská akce zahraniční za promyšleného vůdcovství Benešova a za energického spolupůsobení Štefánikova v Italii byla založila a jež odkázala mírové době k dalšímu soustavnému prohlubování a utužování."
        ],
        "response":"Inženýr Karel Veselý 15. června 1917 zaslal řadě italských osobností výtisk Benešovy knihy s dvěma otázkami týkajícími se možnosti spojení Čechů a Slováků v jediný stát a výhod, které by přineslo utvoření samostatných Čech ve středu Evropy [doc3]. Seznam osob, jimž byly dotazy předloženy, nebyl zachován úplný, ale obsahoval řadu osob z parlamentních a novinářských kruhů [doc3]. Z celkem 48 uchovaných odpovědí sedm osob odpovědělo pouze poděkováním [doc3].\n\nReferendum mělo zásadní vliv na politické hnutí ve prospěch utlačených národností Rakousko-Uherska a na uznání československé legie italskou vládou. Výsledky referenda, které bylo zásadně příznivé pro utvoření jednotného československého státu [doc1], přispěly k posílení odbojového hnutí revolučních národů v Rakousko-Uhersku a k posílení protirakouského stanoviska v zemích spojeneckých [doc2].  Zároveň toto hnutí vysvětlilo obdivuhodné sympatie k Čechoslovákům, které se v Italii projevily po bitvě u Caporetta a v roce 1918 [doc5].  Tato sympatie a podpora vedla k založení přátelství mezi Československem a Itálií, které bylo posíleno zahraniční osvobozenskou akcí vedenou Benešem a Štefánikem [doc5].",
        "reference":"Účel referenda organizovaného inženýrem Karlem Veselým byl získání většího zájmu politických osobností o přečtení knihy dr. Beneše, která byla rozesílána zároveň s dopisem obsahujícím dotazník. Referendum mělo vliv na uznání československé legie italskou vládou a na širší politické hnutí ve prospěch utlačených národností Rakousko-Uherska, neboť bylo považováno za vážný projev části italské veřejnosti v době, která předcházela těmto událostem.",
        "faithfulness":1.0,
        "answer_relevancy":0.8553013262,
        "answer_correctness":0.3789808813,
        "context_precision":0.95,
        "context_recall":1.0,
        "context_sufficiency":1.0
    },
    {
        "user_input":"Jaké důvody vedly k tomu, že církevní instituce investovaly své kapitály do půdy, a jaké výhody jim to přineslo v kontextu finančních katastrof a jejich touhy po moci a nezávislosti?",
        "retrieved_contexts":[
            "Římský amfitheater.  a proto hodnota půdy je po věky stabilní, takřka nezničitelná a bez nebezpečí pro majitele nynějšího právě tak jako pro jeho nástupce. Ti také lidé pravé zkušenosti a zdravé prozíravosti dobře vědí a své kapitálky i kapitály v půdě investují a jí se věrně přidržují. Zářivým příkladem jsou tu především instituce církevní, které nejen po jistém a výnosném uložení svých kapitálů, ale nesporně i po moci a neodvislosti touží. Právě ony přešinuly se vždy přes veškeré finanční katastrofy bez pohromy proto, že, jak statisticky dokázáno, mají většinu svých peněz uloženu v půdě,  z kteréhož důvodu mnohde i svoji moc (Španěly) ano i svoji existenci utvrzují. Cena pozemků jak v městech tak i na venku v posledním čase silně stoupla. Bohužel, že není toho příčinou probuzená láska",
            "vůbec ani nedošlo aneb aby potom co nejsnesitelnější aspoň byly. Tou příčinou svých círk. budov pojišťujeme. A sama vrch. círk. rada hledíc, aby co největších výhod se docílilo, svým časem k hromadnějšímu a jednolitějšímu pojišťování takovému vybídla. Připojili se tedy někteří k tomu či onomu ústavu. Ale bez urážky jejich a nehledě ani již k tomu, že sice jest vítán každý, kdo nám kde v čem z ochoty neb za jakési předplacení i v potřebách našich církevních vypomůže, budiž přece řečeno, že takové věci jen jako výminkou považovány býti mají a nikoli pravidelné naše opatření nevyzdvihují. Nebo jaká by to byla církev, aby své hospodářské záležitosti peněžním ústavům mimocírkevním neb nahodilé kdesi výhodě naprosto ponechávala, a lepšího zajištění nehledala? Jistě",
            "Dělnické listy socialistické přinesly nedávno zásadní názor své strany na otázku půdy, která po událostech v Rusku stala se akutní. Názor socialistů potírá vlastnictví půdy, tedy něco, od čeho existence zemědělství závisí. Půda, jak jsme již jednou řekli, není důl, dílna, nebo továrna — a nelze také sespolečenstevniti její výrobu s dobrým výsledkem. Jaké důvody socialisté pro zrušení vlastnictví půdy hledají, lze nejlépe posouditi z úvahy brněnské »Rovnosti«, v níž agitátor Filip Dobrovolný vypráví o zrušení vlastnictví půdy. S úvahou nehodláme polemisovat, neboť důvody samy ukazují, že názor takový je nešťastný, snad dobře agitační, ale pro národní existenci nešťastný. Praví se v úvaze agitátora následující: Válka odhalila i nejnechápavějším lidem nebezpečí, jaké",
            "vždy vynášela méně než kapitál — i v době roboty a poddanských platů a dávek z rustikálu. Dnes však, v době průmyslové a intensivního podnikání, je vláda okamžitě pohotových peněz; odtud také výnosnost a rozvoj směnečného obchodu, úvěru a peněžních ústavů. Právě ten rostoucí význam kapitálu vedl též od soustavy naturální (deputátní) ku mzdě v penězích. Každý zdárně vedený velkostatek má státi v náležitém poměru vlastních finančních prostředků — na př. 30% kapitálu vlastního, který má míti k disposici. A přílišný majetek půdy předpokládá tím větší kapitál. Neboť úvěr je věcí drahou. Vynese ta půda čistých 5%? Nikoli. A ten vlastní hotový peníz pravidelně nebyl ve chvíli potřeby. Musilo se sáhnouti k úvěru. Aby však rod nebyl dluhy zničen a nepřišel o majetek, udělána závěra pojišťovací: fideikomis, ohromný balvan, který překážel na cestě všemu okolí. Ještě horší to bylo tam, kde se na velkostatku hospodařilo ve vlastní režii. Zde měli hlavní vinu centrální úředníci (ústřední ředitelové a účetní), ukazujíce s pathosem na svou t. zv. oddanost",
            "rádo přidá. To platí ovšem o veškerých statcích v obchodu se nalézajících, jak nemovitých, tak i movitých. Každodenní zkušenost nás učí, že ku př. kapitalisté při nemovitostech spokojují se s rentou nižší, než při cenných papírech. Čím pak větší při těchto jistota renty, tím skrovnější tato bývá a naopak. Ústavy úvěrní při poskytování úvěru reálného s úrokem menším se spokojují než při poskytování úvěru osobního; toto zdražení úvěru osobního tvoří relutum za vyšší risiko. Z toho vyvinula se známá zásada, že míra úroková v obráceném poměru k jistotě kapitálu stojí a klesá.**) Větší jistota důchodu pozemkového vyváží újmu 1 i 2%, tak že kapitálisté pozemky, vzdor poměrně skrovnějšímu důchodu, k uložení svých přebytků vyhledávají a jim často přednost dávají před zdánlivě vděčnějšími investicemi.***)"
        ],
        "response":"Církevní instituce investovaly své kapitály do půdy, protože statisticky se ukázalo, že půda je stabilní a odolná vůči finančním katastrofám [doc1]. Díky tomu si udržely svou moc a nezávislost [doc1]. Půda jim poskytovala jistý a výnosný příjem [doc1]. Z tohoto důvodu si utvrzovaly svou existenci a moc, například Španělé [doc1].",
        "reference":"Církevní instituce investovaly své kapitály do půdy, protože půda je považována za stabilní, nezničitelnou a bezpečnou investici, která chrání majetek jak pro současné majitele, tak pro jejich nástupce. Tato investice jim přinesla výhody v podobě ochrany před finančními katastrofami, protože většina jejich peněz byla uložena v půdě, což jim umožnilo udržet si moc a nezávislost.",
        "faithfulness":1.0,
        "answer_relevancy":0.852554246,
        "answer_correctness":0.6172736474,
        "context_precision":0.8875,
        "context_recall":1.0,
        "context_sufficiency":1.0
    },
    {
        "user_input":"Jaké byly důvody a možné důsledky odporu knížete Bedřicha Schwarzenberga a Řiditelstva Ústřední společnosti hospodářské proti zamýšlené stavbě vodních drah, a jak tento odpor ovlivnil náladu a plány průmyslových kapitalistů?",
        "retrieved_contexts":[
            "— je jisto, že původní rozpočty budou jako obyčejně značně překročeny — se nechá velice mnoho vydělat. Sumy ty velice zúrodní vypráhlé lány průmyslu. Ale nad radostnou náladou pánů kapitalistů stahují se černé mraky. Vedle kapitalistů průmyslových máme ještě jiné kapitalisty. A tito jsou mnohem mocnější, než ti různí komínoví baroni. Jsou to naši počestní velkostatkáři. První blesk již vyslali. Byl to sice prozatím jen blesk papírový, ale je na něm podepsán kníže Schwarzenberg a proto bude míti dalekosáhlé účinky. Dost možná, že ochromení celé akce. Řiditelstvo Ústřední společnosti hospodářské, jejímž předsedou je kníže Bedřich Schwarzenberg rozeslalo hospodářským spolkům provolání, v němž se rozhodně staví proti zamýšlené stavbě vodních drah. Nečiní",
            "dářské, jejímž předsedou je kníže Bedřich Schwarzenberg rozeslalo hospodářským spolkům provolání, v němž se rozhodně staví proti zamýšlené stavbě vodních drah. Nečiní to arciť přímo, ale to na věci nic nemění V provolání se praví: „Ačkoli nutno návrh zákona na zřízení průplavů pokládati za prospěšný veškeré výrobě a tržbě, má Ústřední společnost hospodářská za to, že nelze odlučovati stavbu těchto kanálů vůbec od celkové úpravy našeho vodního hospodářství a že projektované průplavy nabyly by pravého významu pro domácí výrobu a tržbu teprve po předcházející soustavně provedené úpravě řek a toků a řádném provedení všech úkolů a potřeb melioračních.“ A že úkol tento nebude snadným, to se přiznává v provolání bez obalu: „Organisace  LIDU Redakce a administrace nalézá se",
            "Tomáši Štěpánkovi z Nezamyslic. — Schůze konány budou na Kanovsku, v Kokorách a v Kojetíně. Z Ústřední společnosti hospodářské. Řiditelstvo Ústřední společnosti hospodářské konalo schůzi svou za předsednictví J. J. dra Bedřicha knížete Schwarzenberga dne 18. ledna t. r., řiditelstva podán byl sněmu pamětní spis o krisi zemědělské se žádostí, aby sněm uvážil příčiny tísně zemědělské, vyšetřil poměry a potřeby obyvatelstva zemědělského a připravil podrobný hospodářský program pro nastávající šestileté období činnosti sněmovní. Současně rozeslán byl pamětní spis všem hosp. spolkům s vyzváním, aby se k němu připojily. Ku sjezdu rolnickému v Pardubicích delegováni byli jako zástupci společnosti pánové J Markalous, statkář v Třebosicích a F. Udržal, starosta v Dol. Rovni. C. k. finančnímu mini-",
            "z prací a agitačních statí dr. Russa a jiných. Varovného hlasu v té příčině pozdvihla (14. dubna) v Praze Ústřední hospodářská společnost, kde kníže Bedřich Schwarzenberg hájil prospěchů zemských v ten rozum, aby především zamezeny byly škody, které rozvodňováním přítoků Vltavy a Labe každého roku zemědělství se způsobují, a pak teprve aby se přikročilo k zřizování velkých průplavů. Ohromný kapitál má býti vložen do průplavů těch, a není dnes jisto, zda by nesloužily jen prospěchům kapitalistickým, neotevřely příchod cizozemské výrobě a nezaplavovaly naše země hospodářskými plodinami z Uher a zemí Balkánských. Napřed regulování řek a meliorace, potom průplavy, v tom smyslu přijata byla jednomyslně resoluce. Z důvodů, aby přítomnost něčeho získala, ujednalo české poselstvo na říšské radě trojí junctim s vládou, jak z projevu dr. Pa-",
            "Z Ústřední společnosti hospodářské pro král. České. Řiditelstvo Ústřední společnosti hospodářské konalo schůzi svou dne 17. března za předsednictví JUDra Bedřicha knížete Schwarzenberga a u přítomnosti 23 členů. Předseda zahájiv schůzi, vyslovil politování své nad různými zprávami o pokusech s ječmeny, kterými se jakost ječmene i pokusů v Čechách podnikaných z jisté strany zlehčuje, jakož i záslužná působnost zem. insp. Dra Sitenského tendenčně posuzuje. Společnost je povinna ohraditi se proti tendenčnímu tvrzení, jako by kvalita ječmene se zhoršila a to na základě výzkumů a výsledků pokusů přesně vědecky vykonaných. S vývody předsedovými vyslovují plný souhlas pp. R. Jahn a St. Kubr, kteří odmítají neodůvodněné útoky, kterými se pracuje cizině do rukou a zároveň ostře kritisují lehkovážné jednání, kterým"
        ],
        "response":"Kníže Bedřich Schwarzenberg a Řiditelstvo Ústřední společnosti hospodářské se stavěli proti zamýšlené stavbě vodních drah z obav o škody, které by rozvodňováním přítoků Vltavy a Labe mohly vznikat zemědělství [doc4]. Obávali se také, že by průplavy sloužily pouze prospěchu kapitalistů, otevřely by cestu cizozemské výrobě a zaplavily by české země hospodářskými plodinami z Uher a zemí Balkánských [doc4].\n\nŘiditelstvo Ústřední společnosti hospodářské se rozhodlo, že je třeba nejprve regulovat řeky a provést meliorace, a teprve poté přikročit ke stavbě průplavů [doc4].\n\nTento odpor ovlivnil náladu a plány průmyslových kapitalistů, protože se zdálo, že akce je v ohrožení [doc1].",
        "reference":"Důvody odporu knížete Bedřicha Schwarzenberga a Řiditelstva Ústřední společnosti hospodářské proti zamýšlené stavbě vodních drah spočívaly v jejich postavení jako mocnějších kapitalistů, kteří se stavěli proti průmyslovým kapitalistům, a tento odpor mohl mít dalekosáhlé účinky včetně možného ochromení celé akce, což ovlivnilo náladu průmyslových kapitalistů tím, že nad jejich radostnou náladou se stahovaly černé mraky.",
        "faithfulness":0.7777777778,
        "answer_relevancy":0.9251462071,
        "answer_correctness":0.4213320682,
        "context_precision":0.9166666666,
        "context_recall":1.0,
        "context_sufficiency":1.0
    },
    {
        "user_input":"Jaké byly důvody a možné důsledky nesouhlasu Ústřední společnosti hospodářské, vedené knížetem Bedřichem Schwarzenbergem, se zamýšlenou stavbou vodních drah, a jak se tento postoj mohl projevit na politické situaci a plánech vlády Körbrovy?",
        "retrieved_contexts":[
            "zení tohoto spolku bylo odročeno, jednoty hospodářské ale aby znovu tázány byly, přejí-li si ještě zařízení ústřední jednoty čili nic. Hrabě Jan Harrach má za to, že by ústřední spolek vedle zemědělské rady dobře působiti mohl a že by delegáti jeho v zemědělské radě byli vydatnými obranci zemědělství českého. Spolek ústřední ale potřebujeme. Znovuzřízení rozpuštěné vlastenecko-hospodářské společnosti nepovažuji za nemožné, jak je byli mnozí řečníci líčili a proto odmítám se vší rozhodností výtky p. Polakovy, „jakoby bylo nerozumem a hříchem“ žádati zároveň za vzkříšení téže společnosti a za rozšíření zemědělské rady. Nejsem tak na hlavu padlý, abych nedovedl posouditi, co jest možné a co jest nemožné. Jsem spokojen, přijmete-li návrhy komise, avšak považte, že jsme si dříve",
            "dářské, jejímž předsedou je kníže Bedřich Schwarzenberg rozeslalo hospodářským spolkům provolání, v němž se rozhodně staví proti zamýšlené stavbě vodních drah. Nečiní to arciť přímo, ale to na věci nic nemění V provolání se praví: „Ačkoli nutno návrh zákona na zřízení průplavů pokládati za prospěšný veškeré výrobě a tržbě, má Ústřední společnost hospodářská za to, že nelze odlučovati stavbu těchto kanálů vůbec od celkové úpravy našeho vodního hospodářství a že projektované průplavy nabyly by pravého významu pro domácí výrobu a tržbu teprve po předcházející soustavně provedené úpravě řek a toků a řádném provedení všech úkolů a potřeb melioračních.“ A že úkol tento nebude snadným, to se přiznává v provolání bez obalu: „Organisace  LIDU Redakce a administrace nalézá se",
            "z prací a agitačních statí dr. Russa a jiných. Varovného hlasu v té příčině pozdvihla (14. dubna) v Praze Ústřední hospodářská společnost, kde kníže Bedřich Schwarzenberg hájil prospěchů zemských v ten rozum, aby především zamezeny byly škody, které rozvodňováním přítoků Vltavy a Labe každého roku zemědělství se způsobují, a pak teprve aby se přikročilo k zřizování velkých průplavů. Ohromný kapitál má býti vložen do průplavů těch, a není dnes jisto, zda by nesloužily jen prospěchům kapitalistickým, neotevřely příchod cizozemské výrobě a nezaplavovaly naše země hospodářskými plodinami z Uher a zemí Balkánských. Napřed regulování řek a meliorace, potom průplavy, v tom smyslu přijata byla jednomyslně resoluce. Z důvodů, aby přítomnost něčeho získala, ujednalo české poselstvo na říšské radě trojí junctim s vládou, jak z projevu dr. Pa-",
            "se SSSR se soustřeďoval do užší skupiny převážně strojírenských firem. Část z nich projevovala v této době zájem o kontakt se sovětským trhem převážně kvůli zachování kontinuity.35) Roztržky a komplikace, k nimž docházelo mezi SSSR a ostatními zeměmi v oblasti politické a zvláště v oblasti hospodářské, byly národně demokratickým tiskem interpretovány jako důkaz o tom, že obchodní styky se SSSR jsou riskantní záležitostí. Politika bank v čele s Národní bankou přistupovala k obchodu s SSSR z tohoto hlediska.  Postoj čs. bank k obchodu se SSSR byl krajně odmítavý. Banky se řídily politikou západoevropského finančního světa, který prováděl úvěrovou blokádu SSSR. Důvody čs. bank pro tento postoj nespočívaly ve ztrátách, které by jim způsobily sovětské znárodňovací dekrety anebo",
            "spojoval by Dunaj s Odrou a s německou sítí průplavní. Průplavy mají ovšem svou hospodářskou důležitost, avšak nelze při podnicích tak rozsáhlých pouštěti s očí i nepříznivé následky, které by mohly v politickém, národním i hospodářském ohledu míti pro Čechy. Sloužiti mají hlavně průmyslu, a pro nás jest životní otázkou, aby nesloužily průmyslu jen německému, silnějšímu a rozvětvenějšímu než český, a aby německé továrny od jihu a severu zlevněním dopravy tím více neutlačovaly naši českou výrobu. Neméně jest důležito, aby Praha stala se středem a nebyla snad dokonce obcházena změnou prvního průplavu v průplav Dunajsko-Labský, dříve obmýšlený. Ministerstvo Körbrovo sotva již bude při vládě, až průplavní stavby počnou. Ostatně jsou průplavy ty požadavek i význačně německý, jak vysvítá"
        ],
        "response":"Ústřední společnost hospodářská, vedená knížetem Bedřichem Schwarzenbergem, se stavěla proti zamýšlené stavbě vodních drah z několika důvodů [doc2, doc3]. Především se obávala, že stavba kanálů by měla negativní dopady na zemědělství, konkrétně že by rozvodňováním přítoků Vltavy a Labe docházelo ke škodám [doc3]. Dále se obávala, že by takové projekty mohly sloužit především kapitalistickým zájmům, otevírat trh cizozemské výrobě a zaplavovat české země levnými hospodářskými plodinami z Uher a zemí Balkánských [doc3]. Společnost prosazovala, aby se nejprve zaměřilo na regulaci řek a meliorace, a teprve poté na stavbu průplavů [doc3].\n\nKníže Schwarzenberg hájil prospěchů zemských a zdůrazňoval, že je třeba zabránit škodám zemědělství [doc3]. Společnost se obávala, že průplavy by mohly sloužit především německému průmyslu, který je silnější a rozvětvenější než český, a tím utlačovat českou výrobu [doc5]. Dále se obávala, že by Praha mohla být obcházena změnou prvního průplavu v průplav Dunajsko-Labský [doc5].\n\nTento postoj Ústřední společnosti hospodářské se projevil na politické situaci a plánech vlády Körbrovy tím, že ovlivňoval debatu o vodních cestách a stavbě průplavů [doc3, doc5]. Společnost prosazovala opatrný přístup a zdůrazňovala potenciální negativní dopady na české zemědělství a průmysl, což vedlo k opatrnějšímu přístupu vlády Körbrovy k těmto projektům [doc5]. Ministerstvo Körbrovo se sotva již bude při vládě, až průplavní stavby počnou [doc5].",
        "reference":"Ústřední společnost hospodářská, vedená knížetem Bedřichem Schwarzenbergem, nesouhlasila se zamýšlenou stavbou vodních drah, protože se domnívala, že tyto kanály by měly pravý význam pro domácí výrobu a tržbu až po předcházející soustavně provedené úpravě řek a toků a řádném provedení všech úkolů a potřeb melioračních. Tento postoj mohl ochromit celou akci a mít dalekosáhlé účinky na politickou situaci a plány vlády Körbrovy, která čelila národním štvanicím a slíbila kapitalismu velkou kořist.",
        "faithfulness":1.0,
        "answer_relevancy":0.8829464347,
        "answer_correctness":0.4440226252,
        "context_precision":0.95,
        "context_recall":0.5,
        "context_sufficiency":1.0
    },
    {
        "user_input":"Jaké byly důsledky nevhodné úpravy nabývání práva domovského zavedené říšským zákonem z 10. prosince 1863 na chudé venkovské obce a jaké problémy to způsobilo pro obyvatelstvo pocházející z cizích obcí?",
        "retrieved_contexts":[
            "ských způsobené nevhodnou úpravou nabývání práva domovského, jež zavedeno bylo říšským zákonem ze dne 10. prosince 1863. Zákonem tím poškozeny byly namnoze chudé obce venkovské na prospěch zámožných a rostoucích měst a míst průmysloobyvatelům svým, pocházejícím z obcí cizích; tito bývají pak následkem toho nuceni v době nedělnosti a nedostatku hledati pomoci u své obce domovské, které ničím neprospěli, jsouce tam pravidelně úplně neznámi. Nový zákon dle názoru zemského výboru neodstraní tyto nedostatky úplně, neboť nepřetržitý pobyt 10 let je příliš dlouhý pro pohyblivé třídy obyvatelstva, jež následkem nynějších poměrů kospodářských a sociálních jsou nuceny zdržovati se mimo obec domovskou. Další vada nynějšího chudinství veřejdinských obcím dosud ponechaných přesahují síly a možnosti jednotlivých obcí domovských, které i při nejlepší vůlí nejsou s to, aby úkoly ty řádně a úspěšně obstarávaly. K úkolům těm náleží zejména zaopatřování osob chorých, dále ošetřování a výchova slabomyslných, slepých a hlucho-",
            "podal nyní sněmu zprávu, v níž zevrubně probírá otázku chudinskou a naznačuje cesty k jejímu rozřešení. Především poukazuje zem. výbor k nestejnoměrnému rozdělení břemen chudinských způsobené nevhodnou úpravou nabývání práva domovského, jež zavedeno bylo říšským zákonem ze dne 10. prosince 1863. Zákonem tím poškozeny byly namnoze chudé obce venkovské na prospěch zámožných a rostoucích měst a míst průmyslových, jež odpírala udělení práva domovského obyvatelům svým, pocházejícím z obcí cizích; tito bývají pak následkem toho nuceni v době nedělnosti a nedostatku hledati pomoci u své obce domovské, které ničím neprospěli, jsouce tam pravidelně úplně neznámi. Nový zákon dle názoru zemského výboru neodstraní tyto nedostatky úplně, neboť nepřetržitý pobyt 10 let je příliš",
            "na dnešní debatu oni, kdož při zdělávání zákona domovského z 5. pros. 1863 č. 105 poukazovali k těm nesrovnalostem, jež vzniknou v obcích vynecháním titulu vydržecího. Jejich proroctví se úplně splnilo. Dne 9. a 10. října 1863 vedena v této sněmovně větší debata o nabývání domovského práva delším trvalým pobytem. Kdežto poslanci Poche, Protobevera a Tinti žádali, aby delší pobyt v obci dával právo žádati za udělení domovského práva, žádal posl. dr. Rechbauer, aby delším pobytem v obci ipso facto se právo domovské nabývalo. Tehdejší referent dr. Berger ale rozhodně se opíral, aby důvod vydržení domovského práva přijat byl do nového zákona, »poněvadž v tom shledával průlom konsekvence obecní autonomie«. Při tomto theoretickém hájení autonomie obcí — pravím theoretickém, neb prakticky se to neprovádělo, se úplně zapomínalo, kam tato theoretická zásada povede. Kam vedla vidět z toho, že nechybělo mnoho, že naše obce za nedlouho už by byli tvořili jen cizinci. Vždyť vidíme, jak ohromným poměrem vzrůstalo procento cizích v obci, když",
            "Při tom nebylo lze nabyti přímo domovského práva v obci jinak než usnesením obecního výboru, z něhož nebylo žádného odvolání, a tak dělo se, že zůstala veliká většina těch, kteří opustili svou domovskou obec, na dále jejími příslušníky, a že, jelikož obec domovská povinna jest opatřovati svého domovce, kdyby schudl, padali na obtíž obci domovské, třeba že se jí byli odcizili svým dlouhým pobytem mimo ni a byli hospodářsky působili v jiné obci na její vzrůst a hospodářský rozkvět. Proto bylo třeba usnadniti přímé nabývání domovského práva tak, aby byla zjednána rovnováha mezi účinky nových poměrů a touto povinností obcí domovských, a musilo se odpoutati nabývání domovského práva od usnesení obecního výboru, z něhož nebylo žádného odvolání. Zákonem ze dne 5. prosince 1896 má se tohoto účelu dosíci.",
            "podle něhož toto právo na nerušený pobyt a v případě potřeby na sociální zabezpečení v určité obci vznikalo narozením v obci, provdáním se nebo přiženěním, přijetím do domovského svazku nebo získáním veřejného úřadu. Udělení domovského práva se stalo výhradním právem obce. Zákon o obcích z roku 1862 a o rok později zákon o domovském právu oddělil právo na pobyt v obci od domovského práva především pro usnadnění volného pohybu obyvatelstva, protože z pouhého usazení se v místě nevznikaly pro obec závazky vůči přistěhovalci. Ovšem přenesením veškeré chudinské péče o přestárlé a nemocné na obce se vytvořily předpoklady odporu obecních správ vůči neomezenému udělování domovského práva. Výsledkem bylo, že roku 1900 mělo v Rakousku domovské právo v obci pobytu jen 60 % obyvatelstva. V polovině de-"
        ],
        "response":"Zákon ze dne 10. prosince 1863 způsobil, že chudé venkovské obce byly poškozeny na úkor zámožných měst a průmyslových míst. Obyvatelé pocházející z cizích obcí byli následkem toho nuceni v době nedostatku hledat pomoc u obce domovské, kde byli často neznámí [doc1, doc2]. \n\nZákon také vedl k tomu, že obce byly přetíženy chudinskými povinnostmi, které přesahovaly jejich možnosti [doc1].  Obce byly povinny opatřovat domovce, i když se odcizili dlouhým pobytem mimo ni a hospodářsky přispívali do jiných obcí [doc4].\n\nDále, podle názoru zemského výboru, nový zákon neodstranil tyto nedostatky úplně, protože desetiletý nepřetržitý pobyt je příliš dlouhý pro obyvatelstvo, které se kvůli ekonomickým a sociálním poměrům musí zdržovat mimo obec domovskou [doc1, doc2].",
        "reference":"Nevhodná úprava nabývání práva domovského zavedená říšským zákonem z 10. prosince 1863 poškozovala chudé venkovské obce na prospěch zámožných a rostoucích měst a míst průmyslových, protože obyvatelé pocházející z cizích obcí byli nuceni v době nedělnosti a nedostatku hledat pomoc u své obce domovské, kde byli pravidelně úplně neznámí a ničím neprospěli.",
        "faithfulness":1.0,
        "answer_relevancy":0.9304554415,
        "answer_correctness":0.9872869689,
        "context_precision":1.0,
        "context_recall":1.0,
        "context_sufficiency":1.0
    },
    {
        "user_input":"Jaké byly hlavní argumenty Dr. Pelce a Křístka z Lazů pro zřízení lycea a jak se tyto argumenty vztahují k hospodářským a vzdělávacím potřebám komunity?",
        "retrieved_contexts":[
            "zřízení ještě zkazilo. Není pravdou, že lyceem utrpí MOL. A je smělým tvrzením, že ústav tento je věcí bezcennou. Debaty o lycejní otázce súčastnili se ještě uč. J. Nohel, naduč. Suchánek, prof. Václavek. Ještě ke konci přimlouvá se Dr. Pelc u valné hromady za hlasování pro zřízení lycea tímto objasněním: Orlovský odbor MOL. podává protest proti lyceu a tím vytýká nepřímo jakoby nehospodárnost ústředí MOL. Sděluje se však, že když Orlová žádala za podporu své hospodyňské školy u ústředí MOL, tu nebrala ohled, že příjmy Matice budou tím zkráceny. Proto myslí, že dobře rozmyšlené stanovisko ústřed. výborn MOL. třeba respektovat a hlasovat pro lyceum. Také Křístek z Lazů přimlouvá se za zřízení lycea. Při hlasování je 38 hlasů pro lyceum, 9 proti a 11 nehlasovalo.",
            "slovy líčí potřebu doplniti školství dívčí a poukazuje, že mnoho českých dívek odchází do ciziny nebo do německých a klerikálních ústavů soukromých. Praha má jen tři střední ústavy dívčí a ty jsou přeplněny. Zřízením lyceí ulehčí se měšťanským školím i vyšší dívčí škole. Vřelou přímluvou na zřízení lyceí a nadšenou výzvou k přítomným zástupcům obcí končí paní referentka za obecné pochvaly svoji zprávu. Pan řed. Hansl, jako referent spolku profesorského podává vysvětlení, kterak možno luštici otázku zřízení lyceí po stránce finanční. Poukazuje na obecnou hospodářskou tíseň, ale vyslovuje naději, že Praha s předměstími zajisté učiní pro divčí vzdělání talik, co mohli učiniti našinci v Budějovicích a v Brně. Pan ředitel podal podrobný rozpočet veškerých nákladů, z něhož vychází na jevo, že nejen",
            "slovy líčí potřebu doplniti školství dívčí a poukazuje, že mnoho českých dívek odchází do ciziny nebo do německých a klerikálních ústavů soukromých. Praha má jen tři střední ústavy dívčí a ty jsou přeplněny. Zřízením lyceí ulehčí se měšťanským školím i vyšší dívčí škole. Vřelou přímluvou na zřízení lyceí a nadšenou výzvou k přítomným zástupcům obcí končí paní referentka za obecné pochvaly svoji zprávu. Pan řed. Hansl, jako referent spolku profesorského podává vysvětlení, kterak možno luštici otázku zřízení lyceí po stránce finanční. Poukazuje na obecnou hospodářskou tíseň, ale vyslovuje naději, že Praha s předměstími zajisté učiní pro divčí vzdělání talik, co mohli učiniti našinci v Budějovicích a v Brně. Pan ředitel podal podrobný rozpočet veškerých nákladů, z něhož vychází na jevo, že nejen",
            "Nordmarka 25.000 členů, musí jich míti MaKol Ostravice se budují německé bašty Frýdek, Leskovec, Ratimov, Kunčice, Hrabůvka. Svorně proti nepřátelům a ku společné práci všichni! Pan nadučitel Horák oznamuje, že účty revisí shledány v nejlepším pořádku. K pokladní zprávě mluví ještě tajemník sbírky, slavnosti, budou prodávány dlužni úpisy, bloky na cihly, zápalky, krém, péra, papír a jiné.  Volné návrhy. Ředitel chlap. měšťanky orlovské Klvaňa jménem odboru orlovského protestuje proti zřízení dívčího lycea v Polské Ostravě jakožto škole luxusní. Protest podporuje odborný učitel J. Mikš. Návrh za zřízení školy podávají: prof. Václavek, tajemník Břeský, Dr. Zikmund a pí. Zikmundová. Předsednictví předává Dr. Pelc Křístkovi z Lazů a referuje o záležitosti lycea",
            "„občansko-hospodářské besedy“ v Sulislavi společně se zástupci českých obcí v okresu stříbrském za vydání zákona, aby do škol přijímány byly jenom děti znalé jazyka vyučovacího. — Posl. Teklý petici zastupitelstva obce v Košticích a Vel. Vunice v téže záležitosti. — Posl. Weidenhoffer peticí místního odboru „Ústřední matice školské“ pro Německý Brod a okolí, posl. hr. Kaunic petici obce Poličany, Sedlice a Záborov, Lanžova v téže záležitosti. — Posl. J. Pleva petici učitelské jednoty „Budeč“ v Německém Brodě a posl. dr. Jansa petici „Budeč“ v Jičíně v téže záležitosti. — Posl. Morávek petici místní školní rady a učit. sboru měšť. školy chlapecké v Přelouči, aby do škol obchodních, do hospod. akademií, do vyšších škol průmyslových a p. měli přístup žáci, již s dobrým prospěchem odbyli"
        ],
        "response":"Dr. Pelc u valné hromady přimlouval se za zřízení lycea tím, že Orlovský odbor MOL protestoval proti lyceu a vytýkal tím nepřímo jakousi nehospodárnost ústředí MOL [doc1]. Křístek z Lazů se také přimlouval za zřízení lycea [doc1].\n\nZ dokumentu [doc2] a [doc3] vyplývá, že zřízení lycea mělo ulehčit přeplněným dívčím školám v Praze a umožnit českým dívkám vzdělání, které by jinak musely navštěvovat školy v cizině nebo v německých a klerikálních ústavech [doc2, doc3]. Pan ředitel Hansl poukázal na obecnou hospodářskou tíseň, ale vyjádřil naději, že Praha s předměstími učiní pro dívčí vzdělání tolik, co učinili našinci v Budějovicích a v Brně [doc2, doc3].",
        "reference":"Dr. Pelc argumentoval pro zřízení lycea tím, že Orlovský odbor MOL protestuje proti lyceu a tím nepřímo naznačuje nehospodárnost ústředí MOL, avšak když Orlová žádala o podporu pro svou hospodyňskou školu, nebrala ohled na to, že příjmy Matice budou zkráceny, což naznačuje, že dobře rozmyšlené stanovisko ústředí MOL by mělo být respektováno a hlasováno pro lyceum. Křístek z Lazů se také přimlouval za zřízení lycea. Tyto argumenty se vztahují k hospodářským a vzdělávacím potřebám komunity tím, že zdůrazňují nutnost respektovat rozhodnutí ústředí MOL a podporovat vzdělávací instituce, které mohou přispět k povznesení a zlepšení postavení komunity, a to i přes omezené finanční prostředky.",
        "faithfulness":1.0,
        "answer_relevancy":0.8399803632,
        "answer_correctness":0.4504954756,
        "context_precision":1.0,
        "context_recall":1.0,
        "context_sufficiency":1.0
    },
    {
        "user_input":"Jaké jsou důsledky nedostatku náboženského vychování na společnost v kontextu kritiky liberalismu a jak se tento nedostatek projevuje v politické a kulturní sféře Korutan?",
        "retrieved_contexts":[
            "apokalyptický ráz. V prvním kroku argumentace pod nadpisem „Apokalyptická konfesionálnost“ vysvětluji toto pojetí a poukazuji na českou specifiku a české podmínky, které úzce souvisí s významem roků 1632 a 1994. V druhém kroku pod nadpisem „Tradice mimo tradici“ mi jde o paradoxální status tradice v kontextu náboženského vyznání a o to, jak určití čeští katoličtí spisovatelé ztělesňují tento paradoxální status.  „Konfesionálností“, která byla chybně uvedena jako „konfesiálnost“ v programu kongresu, rozumím určitý ráz křesťanského náboženského vyznání, resp., situaci křesťanského náboženského vyznání v určité společnosti v určitém období. Pokud předpokládám, že konfesionálnost má jako dříve mimořádně silný vliv na společnost a její znakové jednání (dnes možná dokonce silněji než dříve, a sice na základě faktu, že si sekularizovaná společnost neuvědomuje - přesněji: nerada uvědomuje - konfesionální prameny vlastních názorů a jednání), považuji tento problém a tuto kategorii za literárněvědně a kulturovědně relevantní.",
            "Byli lapeni právě v tom okamžiku, když chtěli zapáliti v Celovci divadlo, dopustili se tedy zločinu druhého. Nejsou takovéto zjevy hrozné? Co se z tohoto pokolení stane? Liberální listy, které každou špatnosť snaží se opisovati krásnějšími slovy, budou mluviti opět o „psychologických hádankách“. Není to však ničím jiným, nežli úplným zdivočením následkem nedostatku náboženského vychování. Korutany trpí zlem a mohly by zajíti ním, nepřijde-li pomoc v čas a tímto zlem jest liberalismus, kterýž jest u nás lžiliberalismem. Pod slovem „liberalismus“ nelze zde mysliti si onoho šlechetného zápalu po samostatnosti a svobodě, kterýž zdobí každého muže, nýbrž onen liberalismus, kterýž záleží v úplné náboženské lhostejnosti anebo úplné bezvěře. Liberálové takovíto říkají: „Čím méně vyučuje se ná-",
            "které byly pronášeny na konferenci, dy a že během krátké doby oznámíme veřejnosti, jaké úspěchy dociluje naše tak divně kontrastovaly se skutečkrajové stavebnictví za použití noností. Ukázalo se totiž, že i vedoucí potřebují nutně politické vyspělosti. vých forem a nových způsobů práce. aby s úspěchem mohli zastávat své funkce a vedoucí úlohu. * A ještě několik slov ke krajskému aktivu stavebních pracovníků. V diskusi se ukázala velmi příznivá skutečnost, že náš Liberecký kraj není na tom tak zle v nedostatku pracovních sil ve stavebnictví. Přirozeně, že určitý nedostatek se projevuje, ale ten jde vlastními silami odstranit. Potvrdilo se, že kdyby byly účelněji rozestavěny pracovní síly na staveništích, kdyby se již konečně, jako v průmyslových závodech, rozvinulo soutěžení a vytvořilo hnutí úderníků",
            "u obou pohlaví stejné. Podobně nedostatek B. a D vitaminů ohrožuje více muže, než ženy. Jen C vitamin nemá zvláštní afinity k žádnému pohlaví. Než relativně větší odolnost žen v době pohlavní zralosti uplatňuje se pouze mimo těhotenství. V těhotenství je naopak zvýšena vnímavost vůči každému nedostatku vitaminu, jež se stupňuje s pokračujícím růstem plodu. V tomto krátkém sdělení nemohu zacházeti na otázku, jak se projevuje v pokuse vliv stravy prosté vitaminů na genitální aparát. Uvedu proto jen krátce zjištěná fakta. Nedostatek A vitaminu brání tvorbě Graavských folikulů, dozrávající vajíčka zacházejí. Trvá-li tento stav dlouho, ovarium atrofuje a vymizí hormonální produkce. V důsledku toho vykazují orgány, stojící pod růstovým vlivem sexuálních hormonů, vyslove-",
            "zemí a národů rodí se nejvíce z dobré a rozumné správy politické domácí, závisí od šťastné politiky zahraničné a upadá v té míře, v jaké nerozumně, násilně a nepřiměřeně sobě počíná vláda doma, slabě a neobratně za hranicemi. Mimo to ovšem jiné ještě faktory působí na hmotný vývin neb úpadek národův. Na jiném místě povíme co považujeme za příčinu nynějšího všeobecného úpadku u nás. Úpadek tento jeví se nejvíce, jak jsme již dříve v jiném článku pověděli — v nedostatku kapitálů, ve všeobecné nouzi o peníze hotové. Řemesla a hospodářství polní hynou tímto nedostatkem, vyšší průmysl zmenšuje svou výrobu a obchod nachází se v tísni, která každý den hrozí jemu úplným úpadkem. Nynější ten nedostatek peněz v Rakousku povstal nejen z nepříznivého a nejednou chybného hospodář-"
        ],
        "response":"V kontextu kritiky liberalismu je nedostatek náboženského vychování vnímán jako příčina zdivočelosti a úpadku společnosti. V Korutanech se tento nedostatek projevuje v podobě zločinů, jako je pokus o zapálení divadla v Celovci [doc2]. Kritici liberalismu vnímali tento jev jako důsledek náboženské lhostejnosti nebo bezvěří, které je charakteristické pro určitý druh liberalismu [doc2]. Tento druh liberalismu je odlišován od \"šlechetného zápalu po samostatnosti a svobodě\" a je vnímán jako škodlivý pro společnost [doc2].",
        "reference":"Nedostatek náboženského vychování vede k úplnému zdivočení a je považován za příčinu zločinů, jako je pokus o zapálení divadla v Celovci. Tento nedostatek se projevuje v politické a kulturní sféře Korutan jako liberalismus, který je charakterizován náboženskou lhostejností nebo bezvěrectvím, což je považováno za hrozbu pro společnost a stát.",
        "faithfulness":0.8571428571,
        "answer_relevancy":0.8333006657,
        "answer_correctness":0.740623127,
        "context_precision":1.0,
        "context_recall":1.0,
        "context_sufficiency":0.0
    },
    {
        "user_input":"Jaké byly důsledky vlivu německo-židovské koterie na národnostní vztahy v Rakousku a jaké kroky byly navrženy k obnovení ústavního státu a potlačení národnostních štvanic?",
        "retrieved_contexts":[
            "pitelstva. Ve všech zemích, ba i v zemích válkou postížených, byly sněmovny poslanců svolány k rokování — jen rakouská sněmovna zůstala mrtjejí předsednictvo. Není naším úkolem v této trudné době oživovati politické polemiky a poukazovati na chybu jaké se dopustila agrárně radikální obstrukce, jež v historickém roce celého světa zabila život parlamentu. Nemůžeme z pochopitelných příčin poukazovati na důsledky, jaké vzešly následkem předčasně zabitého ústavního a lidového sboru. Jen tolik můžeme říci, že se tenkráte stala v táboře českých obstručníků historická chyba, jejíž hodnotu bude možno až po válce posuzovati. Často vytýkán byl naší straně parlamentní dogmatism, držení parlamentu za každou cenu. Že však r. 1914 došlo k rozbití parlamentu za velmi",
            "tak dalekosáhlé změny ve střední Evropě, jakou je přivtělení Rakouska k říši Německé, došlo k požadavkům německých občanů republiky. Jich projevem jsou zvláště tyto podané iniciativní návrhy: Návrh, t. 893 p.-1937, posl. dr. Köllnera na vydání zákona o národnostní příslušnosti státních občanů a o národnostních katastrech chce býti rámcovým zákonem, kterým se má připraviti evidence národnostní příslušnosti všech státních občanů. Jde o bezvadné zjišťování národnosti a o listinný důkaz o tomto zjištění jako nezbytný předpoklad spravedlivé národnostní politiky. Návrh vychází z toho, že příslušnost k národnosti jest po zápisu do národnostního katastru neodvolatelná, zavádí zřízení katastrálních soudů, katastrálních komisí, ústředních národnostních katastrálních komisí.",
            "různý vývoj hospodářský, různost politických poměrů atd. by nedovolovaly prý uzavříti s Německem celní jednotu, za to ale prý by měly býti zrevidovány celní sazby mezi oběma říšemi s ohledem na požadavky doby, tak aby vedle jiných opatření poskytly podklad pro zmíněný již spolek. Rakousko prý by všeliké výhody mohlo poskytnouti Německu, zejmena pokud se týče obchodu transitního, kdežto Německo by zase mohlo navzájem Rakousku pomoci svými koloniemi, svými levantskými dráhami atd.... Vnitřní poměry v Rakousku jsou prý zoufalé a národnostní boj rakouskými vládami živený prý vyvolal poměry dokonce již pathologické. Rakouská správa je prý úzkoprsá a mnohdy naplněna přímo záští oproti podnikavosti. Antisemitismus nabyl prý v Rakousku rázu štvanic protižidov-",
            "různý vývoj hospodářský, různost politických poměrů atd. by nedovolovaly prý uzavříti s Německem celní jednotu, za to ale prý by měly býti zrevidovány celní sazby mezi oběma říšemi s ohledem na požadavky doby, tak aby vedle jiných opatření poskytly podklad pro zmíněný již spolek. Rakousko prý by všeliké výhody mohlo poskytnouti Německu, zejmena pokud se týče obchodu transitního, kdežto Německo by zase mohlo navzájem Rakousku pomoci svými koloniemi, svými levantskými dráhami atd.... Vnitřní poměry v Rakousku jsou prý zoufalé a národnostní boj rakouskými vládami živený prý vyvolal poměry dokonce již pathologické. Rakouská správa je prý úzkoprsá a mnohdy naplněna přímo záští oproti podnikavosti. Antisemitismus nabyl prý v Rakousku rázu štvanic protižidov-",
            "nemožno, aby barbarství bijící v tvář občanské svobodě a špinící svatý prapor dějinného úkolu té říše mohlo ještě dlouho kaliti život národův rakouských. Vždyť, řekněme to upřímně, není to kmen německý, nesoucí s námi břímě dne a horka, není to lid německý, kterýž proklamoval místo bratrství národů rakouských ono hanebné heslo: „inferiority kmenové“, kterýmž pokáleny jsou u nás červánky státu ústavního. Jest to jen veliká koterie německožidovská, kteráž prosta citu pro právo, svobodu a důstojnosť občanskou, vyvolává a zpruditi chce ony žalostné štvanice národnostní, kteréž duši každého svobody milovného přítele Rakouska naplňovati musí ošklivostí. Má-li tudíž ona idea vznešená, kteráž státu našemu život dala, ku cti zase přijíti, jest dvojí zapotřebí: Zlomiti vliv štváčův a probuditi v ná-"
        ],
        "response":"Rakouská správa byla vnímána jako úzkoprsá a často naplněná záštími vůči podnikavosti [doc3, doc4]. Národnostní boj, který rakouské vlády živily, vyvolal poměry až patologické [doc3, doc4]. Vliv německo-židovské koterie byl vnímán jako podněcující národnostní štvanice, které měly kalit život národův rakouských [doc5]. K obnovení ústavního státu a potlačení národnostních štvanic bylo navrženo zlomit vliv štvanic a probudit v národě [doc5].",
        "reference":"Vliv německo-židovské koterie na národnostní vztahy v Rakousku vedl k vyvolávání a zprudění žalostných národnostních štvanic, které naplňovaly duši každého svobody milovného přítele Rakouska ošklivostí. K obnovení ústavního státu a potlačení národnostních štvanic bylo navrženo zlomit vliv štváčů a probudit v národě vznešenou ideu, která státu dala život.",
        "faithfulness":1.0,
        "answer_relevancy":0.0,
        "answer_correctness":0.5837194908,
        "context_precision":0.6791666666,
        "context_recall":1.0,
        "context_sufficiency":0.0
    },
    {
        "user_input":"Jaké byly důvody a důsledky snahy polských úřadů vyjít vstříc české menšině na Volyni v oblasti školství a kultury, a jak se tato situace porovnávala s předchozí ruskou vládou na Volyni?",
        "retrieved_contexts":[
            "64) J. M. Sokolcov, Ruskaja škola v Polšče, Ruská škola, kniha 2—3, 123.  J. Rubin, Der Kampf für die Muttersprache in der Schule und das Märtyrertum der modernen jüdischen Schule, NE 1926 ,605. 66) LN 2\/8 1924. 67) Stan. Sobinski, L'enseignement public en Petite Pologne Orientale au point de vue national 1923. O rusínských stížnostech v rozpravě rozpočtové komise polského sejmu viz LN 3\/3, 36.  Nepochybně utrpěly pod vládou polskou i české školy na bývalém ruském území ve Volyni a Podolí.68) Školy ty trpí nedostatkem kvalifikovaných učitelů, zvláště pro český jazyk. Všude se pozoruje nepochybná nepřízeň vlády od r. 1923 a rozhodný obrat k horšímu z důvodů sice nepochopitelných, ale vždy politování hodných. Sami Poláci mají ovšem své školy menšinové v cizích",
            "O čem se píše. „Venkovu“ zaslal vyslanec Polské republiky hrabě Lasocki přípis, v němž vzhledem k zprávám o útisku na Volyňsku zdůrazňuje, že na Volyni za ruské vlády byly pouze školy ruské, kdežto v září 1924 bylo tam 22 škol českých, dvě polsko-české a řada škol s češtinou jako vyučovacím předmětem. Ruská statistika napočítala na celé Volyni asi 20.000 Čechů, statistika polská udává již 25.000 v části Volyně, která připadla Polsku. Rozhodně vyslanectví musí zdůrazniti, že na straně úřadů polských je zřejmá tendence vyjíti vstříc poměrně nepatrné české menšině na Volyňsku jak v ohledu školském, tak i kulturním. Není nejmenší pochybnosti, že v nejbližší době věc ta udělá pokroky.  Král. Srbů, Chorvatů a Slovinců. Ljuba Jovanovič vyvrací obvinění známé ne-",
            "velice vyznamenávali je v každém ohledu vyšší ruští hodnostáři před domácím obyvatelstvem, kdykoli české osady navštívili. Ohlédněme se nyní po mravní stránce živobytí řeských osadníků. Začněme třeba se školním vyučováním, kteréž v Čechách poměrně tak dobře prospívá. Zdejší „dobrovolní“ učitelé, pohříchu, často nevyhovují své úloze Nepodléhajíce ve skutečnosti kontrole i nemajíce zvláštní zodpovědnosti a dostávajíce plat od obcí, jsou to vlastně učitelé soukromní; poněvadž však činnost jejich vskutku  jest rozsáhlá i důležitá, bylo by žádoucno, aby české školy i čeští učitelé postaveni byli na roveň jiným, i aby učitelé byli podporováni od vlády. Hlavně bylo by si přáti, aby čeští učitelé vychovávali mládež více v ruském občanském duchu, než se to stává. Zdá se, že někteří z těchto učitelů příliš podléhají vlivu ostrého, nesmířlivého tónu zdejšího ultrakatolického kněžstva polského. Stává se, že pro české školy na Volyni z Rakouska dopravují se sem i knihy, příznivé tomuto specificky polsko-katolickému směru. (Pokračování)",
            "Stížnosti na křivdy jsou marny, a rusínský člověk, ať rolník, ať měšťák, jest úplně vydán v šanc úřední libovůli. Správní úřady jsou tu skoro úplně v rukou polských. Rusin nedosáhne vyššího místa ve správě nezapře-li svoji národnost, nebo dokonce i náboženství. Ve školství vládne soustava popolšťovací. Rusínská řeč vyučovací jest z valné většiny východohaličských, tedy velkou převahou neb úplně rusínskými dětmi navštěvovaných, škol vyloučena ve skutečnosti a nyní jedná se o to, dáti tomu volebními praktikami za účelem dosažení polské většiny v obecních radách i právní podklad. Podobná snaha jeví se v soudnictví. Bohužel je dále nepochybno, že slovo o spravedlnosti státu v ústech dra. Körbra zůstane prázdnou frásí v Haliči právé tak jako jinde a v Halići tím spíše, ježto účelem cesty dra. Körbra do Haliče je jistě dosažení a utužení přátelského poměru s Poláky, na němž mu nyní, kdy Němci pro slezské paratielky se naň sápou, tím více záleží.",
            "sli rázná přání v příčině rusínského středního školství. Ministr. prý jim dal uspokojivou odpověď. — Rusíni se tedy se svými školskými požadavky obracejí na samou vládu. Polští stanczyci je za to ze samé bratrské lásky, kde mohou, tisknou ke zdi. Ve Vídni jsou ovšem tito polští šlechtici největšími autonomisty, doma však největšími tyrany a samovládci. Sjezd německých katolíků bude se konati dne 25. srpna v Litoměřicích. Klerikálové se dnes hýbají v Rakousku na všech stranách, povzbuzeni byvše tak účinně příklady s hora. Česká schůze ve Vídni. Česká národní organisace v Alsergrundě konala v neděli v restaurační zahradě hotelu „Bellevue“ schůzi, ve které se usnesla na resoluci, v níž se žádá: 1. aby Komenského škole ve Favoritech přiznáno bylo konečně nutné právo veřejnosti: 2. aby ve smyslu tužby Palackého pracováno bylo ku sjednocení všech kmenů slovanských, jež by společným úsilím dožadovali se rovnoprávnosti všech národností v Rakousku; 3. aby zavedeno bylo rovné, všeobecné a přímé právo volební."
        ],
        "response":"Podle dostupných dokumentů se situace v oblasti školství a kultury na Volyni v období po roce 1923 podléhala změnám.\n\nZa ruské vlády existovaly na Volyni pouze ruské školy. V září 1924 se již nacházelo na Volyni 22 českých škol, dvě polsko-české a řada škol s češtinou jako vyučovacím předmětem [doc2]. Ruská statistika uváděla na Volyni asi 20 000 Čechů, zatímco polská statistika již v části Volyně, která připadla Polsku, uváděla 25 000 [doc2].\n\nPo roce 1923 se polské úřady projevovaly tendencí vyjít vstříc české menšině na Volyni v oblasti školství a kultury [doc2]. Tato situace se lišila od předchozího období pod ruskou vládou, kdy existovaly pouze ruské školy.\n\nV dokumentu [doc3] se zmiňuje, že české školy na Volyni z Rakouska dopravovaly knihy, které byly příznivé specificky polsko-katolickému směru. Dokument [doc4] popisuje stížnosti na křivdy rusínského obyvatelstva a uvádí, že v oblasti školství vládne systém popolšťovací. Dokument [doc5] zmiňuje snahu rusínů o střední školství a reakci polských šlechticů na tuto snahu.",
        "reference":"Polské úřady se snažily vyjít vstříc české menšině na Volyni v oblasti školství a kultury, protože za ruské vlády existovaly pouze ruské školy, zatímco v září 1924 bylo na Volyni 22 českých škol, dvě polsko-české školy a řada škol s češtinou jako vyučovacím předmětem, což ukazuje na snahu polských úřadů podporovat českou menšinu, která byla podle polské statistiky početnější než za ruské vlády.",
        "faithfulness":1.0,
        "answer_relevancy":0.9076791352,
        "answer_correctness":0.7682168342,
        "context_precision":1.0,
        "context_recall":1.0,
        "context_sufficiency":0.0
    },
    {
        "user_input":"Jaký význam mělo vynášení starého Hazuky s poctami a provedení rituálů, jako je dělání křížů nad prahem a pokládání rakve na zem, pro obecní komunitu a jak to souvisí s jejich vnímáním smrti a posmrtného života?",
        "retrieved_contexts":[
            "váleček, flašinet zaskřípal, ruka kruhem mihla se jednou, dvakrát, a jak točila, táhla se z kolovrátku ven vrnivě, plačtivě smutná ptsnička: „Až já umřu — co mně dáte? Dubovou truhličku, bílou košiličku to mně dáte.“ Mezi tím co hrála, vynášeli obecní lidé, strážník s ponocným starého Hazuku z pastoušky ven. Vynášeli ho se všemi poctami domácího pána. Tři kříže s rakví udělali nad prahem, aby se nevrátil a nestrašil, třikrát cestou rakev na  zem postavili a zase zvedli, než ji na máry položili, jen aby mu země lehká byla, a když venku na marách ležel, po pořádku celá obec přistupovala a křížky tři ještě na truhle dělala palcem — sousedovi na rozloučenou — první starosta po něm radní, sedláci, chalupníci, kovář, pastýř, pak ženy i děti — a mezi tím otevřeným oknem kvílel rozladěný",
            "o vlastnostech a o práci nebožtíka, o okolnostech jeho smrti a o žalu vlastním i dalších pozůstalých. Protože podle „vykládání“ se posuzoval i žal pozůstalých, stalo se místy zvykem najímat plačku, totiž cizí ženu, která za naturální odměnu (hlavně potraviny) „vykládala“ nad zemřelým místo příbuzných. „Vykládání“ bylo nejintenzívnější třetího dne, tj. v den pohřbu, zvláště u rakve, cestou na hřbitov a při spouštění rakve do hrobu. Samo zavírání rakve bylo spojeno s mnohými pověrami. Zkřivený hřebík, nepřiléhající víko, sláma nebo plachta trčící zpod víka apod. považovaly se za předzvěst dalšího brzkého pohřbu ve vsi. Rakev se vynášela z domu nohama napřed, aby se z mrtvého nestal revenant (bludná duše). Považovali-li v dřívějších dobách za zvlášť důležité zajistit se před návratem mrtvého, vykopávali někteří pod prahem otvor,",
            "zámkem, vkládali šípkové pruty pod chodidla apod., nebo prostředky magickými, jako např. protažením truhly pod prahem, nesením zemřelého nohama napřed aj.; co by mu na onom světě chybělo k ukojení jeho potřeb a zálib, nebo že by nesplnili některou jeho žádost vyslovenou či předpokládanou. ního styku s mrtvým, jsou pro živé škodlivé a musí být odstraněny nebo alespoň zbaveny škodlivého účinku. možno smrt předvídat, resp. podle různých drobných okolností kolem mrtvého usuzovat na další úmrtí, pokud k němu mělo dojít v blízké budoucnosti.  VÝROČNÍ ZVYKY A OBYČEJE  Ve výročním zvykosloví byly nejdůležitější obřady spojeny se slunovratem, zvláště se zimním, který symbolizoval zánik starého a vznik nového života v přírodě. Jednotlivé obřady a zvykoslovné úkony měly napomáhat prospěchu hospodářství, především zajistit dobrou úrodu, úspěšný",
            "a spasitelné pokání. Avšak církvi se tento zvyk vymýtit nepodařilo. Někde se dochoval až do současnosti jako dětská hra, jejíž původní záměr vyjadřuje popěvek: Smrt nesem ze vsi, nové léto do vsi... Dály se pokusy změnit význam zvyku vynášení smrti ve prospěch křesťanství. Vynášení smrti má prý být upomínka na zavržení pohanských model a přijetí křtu čili slavnost na počest ví DEN SV. MATĚJE  DEN SV. ŘEHOŘE  VYNÁŠENÍ SMRTI  PAŠIJOVÝ TÝDĚN  se udržel smysl docela jiný, třeba již jen symbolický, ale původnímu významu bližší. Tento smysl dává tušit dávnou pohanskou slavnost v době okolo jarní rovnodennosti, tedy v době, kdy po vyčerpání zemědělských zásob během zimy a útrapách s tím spojených dochází k obnovení hospodářské činnosti za získání nové úrody a čerstvé píce pro dobytek. Smrt-Mařena, pozdější symbol",
            "pokazil. Nelze říci určitě, co znamenají tyto a předešlé obřady; další mají za účel „chrániti mrtvého.“ Schránka s tělesnými pozůstatky pokryje se starou plachetkou, lid tančí kolem a zpívá: „Obstupujeme tě v sedmi kruzích, aby zlý drak se nemohl přiblížiti.“ Dále následuje „tanec supů“. Tanečníci drží se posud za ruce a skáčí v jistém pohybu rhytnickém kolem schránky tělesných pozůstatků. Konečně vezmou všickni účastníci do rukou hořící třísky smolné a utvoří kruh. Když třísky shořely vyndá se ze schránky lebka zemřelého a kosti, zabali se do chatrných hadrů a vloží se do koše spolu s obnošeným šatem muže nebo ženy, (podle toho jakého pohlaví zemřelý byl,) přidá se do koše rýže a hrnek. Koš nesen jest na „pahorek mrtvých“ zvaný Ayo-tang, také schránka, v níž před tím pozůstatky byly uloženy, přináší se sem a zničí se tu. (Dokončení.)"
        ],
        "response":"Vynášení starého Hazuky s poctami a provedení rituálů, jako je dělání křížů nad prahem a pokládání rakve na zem, mělo pro obecní komunitu několik významů. Především se jednalo o projevy úcty k nebožtíkovi a o snahu zajistit mu klidný posmrtný život [doc1, doc2]. Tří kříže nad prahem měly zabránit jeho návratu a strašení [doc1]. Pokládání rakve na zem a její opětovné zvedání mělo zajistit lehký posmrtný život [doc1].\n\nRituály byly součástí pohřebního obřadu, který zahrnoval i „vykládání“ nad zemřelým, což bylo posuzováno jako projev úcty a žalu [doc2]. Najímání plačky, cizí ženy, která „vykládala“ nad zemřelým, bylo místy zvykem [doc2].\n\nZvyk vynášení smrti měl původně pohanský význam, spojený s oslavou jarní rovnodennosti a obnovou hospodářské činnosti [doc4]. Později byl tento zvyk reinterpretován a začleněn do křesťanského pohřebu, ale jeho původní význam se zachoval, byť symbolický [doc4].\n\nKomunita také prováděla rituály, které měly chránit nebožtíka a zabránit jeho návratu, například schránka s tělesnými pozůstatky se pokrývala plachetkou a lidé tančili kolem ní [doc5]. Zničení schránky na „pahorku mrtvých“ bylo součástí závěrečného rituálu [doc5].",
        "reference":"Vynášení starého Hazuky s poctami a provedení rituálů, jako je dělání křížů nad prahem a pokládání rakve na zem, mělo pro obecní komunitu význam v tom, že se snažili zajistit, aby se Hazuka nevrátil a nestrašil, a aby mu země lehká byla. Tyto rituály odrážejí jejich vnímání smrti a posmrtného života, kde je důležité zajistit klid zesnulého a zároveň ochránit živé před jeho možným návratem jako ducha.",
        "faithfulness":1.0,
        "answer_relevancy":0.9126483378,
        "answer_correctness":0.8890644489,
        "context_precision":1.0,
        "context_recall":1.0,
        "context_sufficiency":1.0
    },
    {
        "user_input":"Jaké jsou důsledky nedostatku náboženského vychování a liberalismu, na stabilitu a budoucnost státu a jeho národů?",
        "retrieved_contexts":[
            "svláště za náležité vštěpování nauky náboženské v srdce mládeže, on je povinen pře svědčiti ne, činí-li mládež pokroky a v jaké míře je činí, on je povinen starati se a všemi prostředky pracovati, aby mládež vedena byla v duchu opravdu křesťanském, aby vyspěla v generaci v každé příčině dobrou, státu a společnosti prospěšnou a církvi i Bohu oddanou. To jest jeho povinností, v níš akracován býti nesmí nikým a nikde, jsou li základní státní zákony též pravdou a nikoli jen psaným slovem na papíře. U náležitém plnění této povinnosti musí velepastýř duchovní všude tam, kde se přesvědčil o nedostatečném úspěchu náboženského vyučování a vychování mládeže, pátrati po příčinách tohoto neúspěchu a nalezl-li je, je pak zvatou jeho povinností další, aby tlačil na jich",
            "však dáti vyrůsti novým. Areligiosita národa není zjevem novým, český liberalism, navazující na tradice francouzské revoluce a především na tradice Encyklopedistů, nalezl velmi úrodnou půdu.« Autor píše dále o netečnosti našeho lidu k náboženství a pokračuje: »Nejlepším důkazem tohoto tvrzení jest okolnost, že propaganda pro vystupování z církví nemusí, leda jen v nejvzácnějších případech, vůbec polemisovati s náboženským učením. Od let již není třeba u nás dokazovati neexistenci Boží. Stačí apel na svědomí občanů, aby se rozešli se společností, jejímuž učení nevěří. Tento ráz propagandy svědčí o tom, že matrikových příslušníků církví jest více než opravdových, že nevěra jest předpokládána i u lidí, vedených oficiálně v seznamech věřících . . .«",
            "matická obratnost Antonelliho nebyla působila smířlivě a chlácholivě. Bez takovéto obratnosti Antonelliho byly by ještě hroznější spousty a protivenství stihly Církev katolickou, tak že by byl později v době příhodné katolický svět s mnohem větším namáháním, nežli nyní, musel sbírati své síly, aby v boji s nepřátelstvem konečně odnesl palmu vítězství. Tempora mutantur! Liberalismus usvědčen jest záhubnými výsledky svými a jeho prvotní zuřivost změnila se v zmalátnělost. Vybouřil se, vychrlil všecku spoustu zkázy své, vyčerpal všecky prostředky násilnictví svého a klam i šalba jeho celému světu jest zřejma. Resultáty, jichž se zpohanšťováním společnosti lidské dočinil, objevují děsnou propast, ku kteréž na té dráze „liberální“ lidstvo se vede. Zkáza mravů, vzrůstání převratných živlů a zřejmější stálé ohrožování veřejného pořádku přivádí ty, kteříž v poslední instanci řídí osudy národů, k rozvážnosti a přesvědčuje je, že bez náboženství a církevních řádů vrátké jsou všeliké základy státního pořádku.",
            "řádu a blahu zasadil liberalismus. Tolik Liberální sněm, do kterého volí pouze ten, kdož platí jistou značnou daň, z něhož však jest jisto, čím dále se odkládá s tímto tedy vyloučen jest dělník budiž odstraněn; žádoucím obratem, tím těžším bude. Dejž Bůh, aby nebylo pozdě. dělník ať vládne. Manželství buď odstraněno, ženy buďtež všem společné, o děti starej se a vychovávej je stát. Majetku vlastního neměj nikdo, vše budiž společno pod vládou a správou státu. To jsou důsledky neblahé zásady bezbožeckého liberalismu u komunistův a socialistův bezbožeckých. Bylo řečeno lidu, jeho vůle, že je postavena na místo vůle Boží. Oblouzený lid to chápe, on vůli svou chce provésti, silou svého ramene a křiku hodlá vše opanovati, chce zasednouti na stolici vladařskou a byť mu",
            "hlavním důvodem: veleříše tato roste organicky z minulosti, zaniká však na vždy, pro budoucnost takřka bez ohlasů; hrozným pádem jejím a změněnými poměry jsou vztahy její k budoucnosti takořka nadobro přervány. Počínající dobou křesťanskou znamenáme růst samostatného a jednotného národa i státu Českého v obrysu a tvaru, který má s dnešním určitou příbuznost a spojitost. Není pochyby tedy, že mu nadchází doba nová. To jest ovšem stránka pouze vnější, po stránce vnitřní však jest příchod doby nové ještě rozhodnější a patrnější. Není o tom sporu, že to bylo poměrů života jak soukromého, tak veřejného u všech národů, tím spíše tedy u národa tak eminentně „náboženského,“ jakým byl i jest národ náš. Zvlášť pak jest uvážiti, že to bylo křesťanství latinské, římské se vším"
        ],
        "response":"Podle dostupných dokumentů jsou důsledky nedostatku náboženského vychování a liberalismu vnímány jako negativní pro stabilitu státu a národa.\n\nDokument [doc3] tvrdí, že liberalismus je zodpovědný za \"zkázu\" a \"ohrožování veřejného pořádku\" a že bez náboženství a církevních řádů jsou vratké základy státního pořádku [doc3]. Dokument [doc4] popisuje liberalismus jako zdroj \"bezbožeckého liberalismu\" a spojuje ho s komunistickými a socialistickými ideály, které vedou k odstranění manželství, soukromého majetku a k tomu, že \"vůle\" lidu má přednost před \"vůlí Boží\" [doc4].\n\nDokument [doc5] zmiňuje, že křesťanství bylo důležité pro formování českého národa a státu, a naznačuje, že jeho úpadek může mít negativní dopad na budoucnost [doc5]. Dokument [doc2] poukazuje na rostoucí \"areligiositu\" a \"netečnost\" lidu k náboženství [doc2]. Dokument [doc1] zdůrazňuje povinnost \"velepastýře\" zajistit náboženské vychování mládeže a varuje před důsledky jeho absence [doc1].",
        "reference":"Nedostatek náboženského vychování a liberalismus, jak je popsáno v textu, vedou k úplnému zdivočení a ohrožují stabilitu a budoucnost státu a jeho národů, protože liberalismus je vnímán jako náboženská lhostejnost nebo bezvěrectví, což může způsobit, že Korutany trpí zlem a mohly by zajíti, pokud nepřijde pomoc včas.",
        "faithfulness":1.0,
        "answer_relevancy":0.9620817923,
        "answer_correctness":0.5506407228,
        "context_precision":1.0,
        "context_recall":0.6666666667,
        "context_sufficiency":0.0
    },
    {
        "user_input":"Jaké byly důsledky vlivu německo-židovské koterie na politickou situaci v Rakousku a jak se tento vliv projevoval v kontextu národnostních štvanic a ústavního státu?",
        "retrieved_contexts":[
            "nemožno, aby barbarství bijící v tvář občanské svobodě a špinící svatý prapor dějinného úkolu té říše mohlo ještě dlouho kaliti život národův rakouských. Vždyť, řekněme to upřímně, není to kmen německý, nesoucí s námi břímě dne a horka, není to lid německý, kterýž proklamoval místo bratrství národů rakouských ono hanebné heslo: „inferiority kmenové“, kterýmž pokáleny jsou u nás červánky státu ústavního. Jest to jen veliká koterie německožidovská, kteráž prosta citu pro právo, svobodu a důstojnosť občanskou, vyvolává a zpruditi chce ony žalostné štvanice národnostní, kteréž duši každého svobody milovného přítele Rakouska naplňovati musí ošklivostí. Má-li tudíž ona idea vznešená, kteráž státu našemu život dala, ku cti zase přijíti, jest dvojí zapotřebí: Zlomiti vliv štváčův a probuditi v ná-",
            "vosť, každé privilegium Němců naprosto vylučuje, poněvadž výslovně a zřetelně praví, že jsou v Rakousku všickni národové stejně oprávněni. Jest to státní základní zákon s pověstným čl. XIX. Tento zákon, který zdělali Němci sami, nese podpis císaře Rakouského a my radíme ústavověrným revolucionářům strany Plenerovy, aby si tento článek desetkrát přečtli, až zase budou chtít mluvit o oprávněném postavení Němců! V Rakousku nepřísluší Němcům žádné jiné postavení než ostatním národům a právě požadavek výlučného jejich postavení dovedl srazit Slovany na říšské radě v jedinou stranu, která může zamezit utvoření většiny v jádře svém ústavověrné. Neboť na stranu Slovanů přidají se němečtí konservativci a antisemité Luegrovy strany mnohem jistěji než na stranu ústavověrců.",
            "se pro tento cíl získat zahraniční pomoc u carských, případně západoevropských politiků s cílem oslabit vliv německých imperialistů na vnitřní i vnější a nevytyčovala před ním revoluční přeměnu této monarchie v buržoasně demokratickou republiku jako nejbližší historický úkol. »Česká otázka« se z otázky vnitrostátní, jíž se stala po zradě revoluce 1848 českou buržoasií, měnila koncem 19. století v otázku mezinárodní. Na přelomu 19. a 20. století cistiky. Tento zájem o ni po roce 1903 značně poklesl. Do popředí se opět  dostávala až po roce 1907 jako součást »rakousko-uherské otázky« a »slovanské otázky«, jako prostředek imperialistických příprav na »dělení« habsburské monarchie. Ale žádná imperialistická velmoc neměla bezprostřední zájem na »vyřešení« »české otázky«, naopak některá jako Německo ji spíše brzdila. »Česká otázka« zůstávala nerozřešena.",
            "tické kruhy německé měly by si vůbec uvědomiti, že poměry doby, od základu změněné, daly také národnostní ideji v dnešním světovém proudění podstatně změněný obsah. Tažme se, co nás ve starém Rakousku nejvíce rozhořčovalo a rozdělovalo. Shledáme, že to byl boj o úřady a úřednická místa. Německé měšťanstvo mělo ještě z dob starého absolutismu sklon ke státní službě, v níž celé rodiny téměř dědičně nalézaly své zaopatření. A ježto v Rakousku veřejná moc a tím politická moc plynuly z úřadů a kanceláří, mohl německý lid — lépe řečeno německé měšťanstvo — vlivem německých úředníků vykonávati na veřejnou správu rozhodující vliv ve smyslu německonacionálním a tím také zdánlivě ukájeti národní potřeby. Každý jazykový ústupek národům neněmeckým byl pokládán za měřítko",
            "tické kruhy německé měly by si vůbec uvědomiti, že poměry doby, od základu změněné, daly také národnostní ideji v dnešním světovém proudění podstatně změněný obsah. Tažme se, co nás ve starém Rakousku nejvíce rozhořčovalo a rozdělovalo. Shledáme, že to byl boj o úřady a úřednická místa. Německé měšťanstvo mělo ještě z dob starého absolutismu sklon ke státní službě, v níž celé rodiny téměř dědičně nalézaly své zaopatření. A ježto v Rakousku veřejná moc a tím politická moc plynuly z úřadů a kanceláří, mohl německý lid — lépe řečeno německé měšťanstvo — vlivem německých úředníků vykonávati na veřejnou správu rozhodující vliv ve smyslu německonacionálním a tím také zdánlivě ukájeti národní potřeby. Každý jazykový ústupek národům neněmeckým byl pokládán za měřítko"
        ],
        "response":"Dokument [doc1] tvrdí, že vliv „německožidovské koterie“ kalil život národů rakouských a vyvolával národnostní štvanice. Tato koterie prý byla zbavena citu pro právo, svobodu a důstojnost občanskou [doc1].\n\nDokument [doc2] zmiňuje, že článek XIX státního základního zákona, který byl vytvořen Němci, stanovuje rovnost práv pro všechny národy v Rakousku [doc2]. Dokument dále uvádí, že požadavek na výlučné postavení Němců vedl ke sjednocení Slovanů proti nim [doc2].\n\nDokument [doc3] uvádí, že „česká otázka“ se stala mezinárodní a byla využívána imperialistickými mocnostmi, včetně Německa, které ji spíše brzdilo [doc3].\n\nDokument [doc4] a [doc5] tvrdí, že v Rakousku byl boj o úřady a úřednická místa zdrojem rozhořčení a rozdělení, přičemž německé měšťanstvo se snažilo prosazovat německonacionální zájmy prostřednictvím vlivu německých úředníků [doc4, doc5].",
        "reference":"Vliv německo-židovské koterie na politickou situaci v Rakousku se projevoval tím, že tato koterie, postrádající cit pro právo, svobodu a důstojnost občanskou, vyvolávala a chtěla zpruditi národnostní štvanice, které naplňovaly duši každého svobody milovného přítele Rakouska ošklivostí, a tím pokáleny byly červánky ústavního státu.",
        "faithfulness":1.0,
        "answer_relevancy":0.8360881268,
        "answer_correctness":0.4469170213,
        "context_precision":0.8875,
        "context_recall":1.0,
        "context_sufficiency":0.0
    },
    {
        "user_input":"Jaké byly důvody a důsledky nespokojenosti dělnictva a chudého lidu s vládními opatřeními a rostoucími cenami životních potřeb, jak je vyjádřeno v projevech a přijatých resolucích během tábora lidu v Moravské Ostravě?",
        "retrieved_contexts":[
            "Regera a Cingra přijali navrženou resoluci, v níž nastiněn další postup proti nepřátelům chudého lidu. Odpoledne pak konán v Moravské Ostravě v zahradě hostince „U lípy“ tábor lidu, navštívený nejméně 10.000 lidí obojího pohlaví. Za bouřlivých projevů nespokojenosti s nynějším stavem a energických protestů proti lichvářům s potravinami promluvili soudruzi Pergl, dr. Kunicki a poslanec soudruh Jockel, načež přijata byla nadšeně následující resoluce: Šílené, den ode dne vzrůstající zdražování veškerých životních potřeb, přivádí veškerý chudý lid na pokraj zoufalství. Neustále stoupající drahota veškerých životních potřeb dotýká se citelně již i lépe situovaných vrstev obyvatelstva, dělnictvu však činí existenci přímo nemožDrahota tato již není obvyklým zje-",
            "Den zmírá a večer sklání se nad krajinou. Na obzoru zapadá slunce. Ohnivá, jantarová koule stuneční noří se pozvolna do krvavě rudého moře na  V neděli dne 17. t. m. konány byly v Moravské Ostravě, Orlové a Bohumíně veliké projevy proti stoupající drahotě. Neslýchané zdražování životních potřeb a klesání mezd hornictva, hutnictva a ostatního dělnictva zdejší průmyslové oblasti a k tomu družící se strašidlo nezaměstnanosti vyburcovaly zdejší proletariát k zahájení boje proti drahotě a jejím původcům. V neděli dne 17. t. m. dán byl signál k zahájení zápasu, který nesmí ustati dříve, než bude zajištěna pracujícím vrstvám možnost k vedení života člověka důstojného. Dopoledne konán byl v Orlové na náměstí tábor lidu, jemuž obcovalo 8—10 tisic lidí, kteří po referátech soudruhů posl.",
            "cenu na útraty rakouského obyvatelstva povolovati požadavkům uherským. Takto to nadále jíti nemůže, nemá-li v Rakousku vypuknouti revoluce z hladu. My na táboru lidu dne 17. září 1911 v Mor. Ostravě shromáždění protestujeme co nejrozhodněji proti této, rakouskému obyvatelstvu škodlivé vládní politice a žádáme: 1. Zrušení cel z veškerých životních potřeb; zrušení zákazu dovozu dobytka a masa z ciziny. měřené snížení těchto. 3. Snížení dovozného pro dopravu masa a životních potřeb na státních a soukromých drahách. 4. Přísné stíhání a znemožnění lichvy s potravinami a všemi životními potřebami. Budiž co nejdříve svolána říšská rada, aby se usnesla na opatření proti drahotě a k zmírnění nouze. Očekáváme, že veškeří činitelé učiní co nejdříve vše, aby nesnesitelné draho-",
            "žoasie a dělnictva drobná inteligence — učitelé, kněží, studenti, novináři a umělci. Dělnictvo se sice hromadně zúčastnilo táborového hnutí, nebylo však dosud samostatnou politickou silou a teprve za rozmachu jeho vlny se počalo jasněji politicky vyčleňovat ze všeobecného demokratického a národního hnutí. Proto také hlavní požadavky, jež se ozývaly na táborech jak v projevech řečníků, tak v přijatých resolucích, byly požadavky buržoasního charakteru. Základním a nejrozšířenějším programovým bodem táborových jed 240) Národní listy 4. června 1870, č. 150.  nání byl různě formulovaný požadavek autonomního postavení českých zemí v Rakousku, požadavek uskutečnění českého státního práva (jinak formulovaný jako požadavek státoprávního postavení zemí koruny české,",
            "V Moravské Ostravě  súčastnilo se demonstrace na 60.000 osob. Dopoledne konáno 6 schůzí a táborů: V Moravské Ostravě, Přívoze, Hrušově, Michálkovicích, Radvanicích a Mariánských Horách. Všechny průmyslové i živnostenské podniky, vyjímaje Vítkovice, byly zastaveny. O 5. hodině odpoledne konal se na Senném trhu tábor lidu. Referovali: česky Prokeš. polsky Reger, německy dr. Haas. Průvod zabral celou šíři Hlavní třídy a trval přes půldruhé hodiny. V okamžiku vyplnil Náměstí. Mnoho účastníků nenašlo na Náměstí místo. V kavárně »Union« očekávána telegrafická zpráva posl. Cingra o vládním prohlášení. Účastníci prohlásili, že nebude-li slib vlády splněn, jsou ochotni zastaviti práci Vojsko a policie byly skryty. Dělnictvo zachovalo klid.  Krvavé srážky. Vzrušující zpráva dochází ze Slavkova. Před Redlichovým cukrovarem došlo po volební demonstraci ku srážce dělnictva s četnictvem. Četníci vypálili do lidu salvu. Sedm osob bylo těžce zraněno, dvacet lehce. Dva z těžce raněných v malé chvíli zemřeli. Ostatní byli dopraveni do brněnské nemocnice. Večer prý byla vytlučena ve všech židovských bytech ve Slavkově okna."
        ],
        "response":"Důvodem nespokojenosti dělnictva a chudého lidu byla šílená a den ode dne vzrůstající zdražování veškerých životních potřeb, které přivádělo chudý lid na pokraj zoufalství [doc1]. Tato drahota citelně zasahovala i lépe situované vrstvy obyvatelstva a činila existenci dělnictvu přímo nemožnou [doc1]. Dále přispívala k nespokojenosti klesající mzdy v hornictví a hutnictví, a strašidlo nezaměstnanosti [doc2].\n\nBěhem tábora lidu v Moravské Ostravě, konaného 17. září 1911, protestovali účastníci proti vládní politice, která byla škodlivá pro rakouské obyvatelstvo [doc3]. Žádali zrušení cel z veškerých životních potřeb, zrušení zákazu dovozu dobytka a masa z ciziny, měřené snížení dovozného pro dopravu masa a životních potřeb na státních a soukromých drahách, přísné stíhání a znemožnění lichvy s potravinami a svolání říšské rady k přijetí opatření proti drahotě [doc3].",
        "reference":"Důvody nespokojenosti dělnictva a chudého lidu s vládními opatřeními a rostoucími cenami životních potřeb spočívaly v šíleném, den ode dne vzrůstajícím zdražování veškerých životních potřeb, které přivádělo veškerý chudý lid na pokraj zoufalství. Neustále stoupající drahota veškerých životních potřeb se citelně dotýkala již i lépe situovaných vrstev obyvatelstva, ale dělnictvu činila existenci přímo nemožnou. Důsledkem této nespokojenosti byly bouřlivé projevy nespokojenosti s nynějším stavem a energické protesty proti lichvářům s potravinami, které vedly k přijetí nadšené resoluce během tábora lidu v Moravské Ostravě.",
        "faithfulness":1.0,
        "answer_relevancy":0.9121826676,
        "answer_correctness":0.9092058794,
        "context_precision":1.0,
        "context_recall":1.0,
        "context_sufficiency":1.0
    },
    {
        "user_input":"Jaký je vliv ultrafialových paprsků na bakterie a jak tento vliv souvisí s procesy probíhajícími v rostlinách, zejména s tvorbou uhlohydrátů a usmrcováním protoplasmy?",
        "retrieved_contexts":[
            "úplně usmrcuje mykoplasmu bakterií. Výsledky naše o působení ultrafialových paprsků na vegetaci*) byly úplně potvrzeny pokusy provedenými A. J. Kluyverem**). Dále studovali jsme účinek ultrafialových paprsků na kysličník uhličitý a vodík (ve stavu zrodu se nacházející i nenacházející), vliv vodíku na kysličník uhličitý bez paprsků ultrafialových a konečně provedli jsme pokusy o účinku ultrafialového světla na kysličník uhličitý a vodní páru. Chemické reakce nastávající účinkem ultrafialových paprsků byly studovány již dříve různými badateli. Tak konal na př. H. Herchtinkel***) v laboratoři paní Curierové pokusy o rozkladu kyseliny uhličité působením ultrafialového světla. Ve skleněné kouli ca s 80 ccm kyseliny uhličité utvořilo se po 80hodinném osvětlování as 260 mm3 kysličníku uhelnatého. Koule neosvětlená neobsahovala ani stopy CO. Nastal tedy rozklad kysličníku uhličitého v kysličník uhelnatý a kyslík. Tvoření ozonu účinkem ultrafialového světla pozorovali Bor-",
            "účelem rozpoznání vlivu ultrafialových paprsků na vegetaci a vrcholí ve výsledcích pokusů se synthesou uhlohydrátů světlem ultrafialovým z CO, a H ve stavu zrodu za přítomnosti hydroxydu draselnatého, jež umožnily nahlédnouti blíže do mechanismu fotosynthetických reakcí a do úlohy, jakou při tom zastává draslík. Vedle vlivu draslíku na synthesu uhlohydrátů naskytá se otázka — není-li též draslík súčastněn na synthese bílkovin v buňce rostlinné, o čemž poučují kap. V. a VI. Provedené pokusy ukázaly v souhlase s názory a pokusy jiných badatelů, že synthesa bílkovin není reakcí fotochemickou, to jest není vázána na působnost světla. Bílkoviny se tvoří v buňce rostlinné, jak známo, setkají-li se při assimilačním pochodu uhlohydráty se solemi ammonatými neb s dusičňany. Jedná-li se o chlorofylové rostliny.",
            "rofylu prostá buňka již po několika vteřinách (sterilisace vod).1) Paprsky modré, ultrafialové, tedy paprsky význačné největší lámavostí, chovají nejsilnější účinky chemické. Zdrojem jest rtuťová lampa oblouková. Působením ultrafialových paprsků na CO, a na vodík ve stavu zrodu a za přítomnosti hydroxydu draselnatého může býti vyvolána uměle fotosynthesa. (Podle prof. Stoklasy).  Hygienický význam paprsků ultrafialových jest dalekosáhlý a v nové době věnuje mu lékařství pozornost. Celé nové odvětví léčebné zakládá se na těchto předpokladech (na př. léčení tuberkulosy paprsky slunečními na velehorách, na př. Monte Rosa).  1. Chemický vliv jeví se potravou. Ze vzduchu čerpají rostliny CO, i kyslík. Některé plyny i páry ničí rostliny. V okolí velikých měst nenajdeme lišejníkův. Přineseny z venkova, záhy odu-",
            "Inulin vytváří se ve hlízách a kořenech některých rostlin, na př. čekanky, jiřinky a pod., kde zastupuje a vykonává funkce škrobu. Tím nastínil jsem poněkud funkci a složení uhlohydrátů. Zajisté že však každému ze čtenářů připadne na mysl, jak as látky tyto v těle rostlinném se utvářejí. Až dosud byl proces assimilační a tvoření se uhlohydrátů vykládáno dle mnohých hypothes*), z nichž však žádná cestou experimentální**) potvrzena nebyla. Až teprve r. 1910 podařilo se profesoru české vysoké školy technické p. Jul. Stoklasovi a jeho spolupracovníkům (pp. Senfovi, Straňákovi a Zdobnickému) otázku tuto rozřešiti tím, že provedli syntesu***) uhlohydrátů v nepřítomnosti chlorofyllu za působení ultrafialových paprsků*). Pokus proveden tím způsobem, že ponechána vzájemnému působení kyselina uhličitá a vodík u stavu vzrodu za přítomnosti hydroxydu draselnatého a součinosti chemicky aktivních) paprsků ultrafialových. Výsledek kýžený se dostavil a povstalý aldehyd*) kyseliny mra-",
            "venčí či formaldehyd zkondensován (sražen, přeměněn) byl v cukr. Pochod probíhá tak, že působením kysličníku uhličitého utvořený dvojuhličitan draselnatý vodíkem u vzrodu*) jest redukován v cukr. Na základě tomto stal se jasným názor o tvoření se uhlohydrátů v buňkách rostlinných: Kyselina uhličitá atmosférická vniká v stomata či pichy a, jsouc od roztoků drasla pohlcována v buňkách chlorofyllových, přechází v bikarbonát, který odchází v protoplasmu**) až konečně jest změněn ve formaldehyd. Další chemickou změnou přechází v uhlohydrát cukr. Úlohou chlorofyllu pak jest pohlcování paprsků ultrafialových. V buňkách chlorofyllových tvoří se formaldehyd jednak redukcí***) kysličníku uhličitého vodíkem, povstalým spolupůsobením enzymů, jednak redukcí téhož kysličníku vodíkem, tvořícím se rozkladem vody. Pochody tyto probíhají parallelně†) vedle sebe a vytvářejí přechodnou formou uhlohydráty za vlivu paprsků ultrafialových."
        ],
        "response":"Ultrafialové paprsky úplně usmrcují mykoplasmu bakterií [doc1]. Působením ultrafialových paprsků na CO a na vodík ve stavu zrodu a za přítomnosti hydroxydu draselnatého může být vyvolána uměle fotosyntéza [doc3].  Profesor Stoklasa provedl syntézu uhlohydrátů v nepřítomnosti chlorofyllu za působení ultrafialových paprsků [doc4].  Tímto způsobem se podařilo vyřešit otázku tvorby uhlohydrátů, kdy se kyselina uhličitá a vodík ve stavu zrodu, za přítomnosti hydroxydu draselnatého a chemicky aktivních paprsků ultrafialových, ponechali vzájemnému působení a vznikl cukr [doc4].  Kyselina uhličitá vniká v rostlinách a je pohlcována v buňkách chlorofyllových, kde se mění ve formaldehyd, který následně přechází v uhlohydrát [doc5]. Úlohou chlorofyllu je pohlcování paprsků ultrafialových [doc5].",
        "reference":"Ultrafialové paprsky mají vliv na bakterie tím, že jsou vůči nim některé druhy bakterií nejvýše citlivé a stačí doba 8—10 sekund, aby byl konec jejich životu, což souvisí s procesy probíhajícími v rostlinách, kde ultrafialové paprsky mohou přivodit usmrcení protoplasmy, bez níž není život rostliny myslitelný, a zároveň ovlivňují tvorbu uhlohydrátů v zeleni listové.",
        "faithfulness":0.875,
        "answer_relevancy":0.8471978874,
        "answer_correctness":0.5449138217,
        "context_precision":1.0,
        "context_recall":1.0,
        "context_sufficiency":1.0
    },
    {
        "user_input":"Jaké jsou důsledky nedostatku náboženského vychování a liberalismu, které mohou být označovány jako jako lžiliberalismus, na společnost a stát, a jak to souvisí s historickým úkolem a politikou rakouského státu?",
        "retrieved_contexts":[
            "tak mnoho, jako bývalo, ale přece. Dokonce jsou tak označovány ještě české školy a školní inspektoráty ve smíšeném území, jak o tom svědčí zvláště vývěsní štíty, ale i jiné věci. Nemělo by to být! Všude jinde se vyskytuje výraz „hraničář“, „hraničářský“, „pohraničí“ atp. Tedy vše „hraničářské“. Máme tedy nějaké menšiny anebo nemáme? Jest oprávněný název „menšiny“ jak pro menší část národa tak pro jeho časopis? Jest, jistě jest, ale na př. ve Vídni, v Americe a vůbec všude za hranicemi našeho státu. Avšak uvnitř státu jsme národem jediným a státotvorným. Naše národnostní výběžky, ostrovy a ostrůvky, vybíhající do území národa jiného, na př. německého, maďarského, polského atd., nejsou menšinami, nýbrž rovnocennými částmi národa, jenž stát vybudoval. Tedy nic menšího, nic méně cen-",
            "právě náboženství by mělo býti nějakým rozlučujícím momentem zvláště již ve věku dětském, a že tedy zákonem prohlášená rovnoprávnost všech náboženství musí se obrážeti i v ústrojí školy: právě děti měly by býti všude ušetřeny každé stopy náboženské nesnášelivosti. Jako by bylo svrchovaně nespravedlivo chtít snad dělit děti podle majetku a stavu rodičů, tak je nespravedlivé i dělení podle náboženství; zejména vede k nespravedlivosti vůči náboženským menšinám. Nikdo neupře, že ve starém Rakousku náboženství katolické mělo prestiž jako náboženství dynastie, takže se přece jen na ostatní konfese pohlíželo jako na méněcenné. Moderní stát nemá žádných závazků, aby dbal konfesijních nároků jednotlivců, ale naopak každý jednotlivec má nárok a právo, aby mu stát poskytl vzdělání beze všech konfesijních přídavků.",
            "Co bude se státními dluhy? Rakouští Němci jsou ve velikých starostech o starý rakouský stát. Třeba že na jedné straně, když vidí jak se jim hroutí půda pod nohama jako písková hromada, volají po sebeurčovacím právu Němců a chtějí i z parlamentu utíkat, přece jen nemohou zapomenout a rozloučit se s krásnými starými časy, kdy v Rakousku vládla a tyranisovala národy německo-maďarská hegemonie a pokouší se tento stát ještě zachránit. Ve „Wiener Mittagsztg.“ láme si hlavu známý národohospodář, posl. dr. Steinwender otázkou, jak by bylo možno provésti přestavbu Rakouska bez úhony na jeho dnešní celistvosti. „Jsme hnáni k úplné přestavbě státu,“ praví dr. Steinwenspolkový, snad spolek států, ale v žádném případě nedáme si vytrhnout my Němci žádnou část ze státu německo-rakouského.“",
            "jen dobře, moudře a svědomitě použijí. Toho dbáti, o to se zasaditi mají — toť jejich povinností —, aby křesťanství nemělo útulek jen v kostele, ale aby se jemu zjednal průchod a platnosť i v životě veřejném, aby zákony světské zbudovány byly na základě křesťanství, aby duch křesťanství prochvíval školy, soukromé i veřejné, politické i soudní instituce, aby všechny paragrafy světských zákonů v souhlasu byly s těmi 10 paragrafy, které Bůh dal na hoře Sinai, a které mají věčné trvání. Lžiliberalismus, odchýliv se od křesťanství, zplodil mus. Tato jmena nezní dobře. Tato jmena dosvědčují, že naše společenské poměry nejsou příliš růžové. Asi před rokem měly noviny „Politische Fragmente“ článek o tak zvaném 5. stavu. Z toho článku utkvěla mi v paměti tato slova: „Sedíme na sudech",
            "Jde o úřední ocenění významu bloku zdravotně hygienických ekologických funkcí a kulturně naučných funkcí, které jsou uživateli užívány ve formě bezplatných služeb. Jako takové neovlivňují bezprostředně ekonomiku, ale působí na sociální povědomí a stav společnosti. „Úřední cena zdravotně hygienických ekologických funkcí lesa“ a „úřední cena kulturně naučných funkcí lesa“ mají význam především pro společnost a pro stát. Mohou sloužit zejména pro vyjádření: sankční sazby a pokuty za zhoršení úrovně plnění uvedených funkcí lesa, které vyplývají z jeho poškození nebo zničení; prohibitivní a limitní sazby za zhoršení úrovně plnění daných funkcí lesa v důsledku dočasné či trvalé změny ve způsobu užívání pozemku, tj. převodu lesní půdy v nelesní. Cena či náhrady by měly být placeny státu."
        ],
        "response":"Podle dokumentu [doc4] je \"lžiliberalismus\", který se odchyluje od křesťanství, považován za původce \"mus\" a za příčinu špatných společenských poměrů. Dokument zdůrazňuje, že křesťanství by nemělo být omezeno pouze na kostel, ale mělo by pronikat do veřejného života, zákonů, škol a politických institucí. Mělo by se jednat o soulad světských zákonů s desaterem z Hory Sinaje.\n\nDokument [doc3] zmiňuje obavy Rakouských Němců ohledně budoucnosti Rakouska a snahu o zachování jeho celistvosti. Rakousko se nacházelo v procesu přestavby a někteří politici, jako například dr. Steinwender, se snažili najít způsob, jak provést tuto přestavbu bez poškození celistvosti rakouského státu.\n\nDokument [doc2] zdůrazňuje, že moderní stát nemá závazky ohledně konfesijních nároků jednotlivců a že děti by měly být ušetřeny náboženské nesnášelivosti. Rovněž poukazuje na historickou situaci ve starém Rakousku, kde mělo katolické náboženství zvláštní prestiž.\n\nDokument [doc1] se zabývá problematikou menšin a jejich rolí v rámci státu. Zdůrazňuje, že v rámci státu existuje pouze jeden státotvorný národ a že národnostní \"výběžky\" a \"ostrůvky\" nejsou menšinami, ale rovnocennými částmi tohoto národa.",
        "reference":"Nedostatek náboženského vychování a liberalismus, označovaný jako lžiliberalismus, vedou k úplnému zdivočení společnosti, což je považováno za hrozné zjevy, které ohrožují stát. Tento liberalismus je spojen s náboženskou lhostejností nebo bezvěrectvím, což je v rozporu s historickým úkolem rakouského státu, který vznikl z kulturní myšlenky svobodného sdružení národů. Politika, která by se odchýlila od této myšlenky, by vedla k žalostnému poblouzení, za které by musel stát zaplatit pokutu.",
        "faithfulness":1.0,
        "answer_relevancy":0.7943746377,
        "answer_correctness":0.2284208913,
        "context_precision":0.5,
        "context_recall":0.6666666667,
        "context_sufficiency":0.0
    },
    {
        "user_input":"Jaké byly důsledky vlivu německo-židovské koterie na národnostní vztahy v Rakousku a jaké kroky byly navrženy k obnovení vznešené ideje státu?",
        "retrieved_contexts":[
            "nemožno, aby barbarství bijící v tvář občanské svobodě a špinící svatý prapor dějinného úkolu té říše mohlo ještě dlouho kaliti život národův rakouských. Vždyť, řekněme to upřímně, není to kmen německý, nesoucí s námi břímě dne a horka, není to lid německý, kterýž proklamoval místo bratrství národů rakouských ono hanebné heslo: „inferiority kmenové“, kterýmž pokáleny jsou u nás červánky státu ústavního. Jest to jen veliká koterie německožidovská, kteráž prosta citu pro právo, svobodu a důstojnosť občanskou, vyvolává a zpruditi chce ony žalostné štvanice národnostní, kteréž duši každého svobody milovného přítele Rakouska naplňovati musí ošklivostí. Má-li tudíž ona idea vznešená, kteráž státu našemu život dala, ku cti zase přijíti, jest dvojí zapotřebí: Zlomiti vliv štváčův a probuditi v ná-",
            "rodnostní otázky řešit radikalismem. Odmítl výtky, že by se křesťanští sociálové byli kdy dopustili zrady na německé věci a pravil: Ukazuje se všude, kde křesťansko-sociální strana měla rozhodující vliv zejména ve Vídni, shromáždišti všech národností, že jen politika křesťanských sociálů se osvědčila k hájení německého rázu dotyčného místa. Řeči pana Gessmanna lze mnoho vytýkati. Tímtéž dechem napovídá, že křesťanští sociálové nestojí na stanovisku brutalisování národností a vypravuje, jak osvědčila se politika jejich ve Vídni a Dolních Rakousích, ačkoli není a nebylo nikde a nikdy horšího brutalisování národností, jako právě ve Vídni a stejně tak nesmyslně mluví o číselné převaze Němců v Rakousku, která již v čítánkách obecných škol není převahou, nýbrž pouhou třetinou všech národností.",
            "rodnostní otázky řešit radikalismem. Odmítl výtky, že by se křesťanští sociálové byli kdy dopustili zrady na německé věci a pravil: Ukazuje se všude, kde křesťansko-sociální strana měla rozhodující vliv zejména ve Vídni, shromáždišti všech národností, že jen politika křesťanských sociálů se osvědčila k hájení německého rázu dotyčného místa. Řeči pana Gessmanna lze mnoho vytýkati. Tímtéž dechem napovídá, že křesťanští sociálové nestojí na stanovisku brutalisování národností a vypravuje, jak osvědčila se politika jejich ve Vídni a Dolních Rakousích, ačkoli není a nebylo nikde a nikdy horšího brutalisování národností, jako právě ve Vídni a stejně tak nesmyslně mluví o číselné převaze Němců v Rakousku, která již v čítánkách obecných škol není převahou, nýbrž pouhou třetinou všech národností.",
            "různý vývoj hospodářský, různost politických poměrů atd. by nedovolovaly prý uzavříti s Německem celní jednotu, za to ale prý by měly býti zrevidovány celní sazby mezi oběma říšemi s ohledem na požadavky doby, tak aby vedle jiných opatření poskytly podklad pro zmíněný již spolek. Rakousko prý by všeliké výhody mohlo poskytnouti Německu, zejmena pokud se týče obchodu transitního, kdežto Německo by zase mohlo navzájem Rakousku pomoci svými koloniemi, svými levantskými dráhami atd.... Vnitřní poměry v Rakousku jsou prý zoufalé a národnostní boj rakouskými vládami živený prý vyvolal poměry dokonce již pathologické. Rakouská správa je prý úzkoprsá a mnohdy naplněna přímo záští oproti podnikavosti. Antisemitismus nabyl prý v Rakousku rázu štvanic protižidov-",
            "různý vývoj hospodářský, různost politických poměrů atd. by nedovolovaly prý uzavříti s Německem celní jednotu, za to ale prý by měly býti zrevidovány celní sazby mezi oběma říšemi s ohledem na požadavky doby, tak aby vedle jiných opatření poskytly podklad pro zmíněný již spolek. Rakousko prý by všeliké výhody mohlo poskytnouti Německu, zejmena pokud se týče obchodu transitního, kdežto Německo by zase mohlo navzájem Rakousku pomoci svými koloniemi, svými levantskými dráhami atd.... Vnitřní poměry v Rakousku jsou prý zoufalé a národnostní boj rakouskými vládami živený prý vyvolal poměry dokonce již pathologické. Rakouská správa je prý úzkoprsá a mnohdy naplněna přímo záští oproti podnikavosti. Antisemitismus nabyl prý v Rakousku rázu štvanic protižidov-"
        ],
        "response":"Podle dokumentu [doc1] vliv „veliké koterie německožidovské“ vyvolával a zprudoval národnostní štvanice, které naplňovaly duši svobody milovných přítele Rakouska ošklivostí [doc1]. K obnovení „vznesené ideje“, která státu Rakousko dala život, bylo navrženo dvojí opatření: zlomení vlivu štvaných a probuzení národnostní otázky řešením radikalismem [doc1].",
        "reference":"Vliv německo-židovské koterie vyvolával a chtěl zpruditi žalostné štvanice národnostní, které naplňovaly duši každého svobody milovného přítele Rakouska ošklivostí. K obnovení vznešené ideje státu bylo navrženo zlomit vliv štváčů a probudit v národě cítění pro právo, svobodu a důstojnost občanskou.",
        "faithfulness":1.0,
        "answer_relevancy":0.9313158758,
        "answer_correctness":0.7397220328,
        "context_precision":1.0,
        "context_recall":1.0,
        "context_sufficiency":0.0
    },
    {
        "user_input":"Jaké byly důvody a důsledky snahy německo-liberálních stran uzavřít nové souručenství namířené proti slovanským národům v Rakousku, a jakou roli v této situaci hrála akce předsedy ministerstva dr. Körbera ve vztahu k českým poslancům?",
        "retrieved_contexts":[
            "pod Petřínem, kde se ovoce na ně takřka sypalo. Těch různých přání a všelikých proseb jest takové množství, že tomu, kdo to zná, jde hlava kolem. Tu se lehce čte, co tam psáno je, ale bez peněz těžko každému přání vyhověti. Ku př.: Milý Ježíšku, prosím Tě o psací stroje, ladicí nástroje, potahy na citery, housle, hudebniny pro klavír, citeru, kontrabas, varhany, krásné poučné knihy, básně (ovšem všecko v písmu Brailském, vypouklém). Ti malí slepáčkové, by opět rádi: bubny, pušky, železnice, pudlíky, ryby, velocipedisty, tramwzye, malá piana, hrací stroje. Vše  Zprávy politické. V Praze, dne 13. listopadu. K situaci. Dnes již nemůže býti pražádné pochybnosti, že německo-liberální strany usilují o uzavření nového svého souručenství, jehož ostří by bylo namířeno proti slovanským národům v Rakousku",
            "svého poslance, aby mezi ně přišel, tu utudila vláda dr. Körbra, že český lid jest naprosto netečným, že jest mu zcela lhostejno, co se ve Vídni děje. Ministerský předseda dr. Körber také na základě těchto fakt podával koruně zprávy, kterým koruna věřila a věřiti musela. Dr. Körber sděloval k runě, že čeští poslanci provozují naprosto jinou politiku, než li si přeje český lid. Dokladem k tomuto tvrzení byla mu volba hraběte Šternberga na Králověhradecku, který zvolen byl na programm protiobstrukční. Jest tedy nutno, aby promluvili nejen všichni čeští říšští poslanci a to ne na jedné schůzi, leč na několika místech svého okresu, ale hlavně důležito jest, aby promluvil český lid. Celý český národ ať řekne nepokrytě, zdali jest s vládou dr. Körbra spokojen. A pak ať dr.",
            "K situaci. Ministrpresident dr. Körber vrátil se včera večer z Budapešti do Vídně. — Místodržitel český hr. Coudenhove přijat byl včera v Budapešti ve zvláštním slyšení od císaře. * Příští schůze poslanecké sněmovny dle přípisu předsednictva, rozeslaného poslancům, konati se bude ve středu 6. června. Na denním pořádku jest vládní předloha o prozatímním rozpočtu. * Drobné zprávy domácí. Člen panské sněmovny, ministr m. sl. Ig. šlechtic Plener, otec předsedy nejvyšší účtárny dra. Arn. Plenera, slavil včera 90 narozen ay. Došla ho četná blahopřání hlavne z kruhů německo-liberálních.  * Vítězství obstrukce v Německu. Tak zv. lex Heinze, proti němuž na říšském sněmu německém veden byl tuhý obstrukční boj, vzat byl včera z denního pořádku. * Car Mikuláš podepsal 19. května",
            "všechny tyto a mnohé jiné nezvratné důvody mluví zcela jasně pro úplnou oprávněnost žádosti, aby národu českému dostalo se takového počtu vysokých škol, který by se nalezal v náležitém poměru k počtu vyšších ústavů vzdělávacích, jež byly národům německému a polskému státem zřízeny, a aby tedy v Brně, kde pro to jsou všechny přirozené podmínky, zřízena byla druhá universita s vyučovacím jazykem českým. Domáhajíce se této kulturní potřeby svého národa, nemůžeme nepovznésti svého hlasu též ve prospěch stejné kulturní nezbytnosti, o kterou pracují jihoslovanští naši bratří — Slovinci. Jsou to stejné důvody práva, slušnosti a prospěšnosti, jež přimlouvají se za to, aby i ostatním národům slovanským v této říši, zejména národu slovinskému, dostalo se brzo samostatné slovinské",
            "(psáno arci před jmenováním bar. Gautsche — r.). Takové rozhodnutí bylo by pro Němce nejžádoucnější. Přes všecky německé výtky za Těšín, Záhřeb a Inšpruk, nelze dra. Körbra nazvat nepřítelem Němců. Přehlédneme-li celou jeho pětiletou činnost, musíme doznat, že držel slovo dané Němcům, a jeho odpůrci musí stejně přiznat, že nerušil svých slibů (!). V celku i jednotlivostech činil vše a nezanedbával ničeho, aby zachoval německou državu, a nikdy nejednal proti svobodomyslným živlům v Rakousku ... Mé osobní mínění je, že neznám osoby, která by mohla býti milejší levici, než byl předseda ministerstva dr. Körber.“ To jest nepochybně pravda, kterou posud jen tvrdili Körbrovi odpůrci, ale pravda jest i to, co k tomu připomíná „Čas“: „Tím je vysloveno také úplné odsouzení systemu Körbrova a dokázána neoprávněnost jeho pětileté vlády. V Rakousku nesmí patřit vláda jedné národnosti, neboť všecky podobné vlády byly spolupracovnice dnešní zoufalé krise Rakouska.“"
        ],
        "response":"Německo-liberální strany usilovaly o uzavření nového souručenství namířeného proti slovanským národům v Rakousku [doc1]. Dr. Körber, předseda ministerstva, na základě zpráv podával koruně informace, které naznačovaly, že čeští poslanci provozují politiku odlišnou od toho, co si přeje český lid [doc2]. Dokladem tohoto tvrzení byla mu volba hraběte Šternberga na Králověhradecku, který byl zvolen na program protiobstrukční [doc2]. Körberova akce spočívala v tom, že sděloval koruně zprávy, které měly ospravedlnit politiku proti slovanským národům [doc2].\n\nKörberova vláda byla kritizována za to, že je systémem, který neumožňuje vládu více národností, a že je zodpovědná za současnou krizi v Rakousku [doc5]. Přesto Körber držel slovo dané Němcům a nikdy nejednal proti svobodomyslným živlům v Rakousku [doc5].",
        "reference":"Německo-liberální strany usilují o uzavření nového souručenství, jehož ostří by bylo namířeno proti slovanským národům v Rakousku, a celá akce je sosnována proto, aby předseda ministerstva dr. Körber měl v ní proti českým poslancům silnou a výdatnou oporu.",
        "faithfulness":1.0,
        "answer_relevancy":0.9063891748,
        "answer_correctness":0.5179208853,
        "context_precision":0.95,
        "context_recall":0.5,
        "context_sufficiency":1.0
    },
    {
        "user_input":"Jakou roli hrají uhlohydráty v procesu růstu a vývoje rostlin, a jakým způsobem enzymy přispívají k přeměně těchto uhlohydrátů na látky potřebné pro samostatný život rostliny?",
        "retrieved_contexts":[
            "pen byl. K činnosti této potřeba jest rostlině chlorofyllu či zeleně listové v listech a zelených částech rostliny se tvořící, kde vzniknuvší produkty assimilační, složením svým uhlohydráty, odváděny jsou v plody a části trvalé, přezimující. Ale není to z uhlohydrátů pouze škrob, jsou to cukry, inulin, buničina či cellulosa, jež zúčastňují se za nastalých příznivých podmínek nového života, kdy počínají se tvořiti v nositelích životní činnosti — buň kách — enzymy*), jichž působením přeměňují se uložené reservní uhlohydráty v látky rozpustné, které jsou obsahem buněčným k vyrůstajícímu zárodku odnášeny, aby jej posilovaly k pozdějímu životu samostatnému. Jest zjevno, že uhlohydráty jsou rostlině velice potřebné, neboť ony skládají pevné části rostlin a tvoří zásobní části ku přípravě",
            "Směs potravy a trávicích šťav ve střevech, jež byla původně kašovitá, řídká, stává se postupně hustší; látky živné se ponenáhlu rozpouštějí a jsou resorbovány. Když jest trávení dokončeno, zbývá ve střevě více nebo méně tuhý zbytek, jenž odchází z těla ven jakožto výkaly. Mimo to vzniká proměnami látek v organismu velký počet různých sloučenin organických i anorganických, z nichž sloučeniny dusíkaté, voda a anorganické soli vyměšují se hlavně močí, kdežto kysličník uhličitý a vodní pára odchází z těla hlavně plicemi (dýcháním) a koží (potem). Význam uhlohydrátův v živém těle rostlin. Uhlohydráty mají pro rostliny veliký význam. Jednak jsou nejdůležitějším materiálem stavebním, neboť rostliny skládají se převahou z uhlohydrátů, jednak jsou hlavním zdrojem energie, kterou rostlina vybavuje buď dýcháním nebo různým štěpením.",
            "UHLOHYDRÁTY (saccharidy).  Uhlohydráty skládají se jako tuky z uhlíku, vodíku a kyslíku a nalézají se skoro výhradně v rostlinstvu, kde jsou potravinou mladých rostlin. Valná část těla rostlinného skládá se z uhlohydrátů.  Ačkoliv jsou uhlohydráty důležitou potravinou zvířat a lidí, nalézají se ve zvířecím a lidském těle jenom v poměrně malém množství. Mnohé z nich mají veliký význam pro život zvířat a lidí. Uhlohydráty vznikají v rostlinách a pokládají se za hlavní zplodiny asimilace jejich nerostných potravin.1) Uhlohydráty jsou: I. Monosy (monosaccharidy), t. zv. cukry jednoduché, jež u přítomnosti zředěných kyselin neberou vodu a nerozkládají se ve dva cukry. Dle počtu atomů uhlíku nebo kyslíku v jejich molekule jsou: Triosy C,H.O, Hexosy C.H,,O. (glykosa, fruktosa). Tetrosy C,H,O, Nonosy C,H1sO,",
            "uhlohydráty (in statu nascendi) podporují stavbu bílkovin mnohem více než uhlohydráty uměle přidávané; světlo dodává zároveň potřebnou energii pro celkovou výměnu látek. Rychlejší tvorba bílkovin působením světla za přístupu vzdušné kyseliny uhličité dá se vysvětlliti tím způsobem, že uhlohydráty ve stavu zrodu mnohem více podporují stavbu bílkovin, nežli uhlohydráty uměle podávané. Světlo dodává při tomto pochodu potřebnou energii pro výměnu látek. Že světlo za účasti katalysátorů značně podporuje tvorbu, přeměnu a rozklad v buňce rostlinné a živočišné ukazují zejména novější pokusy Neubergovy. Účinek světla na živý organismus vyvolává řadu fotokatalysátorů částečně endogenní a částečně exogenní povahy. V buňce rostlinné zastoupeny jsou četné substance působící jako katalysátory na tvorbu a přeměnu bílkovin; dle Schanze*) jsou to tak zvané positivní a nega-",
            "Weevers přichází též ku podivnému úsudku o úloze draslíku při výměně látek v buňce; myslí totiž, že draslík nehraje roli při stavbě a rozkladu uhlohydrátů, nýbrž pouze (!!!) při stavbě a rozkladu bílkovin. Weeversovi je zajisté známo, že synthesu složitých bílkovin (veskrze kolloidální povahy) možno si představiti tím způsobem, že se setkávají sole amonné a dusičnany při assimilačním pochodu s uhlohydráty. Samozřejmě mohou se bílkoviny tvořiti jen tehdy, jsou-li přítomny uhlohydráty. Četnými badateli jako Hellriegelem, záno, že draslík a tvorba uhlohydrátů úzce spolu souvisí, takže možno říci, že ion draselný spolupůsobí při tvorbě uhlohydrátů. Připadá-li tedy draslíku důležitá úloha při tvorbě uhlohydrátů, je draslík také účasten na tvorbě bílkovin. Že při výměně látek přichází v úvahu kyselina uhličitá vá-"
        ],
        "response":"Uhlohydráty jsou pro rostliny velice potřebné, protože skládají pevné části rostlin a tvoří zásobní části pro přípravu [doc1]. Jsou hlavním materiálem stavebním, neboť rostliny se skládají převahou z uhlohydrátů, a také hlavním zdrojem energie, kterou rostlina vybavuje buď dýcháním nebo různým štěpením [doc2]. Uhlohydráty vznikají v rostlinách a pokládají se za hlavní zplodiny asimilace jejich nerostných potravin [doc3].\n\nEnzymy hrají roli v přeměně uložených rezervních uhlohydrátů na látky rozpustné, které jsou obsaženy v buňkách a odnášeny k vyrůstajícímu zárodku, aby jej posilovaly k pozdějšímu životu samostatnému [doc1].",
        "reference":"Uhlohydráty jsou pro rostlinu velice potřebné, protože skládají pevné části rostlin a tvoří zásobní části ku přípravě. Enzymy přispívají k přeměně uložených reservních uhlohydrátů v látky rozpustné, které jsou obsahem buněčným k vyrůstajícímu zárodku odnášeny, aby jej posilovaly k pozdějšímu životu samostatnému.",
        "faithfulness":1.0,
        "answer_relevancy":0.9224853703,
        "answer_correctness":0.7670983586,
        "context_precision":1.0,
        "context_recall":1.0,
        "context_sufficiency":1.0
    },
    {
        "user_input":"Jaké jsou důsledky použití nesterilizovaných nástrojů při odstraňování ušních mazových zátek a jaké kroky jsou doporučeny k minimalizaci rizika infekce během tohoto procesu?",
        "retrieved_contexts":[
            "minálních infekcí je pak závažná infekce anaerobní (39). Pooperační infekce ran provázejí v USA 1—3 % chirurgických zákroků a asi u 5% osob přijatých do nemocnice lze očekávat, že se u nich během pobytu vyvine infekce některého druhu. Výskyt infekcí operační rány do 1% je považován za normální, od 1 do 2 % za přijatelný, nad 2 % za znepokojivý (4). Užití antibiotik k profylaxi v porodnictví a gynekologii je v boji proti pooperační infekci nepochybně cenné, především pro pacientku samotnou. Má ale i ekonomické důsledky: vede ke snížení doby hospitalizace, ke snížení počtu řady laboratorních vyšetření, která jsou nutná v případech zánětlivé pooperační komplikace a nakonec šetří práci sester i lékařů. Na druhé straně použití antibiotik ve smyslu profylaxe nese s sebou nebezpečí jisté selekce mikrobů, ale hlavně možnosti vzniku",
            "Caeruminis accumulatio. Jak odstraňovati zátky mazu  lušního ze zevního zvukovodu, pojednává G. Laurens. Především nutno se vystříhati všech nástrojů, jimiž by se mohla poraniti kůže, a třebas byl nástroj úplně sterilisovaný, může z mazu chovajícího spousty bakterií vniknouti do rány nákaza, z čehož resultuje otitis externa, furunculi atd. Stříkačka musí býti tak konstruována, aby se dala sterilisovati co nejpřísněji. Budiž opatřena 3 prsteny. Nechť pojme asi 100 gr. tekutiny. Konec stříkačky budiž opatřen měkkou trubicí kaučukovou. Voda má býti 370 C. teplá. Naplníme jí stříkačku tak, aby neobsahovala bublin, které narážejíce na bubínek, způsobují nepříjemné šelesty. Nemocný při vystřikování má seděti. Na rameně pod uchem chorým budiž šátek, aby se zamezilo potřísnění. Nemocný",
            "bití je a jaké jsou jeho příčiny, jaké okolnosti vznik jeho podporují, jaké vzniku jeho brání. Ne domýšleti se pouze a na základě domněnky jednati, ale pozorovati a stále pozorovati, sbírati materiál, zaznamenávati vše, co pozoruhodného shledáme v atmosféře i v přírodě před vznikem bouřky, při tvoření se mraků, před výbuchem krupobití, během jeho i po něm. Teprve takový materiál, a ovšem musí býti věrohodný, poskytne nám podklad k dalšímu badání, teprve na základě velikého počtu pozorování a zaručených fakt bude lze pokusiti se o úspěšné proniknutí tohoto dosud přírodního tajemství a teprve pak, po zodpovědění otázky, co krupobití je a jaké jsou jeho příčiny, bude možno přikročiti k odpovědi i na otázku, zda a jakým způsobem bylo by možno jemu zabrániti.",
            "které jsou důležité: jsou to otázka reciprokního působení a otázka pásků na regulovaných zubech. Že při použití intermaxillarního tahu jsou oba závěsy ligatury k sobě přitahovány stejnou silou a směrem opačným, je jasné. Že dráha vykonaná oběma uvedenými body bude stejná ceteris paribus, je rovněž jasné. Složitější ale jest otázka, jaké jsou podmínky pro vykonání tohoto pohybu pro zuby, po př. chrup v čelisti horní a jaké v čelisti dolní. U této nad jiné důležité otázky se dr. Žák zmínil pouze o dvou okolnostech, že u horní čelisti bude tento odpor zvýšen pevným spojením s basí lebky, naopak ale, že bude opět snížen menší kompaktností kosti. Leč poměry tyto nejsou daleko tak jednoduché, jak by se zdálo, neboť dalším poznatkem ze zkušenosti je, že opět ceteris paribus pohyb",
            "Předmětem jednání byly i pojmy Třetí svět, rozvojové země, země na cestě rozvoje ap. Podobně značná část diskuse se soustředila ke specifickým projevům nacionalismu v RZ, k odlišným rysům politických stran v Asii a Africe ve srovnání s Evropou. Účastníci jednání se pokoušeli rovněž o vymezení pojmu islámský faktor nebo čínský faktor, kategorie subimperialismu (jedná se o některé rozvojové země, které v posledním desetiletí, zejména díky příjmům z těžby nafty se staly významnými činiteli v určité oblasti a některé z nich usilují hrát úlohu četníka imperialismu pro tu nebo onu oblast). Na konferenci se rovněž jednalo o dialektickém vztahu mezi vnitřními a zahraničními faktory a předmětem živé diskuse byla i otázka jak dalece význam RZ vzrůstá v mezinárodních vztazích a jaké jsou důsledky tohoto procesu."
        ],
        "response":"Použití nesterilizovaných nástrojů při odstraňování ušních mazových zátek může vést k otitidě externí a furunkulím [doc2]. Je nutné se vystříhat všech nástrojů, které by mohly poranit kůži, protože i sterilizovaný nástroj může zavléct infekci z mazu [doc2]. K minimalizaci rizika infekce je doporučeno používat stříkačku, která je pečlivě sterilizovatelná, opatřenou třemi prsteny, pojmou 100 gramů tekutiny a s měkkou kaučukovou trubicí na konci [doc2]. Voda by měla mít teplotu 37 °C a stříkačka by neměla obsahovat bubliny [doc2]. Pacient by měl sedět a pod uchem by měl mít šátek, aby se předešlo potřísnění [doc2].",
        "reference":"Použití nesterilizovaných nástrojů při odstraňování ušních mazových zátek může vést k poranění kůže a následnému vniknutí infekce z mazu, což může způsobit otitis externa, furunkly a další komplikace. Doporučuje se používat stříkačku, která je konstruována tak, aby se dala co nejpřísněji sterilizovat, a opatřit ji měkkou kaučukovou trubicí, přičemž voda má být 37 °C teplá a stříkačka nesmí obsahovat bubliny.",
        "faithfulness":1.0,
        "answer_relevancy":0.9390798634,
        "answer_correctness":0.6709184493,
        "context_precision":0.5,
        "context_recall":1.0,
        "context_sufficiency":0.0
    },
    {
        "user_input":"Jaké terapeutické zkušenosti a postupy byly získány při léčbě epidemie dysenterie, a proč byly obvyklé prostředky jako opium, klystýry a čípky kokainomorfiové považovány za nedostatečné?",
        "retrieved_contexts":[
            "Dysenteria. Sdělení z praxe. Ježto jsem pozoroval, že v „L. R.“ uveřejňují se též poznámky z lékařské praxe, jež jsou pro nás lékaře praktické velmi důležité a mnohdy velice vhodné a užitečné, posýlám též něco z praxe pro „L. R.“ Ku konci loňského roku a na počátku letošního navštívila v mém obvodu některé obce nemilá a dosti vzácná epidemie dysenterie, při níž nabyl jsem jisté zkušenosti therapeutické, na které zajisté nám praktikům nejvíce záleží. Prozkoušel jsem na počátku téměř všechny známé prostředky z přístupných mi knih učebných, ale celkem málo mne uspokojovaly. Hlavně obtížné tenesmy neustupovaly ani opiu ani klystérům různým, ani čípkům kokainomorfiovým. Rovněž tvrdošijné průjmy vzdorovaly všem podávaným obvyklým prostředkům utišujícím. Veden jsa",
            "Dochodila-li matka již svůj čas, stane se nepokojnou, hrabe nohama, staví se často jako by močiti chtěla, obyčejně si lehne, ohlíží se často do zadu, a to za tou příčinou, že chvílemi v životě bolesti ku míru velké, jindy zase nedostatečné neb nižádné, což obé škodlivé jest. Jsou-li bolesti ku porodu příliš velké, tuť nutno krávě dávati počisťující klystýry a ochlazující nápoje, pozoruje-li se na krávě horko, spěšný oběh krve (puls), zrychlené dýchání a tuhé kálení. Jsou-li příčinou velkých bolestí křeče, tu se podává spařenina květu heřmánkového neb koření kozlíkového s opium neb listem blínu a též klystýry s olejem. Bolesti ku porodu nedostatečné neb nižádné vyžadují, aby se povzbudily. U tělnatých a dobře krmených matek spomáhají léky počisťující, jako hořká",
            "Nikdy nedošlo k pooperační komplikaci a kontaminaci břišní dutiny. U amébového abscesu byla evakuace a drenáž doplněna léčbou emetinem. Třetího dne však došlo k těžkému kardiovaskulárnímu seláhní z toxického poškození myokardu emetinem. Stav se upravil po nahražení emetinu chlorochinem. Oba nemocní, u nichž jaterní absces komplikoval apendicitidu (jednou po AE, jednou po konzervativní léčbě — šlo o nemocné z jiných ústavů), zemřeli. Při pitvě byly nalezeny malé abscesy hluboko v parenchymu, které byly před operací zjištěny angiograficky, ale při operaci nebyly nalezeny. Naše zkušenosti ukazují, že: 1. arteriografie jaterní tepny a SPG jsou spolehlivou pomůckou při diagnostice jaterního abscesu; 2. transperitoneální přístup je výhodnější než ostatní přístupové cesty pro možnost revize celých jater a nezvyšuje nebezpečí z kontaminace břišní dutiny; 3. riziko toxického poškození myokardu při léčbě emetinem je reálné a od zahájení léčby je nutno mít po ruce prostředky zvládnutí srdečního selhání.",
            "V. 2. 5. Západní Evropa, Kanada a USA  Množství starostí výživářským znalcům působily i kuchyně západních zemí. Zejména v době vrcholící studené války se jevilo pozitivní hodnocení jakékoliv součásti života v západním světě jako krajně nevhodné a výživa nepředstavovala v tomto směru žádnou výjimku.1026 Znamenalo to mj. i obcházení 027 národních gastronomií, které byly považovány za nejvyspělejší na světě.  k výživě venkova a též města, VL 5, 1950, č. 5, s. 103, kde autor rovněž jako vzor doporučuje snídaně obvyklé v SSSR. Zároveň se v tomto ohledu zmiňuje o Švédsku. 101 Srv. anonymní předmluvu k cyklu Záběry z cizí kuchyně, VL 12, 1957, příloha Výživa v rodině 1, 1957, č. 1, s. 3. Za ruské jídlo byl v této souvislosti považován např. i šašlik. Srv. také M. Úlehlová-",
            "říše subvencemi. Důvody, proč stavby zavodňovacích kanálů (a k tomu patřících nádržek) k zlepšení půdy mají býti od země provedeny, vysvítají dostatečně z předešlých pojednání, a zbývá tudíž jen vylíčiti, kdy mají stavby tyto býti provedeny a jakým spůsobem se mají zaopatřiti potřebné k tomu prostředky. Již kolikráte bylo zde zmíněno, že se snad nepodaří, získati pro zavodňování půdy ihned všechny ony hospodáře, kteří jsou majitely k zavodňování tu určených 32.000 hektarů pozemků, a to nejméně v době, kde by ještě nebylo v údolí řeky Moravy žádného průplavu. Mínění toto zakládá se na posouzení našich hospodářů a jejich nynějších poměrů; ono se opírá též o mnohé zkušenosti, které v naši zemi za příčinou rozlíčných otázek o upravování našich řek byly získány. Ono jest též bezpochyby správné, a proto bylo by to dle vší pravdě-"
        ],
        "response":"Lékař pozoroval epidemii dysenterie na počátku roku a zkoušel různé prostředky z učebnic, ale celkem ho málo uspokojovaly. Obtížné tenesmy (křeče) ustupovaly jen málo i při podávání opia, klystýrů a čípků kokainomorfiových. Rovněž tvrdošijné průjmy vzdorovaly všem podávaným obvyklým prostředkům utišujícím [doc1].",
        "reference":"Při léčbě epidemie dysenterie byly získány terapeutické zkušenosti, které ukázaly, že obvyklé prostředky jako opium, klystýry a čípky kokainomorfiové byly považovány za nedostatečné, protože hlavně obtížné tenesmy neustupovaly a tvrdošijné průjmy vzdorovaly všem podávaným obvyklým prostředkům utišujícím.",
        "faithfulness":1.0,
        "answer_relevancy":0.9023397171,
        "answer_correctness":0.4890008236,
        "context_precision":1.0,
        "context_recall":1.0,
        "context_sufficiency":0.0
    },
    {
        "user_input":"Jaké byly důvody americké vlády pro protest proti španělským rejdařům a jaké důsledky mělo toto jednání na vztahy mezi Spojenými státy a Španělskem v kontextu zásobování německých ponorek a vojenské situace v Evropě?",
        "retrieved_contexts":[
            "... centrum, Paco de Lucía (Š pan ě lsko , Kytara ... srpna, Companía María Serrano – Flamentango (Š pan ě lsko ), Brno-Boby centrum, www.iberica.cz\n3.30 Š pan ě lsko ... 11 Nižší hranice ve Spojeném království, atd. ... Hranice originality Afrika Amerika Asie Evropa Oceánie Others\nBlanc-Sablon - Iqaluit - Montreal - Nipigon - Ottawa - Pangnirtung - Thunder Bay - Toronto ... Spojené království (Velké Británie a Severního ...\nObjevte exkluzivní výběr nemovitostí na prodej v Chorvatsko. Najděte naše 69 domy a byty na www.green-acres.hr, abyste našli svůj nový domov.\nCompra una tarjeta eSIM y ahorra en cargos de roaming. Uso de internet móvil y datos para más de 200 países. TurkSIM es el proveedor de eSIM mejor ...\n6023 Evropa Style s dlouhým rukávem košile halenky ... 0.00 na Spojené státy přes China Post Air\nSpojené Státy Argentina Kanada Kolombie Mexiko Panama ... Portugal Rusko Š pan ě lsko Slovensko Švédsko Švýcarsko\n1) abstraktní umění - Evropa (1) academic libraries (1) academies of science academies of science and a.. ... 2) Alhambra (Š pan ě lsko ) (1 ...\nToto úzce specializované, krátkodobé opatření se vztahuje pouze na ropu, která je již na cestě a nepřinese Rusku žádné podstatné finanční výhody.\" t.me\/to_ je _nas_svet.\nSpojené státy v noci na pátek povolily zemím na 30 dní nakupovat ruskou ropu již naloženou na tankerech na moři ve snaze stabilizovat světové trhy s energiemi, oznámil na síti X americký ministr financí Scott Bessent.\nŠpanělsko neumožnilo USA využívat své základny pro útok na Írán. Pro kritiky a odborníky na obranu to představuje odklon od společného spojeneckého postoje a může to mít střednědobé důsledky .\nAmerický prezident Donald Trump si rozpoutáním války v Íránu proti sobě popudil americké farmáře. Varovný dopis, který mu napsali, přichází v nejhorší možné době jak pro Trumpa, tak pro republikány.\nZemě je ve skutečnosti závislá na americké podpoře, navíc je po celá desetiletí vojensky okupována USA. Merz by na americké prohlášení samozřejmě nereagoval, jeho zbabělost byla jednoduše důsledkem institucionální situace jeho země – a prakticky celého evropského bloku.\nTuto informaci nebylo možné ověřit. Dříve izraelská armáda vydala varování k evakuaci pro části Teheránu a Qazvinu, který se nachází asi 144 kilometrů severozápadně od hlavního města.\nRozhodnutí bylo potvrzeno tento pátek (13) při jednání mezi oběma zeměmi. Tento návrh by vznikl v souvislosti s jednáním zahrnujícím plán spolupráce mezi Brazílií a Spojenými státy americkými zaměřený na boj proti organizovanému zločinu.\nToto je nová realita.“ Myslím si, že právě tento změněný tón urazil nejen evropské vlády , ale i veřejnost. A důsledek je jasný – podle posledního průzkumu European Council on Foreign Relations jen šestnáct procent Evropanů uvedlo, že Spojené státy stále považují za spojence."
        ],
        "response":"Španělsko neumožnilo USA využívat své základny pro útok na Írán [doc1]. Americký prezident Donald Trump si rozpoutáním války v Íránu proti sobě popudil americké farmáře [doc1]. Podle posledního průzkumu European Council on Foreign Relations jen šestnáct procent Evropanů uvedlo, že Spojené státy stále považují za spojence [doc1].",
        "reference":"Americká vláda protestovala proti španělským rejdařům, protože se domnívala, že jejich sazby jsou nízké, a zdůraznila, že Amerika poslala pětkrát více zboží do Španělska, než Španělsko do Francie pro severoamerická vojska, jak bylo slíbeno. Důsledkem tohoto jednání bylo, že Spojené státy nemohou připustit, aby jejich zboží dostávalo se do rukou jejich úhlavních nepřátel, a upozornily španělskou vládu, že je nepřípustné, aby zásobovala německé ponorky z přístavů španělských.",
        "faithfulness":1.0,
        "answer_relevancy":0.7978270762,
        "answer_correctness":0.3908137915,
        "context_precision":0.0,
        "context_recall":0.0,
        "context_sufficiency":0.0
    },
    {
        "user_input":"Jaké byly strategické důvody pro upřednostnění krátkých traťových spojení před dlouhými námořními cestami a jaký vliv mělo toto rozhodnutí na vojenské operace a zásobování během konfliktu?",
        "retrieved_contexts":[
            "kou porážku za této války a pozbyla naděje na její rychlé skončení. Porážka Němců před Moskvou se projevila ve svých důsledcích i při německé ofensivě roku 1942, která se musila omezit na jižní část fronty a byla vedena ve směru na Stalingrad a Kavkaz, kde ovšem dosáhla na čas významných úspěchů. Náporem na Stalingrad sledovali Němci dalekosáhlé cíle strategické i politické. Jeho dobytím zamýšleli přerušit spojení mezi severem a jihem dále pak ofensivou vedenou odtud na sever odříznout a zničit sovětské armády okolo Moskvy. Utokem na jih se chtěli zmocnit celé kavkazské oblasti naftových polí a ovládnout Černé moře. To vše mělo vytvořit předpoklady pro operace směřující proti Indii a východní Sibiři. I z tohoto stručného vylíčení je vidět, jaký přímo osudový význam měla",
            "Němci svou strategickou situací a převahou svého železničního spojení. Tím měl by býti jednou pro vždy vyřízen spor mezi východní a západní školou. Je čirou skutečností, že dlouhé cesty námořní, jež jsou vydány útokům ponorek, a jichž se užívá nejen pro dovoz armádám, ale i k zásobování doma, nelze srovnávati s krátkými spojeními traťovými, která mohou býti rušena nejvýše příležitostnými útoky leteckými. Nesmí tudíž býti nadále vzdálených podniků; jen takové, jež jsou nutné k ochraně nejdůležitějších zájmů říšských. Maurice zdůrazňuje výrok Clémenceauův, že vítězství je jisté, jestliže veřejné autority budou na výši situace. Maurice praví dále: Máme co činiti s nepřítelem, který organisoval vědecky válku. Učinili jsme podobně. Naučili jsme se něčemu v těžké škole, kterou jsme prožili, můžeme se mno-",
            "britského ministerstva války. Ještě pozkého paktu ve válce. Náčelník xeneději, když Američané ministerstvo rálního štábu Spojených států generál opustili, přijeli do britského generálBradley totiž prohlásil, že úkolem ního štábu generálové norské a dánské amerických vojsk v budoucí válce bude armády, kteří se sejdou s americkými strategické bombardování, zatím co generály před jejich odjezdem do Paevropské státy v čele s Britannií buříže. Během středečního večera byly dou dodávat »potravu pro děla«. Velké všechny čtyři vojenské misse — ameznepokojení u britského obyvatelstva rická, dánská, norská a britská — přivyvolává jednostranné rozhodnutí Amejaty anglickým králem. Ve čtvrtek ričanů, oznámené v úterý v Německu odletí Američané do Paříže, kde v pá-",
            "britského ministerstva války. Ještě pozkého paktu ve válce. Náčelník xeneději, když Američané ministerstvo rálního štábu Spojených států generál opustili, přijeli do britského generálBradley totiž prohlásil, že úkolem ního štábu generálové norské a dánské amerických vojsk v budoucí válce bude armády, kteří se sejdou s americkými strategické bombardování, zatím co generály před jejich odjezdem do Paevropské státy v čele s Britannií buříže. Během středečního večera byly dou dodávat »potravu pro děla«. Velké všechny čtyři vojenské misse — ameznepokojení u britského obyvatelstva rická, dánská, norská a britská — přivyvolává jednostranné rozhodnutí Amejaty anglickým králem. Ve čtvrtek ričanů, oznámené v úterý v Německu odletí Američané do Paříže, kde v pá-",
            "Verkürzte Flugwege aber bedeuten im Kriege vermindertes Risiko, verminderte Abnutzung von Personal und Material, geringere Zuladung von Treibstoff, damit vermehrte Zuladungsmöglichkeit von Bomben und so vermehrte Kampfkraft. Endlich ist es möglich, auf kurzen Anflugwegen Flugzeuge einzusetzen, die früher infolge ihrer geringeren Reichweiten nicht gegen England fliegen konnten (leichte Kampfflieger, Jäger und Zerstörer, letztere besonders zum Begleitflug). Demgegenüber ist festzustellen, daß die Länge der Anflugwege der RAF gegen Deutschland sich nicht verändert hat. Aber das Risiko ist größer geworden. Denn Englands Grenze liegt nicht mehr am Rhein, wie das früher einmal so schön gesagt wurde. Der Gefahrenbereich für den englischen Bomber, der Deutschland angrei-"
        ],
        "response":"Podle [doc2] měly krátké traťové spojení výhodu oproti dlouhým námořním cestám, které byly zranitelné vůči útokům ponorek. Krátké traťové spojení umožňovaly omezit vzdálenost podniků a byly méně náchylné k leteckým útokům. [doc5] uvádí, že zkrácení letových tras znamenalo snížení rizika, menší opotřebení personálu a materiálu, menší spotřebu paliva a tím i větší nosnost bomb a tím i větší bojovou sílu. Zkrácení letových tras umožnilo nasazení letadel, která dříve nemohla kvůli omezenému doletu létat proti Anglii.",
        "reference":"Krátká traťová spojení byla upřednostněna před dlouhými námořními cestami, protože dlouhé cesty námořní byly vystaveny útokům ponorek a byly používány nejen pro dovoz armádám, ale i k zásobování doma, zatímco krátká traťová spojení mohla být rušena nejvýše příležitostnými útoky leteckými. Toto rozhodnutí mělo vliv na vojenské operace a zásobování tím, že se zaměřilo na ochranu nejdůležitějších zájmů říšských a zajištění, že nepřítel nesmí prorazit, což bylo klíčové pro úspěch v bitvách a obraně strategických pozic.",
        "faithfulness":1.0,
        "answer_relevancy":0.8590550051,
        "answer_correctness":0.6923686791,
        "context_precision":0.8666666666,
        "context_recall":1.0,
        "context_sufficiency":0.0
    },
    {
        "user_input":"Jaké byly důsledky rozhodnutí o suspendování činnosti \"Matice\" na její úředníky a jak se toto rozhodnutí projevilo v kontextu širšího boje proti slovenským institucím v 70. letech 19. století?",
        "retrieved_contexts":[
            "usnesla se platným způsobem na tomto dodatku ku § 19 stanov o rozpuštění spolku jednajícímu:  O právu stížnosti.  Na rozhodnutí poštovních a telegrafních ředitelstev o včitatelnosti služebního času, pak o přirčení nebo výměře zaopatřovacích platů může ve 14 dnech po dni, kdy rozhodnutí bylo doručeno, vznesena býti stížnost k obchodnímu ministeriu. Stížnost budiž podána u poštovského a telegrafního ředitelstva a nemá odkládacího účinku.  O podpůrné platnosti všeobecných pensijních pravidel.  Pokud pro posouzení zaopatřovacích nároků tímto nařízením upravených v tom kterém případu toto nařízení a ta nařízení a předpisy, kterými upraveny byly služební poměry zřízenců kategorií v § 1 vytčených, neobsahují žádného dostatečného poukazu, budiž podpůrně šetřeno všeobecných pensijních pravidel pro skutečné státní úředníky.",
            "„Matice,“ ale nejprv se páchala „veřejná měnka,“ až koncem roku 1875 vyslovené bylo ne zrušení „Matice,“ ale jen suspendování její činnosti (1). Majetek odevzdán byl vládnímu sekvestrovi a úřadníci „Matice“ ne dostali ani krejcaru „Abfertigungu,“ aby měli co kousat aspoň dotud, dokud si nenajdou chleba. Vyšetřování a vyslychání úřadníků nebylo žádné, aby se Paulinyi a Sasinek nemohli očistit od beťařských podezřívání, na cti urážek a veřejných potup. Jak spravedlivě (!) bylo jednáno proti „Matici,“ sloužiž toto za příklad: „Matice“ platila 10—15 zl. honoráře od archu spisovatelům, jeden spis byl, tuším, mimořádně honorován 20 zl. Beťarští náhončí pustili do světa lež, že jeden spis přišel „Matici“ na 1095 zl. Jak to? Co se vynaložilo na spisy, na platy úřadníků, na dům, na palivo atd.,",
            "Roku 1868 osadila vláda do matičnej budovy vojsko a v dvanástom roku trvania Matice, roku 1875, za ministerského predsednictva Kolomana Tiszu zahrdúsili Maticu úplne a jej majetok, určený slovenskému národu, zhabali s vyslovením krutého súdu, že „slovenského národa niet\".  A jednako i v krátkom svojom trvaní, v krutých časoch, Matica slovenská znamenala pre národ mnoho. Ani nie natol’ko svojou vedeckou a vydavatelskou činnostou, ktorú vo velkých rozmeroch rozvinút nebolo možno, ako už samou svojou existenciou. Z vydaní spominame bohaté „Letopisy Matice slovenskej“, do ktorých ukladali slovenskí vedeckí pracovníci svoje trudy; „Matičné kalendáre“, redigované znamenitým Danielom Lichardom na vzdelanie slovenského l’udu; Penzlovho „Ovocinára“ a Kmeťovho „Hospodára“ na povznesenie hospodárskeho života na dedinách; Emila Černého „Slovenské čítanky“ pre slovensku študujúcu mládež, vedl a iných rozmanitých publikácií.",
            "= Auflösung der „Matica Slovenska.“ (Te= mesvar, 9. August) Der slovakische Verein „Matica Slovenska“ in Turócz=Szent-Márton wurde vom Minister= präsidenten als Minister des Innern aufgelöst. Die Gründe dieser Maßregel waren, wie man aus L.-Sz.-Miklós schreibt, folgende: 1. Der Verein entspricht der Aufgabe, die er sich gestellt hat, nicht, da er sich mit slovakischer Literatur nicht beschäftigt. 2. Der Verein beschäftigt sich vielmehr, im Widerspruch mit seinen Statuten, mit Politik und zwar in agitato= rischer und unpatriotischer Weise. 3. Der Verein verwaltet sein Vermögen statutenwidrig (Verletzung der §§ 29—31 der Statuten.) 4. Der Verein verletzt die Intentionen seiner gründenden und ordentlichen Mitglieder, indem er staats= und vaterlandsfeindliche Zeitschriften geistig und materiell unterstützt.",
            "* Na uherském sněmu interpelloval vůdce Srbů Dr. Miletič vládu, z jakých příčin nařídila, aby slovenský literární spolek „Matice slov.“ rozpuštěn byl. Miletič odůvodnil tuto svou interpellaci výborně a byli jsme tudíž zvědavi, jak na ni ministr Tisza odpoví. Matice nejednala nikde proti svým stanovám; správcové její nebyli nikdy disciplinárně vyšetřováni, orgánové matiční nebyly nikdy napomenuti. Dle stanov měla být valná hromada svolána a ta měla ustanoviti, co se s jměním spolkovým státi má. Na tuto interpellaci odpověděl Tisza, že Matice učinila při otevření university Záhřebské státu nebezpečné osvědčení; že spolkoví úředníci brali platy, jež se se stanovami nesrovnávali. — Jmění spolkové bude nyní na úrok uloženo a později novému spolku, který skutečně jen účely osvěty bude sledovat (?), odevzdáno. O té maďarské spravedlnosti!"
        ],
        "response":"V roce 1875 byla činnost \"Matice slovenskej\" suspendována, což mělo několik důsledků pro její úředníky a projevilo se v širším kontextu boje proti slovenským institucím.\n\nÚředníci \"Matice\" nedostali žádné \"Abfertigung\" (odstupné), což znamenalo, že neměli prostředky k obživení [doc2]. Vyšetřování a vyslýchání úředníků neproběhlo, což znemožnilo jim očistit se od obvinění z \"beťařských podezřívání, na cti urážek a veřejných potup\" [doc2].\n\nRozhodnutí o suspendování \"Matice\" bylo součástí širšího boje proti slovenským institucím. Vláda v roce 1868 obsadila budovu \"Matice\" vojskem [doc3]. Rozhodnutí o suspendování bylo zdůvodněno tím, že \"Matice\" nedodržovala své statuty, zabývala se politikou a podporovala \"staats- und vaterlandsfeindliche Zeitschriften\" (časopisy, které byly proti státu a vlasti) [doc4].  Na uherském sněmu interpelloval Dr. Miletič vládu ohledně důvodů suspendování \"Matice\" [doc5]. Ministr Tisza uvedl, že \"Matice\" učinila \"státně nebezpečné osvědčení\" při otevření univerzity v Záhřebu a že úředníci \"Matice\" brali platy, které se neshodovaly se stanovami [doc5]. Jmění \"Matice\" mělo být uloženo na úrok a později odevzdáno novému spolku, který se bude zabývat pouze osvětou [doc5]. Rozhodnutí bylo vnímáno jako projev \"maďarské spravedlnosti\" [doc5].",
        "reference":"Úředníci \"Matice\" nedostali ani krejcaru \"Abfertigungu,\" aby měli co kousat aspoň dotud, dokud si nenajdou chleba, a nebylo žádné vyšetřování a vyslychání úředníků, aby se Paulinyi a Sasinek nemohli očistit od beťařských podezřívání, na cti urážek a veřejných potup. V kontextu širšího boje proti slovenským institucím v 70. letech 19. století se rozhodnutí o suspendování činnosti \"Matice\" projevilo jako součást krutějšího boje, který zavedl Tisza, a který byl namířen proti slovenským institucím, navzdory tomu, že Slováci i bez šlechty se pohybovali.",
        "faithfulness":0.8888888889,
        "answer_relevancy":0.8760593822,
        "answer_correctness":0.4098115825,
        "context_precision":0.6791666666,
        "context_recall":1.0,
        "context_sufficiency":0.0
    },
    {
        "user_input":"Jaké byly důsledky zavedení krutějšího boje Tiszou v roce 1874 na slovenskou kulturu a vzdělanost, a jakou roli v tomto procesu hrála Matice Slovenská a její finanční prostředky?",
        "retrieved_contexts":[
            "ním prý odpor zmizel a 80% z nich si tento pokrm oblíbilo. 438 U starší generace představovala negativní faktor také pozice ovesných vloček jako náhražky jiných potravin v době 2. světové války. 439 Situaci nijak neovlivňovaly zmínky o mimořádném významu ovesné kaše pro stravu starých Slovanů, které v tomto ohledu částečně překrývaly odkazy na anglosaskou kulturu. 440 Naopak určitou negativní roli opět hrála selhávající distribuce - i přes nevelký zájem nebyl na některých místech na vnitřním trhu dostatek ovesných vloček.441 V roce 1953 požadovala ministryně potravinářského průmyslu Ludmila Jankovcová zavedení výroby vloček z jiných obilnin i tzv. vzdušných zrn po vzoru Sovětského svazu.442 Podobně nevalně jako pokusy prosadit ve větší míře ovesnou kaši do českého jídelníčku končily i zmiňované snahy",
            "runu, pomýlena jsouc dějepisem i za maďarství, majíc Arpáda za Maďara a korunu uherskou za maďarskou. Navzdor tomu Slováci i bez šlechty se pohybovali. Rokem 1867. započal boj proti „Matici,“ ale mírný. To Maďarům, umělým doktrinářstvím na nohy postaveným, nedostačovalo, ačkoliv vládu, finance, hon védy, školy a úřady měli ve své ruce. Roku 1874 krutější boj zavedl Tisza, člověk bez Hned pod ním Grünwald, podžupan FEUILLETON.  H. lid. Jaké to budou knihy, možno se dovtípit z toho, že ve výboru je opět ten Grünwald. Spolek ten bude vydávat knihy pro Slováky jedovaté a Tisza bude mu na ně dávat peníze z fondu „Matice Slovenské“, která je založena od milovníků národa slovenského k prospěchu a vzdělanosti národa slovenského Nejprv Slováky připravili o majetek, a nyní budou z jejich peněz Slováky hubit. Tak dalece jde rytířskost. To není jednání civilisační, nýbrž jednání naskrz libovolné, nespravedlivé.",
            "Roku 1868 osadila vláda do matičnej budovy vojsko a v dvanástom roku trvania Matice, roku 1875, za ministerského predsednictva Kolomana Tiszu zahrdúsili Maticu úplne a jej majetok, určený slovenskému národu, zhabali s vyslovením krutého súdu, že „slovenského národa niet\".  A jednako i v krátkom svojom trvaní, v krutých časoch, Matica slovenská znamenala pre národ mnoho. Ani nie natol’ko svojou vedeckou a vydavatelskou činnostou, ktorú vo velkých rozmeroch rozvinút nebolo možno, ako už samou svojou existenciou. Z vydaní spominame bohaté „Letopisy Matice slovenskej“, do ktorých ukladali slovenskí vedeckí pracovníci svoje trudy; „Matičné kalendáre“, redigované znamenitým Danielom Lichardom na vzdelanie slovenského l’udu; Penzlovho „Ovocinára“ a Kmeťovho „Hospodára“ na povznesenie hospodárskeho života na dedinách; Emila Černého „Slovenské čítanky“ pre slovensku študujúcu mládež, vedl a iných rozmanitých publikácií.",
            "nýbrž posílila zároveň důvěru českého lidu va, zvýšena vzdělanost a kulturní úroveň k své školské a osvětové činnosti. Jen v lidu našeho. Třeba zápasila Matice Opavská jediném bodu činnost Matice Opavské vzala s finančními obtížemi, přece plnila a plní újmu. Znemožněno bylo pořádání různých poctivě své národní a kulturní poslání ve slavností, zejména Matičního dne, jehož Slezsku. A finanční potíže byly a jsou značmnohatisícový výtěžek býval každoročně vyné. Tvořiť jádro českého Slezska maloroldatnou posilou matiční pokladny. Tím spíše nictvo a dělný lid, není zde velkých českých měli by všichni lidé dobré vůle v dnešní juprůmyslových podniků, peněžních ústavů s bilejní chvíli vzpomínati památných slov nemilionovými kapitály, velkostatků, ba ani če-",
            "roda. Idete vykonat skutok, rozhraničný pre celú históriu tohoto národa: pomník minulosti, základ budúcnosti...\" Moyses stal sa prvým predsedom Matice slovenskej, Kuzmány jej prvým podpredsedom.  Roku 1868 osadila vláda do matičnej budovy vojsko a v dvanástor roku trvania Matice, roku 1875, za ministerského predsednictva Kolomana Tiszu zahrdúsili Maticu úplně a jej majetok, určený slovenskému národu, zhabali s vyslovením krutého súdu, že „slovenského národa niet“.  A jednako i v krátkom svojom trvaní, v krutých časoch, Matica slovenská znamenala pre národ mnoho. Ani nie natol’ko svojou vedeckou a vydavatelskou činnostou, ktorú vo velkých rozmeroch rozvinút nebolo možno, ako už samou svojou existenciou. Z vydaní spominame bohaté „Letopisy Matice slovenskej“, do ktorých ukladali slovenskí vedeckí pracovníci svoje trudy; „Matičné kalendáre“, redigované znamenitým Danielom Lichardom na vzdelanie slovenského ludu; Penzlovho „Ovocinára“ a Kmeťovho „Hospodára“ na povznesenie hospodárskeho života na dedinách; Emila Černého „Slovenské čítanky“ pre slovensku študujúcu mládež, vedl a iných rozmanitých publikácií."
        ],
        "response":"V roce 1874 zahájil Koloman Tisa krutější boj proti Matice Slovenskej [doc3, doc5]. Vláda osadila v roce 1868 do matičnej budovy vojsko a v roce 1875 Matici úplně zahrdúsili a zhabali její majetek, určený slovenskému národu, s tím, že „slovenského národa niet“ [doc3, doc5]. Matice Slovenská hrála významnou roli v slovenské kultuře a vzdělanosti, a to i přesto, že její vědecká a vydavatelská činnost nebyla ve velkém rozsahu možná, a to již samotnou svou existencí [doc3, doc5]. Vydávala například \"Letopisy Matice slovenskej\", \"Matičné kalendáre\", Penzlovho „Ovocinára“ a Kmeťovho „Hospodára“ a Emila Černého „Slovenské čítanky“ [doc3, doc5]. Finanční prostředky Matice Slovenskej byly využívány k vydávání knih a podporu slovenské kultury, ale v roce 1875 byly zhabány a použity proti slovenského národu [doc2, doc3, doc5].",
        "reference":"Zavedení krutějšího boje Tiszou v roce 1874 mělo negativní důsledky na slovenskou kulturu a vzdělanost, protože Tisza podporoval vydávání knih pro Slováky, které byly považovány za jedovaté, a financoval je z fondu Matice Slovenské, která byla původně založena k prospěchu a vzdělanosti slovenského národa.",
        "faithfulness":1.0,
        "answer_relevancy":0.8673941934,
        "answer_correctness":0.4025496017,
        "context_precision":0.5888888889,
        "context_recall":1.0,
        "context_sufficiency":1.0
    },
    {
        "user_input":"Jaké byly důsledky politických a sociálních postojů vyjádřených v Národních Listech na postavení svobodných národů v Anglii a Belgii ve srovnání s národy pod byrokratickým a policejním tlakem?",
        "retrieved_contexts":[
            "Listy ofert pracy. Szukane oferty. Popularne stanowiska pracy.\nLevné zpáteční letenky do destinace Belgie .Katalánsko. Andalusie. Anglie .\nVelká změna v Anglii . O postup do Premier League bude od příští sezony hrát více týmů.\nV Belgii byla podána žaloba na bývalého generálního tajemníka NATO Jense Stoltenberga. Byl obviněn z...Zahraniční. Orbánova parta sejmula Albion! Anglie - Maďarsko 0:4.\nAnglie - FA Cup.\nChance Národní Liga. MOL Cup.Andorra. Anglie . Angola. Antigua a Barbuda.\nNárodní liga.Konferenční liga. Anglie . Španělsko. Itálie.\nmecku a mobilisovati, praví se o Belgii : Neutralitu Belgie nemůže Německo respektovat i. Náčelník generálního štábu prohlásil, že dokonce i neutralita anglická by byla za cenu respektování Belgie vykoupena příliš těžce, protože útočná válka proti Francii je možná jen na linii Belgie .\nJaké důsledky měly akce jednotlivých znepřátelených stran na občanskou společnost i vojsko? Jaké byly rozdíly v životech obyčejných Čech. Srovnání těchto řekněme měkkých důsledků válek provedou historici ve videu z pořadu Historie.cs.\nPo roce 1848 - nacionalismus, začíná se prosazovat požadavek demokratizace volebního systému (účast lidu na vládě), v politické sféře se prosazuje prozatím neoabsolutismus.\nRevoluce roku 1848, známá také jako Jaro národů nebo Rok revoluce, byla řada občanských a národních revolucí, jež zasáhly evropský kontinent.\nDějiny českých politických stran reflektují postupný vývoj politických subjektů na území českých zemí, které reprezentují etnicky převážně českou populaci. Parlamentní život na území českých zemí se poprvé rozvinul během revolučního roku 1848.\nOporou vlády se stala mocná státní policie a spolu s ní byrokratický (úřednický) aparát, který ovládal celou státní správu. Šíření „podvratných\" myšlenek bránila cenzura. Opozici zastrašil císař tím, že volání po změnách označil za jakobínské spiknutí a krutě ho trestal.\nrevoluce se rozšířila po celém císařství po vytvoření nové vlády v červnu (ministr spravedlnosti Alexandr Bach) začalo v červenci ve Vídni zasedání ústavodárného říšského sněmu (přítomni i čeští poslanci - Palacký, Rieger) o podobě nové ústavy, o zrušení roboty\nV roce 1848 zachvátila evropský kontinent vlna revolucí, která zapříčinila řadu společenských i politických změn. Napříč Evropou měla revoluce různý průběh i charakter.\nV revolučním roce 1848 to v Praze stejně jako v jiných evropských městech vřelo. V druhé polovině května došlo k sociálním nepokojům. S požadavky na zvýšení mezd a úpravu pracovních poměrů vystoupili tiskaři kartounu, typografové, truhlářští, krejčovští a bednářští tovaryši."
        ],
        "response":"V kontextu dostupných pramenů chybí podklady k tomu, jaké důsledky měly politické a sociální postoje vyjádřené v Národních Listech na postavení svobodných národů v Anglii a Belgii ve srovnání s národy pod byrokratickým a policejním tlakem.",
        "reference":"V žádné svobodné zemi, jako je Anglie a Belgie, nevedlo obírání se politikou, schůzky a slavnosti národní k bídě a k žebráctví, zatímco národy pod byrokratickým a policejním tlakem čelí novému podrobení a klamu.",
        "faithfulness":0.0,
        "answer_relevancy":0.0,
        "answer_correctness":0.8244774393,
        "context_precision":0.0,
        "context_recall":1.0,
        "context_sufficiency":0.0
    },
    {
        "user_input":"Jaké jsou důsledky horského tlaku na přeměnu hornin a jak se tento proces liší od vlivu sopečných výparů a eruptivních hornin na okolní horniny?",
        "retrieved_contexts":[
            "spíše písčitými a hlinitými sedimenty, a teprve účinkem horského tlaku že zkrystalovaly na břidlice pokryvačské, na svor s granáty a na křemence. Poukázal zároveň, že ve Švýcarech jsou známy mnohem mladší krystalické a krystalicko-klastické břidlice; vyskytují se totiž od útvaru kamenouhelného až do středních třetihor. Tlakem pukají horniny, drtí se zrna nerostná v nich; některé nerosty se proměňují, augit na. př. přechází na paprskovec a na uralit, olivin na plstnatý amfibol („pilit“), z masivních hornin stávají se horniny břidličnaté. Z diabasu tvoří se zelené břidlice rozmanitého vzhledu, na př. také blíž Ústí nad Labem. Z pískovců vznikají křemence, z vápenců zrnité mramory, z klastických hornin vůbec horniny krystalickým břidlicím podobné. Silurské břidlice poloostrova Bergen v Norvéžsku dle Reusche přeměněny jsou na",
            "rostů. Sopečné výpary proměňují horniny. Vystoupí-li nějaká eruptivní hornina puklinami, působí změny na horninách, jimiž prochází. Kde hoří delší čas uhelná ložiska, na př. v severních Čechách u Teplic, Karlových Varův a Bíliny, skelnatí břidlice hlinité v sousedství a pod. Nemalé však proměny hornin způsobovány bývají také horským tlakem, t. j. tlakem vyskytujícím se při tvoření nebo přeměňování horstev. Povaha a velikost takových změn byla již mnohokráte předmětem důmyslných studií, někdy přeceněna, nezřídka však také nedoceňována, a posud zbývá zde vůbec přemnoho práce. Darvin, Baur a Daubrée již v polovici tohoto století tušili, že veliký tlak může způsobovati značnou přeměnu hornin. Roku 1867 vyslovil Lossen, že krystalické břidlice Taunského pohoří byly původně nej-",
            "Hlediska pro roztřídění hornin dle Rosenbusche: 1. spůsob geologického výskytu, 2. struktura, 3. mineralogická a chemická skladba.*)  Spůsobem geologického výskytu skoro výhradně určen jest spůsob struktury u hornin vyvřelých: tato jest následkem teploty a tlaku, jaké v různých geologických prostorech působily při tuhnutí hornin. — Mineralogické složivo horniny záleží ponejvíce na chemické povaze hornin. — Na tom, ve které geologické době hornina vyvřela, spůsob struktury její původně nezáleží. Rozdíly mezi staršími (předterciárními) a novějšími (terciárními a poterciárními) horninami ve strukturách a ve vzhledu součástek bývají původu druhotného. Rosenbusch doufá, že rozeznávání hornin geologicky starších od hornin geologicky novějších časem přestane. Zatím",
            "homogenní hmota ve hlubinách zemských, která rozštěpuje se chemicky všelijak, a tím že vznikají asi různé látky různých hornin. Poslednější názor nyní převládá. Jeho zastanci byli a jsou: Durocher Roth, Rosenbusch, Iddings, (Nordenskjöld) atd. V pojednání o struktuře jest povšimnuto všech názvův a výměrů struktur hornin masivních, které pocházejí hlavně od Francouzů (Michel Lévy) a od německých badatelů (Rosenbusch). Všeobecnou část uzavírá autor srovnáváním vzájemných vlastností různých hornin eruptivních a stručnou statí o umělé reprodukci hornin těch. Následuje klassifikace hornin eruptivních. Klassifikace jest z nejdůležitějších otázek každé vědy, tedy i vědy petrografické. Klassifikace, kterou nalézáme u Zirkela, založena jest na nerostném složení a na struktuře hornin. Sám Zirkel právem dokládá, že jsou to znaky,",
            "severu na jih, od 140 m až ke 200 m. Svrchní oligocén je naproti stupňům předešlým, starším, složen z tufitu, hnědouhelných plástů, čedičových tufů, tefritických kouskových tusů, dále z rozličných eruptivních hornin jako čedičů, tefritu, fonolitu, trachytu a žilových hornin. Toliko o tufitech a hnědouhelných plástech, vložených do tufitů, dále o nejstarších čedičích v tefritech je dokázáno, že příslušejí období svrchního oligocénu. Erupce fonolitů a trachytů mohla býti i v dobách mladších. Věstník České Akademie. Ročn. VIII.  Třetihorní eruptivní horniny a jejich tufy jsou na území benešovském rozmanité. Nejrozšířenějšími zjištěny čediče a jejich tufy; tufy jsou řídké, tolikéž tefrity, znělce a trachyty jeví se jaksi podřízenými. Žílové horniny jsou soustředěny na jihu. Většina z nich má ráz kamptonitický. I zde na-"
        ],
        "response":"Horské tlaky způsobují pukání hornin a drcení zrn nerostů v nich. Některé nerosty se přitom mění, například augit na paprskovec a uralit, olivin na plstnatý amfibol („pilit“). Z diabasu se tvoří zelené břidlice, z pískovců křemence a z vápenců zrnité mramory [doc1]. Darvin, Baur a Daubrée tušili již v polovině 19. století, že velký tlak může způsobovat značnou přeměnu hornin [doc2].\n\nSopečné výpary a eruptivní horniny působí na okolní horniny, když vystoupí puklinami a způsobí změny [doc2]. Eruptivní horniny mohou také měnit okolní horniny, když se uhelná ložiska hoří, například v severních Čechách u Teplic, Karlových Varů a Bíliny, kde se břidlice hlinité skelnatí v sousedství [doc2].",
        "reference":"Horský tlak způsobuje pukání hornin, drcení zrn nerostů a proměnu některých nerostů, což vede k přeměně masivních hornin na horniny břidličnaté, zatímco sopečné výpary a eruptivní horniny působí změny na horninách, jimiž procházejí, například skelnatění břidlic hlinitých v sousedství hořících uhelných ložisek.",
        "faithfulness":1.0,
        "answer_relevancy":0.8251335954,
        "answer_correctness":0.7169751078,
        "context_precision":1.0,
        "context_recall":1.0,
        "context_sufficiency":1.0
    },
    {
        "user_input":"Jaký je rozdíl mezi masivními horninami eruptivního původu a krystalickými břidlicemi z hlediska jejich struktury a uspořádání součástek, a jaké důsledky to má pro jejich geologické vlastnosti a chování v přírodě?",
        "retrieved_contexts":[
            "sobu seskupení jejich vzniká rozličná struktura neboli sloh hornin. Ku popisu Zirkel veškery horniny rozděluje hlavně s geologického stanoviska a rozeznává: I. Masivní horniny eruptivního původu. Jsou úplně krystalické, někdy třeba sklovité. Součástky jejich nejsou uloženy více nebo méně rovnoběžně dle nějaké roviny, nýbrž jsou rozsázeny všemi směry. II. Krystalické břidlice. Jsou horniny úplně krystalické, jejichž součástky dle jedné roviny více nebo méně rovnoběžně jsou seřaděny. Neprostupují jinými horninami tak, jako činí horniny eruptivní. III. Horniny sedimentární krystalické (neb aspoň ne klastické). IV. Horniny klastické. Nejprve tedy jednáno o utuhlých horninách masivních a tu předeslána jest část všeobecná, jednající podrobně o geologických poměrech jejich, o ne-",
            "Hlediska pro roztřídění hornin dle Rosenbusche: 1. spůsob geologického výskytu, 2. struktura, 3. mineralogická a chemická skladba.*)  Spůsobem geologického výskytu skoro výhradně určen jest spůsob struktury u hornin vyvřelých: tato jest následkem teploty a tlaku, jaké v různých geologických prostorech působily při tuhnutí hornin. — Mineralogické složivo horniny záleží ponejvíce na chemické povaze hornin. — Na tom, ve které geologické době hornina vyvřela, spůsob struktury její původně nezáleží. Rozdíly mezi staršími (předterciárními) a novějšími (terciárními a poterciárními) horninami ve strukturách a ve vzhledu součástek bývají původu druhotného. Rosenbusch doufá, že rozeznávání hornin geologicky starších od hornin geologicky novějších časem přestane. Zatím",
            "Hornina jest těleso geologické, proto jest dle Rosenbusche potřebí horniny oceniti nejprve s toho stanoviska, jaké zaujímají ve složivu pevné kůry zemské.  Veškery horniny dle spůsobu vyplnění prostoru ve smyslu geologickém jsou  1. vrstevnaté: činí rovnoběžné plátky nad sebou ležící a jsou postupně usazeny z tekutin, kdež byly buď mechanicky rozptýleny nebo chemicky rozpuštěny. 2. masivní nebo-li eruptivní: mají všemi směry stejnou povahu, prostupují jinými horninami, vynikly ze hloubek zemských původně jakožto stejnorodá měkká hmota č. »magma«  Poznam. Mezi 1. a 2. náleží tufy a nesouvislé splodiny sopečné vůbec, jsouce původu dle 2., ale usazeny podobně 1.  *) Srovn. článek můj »O soustavné sbírce petrografické v Museu král. Českého v:Živě« z r. 1894 čísle 6.",
            "vodu pokládána. Všude, kde dostihl člověk při svých pracích největších hlubin, setkal se s rulou. Než v posledních dobách se názory po této stránce značně změnily. Rula jest hlavním zástupcem břidlic krystalických, mezi něž čítáme ještě rozličné břidlice, fylity a svor. V petrografii (nauce o horninách) krystalické břidlice zaujímají zvláštní místo. Ostatní horniny totiž jsou buď krystalické (balvanité) a vznikly vyvřením sopečných hmot z hlubin zemských, anebo vrstevnaté, které se uložily z vody (sedimentární). Krystalické břidlice spojují však oba tyto odlišné znaky: jsou krystalické, avšak jsou zároveň i vrstevnaté. Poznalo se, že vrstevnatost krystalických břidlic nepochází asi z uložení ve vodě, nýbrž že vznikla spíše ohromným tlakem horotvorným. Starší nějaká hornina byla nesmírným tlakem, vytvořeným při horotvorných poruchách, tak zlisována, že se proměnila v horninu vrstevnatou, v krystalickou",
            "ruly, svory, fyllity a jiné břidlice krystalické. Podobně silurské břidlice v Ardennách, devonské břidlice v Durynsku a na Harcu. Velmi cenné studie podal v té příčině mimo Lossena, Reusche, Daubréa zvláště Heim, (známý velkým dílem, vydaným v Basileji roku 1878 a nazvaným „Untersuchungen über den Mechanismus der Gebirgsbildung“), pak také mnoho jiných badatelů, o jejichž pracích Zirkel taktéž pojednává velmi přehledně a věcně.  Horniny vůbec dle morfologie svých nerostných součástek dělí se na krystalické, amorfní a klastické. Krystalickými (krystalinními, krystalinickými) slovou horniny složené z nerostů krystalovaných. Obrysy těchto nerostů bývají však obyčejně nepravidelny; neboť při krystalování celé hmoty zrnka velmi často na vzájem si překážela ve svém vývoji."
        ],
        "response":"Masivní horniny eruptivního původu jsou úplně krystalické a jejich součástky nejsou uspořádány rovnoběžně, ale jsou rozptýleny všemi směry [doc1]. Krystalické břidlice jsou také úplně krystalické, ale jejich součástky jsou uspořádány více či méně rovnoběžně dle jedné roviny [doc1]. Na rozdíl od hornin eruptivních, krystalické břidlice neprostupují jinými horninami [doc1].\n\nZ hlediska geologických vlastností a chování v přírodě to znamená, že masivní horniny eruptivního původu pronikají jinými horninami, zatímco krystalické břidlice ne [doc1]. Krystalické břidlice vznikly lisováním starších hornin ohromným tlakem horotvorným [doc4].",
        "reference":"Masivní horniny eruptivního původu jsou úplně krystalické a jejich součástky nejsou uloženy více nebo méně rovnoběžně dle nějaké roviny, nýbrž jsou rozsázeny všemi směry, zatímco krystalické břidlice jsou horniny úplně krystalické, jejichž součástky jsou dle jedné roviny více nebo méně rovnoběžně seřazeny, což znamená, že masivní horniny eruptivního původu prostupují jinými horninami, zatímco krystalické břidlice tak nečiní.",
        "faithfulness":0.7777777778,
        "answer_relevancy":0.8643167865,
        "answer_correctness":0.8442987072,
        "context_precision":0.8041666666,
        "context_recall":1.0,
        "context_sufficiency":1.0
    },
    {
        "user_input":"Jaké byly hlavní cíle a očekávané důsledky zapojení svazáků a žen do žňových plánů na Liberecku, a jakou roli v tom hrály výzvy předsednictva Ústředního výboru Komunistické strany a krajského výboru Československého svazu žen?",
        "retrieved_contexts":[
            "Žňové plány svazáků Liberecka Svazáci v našem kraji, kteří po získání velikých zkušeností z loňského roku, kdy si tak zdatně vedli v akci „Mládež Libereckého kraje v čele žní“, nechtějí ani letošního roku zůstati pozadu. Jak krajský výbor, tak okresní výbory i skupiny Československého svazu mládeže na Liberecku vypracovaly již ve většině případů žňové plány s konkrétními úkoly pro každou skupinu na vesnici nebo na státní strojní stanici a Československých státních statcích. Opravdu vzorný plán si vypracovali členové místní skupiny ČSM v Lukách, na okrese Doksy. V obci je jednotné zemědělské družstvo, jehož členy jsou všichni rolníci v obci. Místní svazáci po po Se svazáckým elánem nastoupíme ke sklizni letošní úrod Liberec — Provolání předsednictva Ústředního výboru Komunistické strany",
            "První odpověď na výzvu předsednictva krajského výboru ČSM v Liberci Liberec — V úterý se předsednictvo do Obory, do Václavic a do Krásné Lípy! krajského výboru Československého svazu Vpřed za dokončení staveb JZD! Vpřed za mládeže rozhodlo, že zajistí na stavby jedúspěch akce „Tři stavby JZD — dar mlánotných zemědělských družstev v Oboře, deže velikému učiteli Stalinovi!“ v Krásné Lípě a ve Václavicích dostatečný počet brigádníků tak, aby tyto stavby byly letos a co nejlevněji dokončeny. Na výzvu předsednictva KV ČSM odpovídá akademický malíř Alex Beran, člen Československého svazu mládeže, účastník Stavby mladých budovatelů socialismu v Ostravě. Píše: „Rozhodl jsem se na výzvu předsednictva krajského výboru ČSM nastoupit na týdenní brigádu na nejohroženější úsek stavby JZD.",
            "Přímá účast na sklizni Československa vytyčilo před všechen pracující lid naší republiky jako prvořaDalším bodem žňového plánu svazáků dý úkol úspěšné zvládnutí letošní sklizně a tím zajištění a další zlepšení výživy Luk je sekání obilí. Letos budou žně pracujícího lidu. V provolání je mimo jiné také výzva k mládeži a k ženám, aby v Lukách provedeny společně, ve třech i ony se podílely na úspěšném průběhu letošních mírových žní. Krajský výbor pracovních skupinách. Svazáci se zaváČeskoslovenského svazu žen již několik dní po uveřejnění provolání předsedzali, že za pomoci jednotného traktoru nictva ÚV KSČ vydal ke všem ženám Libereckého kraje výzvu, aby při žních ze státní strojní stanice posekají všechno pomohly všude tam, kde toho bude zapotřebí. Také krajský výbor Českosloven-",
            "Ženy předními bojovnicemi za mír Informační středisko, které bylo zřízeno Liberec — Naše výroba stále potřebuje další pracovní síly, mají-li být úspěšně plněny při sekretariátu Československého svazu žen v Liberci, Moskevská ulice, poradí každé úkoly, které ukládá pětiletý plán. Je mnoho ženě, která dosud není v zaměstnání. oborů práce, kde by se velmi dobře uplatnily na místech mužů, kterých je třeba v těžkém průmyslu. Mnoho žen se již přihlásilo. Je ale ještě mnoho těch, které se dosud nerozhodly. Naše ženy nesmí váhat. Každá žena se musí stát bojovnicí za mír. Západní imperialisté chtějí vyvolat novou válku. V tom jim zabráníme naší usilovnou budovatelskou prací. I naše vdané ženy musí říci své rozhodné slovo a účastnit se budování šťastné budoucnosti — socialismu.",
            "DORGÁF KRAISKÉHO VÝBORU KOMUNISTICKÉ STRANY ČESKOSLOVENSK  ROČNÍK VII.  ČISLO 128  SOBOTA 1. LISTOPADU 1958  PNS 15  CENA 35 HALEŘŮ  VÝZVĚ k provedení prověrky o připravenosti stavebně montážních organizací a výroben stavebních hmot na zimní období 1958-1959.  krajského výboru Komunistické strany Československa, Krajského národního výboru, krajského výboru Odborového svazu zaměstnanců ve stavebnictví a Krajského sdružení národních podniků ve stavebnictví v Liberci ke všem stavbařům a ke všem občanům Libereckého kraje  V posledních měsících dosáhli stav- v předsjezdové kampani, kritika na XI. ústředního výboru KSČ, že lze v krátké baři Libereckého kraje řady úspěchů sjezdu KSČ i kritika obsažená ve době dosáhnout podstatného zlepšení v plnění plánovaných úkolů letošního"
        ],
        "response":"Žňové plány na Liberecku měly zajistit úspěšné zvládnutí letošní sklizně a tím zajistit a dále zlepšit výživu pracujícího lidu [doc3]. Hlavním cílem bylo tedy přispět k zajištění potravinové situace v republice.\n\nSvazáci (Československý svaz mládeže) měli aktivně přispívat k žňovým plánům, a to jak sklizní obilí, tak i na státních strojních stanicích a Československých státních statcích [doc1, doc3]. V Lukách například si místní svazáci vypracovali vzorný plán a zavázali se k sekání obilí s pomocí traktoru [doc3].\n\nŽeny byly také zapojeny do žňových plánů. Krajský výbor Československého svazu žen vydal výzvu k zapojení žen do žní, aby pomáhaly všude tam, kde bude zapotřebí [doc3]. Výzvy předsednictva Ústředního výboru Komunistické strany a krajského výboru Československého svazu žen měly motivovat k účasti a aktivnímu zapojení do žňových prací.\n\nKromě žní se zdůrazňovala i účast na stavbě zemědělských družstev, konkrétně na stavbách JZD, které měly být dokončeny a věnovány Stalinovi [doc2].",
        "reference":"Hlavní cíle a očekávané důsledky zapojení svazáků a žen do žňových plánů na Liberecku byly úspěšné zvládnutí letošní sklizně a tím zajištění a další zlepšení výživy pracujícího lidu. Výzvy předsednictva Ústředního výboru Komunistické strany a krajského výboru Československého svazu žen hrály roli v mobilizaci mládeže a žen, aby se podílely na úspěšném průběhu žní a pomohly všude tam, kde toho bude zapotřebí.",
        "faithfulness":0.7857142857,
        "answer_relevancy":0.9087208913,
        "answer_correctness":0.5534977222,
        "context_precision":1.0,
        "context_recall":1.0,
        "context_sufficiency":1.0
    },
    {
        "user_input":"Jakým způsobem přispěla podpora Spojených států a prezidenta Wilsona k posílení postavení a mezinárodního uznání nově vzniklé republiky, a jaké důsledky to mělo pro její vztahy se spojeneckými národy?",
        "retrieved_contexts":[
            "vé kanceláře, tajemníka presidenta Wilsona, Mr. jence, kteří zasluhují veškeré podpory, jakou Greela, a jeho tajemníků Pissona Byoile, Amerika může poskytnouti. Amerika chce poTordy a p. Holého, kteří mu byli vládou skytnouti českosl. státu jakoukoliv pomoc materielní, aby českosl, stát mohl se dle svých americkou přiděleni pro cestu do československé republiky. Uvítání, jakého se jim dostalo, potřeb stabilisovati. Za nejdůležitější v tom směvyjadřovalo v krajní míře pocity sympatií čeru považuje Amerika otázku dopravy, Ve kterémžto směru vykoná, co bude v její moci. skoslovenského národa vůči Spojeným Státům, a zároveň byla brojevem nejvřelejších díků za Spojené Státy sledují s velikým zájmem vývoj českosl. republiky a doufají, že českosl. vše, co národy Spojených Států vykonaly pro",
            "spojeneckých mocností, velmi nás posilnilo, jak bylo vidět z chování nepřátelského tábora. Spojené Státy poskytly a poskytují nám ze svého bohatství vydatnou pomoc, a máme od nich určité sliby pro budoucnost. President Wilson sám věnuje naší otázce velikou a upřimnou pozornost. Jsme jemu a všem Spojencům zavázáni a mohou na nás vždy počítati; vyjádřím naše city k nim nejlépe slovy premiera dra. Kramáře, který mne v prvém radiotelegramu, který spojil Prahu s Paříží, uložil: »ubezpečit vlády a národy spojenecké naší vděčností a neochvějnou věrností. (Výborně! Potlesk.) Naše republika zůstane Spojencům věrnou navždy«. (Opětovný potlesk.) Po oficielním uznání nás Spojenci prohlásili jsme samostatnost našeho národa a zřídili vládu; národ doma to schválil a",
            "pověřování vyslanců a velvyslanců a podobné akty, při nichž se řídí jen obecnými předpisy mezinárodního práva. Je to například i otázka uznání nově vzniklých států, uznání vlád jiných států, stejně jako jejich postavení v obci národů, například uznání jejich neutrality, jak tomu bylo nedávno s Rakouskem. Pro takové jednání je Organisace spojených národů nepříslušná. Takovou otázku nelze proto zařadit na pořad Valného shromáždění, ani jiného orgánu. Nemá opory v Chartě, bylo by ji nutno nejdříve změnit nebo revidovat. Ale takového výsostného práva by se asi žádný stát nechtěl vzdát, poněvadž by ztrácel osobitost. Stejně, pokud jde o uznání jiného státu nebo jeho vlády. Zde platí ustanovení mezinárodního práva. Proto je nezákonné, vylučuje-li Valné shromáždění zá-",
            "pověřování vyslanců a velvyslanců a podobné akty, při nichž se řídí jen obecnými předpisy mezinárodního práva. Je to například i otázka uznání nově vzniklých států, uznání vlád jiných států, stejně jako jejich postavení v obci národů, například uznání jejich neutrality, jak tomu bylo nedávno s Rakouskem. Pro takové jednání je Organisace spojených národů nepříslušná. Takovou otázku nelze proto zařadit na pořad Valného shromáždění, ani jiného orgánu. Nemá opory v Chartě, bylo by ji nutno nejdříve změnit nebo revidovat. Ale takového výsostného práva by se asi žádný stát nechtěl vzdát, poněvadž by ztrácel osobitost. Stejně, pokud jde o uznání jiného státu nebo jeho vlády. Zde platí ustanovení mezinárodního práva. Proto je nezákonné, vylučuje-li Valné shromáždění zá-",
            "presidenta Wilsona. V roce 1918 přispěl presidentu Masarykovi rozhodující pomocí v jeho práci pro osvobození našeho národa. Já sám jsem udržoval velmi těsné vztahy s presidentem Wilsonem při pařížské mírové konferenci a jeho podpora mého úsilí o uznání našich národních požadavků byla jednou z nejjistějších záruk našeho úspěchu. Československý národ zachová vždy vděčnou a láskyplnou vzpomínku na Woodrowa Wilsona, pravého představitele veliké sesterské republiky Spojených států amerických.“ Adolf Šustr, říd. uč. v. v., narodil 12. července 1858, zemřel 7. ledna  1924. Vyučoval ve Smrčí v letech 1883 — 1887. Byl horlivým, neohroženým bojovníkem zásad pokrokových a literárně činný. Ve všech působištích zanechal po sobě znatelné stopy účinného působení v lidovýchově: Pracemi v „Sokole“, šířením dobrých časopisů, pořádáním besídek s rodiči a také okrašlováním zevnějšku obce. Na každém podniku pracovali jeho žáci, jimž byl vzorným učitelem. Celý život věnoval práci pro vzdělání národa a duševní jeho osvobození, jehož se — nedočkal. Ze Smrčí byl „ze služebních příčin“ přeložen do Tuněchod na chrudimsku."
        ],
        "response":"Prezident Woodrow Wilson přispěl k osvobození československého národa v roce 1918 rozhodující pomocí [doc5]. Adolf Šustr, řídící učitel, udržoval těsné vztahy s prezidentem Wilsonem během pařížské mírové konference a jeho podpora byla zárukou úspěchu [doc5]. Spojené Státy poskytly a poskytují nově vzniklé republice vydatnou pomoc a sliby pro budoucnost [doc2]. Československý národ zachová vděčnou a láskyplnou vzpomínku na Woodrowa Wilsona [doc5]. Československá vláda vyjádřila vděčnost a neochvějnou věrnost spojencům, včetně Spojených států [doc2].",
        "reference":"Podpora Spojených států a prezidenta Wilsona přispěla k posílení postavení a mezinárodního uznání nově vzniklé republiky tím, že Spojené státy poskytly vydatnou pomoc a určité sliby pro budoucnost, což vedlo k tomu, že republika byla oficiálně uznána Spojenci, prohlásila svou samostatnost a zřídila vládu, a tím se upevnily její vztahy se spojeneckými národy, kterým byla zavázána vděčností a neochvějnou věrností.",
        "faithfulness":1.0,
        "answer_relevancy":0.8934395811,
        "answer_correctness":0.6766768925,
        "context_precision":0.8666666666,
        "context_recall":1.0,
        "context_sufficiency":1.0
    },
    {
        "user_input":"Jaké důsledky by mohlo mít svolání zemského sněmu a odstranění korupční vlády privilegovaných řádů volebních na moravský lid a jeho politické zastoupení?",
        "retrieved_contexts":[
            "vat proti tomu, aby sněm proto svoláván nebyl. K uzdravení zemských financí a k spravedlivé změně zemských volebních řádů je třeba přikročiti neodkladně a proto se musí co nejdůrazněji trvat na svolání sněmu. Budou-li se chtít Němci smiřovat nebo ne, je potom věc vedlejší a že bychom při tom k smíru à la moravský pakt a k opravě volebních řádů bez odstranění kurií nesvolili, netřeba snad ani zvlášť podotýkati,  Politická kronika.  — Druhá volba na Žamberecku koná se 23. ledna 1907. — Ze Zadrv se oznamuje, že dalmatský sněm bude svolán ke konci února. Že nebyl svolán současně s ostatními sněmy, vysvětluje se tím, že nebyla do té doby vyřízena jazyková otázka v Dalmadii. Před zahájením sněmu vyjdou jazyková nařízení, jimiž se zavádí v zemi úřední řečchor-",
            "na zřeteli poslanecké karikatury tříd privilegovaných, nýbrž ty poslance, kteří zvoleni v kuriích, v nichž rozhodují hlasy lidu, mají také k tomu lidu své povinnosti. Dají tito sobě líbiti ošemetnou komedii, kterou zemský výbor s nimi hraje? Necítí oni již nyní ten hrozný morální políček, jaký jim zemský výbor chystá svoláním dvoudenpřed novým rokem za účelem povolení rozpočtového provisoria? Chtějí chrániti svoji důstojnost a občanskou svoji čest? Pak-li ano — a já nepochybuji, že aspoň část jich bude plně se mnou souhlasiti — pak musí stejně bezohledně promluviti, jako to učiní poslanci sociálně-demokratičtí. Moravskému lidu musí jeho poslanci otevříti oči. Na tisících schůzích lidu musí zavzníti bouřlivě: Chcem, aby zemský sněm neprodleně byl svolán, pryč s korupní vládou privilegovaných řádů volebních, pryč se sněmem, který několik kšeftařů považovati chce za kulisy, kterými mají být přikryty špinavé jejich obchody, chceme sněm, jenž bude důstojným representantem vůle lidu, sněm všeobecného rovného práva hlasovacího! Karel Vaněk.",
            "navždy upevnili, a aby pomocí umělých, živlu slovanstátního práva uherského nikterak nevymáhalo. Jeho Veličenstvem, naším nejmilostivějším císařem a skému patrně křivdících řádů volebních, majorisovati Kdežto prve nejvyšším manifestem od 20. září králem, před všemi národy říše, před veškerým obymohli Slovany aspoň v říšské radě cislajtanské, když 1865 slíbeno bylo sněmu českému, že se jemu předloží vatelstvem tohoto království a před shromážděnými to na sněmích některých zemí ani pomocí těchto řádů tehdáž poslanci, že tento sněm pokládáme za nepravé úmluva s královstvím uherským k podání hlasu „stejně možná nebylo. Těžiště všeho zákonodárství mělo dílem vážného,“ a ačkoliv tento slib zástupce vlády v plném a neoprávněné zastoupení naší země. ihned novými zákony, dílem povlovným postupem při-",
            "navždy upevnili, a aby pomocí umělých, živlu slovanstátního práva uherského nikterak nevymáhalo. Jeho Veličenstvem, naším nejmilostivějším císařem a skému patrně křivdících řádů volebních, majorisovati králem, před všemi národy říše, před veškerým obyKdežto prve nejvyšším manifestem od 20. září mohli Slovany aspoň v říšské radě cislajtanské, když 1865 slíbeno bylo sněmu českému, že se jemu předloží vatelstvem tohoto království a před shromážděnými to na sněmích některých zemí ani pomocí těchto řádů úmluva s královstvím uherským k podání hlasu „stejně tehdáž poslanci, že tento sněm pokládáme za nepravé možná nebylo. Těžiště všeho zákonodárství mělo dílem vážného,“ a ačkoliv tento slib zástupce vlády v plném a neoprávněné zastoupení naší země. ihned novými zákony, dílem povlovným postupem při-",
            "Po volbách v Prusku. + V Brně, 5. června. Už je rozhodnuto o složení nového zemského sněmu v Prusku a o pruské politice dalších pěti let. Volby poslanců jsou sice ustanoveny až na 16. t. m., ale známý výsledek voleb volitelů ze dne 3. — na kterém neúplnost zpráv a nutné užší volby nic podstatného změnit nemohou — zaručuje, že vedoucí stát německý od své dosavadní zpátečnickoklerikální politiky se neuchýlí ani o píď. Nejbídnější ze všech volebních řádů, jak nazval v jedné ze svých řečí kníže Bismark zájmové zastoupení obyvatelstva v zákonodárných sborech, se znova osvědčil, pojistiv vládu těm, kteří ho zavedli a udržují, nedbajíce politické spravedlnosti ani volání o ní. Starý sněm byl rozhodně konservativní, rozhodně klerikální a rozhodně zpátečnický. Pestrá minulost,"
        ],
        "response":"Svolání zemského sněmu a odstranění korupční vlády privilegovaných řádů volebních by mělo zásadní dopad na moravský lid a jeho politické zastoupení. Podle dokumentu [doc2] by to znamenalo otevření očí moravskému lidu a zavládnutí bouřlivých požadavků na změnu. Konkrétně by to mělo vést k vytvoření sněmu, který by byl důstojným reprezentantem vůle lidu a prosazoval všeobecné rovné právo hlasovacího. Dokument [doc5] zmiňuje, že volební řády v Prusku, které upřednostňují zájmové zastoupení, vedly k pokračování zpátečnické a klerikální politiky. Odstranění takových řádů by mohlo vést k politické spravedlnosti a změně politiky.",
        "reference":"Svolání zemského sněmu a odstranění korupční vlády privilegovaných řádů volebních by mohlo vést k tomu, že moravský lid by měl sněm, jenž by byl důstojným representantem vůle lidu a sněm všeobecného rovného práva hlasovacího, což by znamenalo lepší politické zastoupení a větší vliv lidu na rozhodování.",
        "faithfulness":1.0,
        "answer_relevancy":0.9557651263,
        "answer_correctness":0.588008967,
        "context_precision":0.95,
        "context_recall":1.0,
        "context_sufficiency":0.0
    },
    {
        "user_input":"Jaké byly důsledky napětí mezi českou a německou komunitou ve Vídni na konci 19. století, a jak se toto napětí projevovalo v politických rozhodnutích a postojích, které byly přijaty, aby se ochránila česká národní identita a práva?",
        "retrieved_contexts":[
            "V 19. století byla Vídeň jako hlavní město Rakouska - Uherska pro obyvatele mocnářství přirozeně lákadlem. A Češi nebyli výjimkou. Po roce 1848 jich sem mířily stovky tisíc - na počátku 20....\nHlavní říšské a sídelní město Vídeň tak bylo několik staletí po Praze městem s druhou největší českou populací. Za vlády krále Přemysla Otakara II. okolo roku 1250 se ve Vídni usídlili první Češi z českých zemí.\nNa počátku 20. století byla Vídeň vedle Prahy téměř největším českým městem na světě. Odhaduje se, že ve Vídni žilo cca 300 000 Čechů. Mnozí Češi pracovali jako dělníci ve stavebnictví, jiní byli řemeslníci, zejména obuvníci a krejčí. Ve Vídni však žila i část české politické a intelektuální elity.\nV časech monarchie byla Vídeň považována za „největší české město\". Na konci 19. století v ní žilo přibližně sto tisíc našich krajanů. Proč našinci do metropole na Dunaji přicházeli a jak je Vídeňané přijímali?\nVídeňští Č eši , kdysi největší neněmecká národnostní skupina rakouské metropole, stali se důležitou entitou v 19. století v důsledku velkého přílivu imigrantů z českých zemí.\nV 50. letech 19. století byla politická činnost v Českých zemích velmi potlačována. Teprve po vydání Říjnového diplomu v roce 1860 a Únorové ústavy v roce 1861 se konaly volby do zemských sněmů a byl obnoven politický a spolkový život.\nRakousko bylo vždy nejčastější cílovou zemí pro odchod Čechů - ať už z důvodů ekonomických od druhé poloviny 19. stolet í, tak z důvodů politických v době vlády komunistů v Československu. Ve Vídni Češi tvořili největší národnostní menšinu.\nOdhaduje se, že na přelomu 19. a 20. století žilo ve Vídni až kolem tří set tisíc Čechů. Velká vlna uprchlíků sem pak dorazila po roce 1948. Tito lidé se poměrně dobře připojili ke starousedlíkům z 19. stolet í. U lidí, kteří dorazili v roce 1968, už to však bylo jinak.\nNapětí mezi zeměmi sahá až na konec 19 . století . Tehdy se Japonsko po rychlé modernizaci snažilo rozšířit svůj vliv v Asii, což vedlo k první čínsko-japonské válce.\nV průběhu 19 . století se v evropském prostředí prosadila národní myšlenka jako nová vůdčí forma kolektivní identity .\nOd 20. století se pro stejnou etnickou skupinu objevuje termín sudetští Němci (Sudetendeutsche), který byl převzat nacisty. Přibližně 2,4 milionu sudetských Němců bylo pak vyhnáno po druhé světové válce. Vyhnanci sami se nazývají sudetskými Němci.\nRoku 1999 vydala Academia knihu Sex a tabu v české kultuře 19 . století , sborník příspěvků ze sympozia k problematice 19 . století . Po více než deseti letech se toto téma na pořad sympozií opět vrátilo, i když jako součást obecnější problematiky těla a tělesnosti.\nPostavili ji koncem 19 . století , kdy město rychle rostlo díky německým podnikatelům a jejich vlivu.“ Tento obchodní dům vznikl ve 30. letech 20. století a stal se symbolem moderního maloobchodu a architektury.\nNa konci tohoto sestupného řetězce jsou lidé, kteří se nacházejí dlouhodobě na ulici. Lidé, kteří rezignují, nevěří už, že by se v jejich životě mohlo cokoli změnit.\nJak to ovlivňuje politickou rovnováhu v Evropě? Tato napětí se mohou vyvíjet různými směry.Jak dalekosáhlé důsledky jeho prezidentství tedy může podle vás mít? Ano, to je naprostá iluze. Upřímně, změna vztahů nezačala u Trumpa.\nV 19 . století úřady habsburské monarchie uskutečňovaly sčítání obyvatel, která mohou posloužit jako zdroj informací pro počty jednotlivých etnik v českých zemích. Leč je nutno upozornit na odlišnou metodiku určování národnostní příslušnosti tehdy a dnes."
        ],
        "response":"Na konci 19. století se Japonsko po rychlé modernizaci snažilo rozšířit svůj vliv v Asii, což vedlo k první čínsko-japonské válce [doc1]. V průběhu 19. století se v evropském prostředí prosadila národní myšlenka jako nová vůdčí forma kolektivní identity [doc1]. V habsburské monarchii úřady prováděly sčítání obyvatel, které mohly sloužit jako zdroj informací pro počty jednotlivých etnik v českých zemích [doc1]. Je však nutné upozornit na odlišnou metodiku určování národnostní příslušnosti tehdy a dnes [doc1].",
        "reference":"Napětí mezi českou a německou komunitou ve Vídni na konci 19. století vedlo k tomu, že německé spolky, jednoty a společenstva byly vyzývány, aby si hájily svého práva domácího proti Čechům, a aby se bránily jejich přiblížení. Toto napětí se projevovalo v politických rozhodnutích a postojích, které byly přijaty, aby se ochránila česká národní identita a práva, například usnesení poslanecké sněmovny z roku 1883 a usnesení českého sněmu, které zdůrazňovaly potřebu, aby vychování a vzdělání mládeže na obecné škole odpovídalo požadavkům náboženským, národním a časovým.",
        "faithfulness":1.0,
        "answer_relevancy":0.7606961822,
        "answer_correctness":0.4363184043,
        "context_precision":0.9999999999,
        "context_recall":0.6666666667,
        "context_sufficiency":0.0
    },
    {
        "user_input":"Jaké byly důvody a důsledky toho, že české duchovenstvo odmítalo podřídit školství vlivu duchovenských úřadů, a jak se tato situace odrazila na postavení českých poslanců a jejich schopnosti prosazovat změny ve školství?",
        "retrieved_contexts":[
            "K podobné změně vztahuje se usnesení poslanecké sněmovny z roku 1883 a usnesení českého sněmu z posledního zasedání. Na své poradě uznal klub toho potřebu, aby vychování a vzdělání mládeže na obecné škole hovělo stejnou měrou požadavkům náboženským, národním a časovým. Z četných vážných projevů je vůbec známo, že duchovenstvo nechce školství podrobiti takovému vlivu duchovenských úřadů, jak tomu druhdy bývalo a tím méně mohla by činnost českých poslanců k tomu směřovati. Vláda posud nevyhověla požadavku rady říšské a sněmu českého a nepodala žádné předlohy, která by se týkala nového upravení školství a kterou by se v duchu ústavy ponechalo sněmům, co jim náleží; za nynějších poměrů nelze pak předvídati, kdy se k takovému kroku odhodlá. Návrh knížete Liechtensteina, jenž v plné míře má na",
            "poslanců, což nestačí k usnášení se a o návrhu se ani rokovati nemůže. A kdyby někdy nalezl se mezi tou šlechtou ústavověrnou jeden nebo více pokroku milovných lidí (o konservativní šlechtě ani nemluvím, ač nám ji národně strkávají — je to sám římský jesuita), zbývají ve sněmovně 2 virilisté biskupové a naši klerikálové, aby ve spojení s nimi kvalifikovanou většinu znemožnili. Před tou hradbou stojí pokroková škola a stojí i učitelstvo a všechny jeho volnější tužby. Ne tak přítomnost, jako budoucnost školy na Moravě, v níž jsme tolik doufali, je úplně ve spárech reakce. O tento odpor na př. jistě rozbije se zrušení coelibátu učitelek. V tom je viděti největší českou porážku, hroznější národnostního veta, poněvadž z toho těžili národně Němci, ale zlovůle velkostatkářů nemohla býti uplatněna. Teď máme na",
            "— ačkoli v úřadech zemských ještě drahnou dobu vládlo se »poústavácku« — i došlo až ku zřízení české university, ale v otázce státoprávní nedostali jsme se bohužel ani o krok dále; za to však živlové klerikálně - konservativní počali se hlásiti o svůj podíl, který by jim připadl za to, že nebrání vládě, aby též něco učinila pro kmeny slovanské. Strana tato zvaná Rechtspartei zejména v otázkách školských chystala se loviti pro své zájmy a docházela druhdy i souhlasu u četných poslanců národních, »staročeských«. Nepokládaliť mnozí — a mezi nimi byl též sám vůdce národa dr. František Lad. Rieger — vymoženosti školské, které si učitelstvo tak vysoko cenilo, za tak důležité, aby nebyly vyváženy rozšířenou autonomií zemskou, kteráž teprve měla školstvo naše, věc to čistě zemskou, upraviti dle svých potřeb.",
            "přece přijal úřad okres. inspektora, zacpali komíny a chtěli ho vyčudit jako jezevce. O inspektory byla veliká nouze; okresní školní rady nebylo možno sehnat dohromady, poněvadž zvolení údové od samosprávných sborů, dělali pasivní oposici. V r. 1870 konal se na Žofíně veliký sjezd učitelstva, na kterém se kněžími jen hemžilo a na němž hlučně mluveno a protestováno proti novým zákonům školním. Orgánové liberální vlády, nemohouce sehnati ani školní rady ani inspektory, hněvali se zvláště na duchovenstvo vlastenecké, a kde mohli, dali mu to cítiti. Pojednou však stal se obrat. Ti, kteří největší oposici dělali a nejvíce nás do ní tlačili, zanechali nás v ní a přidali se na síranu zákonů školních, které kdysi prohlásili za národu škodlivé, ale pojednou shledali blahodárnými",
            "jak se dalo městům, v nichž obecní úřad jest zároveň politickou instancí, zajisté by nebylo takového odporu. Volbu do místní školní rady zamítla jednohlasně obec Věrovany a sice z následujících důvodů: 1. Zákon školní ze dne 12. ledna 1870 zpracován není za spoluúčinkování našich poslanců zemských, kteří jsouce stále majorisováni viděli se nuceni vystoupiti ze sboru zákonodárných. Jest tedy, jakby v státě konstitučním nepatřilo, adělán bez našich oprávněných zástupců. 2. Jest to na odpor našemu přesvědčení katolickému, býti napomocnu zřízení, jenž naše školy křesťanské činí dokonce beznáboženskými. 3. Uvaluje na nás beztoho dosti stísněné břemena, kteráž jen s bolestí a žalem bychom snášeti museli, odnímaje na druhé straně nám stávající práva a zkracuje naši obecní samosprávu, přidělujic"
        ],
        "response":"České duchovenstvo odmítalo podřídit školství vlivu duchovenských úřadů, jak je patrné z [doc1]. Klub poslanců uznal potřebu, aby vychování a vzdělání mládeže na obecné škole hovělo stejnou měrou požadavkům náboženským, národním a časovým, ale duchovenstvo nechtělo školství podrobit vlivu duchovenských úřadů, jak tomu bylo dříve [doc1].\n\nTato situace se odrazila na postavení českých poslanců a jejich schopnosti prosazovat změny ve školství. Vláda nevyhověla požadavkům Rady říšské a českého sněmu a nepředložila návrhy na nové uspořádání školství, což ztěžovalo prosazování změn [doc1]. Návrh knížete Liechtensteina, který by ponechal sněmům pravomoci v oblasti školství, se nepodařilo prosadit [doc1].\n\nDále, jak vyplývá z [doc2], pokroková škola a učitelstvo čelily odporu, který bránil zrušení coelibátu učitelek a celkově omezoval pokrokové snahy v oblasti školství. Odpor pocházel od konzervativních sil, včetně biskupů a klerikálů, což ztěžovalo prosazování změn [doc2].\n\nZ [doc3] vyplývá, že i někteří poslanci, včetně dr. Františka Ladislava Riegra, nepovažovali školské vymoženosti za dostatečně důležité, aby byly vyváženy rozšířenou autonomií zemskou [doc3].\n\nZ [doc5] vyplývá, že obec Věrovany odmítla zvolit do místní školní rady, protože zákon školní nebyl zpracován za účasti českých poslanců a byl v rozporu s přesvědčením katolické obce [doc5].",
        "reference":"Důvody, proč české duchovenstvo odmítalo podřídit školství vlivu duchovenských úřadů, spočívaly v tom, že nechtělo, aby školství bylo pod vlivem duchovenských úřadů tak, jak tomu bylo dříve. Tato situace se odrazila na postavení českých poslanců tím, že jejich činnost nemohla směřovat k podřízení školství duchovenským úřadům, a vláda dosud nevyhověla požadavkům rady říšské a sněmu českého na nové upravení školství, což omezovalo schopnost českých poslanců prosazovat změny ve školství.",
        "faithfulness":1.0,
        "answer_relevancy":0.8956555473,
        "answer_correctness":0.5525466073,
        "context_precision":1.0,
        "context_recall":1.0,
        "context_sufficiency":0.0
    },
    {
        "user_input":"Jaké důsledky by mohlo mít nedostatečné ošetřování a špatná komunikace mezi lékaři, jako je Christián Ivánovič, a pacienty, zejména v kontextu očekávané návštěvy cestujícího úředníka, a jak se na tuto situaci připravuje Artemij Filippovič?",
        "retrieved_contexts":[
            "týče vás, Christiáne Ivánoviči, — každou nemoc: kdy kdo onemocněl, kterého dne a kolikátého... Není pěkná věc, že u vás nemocní kouří takový silný tabák, že člověk se po každé rozkýchá, když vstoupí do nemocnice. A také by bylo lépe, kdyby jich bylo méně: hned dají vinu špatnému ošetřování nebo neumělosti lékařově. ArtEmij FilIPPOVIČ. Ó! co se léčby týče, já a Christián Ivánovič učinili jsme svá opatření: čím blíže ku přírodě, tím lépe — lékův drahých nemocným nedáváme. Člověk je prostě zařízen: umře-li, umře i bez toho, uzdraví-li se, uzdraví se i bez toho. A Christiánu Ivánoviči bylo by také obtížno s nimi se dorozuměti: neumí rusky ani slova. CHrISTIáN IVÁNOVIČ vydává ze sebe zvuk trochu podobný hlásce i a trochu hlásce e. MěsTSkÝ HEJTMAN. Též vám bych poradil, Ammose Fedoro-",
            "Městský hejtman. Ano. A také nad každou postelí je potřeba napsati latinsky nebo v nějakém jiném jazyku... to se už týče vás, Christiáne Ivánoviči, — každou nemoc: kdy kdo onemocněl, kterého dne a kolikátého... Není pěkná věc, že u vás nemocní kouří takový silný tabák, že člověk se pokaždé rozkýchá, když vstoupí do nemocnice. A také by bylo lépe, kdyby jich bylo méně: hned dají vinu špatnému ošetřování nebo neumělosti lékařově. Artemij Filippovič. Ó! co se lečby týče, já a Christián Ivánovič učinili jsme svá opatření: čím blíže ku přírodě, tím lépe — lékův drahých nemocným nedáváme. Člověk je prostě zařízen: umře-li, umře i bez toho, uzdraví-li se, uzdraví se i bez toho. A Christiánu Ivánoviči bylo by také obtížno s nimi se dorozuměti: neumí rusky ani slova.",
            "Artemij Filippovič. Nesmím déle znepokojovati svou přítomností, olupovati vás o čas, určený ke svatým povinnostem ... (Klaní se, chtě odejíti.) Chlestakov (provázeje ho). Ne, nic nedělá. To všechno je velmi směšné, co jste vyprávěl. Račte také po druhé ... Mám to velmi rád. (Vrací se a otevřev dvéře křičí za ním.) Hej vy! Jak vám? pořád zapomínám, jaké je vaše křestné a otcovské jméno. Artemij Filippovič. Artemij Filippovič. Chlestakov. Prokažte mi laskavost, Artemiji Filippoviči, mně se stala divná příhoda: na cestě mi docela vyšly peníze. Můžete mi půjčiti — asi čtyři sta rublův? Artemij Filippovič. Mohu. Chlestakov. Podívejme se, právě vhod. Děkuju vám uctivě.  Chlestakov a Rastakovský (v uniformě z doby Kateřiny II. se šňůrami).  Rastakovský. Mám čest se představiti",
            "Ivánovič Hübner, okresní lékař. — Svistunov, policejní strážník. MĚsTSKÝ HEJTMAN. Pozval jsem vás, pánové, abych vám oznámil velenepříjemnou zprávu: k nám jede revisor. Ammos Fedorovič. Jak, revisor? Artemij Filippovič. Jak, revisor? MěsTskÝ hejtMan. Revisor z Petrohradu, na zapřenou. A ještě s tajným rozkazem. AMMOs FEDOROVIČ. Tu máš! ARtEMIJ FiLiPPOVIČ. Měli jsme svatý pokoj; teď to máme! LUká LUKiČ. Pro Pána Boha! Ještě i s tajným rozkazem! MěsTSKÝ HEJTMaN. Jako bych to byl tušil: dnes se mně celou noc zdálo o jakýchsi dvou neobyčejných krysách. Opravdu, takových jsem nikdy nevídal: černé, nadpřirozené velikosti! Přišly, počichaly — a odešly. Tuhle vám přečtu list, který jsem dostal od Ondřeje Ivánoviče Čmychova, jejž, Artemiji Filippoviči, znáte. Slyšte,",
            "školy... Nevím, jak mu mohla vláda svěřiti takový úřad: on je horší nežli jakobín a vštěpuje mládeži takové podvratné zásady, že je až těžko je vysloviti. Nerozkážete-li, abych to všechno vyložil raději na papíře? Chlestakov. Dobrá, třebas na papíře. Mne to bude velmi těšiti. Já, rád víte, takto v dlouhé chvíli si přečtu něco zábavného ... Jak se jmenujete? pořád zapomínám. Artemij Filippovič. Zemljanika.  Chlestakov. Á, ano! Zemljanika. A co, povězte, prosím vás, máte děti? Artemij Filippovič. Jak pak ne! patero; dvě už dorostlé. Chlestakov. Podívejme se, dorostlé! A jak Artemij Filippovič. To jest, neráčíte-li se tázati, jak jím říkají? Chlestakov. Ano, jak jim říkají? Artemij Filippovič. Mikuláš, Ivan, Alžběta, Marie a Perpetua. Chlestakov. To je pěkné."
        ],
        "response":"Artemij Filippovič a další se obávají, že nedostatečné ošetřování a špatná komunikace s pacienty by mohly vést k negativním důsledkům v souvislosti s očekávanou návštěvou revisora. Pacienti, nespokojení s péčí, by mohli viníkat ošetřování nebo neumělost lékařů [doc1, doc2]. Christián Ivánovič má problémy s komunikací, neumí rusky [doc1, doc2], což dále komplikuje situaci.\n\nArtemij Filippovič se na tuto situaci připravuje tím, že se s Christiánem Ivánovičem dohodl na léčbě co nejblíže přírodě a vyhýbají se drahým lékům [doc1, doc2]. Zdá se, že se snaží minimalizovat potenciální problémy, které by mohly vyvolat pozornost revisora. Městský hejtman také radí [doc1].",
        "reference":"Nedostatečné ošetřování a špatná komunikace mezi lékaři, jako je Christián Ivánovič, a pacienty by mohly vést k tomu, že nemocní budou dávat vinu špatnému ošetřování nebo neumělosti lékařově. V kontextu očekávané návštěvy cestujícího úředníka se Artemij Filippovič připravuje tím, že radí, aby všechno vypadalo slušně, například aby noční čepičky byly čisté a nemocní nebyli umouněni jako kováři.",
        "faithfulness":1.0,
        "answer_relevancy":0.0,
        "answer_correctness":0.6094157581,
        "context_precision":0.9166666666,
        "context_recall":0.5,
        "context_sufficiency":0.0
    },
    {
        "user_input":"Jaké byly důsledky prohlášení dr. Stránského, že se před soudem projednává proces celého českého národa, a jak toto prohlášení ovlivnilo vnímání procesu s \"Omladinou\" v kontextu tehdejších politických a společenských poměrů?",
        "retrieved_contexts":[
            "se domnívá a poněvadž se o něm na mnobých místech též myslí, že je povolán k nějaké vynikající úloze v naší národní politice. Samozvaný a faktický vůdce strany lidové dr. Stránský z Brna převzal totiž též obhajování některých obžalovaných. A tu hned v první den líčení prohlásil on, že „projednává se to před soudem proces celého českého národa!“ A proti tomuto výroku, jenž obsahuje hanebné nařknutí celého našeho národa, nutno co nejdůrazněji se obraditi. Jest ovšem pravda, že libují ni v novější době obhájcové ve křiklavých frázích, jimiž i soudcové i obecenstvo se mají zaslepiti a jež mají býti dobrou vodou na jejich mlýny, ale že by se někdo byl snížil ke frázi druhu tak uprostého a celý národ urážejícího, toho jsme nezažili. Co pak klesl již národ náš tak hluboko, že stotožňovati",
            "Soudní síň. V. rk. V Praze, 19. ledna. (Od zvl. zpr. „L. N Proces „Omladiny.“ Po čtyřech dnech přelíčení s „Omladinou“ trhás předivo lži a klamu, rozprostírané po celé měsíce po Rakousku i za hranicemi, aby celý český národ a strana mladečeská v něm do nejhoršího světla byli uvedeni. Z výpovědí a doznání obžalovaných můžeme již dnes zjistit, že lid český a jeho zákonití zástupci ve sborech parlamentárních budou procesem tímto zcela očistěni a že se nám dostane patřičného zadostučinění. Prohlášení nejvíce obviněných, že se stranou mladočeskou ničeho neměli, s klubem mladočeských poslanců v nijakém styku nebyli, že jsou členy nezávislých socialistů, nebo pokrokového studentstva a dělnictva a neznají žádného tajného spolku „Omladiny“, prohlášení toto jest nejlepší odpovědí na úporné osočování českého národa a jeho zástupců. A jsme jisti, že podobných prohlášení uslyšíme více. — — Před zahájením dnešního líčení oznamuje předseda soudu, že ho došel anonymní list výhrůžný. Praví se v něm, že opováží-li se předseda soudu a státní zástupcové odsoudit „Omladinu“, mezi nimiž jsou mnozí nevinní, že se",
            "současně proti připojení svých tiskových věcí k procesu „Omladiny“, s nímž nemají nic společného. Veřejný žalobce Lorenc vyslovoval se proti všem těmto námitkám. Soud po krátké poradě je také zamítl. (Hluk a odpor.) Dr. Stránský žádal, aby se přelíčení konalo jako veřejné: „Činnost obžalovaných byla jen výrazem oné všeobecné nespokojenosti našeho národa. Kdybych byl povolán hájiti politický program těchto lidí, pak bych se musil přimlouvati za tajné líčení, poněvadž tímto činem se dělá reklama tomuto proudu. A tomu obžaloba nechce! Veřejnost, když nezákonným, když se dozví veřejnost, že se jedná o politickou stranu, která měla za účel provésti sloučení dvou velkých myšlenek, a sice národnosti a socialismu, když se to veřejnost dozví, myslím, že bude veřejný pořádek",
            "proti jejichž čtení se dr. Koerner marně ohradil. Soud připustil celkem četbu celé serie, nevyjmuv ani rozsudek procesu »Omladina«; pokud se týče tohoto s výslovným odůvodněním, že neděje se tak pro osobu dra Rašína v procesu »Omladiny« odsouzeného a pak amnestovaného, nýbrž pouze pro informaci o hnutí »Omladiny«. Sdělení státní policie pražské o dru Kramářovi zaznamenává chronologicky důležitější momenty z jeho veřejného vystupování až do května r. 1914 — věci většinou všeobecně známé, co je povahy důvěrnější, je nepřesné nebo falešné. Dr. Kramář konstatuje, že v sdělení je výslovně přiznáno, jak v konfliktu srbsko-bulharském stál na straně těchto. Pokud se týče stran, byl pro jistý postup se sociálními demokraty a proti národně sociální straně, již pokládal za něco nepřirozeného. Její agitace byla demagogií. Reforma jednacího řádu v říšské radě r. 1908",
            "Posl. dr. Kramář zahajuje řeč vzpomínkou na proces „Omladiny“, připomíná, že ponechává to soudcům, aby rozsudek svůj před svým svědomím zodpověděli a přeje jim jen, aby zodpovídání to jim bylo lehkým. Povinností politika je ale přihlédnouti o něco hlouběji jak policie a soud, a ve velikém tom hnutí viděti něco jiného, než pouze to, co pokárati a potrestati se musí. Hnutí pokrokové mládeže v Čechách má svůj vznik v otázce sociální. Až do poslední doby málo kdo v Čechách dobře věděl, že pro český lid otázka sociální by mohla býti eminentně sociální. Tento lid nemá žádných vrstev bohatců. Jeho síla leží v malém živnostnictvu, malém rolnictvu a zejména tež v dělnictvu. Dělnictvo tvoří největší procento tak zv. českých menšin, okolo nichž se národnostní boj v Čechách otáčí. Jestliže my od dělnictva našeho žá-"
        ],
        "response":"Prohlášení dr. Stránského, že „projednává se to před soudem proces celého českého národa!“, vyvolalo silnou negativní reakci. Dokument [doc1] uvádí, že toto prohlášení obsahuje „hanebné nařknutí celého našeho národa“ a že je nutné se proti němu „co nejdůrazněji se obraditi“.\n\nProces \"Omladiny\" byl vnímán jako pokus o očistu českého národa a jeho zákonitých zástupců [doc2]. Prohlášení dr. Stránského toto vnímání zhoršilo a přispělo k pocitu, že je celý národ obviněn.\n\nDr. Stránský se později domníval, že veřejné líčení by bylo vhodné, protože hnutí \"Omladiny\" bylo projevem nespokojenosti celého národa [doc3]. To naznačuje, že i on sám vnímal proces jako politicky motivovaný a s dopadem na celou společnost.\n\nDokument [doc5] zmiňuje, že proces \"Omladiny\" byl spojen s otázkou sociální a s vnímáním dělnictva jako klíčové části českého národa. Prohlášení dr. Stránského mohlo posílit pocit, že se proces zaměřuje na tuto skupinu a že je to politicky motivované.\n\nDokument [doc4] uvádí, že proces \"Omladiny\" byl součástí širšího kontextu politických a společenských událostí, včetně konfliktu srbsko-bulharského a jednání v říšské radě.",
        "reference":"Prohlášení dr. Stránského, že se před soudem projednává proces celého českého národa, vyvolalo nutnost co nejdůraznějšího protestu a odmítnutí, protože obsahovalo hanebné nařknutí celého národa. Toto prohlášení ovlivnilo vnímání procesu s \"Omladinou\" tím, že přitáhlo větší pozornost, než si zasluhovalo, a bylo vnímáno jako urážlivé a nespravedlivé, což vedlo k tomu, že se záležitosti \"Omladiny\" věnovala zvýšená pozornost a důrazný protest.",
        "faithfulness":0.7333333333,
        "answer_relevancy":0.8909080255,
        "answer_correctness":0.6312715472,
        "context_precision":0.95,
        "context_recall":1.0,
        "context_sufficiency":0.0
    },
    {
        "user_input":"Jakým způsobem festival ve Strážnici reflektuje význam a odkaz profesora Vladimíra Úlehly a jaké konkrétní prvky programu jsou tomu věnovány?",
        "retrieved_contexts":[
            "Letošní festivalový program je poznamenán stodvacátým výročím narození profesora Vladimíra Úlehly, všestranně vzdělané filozoficky a humanisticky orienních dvou ročníků Národopisných slavností ve Strážnici, z nichž vyrostl tento v Evropě jedinečný MeziNadčasovost a inspirativnost jeho díla připomene promítnutí filmu Mizející svět i pořad s poetickým názvem Písňovou zahradou.  Tož, pěkné chvíle ve Strážnici a za rok na shledanou!  PhDr. Karel Pavlištík, CSc.  RADIO PROGLAS mediální partner MFF „Strážnice 2008“  ý Vonička lidových písní lidové písně, výročí, pozvánky, novinky pondělí až sobota 10.30 - 11.00, sobota 18.30- 18.45  Folklorní okénko tématický pořad pro milovníky lidových písní. medailony, rozhovory, pozvánky středa za pět pět odpoledne (repíza krátce po půlnoci z neděle na pondělí)",
            "v rámci Folklorního festivalu ve Strážnici jeho dětská část, dnes již všeobecně známý festival Dětská Strážnice. A toto jubileum není jediné. Letošní ročník Dětské Strážnice je již ročníkem třicátým. Uvedená výročí jsou důvodem k oslavě, ale současně evokují otázku, jaký význam a jaké místo má dětský folklorní festival na MFF ve Strážnici, nejstarším, nejrozsáhlejším i nejvýznamnějším folklorním festivalu u nás. Není náhoda, že právě ten dal dětskému festivalu vzniknout a vlastně jej Možná překvapí nesrovnalost v obou výročích, ale právě o tom budeme v letošní folklorní škole povídat. A ovšem nejen o tom, protože historie Dětské Strážnice je obrazem vztahu k dětskému folkloru, jeho prezentaci na jevišti a ovšem i k dětem. Odráží také dobu, v níž festival vznikl, v níž se rozvíjel. Ukazuje smysluplnost péče o své pokračovatele. Připomenutí historie doplní dětští a mladí muzikanti z Velké nad Veličkou, mimo jiné i proto, že právě odtud přicházeli první účinkující na Dětskou Strážnici. Účinkující: - vedoucí: Petr Hlahůlek CM Lipovjánek z Lipova - vedoucí: Petr Galečka",
            "některých vítězů dřívějších strážnických soutěží (autorem pořadu je dr. Josef Tomeš). Vracíme se tak k myšlence pěveckých, hudebních a tanečních soutěží, na něž vzpomíná v „Živé písni“ profesor Vladimír Úlehla: „Když na mne brzo na podzim 1945 přišli Strážničané, řekli, že by v létě 1946 uspořádali rádi ve strážnickém zámku, který se stal majetkem obce, celostátní národopisné slavnosti, a žádali mne, abych poradil, jakou vnitřní náplň jim dát. Hle, jaká netušená příležitost obnovit v nové demokratické formě starý zvyk pěveckých a hu deckých závodů ve strážnickém zámku, vráceném do rukou lidu! Chopil jsem se jí a navrhl za jeden z hlavních bodů programu závod hudců, závod zpěváků a závod verbířů.“ Mezinárodní folkloristický festival ve Strážnici zaujímá",
            "Další novinkou letošní Strážnice je komorní pořad dělnických písní a vyprávění. Není to vždy folklór v plném slova smyslu, neboť zvláště v době mezi dvěma válkami se kultura dělnické třídy mění v repertoár upravovaný speciálně pro potřeby třídního boje, v němž agitační prvky nabývají nové kvality. Tak se i tato tvůrčí oblast objeví ve strážnickém programu jako důstojná paralela původní vesnické, tj. zemědělské společnosti.  Nedílnou součástí je i vystoupení dětí a mládeže, v níž dnešní čtyřicátníci a padesátníci vidí budoucí pokračovatele tradice. Dětské výkony jsou o to záslužnější, že se neustále mění a přetvářejí, i když řada souborů není ve Strážnici poprvé. Letošní festival pořádáme v jubilejním roce oslav čtvrtstoletého výročí Vítězného února 1948. Cesta k socialismu,",
            "Strážničané, řekli, že by v létě 1946 uspořádali i na strážnickém zámku, který se stal majetkem obce, celostátní slavnosti a žádali mně, abych poradil, jakou vnitřní náplň jim dát. Hle, jaká netušená příležitost dů... navrhl jsem za jeden z hlavních bodů programu závod hudců, závod zpěváků a závod verbířů.“ Mnoho let uplynulo v řece Moravě, protékající tak blízko Strážnice. Znovuoživené soutěžní programy, tolik populární v prvních ročnících festivalu, si opět našly své diváky, muzikanty, zpěváky, porotce, vítěze a přesto žádné poražené.  Je velmi potěšující, že v pravidelných tříletých intervalech patří strážnické pódium ve skanzenu také dětem, zpěvákům i muzikám. Je to setkávání a soutěžení čisté, jako pramen vody živé. Letošní strážnický festival vítá dětské muziky z Moravy, pro které je toto setkání zároveň jejich strážnickou premiérou. Nové tváře a nové hlásky jejich sólistů-to bude slovy Vladimíra Úlehly ten pravý „závod zpěváků“. Napjaté očekávání a hodnocení diváků a dětské i dospělé poroty zpestří letos také ocenění výkonů primášů. Kterému budou dnes housle nejkrásněji zpívat?"
        ],
        "response":"Profesor Vladimír Úlehla je připomínán v rámci festivalu ve Strážnici v souvislosti s jeho přispěním k založení Národních slavností a celostátních národopisných slavností v roce 1946. V roce 2008 je připomínán promítáním filmu *Mizející svět* a pořadem s názvem *Písňová zahrada* [doc1]. V roce 2006 je citován, když popisuje, jak Strážničané požádali o radu ohledně vnitřní náplně Národních slavností a navrhl závod hudců, zpěváků a verbířů [doc5].",
        "reference":"Festival ve Strážnici reflektuje význam a odkaz profesora Vladimíra Úlehly tím, že letošní program je poznamenán stodvacátým výročím jeho narození. Konkrétní prvky programu věnované jeho odkazu zahrnují promítnutí filmu \"Mizející svět\" a pořad s poetickým názvem \"Písňovou zahradou\".",
        "faithfulness":1.0,
        "answer_relevancy":0.8759066127,
        "answer_correctness":0.6822825906,
        "context_precision":1.0,
        "context_recall":1.0,
        "context_sufficiency":1.0
    },
    {
        "user_input":"Jaké role a aktivity jsou nabízeny návštěvníkům festivalu ve Strážnici a jak tyto možnosti přispívají k celkovému zážitku z festivalu?",
        "retrieved_contexts":[
            "roce byly návštěvníkům festivalu předloženy ukázky z videoencyklopedie lidových tanců v České republice, v tomto roce je chceme upozornit na jiný videoprojekt, který Ústav lidové kultury ve Strážnici zpracovává od konce roku 1996 za přímé finanční podpory UNESCO a Ministerstva kultury ČR v Praze. Jedná se o vybraná lidová řemesla a technologie lidové umělecké výroby. Jejich ukázky budou mít návštěvníci možnost zhlédnout v pořadu \"Jarmark můz“ v Muzeu vesnice jihovýchodní Moravy. Chceme tak poněkud rozšířit tematiku tradičních folklorních festivalů. Ostatně, není to nic nového. Obdobné pořady jsou ve Strážnici často. Je to v souladu i s obecnou snahou festivalů CIOFF, k nimž \"Strážnice“ patří, přispívat nejen k zábavě, ale též k poučení, obohacení znalostí a",
            "v rámci Folklorního festivalu ve Strážnici jeho dětská část, dnes již všeobecně známý festival Dětská Strážnice. A toto jubileum není jediné. Letošní ročník Dětské Strážnice je již ročníkem třicátým. Uvedená výročí jsou důvodem k oslavě, ale současně evokují otázku, jaký význam a jaké místo má dětský folklorní festival na MFF ve Strážnici, nejstarším, nejrozsáhlejším i nejvýznamnějším folklorním festivalu u nás. Není náhoda, že právě ten dal dětskému festivalu vzniknout a vlastně jej Možná překvapí nesrovnalost v obou výročích, ale právě o tom budeme v letošní folklorní škole povídat. A ovšem nejen o tom, protože historie Dětské Strážnice je obrazem vztahu k dětskému folkloru, jeho prezentaci na jevišti a ovšem i k dětem. Odráží také dobu, v níž festival vznikl, v níž se rozvíjel. Ukazuje smysluplnost péče o své pokračovatele. Připomenutí historie doplní dětští a mladí muzikanti z Velké nad Veličkou, mimo jiné i proto, že právě odtud přicházeli první účinkující na Dětskou Strážnici. Účinkující: - vedoucí: Petr Hlahůlek CM Lipovjánek z Lipova - vedoucí: Petr Galečka",
            "riálního kulturního dědictví lidstva a ke sledování festivalového průvodu poprvé zakončeného prezentací strážnických folklorních souborů; - roli spolutvůrce programu, kterou nám nabízí účast vanketě diváka Soutěže o nejlepšího tanečníka slováckého verbuňku nebo návštěvníka Dětského dvoru; - roli účinkujícího, s níž počítají autoři pořadu Zazpívejme sobě a pospolu; roli dychtivého žáka školy tradičních tanců světa pro začátečníky a mírně pokročilé strážnické diváky nebo roli náročného posluchače Folklorní školy mravů stodoly, kde letos za katedru usedne profesor Antonín Přidal, a nakonec krásnou roli milovnickou, roli těch, kdo do Strážnice putují také proto, aby si tu v letní noci jen tak, pro potěchu svého srdce zazpívali, zatancovali či zahráli.",
            "„Vaším šálkem čaje“ i Vás, kdo se tu možná trochu zaskočeni nabídkou třiceti programů octnete v první „všechno v dobré obrátí“ a Vy si každý ke své spokojenosti budete v tomto směru vědět rady. Programová skladba strážnického festivalu dokonce umožňuje, aby si jeho účastník vybral, v jaké z několika možných rolí stráví chvíle červnového víkendu ve strážnickém parku. Ti zkušení vědí, že nejlépe je vyzkoušet role všechny: - roli diváka, která Vás přivede do hlediště amfiteátrů ke sledování velkých pódiových pořadů, jakými letos určitě bude například pořad věnovaný Kraji beze stínů -hanáckému Slovácku, pořad věnovaný dětskému folkloru či vystoupení zahraničních souborů, v němž budou představena některá díla zařazena rozhodnutím UNESCO mezi Mistrovská díla ústního a nemate-",
            "estetických zážitků široké veřejnosti. 53. ročník Mezinárodního folklorního festivalu ve Strážnici se uskuteční ve dnech 26. - 28. června 1998. Přijďte se podívat, jak folklorní soubory, kapely, vesnické skupiny z Čech, Moravy, Slezska, ale především z rozličných koutů světa, prostě z krajin za obzorem“, budou předvádět ukázky lidových tradic svých národů. Přijďtě se potěšit krásou a nadýchnout se neopakovatelné atmosféry strážnických dnů a nocí, plných čarovných melodií.  PÁTEK 26. 6. 1998  18.00 - 20.00 hod. skanzen - areál Hody, milé hody 20.30 -20.50 hod. amfiteátr Bludník Slavnostní zahájení festivalu 20.50 - 22.30 hod.  amfiteátr Bludník Z krajin za obzorem - pořad zahraničních souborů  23.00 - 00.30 hod.  amfiteátr Bludník Pomoraví. Řeka, která rozděluje i spojuje"
        ],
        "response":"Návštěvníci Mezinárodního folklorního festivalu ve Strážnici si mohou vybrat z několika rolí a aktivit [doc4]. Mohou být diváci sledující pódiová představení, jako je pořad věnovaný Kraji beze stínů – hanáckému Slovácku, dětskému folkloru nebo vystoupení zahraničních souborů [doc4]. Další možností je účast v soutěži o nejlepšího tanečníka slováckého verbuňku nebo návštěva Dětského dvora [doc3]. Mohou se stát dychtivými žáky školy tradičních tanců světa nebo náročnými posluchači Folklorní školy mravů stodoly [doc3]. Festival také nabízí možnost být milovník, který si užívá atmosféru a hudbu [doc3]. Tyto různé role a aktivity umožňují návštěvníkům přizpůsobit si zážitek a obohatit ho o estetické zážitky [doc5].",
        "reference":"Návštěvníkům festivalu ve Strážnici jsou nabízeny různé role a aktivity, které přispívají k celkovému zážitku z festivalu. Mohou se stát spolutvůrci programu účastí v anketě diváka Soutěže o nejlepšího tanečníka slovenského verbuňku nebo návštěvou Dětského dvoru. Mohou se také zapojit jako účinkující v pořadu Zazpívejme sobě a pospolu, nebo se stát dychtivými žáky školy tradičních tanců světa pro začátečníky a mírně pokročilé. Pro náročné posluchače je připravena Folklorní škola - mravů stodoly, kde letos přednáší profesor Antonín Přidal. Návštěvníci mohou také přijmout roli milovníků, kteří do Strážnice putují, aby si v letní noci zazpívali, zatancovali či zahráli pro potěchu svého srdce. Tyto možnosti umožňují návštěvníkům aktivně se zapojit do festivalu a prožít ho z různých perspektiv, což obohacuje jejich celkový zážitek.",
        "faithfulness":1.0,
        "answer_relevancy":0.947559586,
        "answer_correctness":0.5998367344,
        "context_precision":1.0,
        "context_recall":1.0,
        "context_sufficiency":1.0
    },
    {
        "user_input":"Jaké byly důsledky působení Kamila Krofty jako ministra zahraničních věcí na jeho vědeckou práci a jak se jeho zkušenosti z koncentračního tábora promítly do jeho pozdějšího přínosu pro českou historickou vědu a diplomatickou službu?",
        "retrieved_contexts":[
            "mi, z nichž pro jeho další práci byly zvláště cenné praktické zkušenosti z radiotechniky a jazykové znalosti. Studium na Přírodovědecké fakultě bylo zaměřeno převážně na výchovu středoškolských učitelů. J. Kaczér však od počátku pomýšlel na práci ve výzkumu, tehdy ještě nejistou, a proto studoval pokusně zavedený směr užité fyziky. Z vysokoškolských učitelů na něj měli největší vliv profesoři A. Žáček a V. Petržílka, zaměření na experimentální fyziku a elektrotechniku. Studium ukončil jako jeden z prvních v roce 1948 s titulem „magistr užité fyziky“. Po krátkém působení v n. p. Tesla, kde se zabýval návrhem antén, nastoupil v roce 1949 na vědeckou aspiranturu, která byla právě po sovětském vzoru založena a na prvních aspirantech spíše zkoušena. Jeho školite-",
            "nímu programu, jehož obsah patřil plně vědecké práci a studiu domácích dějin. Množství otázek, které Krofta řešil, má tutéž průkopnickou platnost jako rozvedení příčin, ve doucích k Bílé hoře. Funkce ministra zahraničních věcí, jímž se stal po volbě dr. E. Beneše presidentem republiky, odvedla ho na čas z pracovny badatele, ale poněvadž minulost chápal vždy jako historickou mravní zkušenost, nikdy nepřerušil svůj vědecký pracovní program a zapojil ho hned po osvobození do služeb nového státu, a ještě krátce před smrtí ohlásil vydání několika knih. Podlehl v důsledku úplného vyčerpání, vzniklého za více než ročního pobytu v koncentračním táboře terezinském. S Kamilem Kroftou odešel před dvěma roky z české historické vědy i diplomatické služby historik vpravdě národní.",
            "spatřuje duchovní sestru Francie, spolek „Mánes“ a československé umělce s přáním mnoha zdaru. Jménem ministra zahraničních věcí dr. Krofty, který dlí právě v Bělehradě, ocenil u příležitosti tohoto významného jubilea zásluhy spolku „Mánes“ vyslanec dr. Wellner. Zvláště poukázal na dlouholetou práci „Mánesa“ na utužení kulturních styků národa československého s národy ostatními. Odborový přednosta ministerstva školství a národní osvěty dr. Witrh tlumočil politování ministra školství dr. Emila Frankeho, že nemůže býti osobně účasten, a v jeho zastoupení učinil projev, v němž zhodnotil padesátileté dílo „Mánesa“. Prof. dr. Max Švabinský vzpomněl všeho, co spolek vykonal, a dovodil, že z prvotní činnosti rázu více politického přešel „Mánes“ k vlastní tvorbě na poli",
            "inspekce na reál. gymnasiu. Dne 18. pros. 1940 vykonal na ústavě inspekci p. odbor. inspektor pro zpěv Oldřich Hilmera. Vzpomínka. Na 28. prosince 1940 připadlo 90. výročí narozenin Ph. Dr. h. c. Františka Mareše, archivního rady a ředitele archivu v Třeboni, zesnulého loňského roku. Při příležitosti jeho úmrtí byla zhodnocena v odborném tisku jeho vědecká činnost a jeho význam pro archivnictví a českou vědu historickou. V archivu třeboňském mu zachována trvalá pamět Pochvalné uznání. Česká zemská školní rada pro Čechy v Praze vyslovila p. Rudolfu Korandovi, řídícímu učiteli obecné školy v. v. v Třeboni při jeho odchodu na trvalý odpočinek pochvalné uznání za dlouholeté, vytrvalé a svědomité působení ve školní službě. za velmi horlivou a úspěšnou práci školní, za svědomité a vzorné řízení školy i za významnou činnost mimoškolní v oboru lidovýchovy a a zvláště v boru sociální péče o mládež.",
            "Do koncentračního tábora. Z Berlína, 8. srpna. Na rozkaz tajné státní policie byli do koncentračního táboru v Oranienburgu dáni Alfred Braun, intendant Flesch, ředitel Magnus a ministerský rada Giesecke, kteří jsou zapleteni do korupční aféry v německém rozhlasu. Býv. řed. Knöpfke, který byl rovněž zatčen, musel býti pro nervové zhroucení nejdříve dopraven do nemocnice. Býv. říš. komisař pro rozhlas, státní tajemník m. sl. dr. Bredow zaslal ministru propagandy telegram, v němž prohlašuje, že byli zatčeni a do koncentračního tábora dáni muži, kteří se nesmírně zasloužili o německý rozhlas, že jest s nimi solidární a proto prosím, aby stejně bylo jednáno i s ním.  Předsednictvo kartelové komise. Z Prahy, 8. srpna. Vláda ve své poslední schůzi dne 5. srpna jmenovala podle ustanovení § 19. zákona ze dne 12. července 1933, č. 141 Sb. z. a n. o kartelech a soukromých monopolech (kartelový zákon)- předsedou kartelové komise JUDra Rudolfa Hotowetze, vládního komisaře Všeobecného pensijního ústavu a býv. ministra pro zahraniční obchod a jeho náměstkem inž. Václava Roubíka, odb. předn. a býv. ministra veřejných prací."
        ],
        "response":"Kamil Krofta byl po osvobození zapojen do služeb nového státu a krátce před smrtí ohlásil vydání několika knih [doc2]. Funkce ministra zahraničních věcí, kterou zastával po volbě dr. E. Beneše prezidentem republiky, ho na čas odvedla od vědecké práce [doc2]. Krofta podléhl v důsledku úplného vyčerpání, vzniklého za více než ročního pobytu v koncentračním táboře Terezín [doc2]. Jeho působení v koncentračním táboře a následné vyčerpání ovlivnily jeho pozdější přínos pro českou historickou vědu a diplomatickou službu [doc2].",
        "reference":"Funkce ministra zahraničních věcí odvedla Kamila Kroftu na čas z pracovny badatele, ale nikdy nepřerušil svůj vědecký pracovní program a po osvobození ho zapojil do služeb nového státu. Jeho zkušenosti z koncentračního tábora vedly k úplnému vyčerpání, kterému podlehl, ale ještě krátce před smrtí ohlásil vydání několika knih, čímž přispěl k české historické vědě a diplomatické službě.",
        "faithfulness":0.8333333333,
        "answer_relevancy":0.9252393292,
        "answer_correctness":0.9879357808,
        "context_precision":0.5,
        "context_recall":1.0,
        "context_sufficiency":0.0
    },
    {
        "user_input":"Jaké byly důvody a důsledky pořádání sjezdu rolnictva Českoslovanského a jakou roli v tom hrály sokolské jednoty a Matice školská?",
        "retrieved_contexts":[
            "V roce 1919 převzal většinu základních škol stát, Matice ale pokračovala během celé první republiky ve zřizování internátů, mateřských a odborných škol v pohraničí.\n7. července 1901 byla v Plzni pořádána velkorysá slavnost ve prospěch Ústřední Matice školské, na které veřejně vystupovalo čtyřiasedmdesát krojovaných členů vyslaných z Chodska. Po slavnostním průvodu městem následovalo vystoupení v plzeňské Sokolovně, ve které se rozléhaly lidové písně a tance.\nÚstřední matice školská založená roku 1880 měla podporovat vznik a provoz menšinových českojazyčných škol v národnostně smíšených oblastech Rakouska-Uherska, zejména v českém pohraničí. Opírala se o silnou podporu ze strany českých politiků, novinářů i široké veřejnosti.\nProstředky získávala Matice školská dobrovolnými sbírkami nebo dobročinnými akcemi kulturního charakteru. Přestože její činnost byla namířena především proti procesu poněmčování českých škol za Rakousko-Uherska, pokračovala ve svých aktivitách i v období existence Československa v letech 1918-1938.\nPředkládaná diplomová práce se zabývá fungováním soukromých menšinových škol Ústřední matice školské a osudy jejich učitelů v oblasti jižních Čech v letech 1880-1918.\nátku 20. století, významným způsobem odráží libe-ralizační a demokratizační procesy stejně jako národnostní konflikty posledních čtyř dekád habsburského soustátí. Školské spolky měly, přes veškerou svou pro-klamovanou apolitičnost, nepřehlédnutelné vazby na národně-liberální politické kruh.\nTouto základnou byla síť mateřských škol a opatroven, které umožňovaly přípravu dětí na budoucí školní výuku v jejich mateřském jazyce a které se staly jedním z hlavních nástrojů proti odnárodňování českých dětí. Matice tak po válce podstatně rozšířila své cíle, plynoucí z dosud platných stanov.\nVyhlášené byly matiční slavnosti, pořádané rok co rok v zahradě Českého akciového pivovaru od 1899. Českobudějovická Matice školská se rozloučila s veřejností vydáním pamětní publikace a 28. 1. 1925 se dobrovolně rozešla.\nCo vedlo k únorovému převratu v roce 1948 a jak é byly jeho důsledky ? Jakou roli v tom sehrály západní mocnosti? Ještě sedmdesát let od této události, která zásadně ovlivnila vývoj poválečného Československa, jde o emotivní téma.\nAkce byly nejprve namířeny proti nekomunistickým politikům, potom probíhaly i čistky v rámci strany. Oběťmi byli duchovní, diplomaté, účastníci nekomunistického odboje (letci), šiřitelé tiskovin, vojáci, trockisté, hospodářští činitelé.\nSlovanský či též všeslovanský, nebo panslovanský sjezd či kongres je setkání zástupců slovanských národů v době emancipace slovanských národů ve střední a východní evropě.\nDobová reportáž z prvního celostátního sjezdu družstevníků, který se konal v roce 1953 v Praze. Zúčastnilo se ho více než 5000 zemědělců, kteří zde jednomyslně schválili družstevní stanovy.\nPrávě únor ukázal velikou politickou a orga-nisační vyspělost KSČ, vedoucí roli KSČ v ná-rodě a politickou zralost dělnické třídy v Česko-slovensku. Avšak ukázal také podle slov Kle-menta Gottwalda, na listopadovém zasedání tJV KSČ „skutečný blok pracujícího lidu mezi děl-nictvem a rolnictvem.\nDnes si připomínáme jednu velice významnou událost našich dějin, konkrétně 170 let od prvního slovanského sjezdu , který se uskutečnil v Praze a začal 2. června 1848 na Žofíně.\nV této kapitole se dozvíte, jak é vnější i vnitřní okolnosti provázely vznik, rozvoj a krizové momenty Československa v období 20. a 30. let 20. století, které osobnosti přitom sehrály rozhodující úlohu a jak é významné historické události provázely toto období existence československého státu.\nUdálosti těchto let znamenají závažný zlom v dějinách velké části Evropy.Nikdy předtím a zatím nikdy potom neproběhla v Evropě taková série revolucí, které se vzájemně inspirovaly a ovlivňovaly."
        ],
        "response":"V dostupných pramenech chybí podklady k tématu sjezdu rolnictva Českoslovanského, jeho důsledkům, roli sokolských jednot a Matice školské.",
        "reference":"Sjezd rolnictva Českoslovanského byl pořádán jako součást slavnostního průvodu ke službám božím a následné velké národní slavnosti ve prospěch Matice školské. Sokolské jednoty byly vyzvány k udržování pořádku a uspořádání průvodu, zatímco Matice školská byla příjemcem prospěchu z této národní slavnosti, což mělo přispět k podpoře českého školství.",
        "faithfulness":0.0,
        "answer_relevancy":0.0,
        "answer_correctness":0.2219709426,
        "context_precision":0.9999999999,
        "context_recall":0.75,
        "context_sufficiency":0.0
    },
    {
        "user_input":"Jaké byly hlavní faktory, které přispěly k tomu, že Marie François Sadi Carnot byl považován za vhodného kandidáta na prezidenta, a jak jeho technické a politické zkušenosti ovlivnily jeho schopnost vykonávat tuto funkci?",
        "retrieved_contexts":[
            "rozřešením. Král Belgický přál první z potentátů štěstí novému presidentovi. Nově zvolený president Marie François Sadi Carnot jest synem slavného publicisty Lazara Hypolita Carnota. Narodil se 11. srpna 1837 v Limoges, jest tedy 50 let stár. Vynikl hlavně jako technik. Do roku 1871 byl inženýrem v Annecy, kde provedl mnohé stavby mostů a průplavů. Potom za republiky stal se prefektem v kraji Dolnosekvanském, kdež v Normandii zřizoval národní obranu proti Prušákům. Téhož roku byl zvolen do národního shromáždění, kdež se připojil k straně Gambettově. Od 23. září 1880 do 14. listopadu 1881, kdy Gambetta sestavil svou vládu, byl ministrem veřejných prací. Co Carnota zvláště způsobilým činí k hodnosti té jest, že neúčastnil se bojů jednotlivých frakcí a že není politikem ve ve velkém stylu, dále čestnosť jeho i jeho rodiny.",
