[
    {
        "user_input":"Jaké byly důsledky zavedení říšského zákona ze dne 10. prosince 1863 na chudé venkovské obce a jaké problémy tento zákon způsobil v souvislosti s pohyblivými třídami obyvatelstva a jejich právem domovským?",
        "retrieved_contexts":[
            "Z oboru samosprávy. Přijetí ve svazek domovský v Praze. (Panu Na. zl.) Zákonem říšským ze dne 3. prosince 1863, kterým se pořádají záležitosti domovské, jest ustanoveno v § 49., že od té chvíle, kdy dotčený zákon domovský nabude platnosti, pozbudou v příčině věcí, o kterých se v něm nařizuje, všichni zákonové předešlí, kteří se s ním nesrovnávají, moci své. Jakož dle dotčeného říšského zákona domovského nelze nabýti práva domovského pouhým, nepřetržitým zdržováním se v obci po určitou řadu let, jest tímto zákonem také zrušeno ustanovení § 11. zat. obecního řádu města Prahy, dle kterého „měl každý říšský občan rakouský právo, žádati, aby přijat byl za příslnšníka obce pražské, když 1. měl úplné právo a moc, nařizovati o své osobě a o své majetností; 2. když před tím nejméně deset let bez",
            "Země událostmi poslední nešťastné války hluboce dne 26. února zákon o zastupitelstvu říšském, zemské plomu 1860 čl. II. uvedeny jsou, říšské radě ouplné, stížená počíná zotavovati se z ran jí zasazených. zřízení a řád volení pro markrabství Moravské prohlánemohou tyto záležitosti přenechati shromáždění dle Řada návrhů zákonů a otázek týkajících se blaha silo, sněm zemský, ačkoli tyto zákony ústavní od věků stávajících základních zákonů k tomu nikterak neoprávzemě, ježto v dřívějších zasedáních byly již vzaty v úzděděné právo těchto zemí a složení sněmu od stavů něnému, ač nechtějí-li svoje postavení jakožto organické vahu, nemohly býti uvedeny ku konci, tak návrhy zátohoto markrabství následkem královského reskriptu ze individuality uvésti tím v nebezpečenství.",
            "jímžto se změňují některá vyměření zákona o tisku, daného dne 17. prosince 1862, č. 6 zákonníka říšského na rok 1863, a zákona o řízení trestním u věcech tiskových, daného téhož dne, č. 7 zákonníka říšského. (Obsaž. v částce LVIII. zákonníka říšského, č. 142, str. 409, vyd. a rozesl. dne 18. října 1868.) S přivolením obojí sněmovny rady říšské vidí se Mi z části změniti zákon o tisku, daný dne 17. prosince 1862 (č. 6. zákonníka říšského na r. 1863) a zákon o řízení  v trestních věcech tiskových, daný téhož dne (č. 7. zákonníka říšského na rok 1863), a naříditi takto:  Článek I. §. 12. zákona o tisku bude takto zníti: Odpovědným redaktorem periodického spisu tištěného může býti toliko občan rakouský, který jest v požívání práv svých a bydlí v tom místě, kde spis periodický",
            "Vedle neporušeného zachování obou těchto zásad musí ale též postaráno býti, aby co nejdříve odpomoženo bylo vadám, které odkryla zkušenost jak ve formální, tak v materialní části zákona o tisku. Rovněž neodkladným jest upravení práva spolčovacího a shromažďovacího, aby toto základní právo ústavnosti postaveno bylo pod ochranu a v meze zákonů a jásně ustanoveny hranice práva dohledacího i povinnosti dohledací vlády. Poslední říšský sněm usnesl se o zákoně o vyvazení desátku z vína. Úkolem nynějšího říšského sněmu bude, aby odstranil ostatní, ještě stávající feudální poměry šetře při tom úplně svatosti majetku na základě pravých národohospodářských zásad. Právě minulý říšský sněm rozšířil zákonem o národní škole blahé následky vyučování na každého.",
            "Článek 8. Svoboda osobní jest pojištěna. Zákon, daný dne 27. října 1862 (č. 87 zákonníka říšského) pro ochranu svobody osobní, prohlašuje se tímto za čásť tohoto základního zákona státního. Byl-li by kdo proti zákonu zatčen aneb zatčení jeho prodlouženo, vzejde z toho státu povinnost, nahraditi mu za takové ublížení škodu. Článek 9. Právo domácí jest neporušitedlné. Zákon, daný dne 27. října 1862 (č. 88 zákonníka říšského) pro ochranu práva domácího, prohlašuje se tímto za čásť toho základního zákona státního. Článek 10. Tajnost psaní nebudiž porušována, a psaní zabavována buďte dle zákonů o tom vydaných toliko v případech války aneb z rozkazu soudcovského, leč že by byl někdo dle zákona zatčen nebo by bylo v domě hledáno. Článek 11. Každému přísluší právo petiční.",
            "sedského práva (občanského) odepříti nemůže, kteří domů neb pozemností v mezích obce položené od souseda nabyli anebo dědili, když ten, který o sousedské právo žádá, a) s předchozím majitelem nemovitosti v poměru manželském neb ve spolku příbuzenství se nacházel, a b) z bezúhonné pověsti se těší. §. 8. Každý rakouský občan státní má míti v některé obci právo domovské. Práva a povinnosti domovské ustanoví se zvláštním zákonem říšským. (Článek II. zákona, daného 5. března 1862.) Až do vydání zákona takového zůstanou v platnosti nynější nařízení o právě domovském vydaná. O žádosti cizího (přespolního) za propůjčení domovského práva rozhoduje obec. (Článek II. a III. zákona dan. d. 5. března 1862.) §. 9. Názvy ohčanův v jednotlivých obcích odvyklé tímto zákonem se nezrušují.",
            "Zákonník říšský pro  království a země v radě říšské zastoupené.  Částka XXXIII. — Vydána a rozeslána dne 11. června 1873.  Zákon, daný dne 2. května 1873, pro království Dalmatské, o tom, jak se má u soudů předsejíti v rozepřech, vzešlých ze smlouvy o nájem vůbec, též když se dává výpověď z pachtovaných nebo najatych věcí nemovitých aneb zákonem za nemovité prohlášených, jakož i z mlýnů lodních a z jiných stavení na lodích zřízených, i také když se tyto věci vracejí. S přivolením obojí sněmovny rady říšské vidí se Mi naříditi takto:  §. 1. Všeliké rozepře, vzešlé ze smluv o nájem, výpovědi ze smluv těchto prostředkem soudu dávané, všeliká přelíčení a jiná opatření, učiněná z příčiny výpovědi, dané z pachtovaných nebo najatých pozemků, stavení a jiných věcí nemovitých aneb zákonem za nemovité pro-",
            "Jaké jsou v těchto dnech hlavní bezpečnostní výzvy? Těch prvků je celá řada. Jaderná elektrárna je extrémně komplexní zařízení, je tam obrovské množství systémů a technologií, všechny musí být perfektně sladěny.\nPraha, 1898; HABICHT, K. Zákon obecní pro království české ze dne 16. dubna r. 1864 se všemi doplňky a dodatky a volebním řádem do obcí .\nDne 22. 1. 2026 skončila výjimka pro držitele dočasné ochrany, pro které bylo vydání potvrzení o pobytu dosud bez… Prodloužení víz strpění vydaných v souvislosti s ozbrojeným konfliktem na Ukrajině.\nVeřejnost slyšela hlavně to, že diverzifikujeme a že budoucnost patří LNG. Jaké objemy? Za jaké ceny? S jakými závazky? Inu – geopolitika je složitá věc, občane, to bys stejně nepochopil.\nDiskusia: 2 príspevky. Prečítané: 140x. Na okraji obce Haluzice, okres Nové..."
        ],
        "response":"Omlouvám se, ale na základě poskytnutých dokumentů nemohu odpovědět na otázku ohledně důsledků zavedení říšského zákona ze dne 10. prosince 1863 na chudé venkovské obce a problémy s pohyblivými třídami obyvatelstva a jejich právem domovským.",
        "reference":"Zavedení říšského zákona ze dne 10. prosince 1863 poškozovalo chudé venkovské obce na prospěch zámožných a rostoucích měst a míst průmyslových, protože obyvatelé pocházející z cizích obcí byli nuceni hledat pomoc u své obce domovské, kde byli neznámí a ničím neprospěli. Nový zákon neodstranil tyto nedostatky úplně, protože požadavek nepřetržitého pobytu 10 let byl příliš dlouhý pro pohyblivé třídy obyvatelstva, které byly nuceny zdržovat se mimo obec domovskou kvůli ekonomickým a sociálním poměrům.",
        "faithfulness":0.0,
        "answer_relevancy":0.0,
        "answer_correctness":0.2285343827,
        "context_precision":0.8333333333,
        "context_recall":1.0,
        "context_sufficiency":0.0
    },
    {
        "user_input":"Jaké byly důsledky odhalení pomníku Josefa Dobrovského v Praze na vnímání jeho odkazu a jak se to projevilo ve veřejném prostoru města?",
        "retrieved_contexts":[
            "Besedy a k uskutečnění zmíněného cíle nezištně pracovali, by opět zavítali mezi nás a laskavě podali nám své ruce k dílu, jež korunováno bude jednou historií národa. Veškeří bývalí p. t. členové nechť vstoupí opět v řady naše s prominutím všech spolkových příspěvků, by oslava velikého muže též velikolepě skončena byla. První schůzka ustavujícího se slavnostního výboru pro odhalení pomníku Jos. Dobrovskému odbývá se dne 22. března 1902 o 8. hod. večerní ve velkorestauraci »Konviktě« a žádá se, by se všichni příznivci a ctitelé Jos. Dobrovského do ní určitě dostavili. V Praze, dne 15. března 1902. Za správní výbor Besedy »Dobrovský« v Praze Josef Müller, t. č. starosta.  Z komitétu pro vnitřní okrášlení kaple v Nuslich. Na pořízení nového postranního oltáře Panny Marie",
            "slice ukazují, nezbývá nám nic jiného, než pěkně platit — a zas platit. Pomník věhlasného učence českého Josefa Dobrovského odhalen byl v den sv. Petra a Pavla o půl 11 hod. dopoledne ve městském sadě blíže musea království českého v Praze. Pomníkem tímto bude počet veřejných pomníků, kterými se máti českých měst Praha honosí, opět rozmnožen. Těšíme se z toho velice, že pomník tento platí křísiteli národa našeho, který mu mimo tento pomník zachová ještě jiný, a to věčnou pamět v srdcích svých. Dle učení Tolstého. „Nový kult“ v 9. svém čísle v překladu má tento zajímavý dopis. Bývalý vojenský lékař dr. Skarvan byv vyzván obecní radou v Locarnu ve Švýcarsku, aby zaplatil daně, odpověděl následujícím listem. „Obecní radě v Locarnu! Dne 24. t. m. přišel do mého bytu jeden",
            "policejní síť a nejpřísnější censura. Jak každá svobodnější myšlenka byla tehdy stíhána, toho význačným dokladem jest osud lidumilného kněze idealisty, Bernarda Bolzana, professora náboženství při fakultě filosofické v Praze. Bolzano totiž ve svých výkladech kladl hlavní váhu na ducha náboženství, nikoli na dogmata; ale ačkoliv kacířství u něho shledáno nebylo, přece učení jeho uznáno bylo za nebezpečné státu, úřad jeho mu odňat a jen důraznému zakročení Josefa Dobrovského se podařilo zachovati mu osobní svobodu. O krutém řádění tehdejší censury svědčí jednak ohromný počet zabavených knih (za dvě léta 2500 spisů), jednak zákaz vydávati Komenského, poněvadž byl český vyhnanec, Všehrda, poněvadž knihy jeho nebyly v souhlase se státními poměry rakouskými, Dalimila, poněvadž byl",
            "s podotknutím, že v Praze s radostí znamenali, jak upřímným sympatiím se Francouzové těší u českého obyvatelstva a že budou na svých školách rovněž vštěpovati svěřené jim mládeži úctu a lásku k českému národu. *Pomník Jakuba Vojty Slukova, prvý pomník českého herce, odhalen byl v neděli 21. srpna v rodné obci Jakuba Vojty ve Žlukově u Veselí Mezimostí. Pomník vynikajícímu zemřelému umělci postaven byl nákladem Spolku pro postavení pomníku J. V. Slukova za pomoci divadla Uranie, jejímž, jak známo, ředitelem byl Vojta Slukov až do své smrti dne 16. března r. 1903. K slavnosti odhalení dostavilo se hojně hostí z Prahy, zvláště z kruhů uměleckých. Při odhalení uvítal shromážděné občanstvo a hosty předseda Spolku JUDr. Hoblík, načež slavnostní řečník dr. Ladislav Klumpar vřelými slovy ocenil",
            "velikánu a knězi buditeli Josefu Dobrovskému. Mistrovské dílo nadějného umělce Žďárského, jehož v rozpuku vývinu jeho umělecké tvorby povolal Nejvyšší do svých nevyzpytatelných končin, náleží k nejlepším a nejzdařilejším výtvorům jeho velikého umění a bude zajisté chloubou a ozdobou nejen naší matičky Prahy, nýbrž celého českého národa. Den 29. června 1902 bude opravdovým svátkem všeho českého lidu a velikému učenci Josefu Dobrovskému projevena bude tímto pomníkem nezměrná úcta a láska, s níž český lid na svého buditele s vděkem pohlíží. Aby oslava odhalení pomníku Josefu Dobrovskému byla opravdovým svátkem celého národa a důstojnou representací naši Besedy, vyzýváme tímto co nejlaskavěji všechny p. t. dámy a pány, kteří bývali před lety horlivými členy naší"
        ],
        "response":"Odhalení pomníku Josefa Dobrovského v Praze bylo vnímáno jako významná událost pro český národ [doc 1, doc 2, doc 5]. Den 29. června 1902 byl vnímán jako \"opravdový svátek všeho českého lidu\" [doc 5]. Pomník měl být \"chloubou a ozdobou nejen naší matičky Prahy, nýbrž celého českého národa\" [doc 5]. Pomník Josefa Dobrovského byl jedním z mnoha pomníků, kterými se Praha pyšnila [doc 2].",
        "reference":"Pomník Josefa Dobrovského v Praze přispěl k rozmnožení počtu veřejných pomníků, kterými se město Praha honosí, a zároveň slouží jako pocta křísiteli národa, jehož odkaz bude zachován nejen tímto pomníkem, ale i věčnou pamětí v srdcích lidí.",
        "faithfulness":1.0,
        "answer_relevancy":0.8982168813,
        "answer_correctness":0.6106648574,
        "context_precision":0.8666666666,
        "context_recall":1.0,
        "context_sufficiency":0.0
    },
    {
        "user_input":"Jaké jsou důsledky nesprávného použití nástrojů při odstraňování ušního mazu a jaké preventivní opatření je doporučeno k minimalizaci rizika infekce?",
        "retrieved_contexts":[
            "Caeruminis accumulatio. Jak odstraňovati zátky mazu  lušního ze zevního zvukovodu, pojednává G. Laurens. Především nutno se vystříhati všech nástrojů, jimiž by se mohla poraniti kůže, a třebas byl nástroj úplně sterilisovaný, může z mazu chovajícího spousty bakterií vniknouti do rány nákaza, z čehož resultuje otitis externa, furunculi atd. Stříkačka musí býti tak konstruována, aby se dala sterilisovati co nejpřísněji. Budiž opatřena 3 prsteny. Nechť pojme asi 100 gr. tekutiny. Konec stříkačky budiž opatřen měkkou trubicí kaučukovou. Voda má býti 370 C. teplá. Naplníme jí stříkačku tak, aby neobsahovala bublin, které narážejíce na bubínek, způsobují nepříjemné šelesty. Nemocný při vystřikování má seděti. Na rameně pod uchem chorým budiž šátek, aby se zamezilo potřísnění. Nemocný",
            "propracována Jírovcem a Peterem a jejich spolupracovníky. Znalost jejich základních prací má být samozřejmostí pro každého gynekologa. 2. Rozpoznání, příznakosloví a léčba trichomoniasy muže, který je článkem v přenosu infekce a zdrojem recidiv při konjugální formě trichomoniasy. 3. Preventivní opatření vlastní. Má-li dojít k likvidaci trichomoniasy jako choroby sociální, je třeba se řídit obdobnými zásadami, které jsou běžné při ošetřování kapavky a příjice, t. j. zjištění zdroje nákazy, zde aktivní vyhledávání bezpříznakových nosičů. Trichomoniasa je chorobou pohlavní, ne sice ve smyslu právním, leč nesporně ve smyslu biologickém. Řešení preventivních opatření proti trichomoniase je však daleko svízelkaře sám. Při ošetřování mužské trichomonádové urethritis je nám vyšetření a",
            "minálních infekcí je pak závažná infekce anaerobní (39). Pooperační infekce ran provázejí v USA 1—3 % chirurgických zákroků a asi u 5% osob přijatých do nemocnice lze očekávat, že se u nich během pobytu vyvine infekce některého druhu. Výskyt infekcí operační rány do 1% je považován za normální, od 1 do 2 % za přijatelný, nad 2 % za znepokojivý (4). Užití antibiotik k profylaxi v porodnictví a gynekologii je v boji proti pooperační infekci nepochybně cenné, především pro pacientku samotnou. Má ale i ekonomické důsledky: vede ke snížení doby hospitalizace, ke snížení počtu řady laboratorních vyšetření, která jsou nutná v případech zánětlivé pooperační komplikace a nakonec šetří práci sester i lékařů. Na druhé straně použití antibiotik ve smyslu profylaxe nese s sebou nebezpečí jisté selekce mikrobů, ale hlavně možnosti vzniku",
            "aktivity pankreatických enzymů v séru a moči (amyláza, lipáza) za 24 a 48 hodin po výkonu byly u 59 osob (37,5 % všech kanylací) zachyceny zvýšené hodnoty. Při naplnění pankreatického vývodu (110krát) došlo k přechodnému zvýšení enzymů trvajícímu 1—2 dny v 50 %, při naplnění žlučových cest pouze v 8,5 % (4 ze 47 náplní). — Akutní pankreatitida komplikovala vypšetření u 7 osob, tj. v 4,45% všech kanylací, resp. zvýšení teploty do 38 °C. Komplikace jiného rázu, zejména projevy sepse, alergie a kardiovaskulární příhody nebyly pozorovány. Ve všech případech byla akutní pankreatitida zvládnuta konzervativní léčbou antibiotiky, Trasylolem a parenterální výživou. — Je upozorněno na možné příčiny vzniku vedlejších reakcí při ERCP a jsou doporučena metodická i preventivní a léčebná opatření při výkonu a po něm ke zmenšení rizika komplikací.",
            "Obě nemoci představují obtížný vědecký problém. Nelze s absolutní jistotou odpovědět na všechny otázky, které se jich týkají. Přesto bylo dosaženo velkého pokroku v poznání o vzniku epizoocie BSE, o příčinách jejího šíření, o nejrizikovějších tkáních pro konzumaci a o pravděpodobných příčinách objevení se příbuzné nemoci mezi lidmi. Nejdůležitější poznatek intenzivního výzkumu a praktických zkušeností je ten, že stát může řadou opatření zabránit proniknutí infekčního agens do potravinového řetězce a tak zajistit bezpečnost zásobování masem. Pokud se zavedou všechna příslušná opatření k minimalizaci expozice lidí a jsou také kontrolována, lze hovězí maso a masné výrobky hovězího původu považovat za prosté původce BSE a tedy bez jakéhokoli rizika, že by vyvolaly vCJD u lidí. Dokument obsahuje nejzávažnější dotazy spotřebitelů kladené orgánům veřejné zdravotní správy a veterinářům. Jejich zodpovězení je v zemích s hlášeným výskytem BSE velmi potřebné. Ovšem s ohledem na dlouhou inkubační dobu a na skutečnost, že kontaminovaná krmiva byla mezinárodním obchodem široce distribuována do řady zemí, je užitečné, aby také"
        ],
        "response":"Nesprávné použití nástrojů při odstraňování ušního mazu může vést k poranění kůže a následné infekci, což může způsobit otitis externa a furunculi [doc 1]. Stříkačka by měla být konstruována tak, aby se dala sterilizovat a měla 3 prsteny, pojmout asi 100 gr tekutiny a být opatřena měkkou trubicí z kaučuku [doc 1]. Voda by měla být teplá (37°C) a bez bublin [doc 1]. Pacient by měl sedět při vystřikování a pod uchem by měl mít šátek, aby se předešlo potřísnění [doc 1].",
        "reference":"Nesprávné použití nástrojů při odstraňování ušního mazu může vést k poranění kůže a vniknutí nákazy z mazu chovajícího spousty bakterií do rány, což může mít za následek otitis externa, furunculi atd. Doporučuje se používat stříkačku, která je konstruována tak, aby se dala co nejpřísněji sterilizovat, a měla by být opatřena měkkou trubicí kaučukovou.",
        "faithfulness":1.0,
        "answer_relevancy":0.8159035863,
        "answer_correctness":0.6839050706,
        "context_precision":0.9999999999,
        "context_recall":1.0,
        "context_sufficiency":0.0
    },
    {
        "user_input":"Jaké jsou důvody pro použití různých léčebných metod u novorozenců a dospělých s očními infekcemi, a jaké jsou potenciální důsledky nesprávného použití těchto metod?",
        "retrieved_contexts":[
            "přirozené použít asymptotických metod nelineární mechaniky, neboli t. zv. metody malého parametru. Účinnost těchto metod při řešení různých slabě nelineárních pružných soustav i při řešení problémů fysikálních byla dokázána základními pracemi akademiků K. M. KRYLOVA a N. N. BOGOLJUBOVA. Proto rozvíjení těchto metod a jejich použití pro řešení úloh uvažovaného typu s hysteresí, které jsou klasickým příkladem „slabě nelineárních“ kmitů, bylo zcela přirozené a účelné. Krátce se zastavíme u schematu výpočtu kmitání pružných soustav s uvažováním ztrát v materiálu, při čemž budeme vycházet z nelineárního pojetí problému a použijeme metody nelineární mechaniky, založené na rozvoji v řadu podle mocnin malého parametru.  Vynucené příčné kmity prutu  Pro názornost budeme vyšetřovat typický případ výpočtu kmitání pružné",
            "stigmin, jenž se vkapává v 1\/40 roztoku několikráte denně. Mimo to lze vkapovati každou hodinu aq. chlorat. (1: 2 až 1:3 aq. destill.). Prognosticky jest důležito, že obrat k lepšímu nastává súžením se zorničky. Ku vyjasnění jizev rohovkových, kteréž ovšem lze konati teprve po úplném přestání sekrece, používá se zprvu tinct opiová, každodenně dopoledne. Jelikož novorozenec jest velmi citlivý oproti opiu, nesmí se přenechati podávání jeho lidem domácím. Důležito jest sesíliti zároveň celkový stav dítěte. Mnohem obtížnější jest léčiti gonnorrhoický zánět spojivky u dospělého, jelikož tu i zdánlivě lehký případ může končiti přes nejpečlivější léčení oslepnutím. Tu jest nutno bez výjimky poslati nemocného do nemocnice k ošetřování. (Münch. Med. Woch. 1896, č. 7.) z—.",
            "významnou součástí potravy ptáků a zvěře v horských oblastech. Vyskytuje se v různých formách, z nichž významné jsou zejména genotypy odolné k chorobám, rychle rostoucí a poskytující velké úrody výživných plodů. Reprodukce jeřábu ptačího metodami in vitro má velký význam pro rychlé rozmnožování vybraných hodnotných genotypů. In vitro reprodukce je důležitá pro záchranu cenných genotypů a populací. Prováděné experimenty byly zaměřeny na vypracování vhodných metod reprodukce dospělých stromů Sorbus aucuparia za použití in vitro metod, které by umožnily rychlé rozmnožení odolných a produktivních genotypů. Byl zejména zjišťován vliv různých fytohormonů na množení prýtů in vitro a jejich zakořeňování a růst stromků po jejich vysazení na venkovní plochy. Experi-",
            "obrazu při řešení problémů v mnoha oblastech vědy a techniky. Mitra K.S., Sicuranza G.L.: Nonlinear Image Processing, Academic Press, New York 2000, 455 s., ISBN: 0-12-500451-6, cena: 89,95 USD. V posledních letech nastává výrazný pokrok ve vývoji nelineárních metod v oblasti zpracování signálů a obrazu, zejména pak vzhledem k vývoji počítačové techniky a elektroniky, která začíná umožňovat efektivnější praktické použití sofistikovanějších (nelineárních) algoritmů při analýze digitálního obrazu. Důvody pro použití složitějších nelineárních algoritmů jsou dány především tím, že samotné vizuální vnímání člověka zahrnuje některé nelineární efekty, optické zobrazovací systémy vykazují nelineární chování a reálný obrazový signál nevyhovuje předpokladům při použití lineárních metod.",
            "Druh použití CRM  Konkrétní možnosti využití CRM  vývoj a zhodnocení analytické metody  ověření a zhodnocení přesnosti a správnosti testovaných metod vývoj referenčních testovacích metod zhodnocení rutinních metod ověření způsobilosti (platnosti) metody pro konkrétní použití  zajištění návaznosti měření  vývoj sekundárních RM vývoj protokolů pro zajištění návaznosti analýz přímé rutinní použití  zabezpečení kompatibility měření  přímá kalibrace metod a přístrojů interní zabezpečení jakosti externí zabezpečení jakosti  Certifikované referenční materiály na bázi skel jsou určeny ke kontrole chemického složení skel v laboratořích výrobců, zkušebních, výzkumných a vývojových laboratořích, střediscích metrologických služeb, příp. na dalších pracovištích, zabývajících se"
        ],
        "response":"U dospělých je gonorrhoický zánět spojivek obtížnější léčit, jelikož i zdánlivě lehký případ může končit oslepnutím i přes pečlivé léčení [doc 2]. Proto je nutné poslat nemocného do nemocnice k ošetřování [doc 2]. Novorozenec je velmi citlivý na opium, proto nesmí být podávání opiu přenecháno lidem domácím [doc 2]. Důležité je sesílit zároveň celkový stav dítěte [doc 2].",
        "reference":"U novorozenců je důležité sesílit celkový stav dítěte a opium nesmí být podáváno lidem domácím kvůli citlivosti novorozence. U dospělých je léčba gonnorrhoického zánětu spojivky obtížnější, protože i zdánlivě lehký případ může končit oslepnutím, a proto je nutné poslat nemocného do nemocnice k ošetřování. Potenciální důsledky nesprávného použití léčebných metod zahrnují oslepnutí u dospělých a riziko pro novorozence kvůli citlivosti na opium.",
        "faithfulness":1.0,
        "answer_relevancy":0.8568465085,
        "answer_correctness":0.8632680096,
        "context_precision":0.5,
        "context_recall":1.0,
        "context_sufficiency":0.0
    },
    {
        "user_input":"Jaké byly důvody pro vyloučení komunistické revoluce v Německu a jakou roli v tom hrála organizace občanstva a politická situace v zemi?",
        "retrieved_contexts":[
            "January 27, 2026 - Přirozeným spojencem Hindenburga pro vytvoření autoritativní vlády byla Německá národně lidová strana (Deutschnationale Volkspartei, DNVP), která zastávala pozici nacionalistů, ovšem po roce 1929 vlivem nastupující ekonomické krize čelila odlivu mladých a více radikálních sympatizantů k myšlence revoluce zosobňovanou NSDAP. Tato strana taktéž sloužila jako protiváha narůstající popularitě komunismu v Německu.\nNovember 27, 2025 - Prezident vydal 28. února 1933 Dekret o požáru Říšského sněmu, který pozastavil do odvolání ty články ústavy, které se týkaly osobní svobody, svobody projevu, svobody tisku, práva na shromažďování a poštovního tajemství. Noviny podporující komunisty a sociální demokraty byly na 14 dní zavřeny. Kanceláře Komunistické strany byly uzavřeny a komunističtí poslanci s jejich úředníky vsazeni do ochranné vazby.\nJune 23, 2025 - Sociálně slabé skupiny obyvatel ... podmínek. Po vojenských porážkách vzbouřenců a bezvýsledném zasedání Frankfurtského parlamentu byla revoluce v německých zemích v roce 1849 potlačena ....\n3 weeks ago - Německé znovusjednocení (německy Deutsche Wiedervereinigung) je proces připojení Německé demokratické republiky (NDR) a Západního Berlína ke Spolkové republice Německo (SRN), završený 3. října 1990. Bylo umožněno pádem komunismu a železné opony na sklonku roku 1989.\nFebruary 3, 2025 - Ve výboru byl Karl Radek, který měl zastávat v Komunistické straně Německa názory Moskvy, Vasilij Schmidt, který měl tvořit revoluční buňky v německých odborech, Georgij Pjatakov, jež byl odpovědný za celkovou koordinaci a spojení s Moskvou, a Józef Unszlicht měl na starosti vojenské záležitosti a po revoluci měl vytvořit německou obdobu ruské Čeky. Sovětský velvyslanec v Berlíně Nikolaj Krestinskij se stal neoficiálně taktéž součástí příprav a měl na starost finance (400 tisíc dolarů). Bolševikům se zdála tehdejší situace v Německu velice podobná revoluční atmosféře v Rusku v létě 1917."
        ],
        "response":"Komunistická revoluce v Německu byla potlačena po vojenských porážkách vzbouřenců a bezvýsledném zasedání Frankfurtského parlamentu v roce 1849 [doc 1]. Prezident vydal 28. února 1933 Dekret o požáru Říšského sněmu, který pozastavil články ústavy týkající se osobní svobody, svobody projevu a dalších práv [doc 1]. Noviny podporující komunisty a sociální demokraty byly zavřeny a kanceláře Komunistické strany byly uzavřeny, přičemž komunističtí poslanci byli vzati do vazby [doc 1]. Bolševikům se zdála tehdejší situace v Německu podobná revoluční atmosféře v Rusku v létě 1917 [doc 1].",
        "reference":"Komunistická revoluce v Německu byla vyloučena, protože občanstvo bylo příliš silné a dobře organizované, což by umožnilo potlačit každé takové hnutí.",
        "faithfulness":0.9,
        "answer_relevancy":0.8570792988,
        "answer_correctness":0.2271243533,
        "context_precision":0.9999999999,
        "context_recall":0.0,
        "context_sufficiency":0.0
    },
    {
        "user_input":"Jaké byly důsledky kritické situace stavebních živnostníků, na kterou poukázali řečníci jako stavitel Havlena a tajemník Pekárek, a jak tato situace souvisí s politickými změnami v Rumunsku a Ukrajině, které jsou zmíněny v textu?",
        "retrieved_contexts":[
            "prý již takřka učiněna dohoda o 300.000 tunách. Maďaři žádají ještě dalších 100.000 starý systém politické moci v Rumunsku, kde tun slezského uhlí. — Protestní schůze stavebních živnostníků vláda bývala v rukou šlechty, která býla téměř konala se včera večer v sále Měšťanské Bejediným živlem v parlamentu. Směr celé vlády sedy v Praze, kdež promluvili jako hlavní řečurčovala osoba ministerského předsedy, resp. níci stavitel Havlena a tajemník Pekárek a závůle panovníkova. stupci 26 společenstev, zejména za zámečníky Dnes trvá sice v Rumunsku království, avšak p. Payer, za elektrotechniky p. Vondřich a za strojní průmysl p. Káš, kteří poukázali na kri značně. Zavedení všeobecného, přímého, tajného tickou situaci svého stavu, jíž zaviňuje nedopráva hlasovacího do poslanecké sněmovny a",
            "chová francouzský učenec k našim dějepiscům (na př. o Tomkovi, o němž praví, že »jeho jméno by bylo slavné po vší Evropě, kdyby z vlasteneckého pocitu, hodného obdivu, nebyl psal všecka díla svá česky...«). Ale hlavní důvod, proč přejeme si všichni, aby toto dílo stalo se známým v celém našem národě, vězí přímo v obsahu díla. Ono zabývá se událostmi, které líčí slavné listy českých dějin, ale zároveň také listy temné. Událostmi, které jsou půdou, z níž přímo vyrostlo naše nynější stísněné národní žití. Ukazují nám, jak vznikla naše politická odvislost, jaké byly její příčiny, za jakých okolností se upevnila. Má to hluboký vyznam pro každý národní život, vejdou-li příčiny jeho politické odvislosti, ať již jsou historické, ve známost v nejširších je-",
            "„O zřízení živnostenské rady pro Morava.“ Referent úvodem klade důraz na nutnost hospodářské práce v národě. Ty časy už minuly, kdy zájem národa na veřejných záležitostech mohl se vyčerpávati jen po stránce politické. Už náš Havlíček případně pověděl, že je třeba, aby každý Čech měl nejenom něco ve hlavě, ale také v kapse. Nezbytnou podmínkou politického zmohutnění českého národa je sesílení jeho hospodářské, zejména středních jeho vrstev, jádra to národa. Živnostnictvo má pro hospodářskou rovnováhu státu vůbec význam posud nedoceněný, pro český národ, a zejména u nás na Moravě (dokázaly to dějiny národního rozvoje našich měst) znamená pak zvláště zachování a zvelebení našeho živnostenského stavu duležitou potřebu národní. Požadavky živnostnictva, směřující k tomu, aby třídě malo-",
            "dokonalost ještě zvětšovalo před níky při udržovacích pracích v záúnorem rozvratné působení souvodech. Na stavbách ČSZ je nekromých podnikatelů. Jiným nedodostatek dělníků. Odstranění čerstatkem stavebnictví před únorem ných mezd zjevných i skrytých, bylo, že o plánování v závodech které stále ještě rozvracejí proi na stavbách nebylo v naprosté covní morálku a odvádějí dělníky většině potuchy, a konečně další ze staveb, je úkolem nezbytným a závadou bylo, že se stavební manaléhavým. Rovněž většího porozteriál dostával a do značné míry umění pro potřeby znárodněného ještě dnes se dostává na stavbu stavebního průmyslu při spolutak složitými cestami, že v celých práci s jinými výrobními obory, svazcích nepřehledných právních i mezi soukromým řemeslným sekto-",
            "dokonalost ještě zvětšovalo před níky při udržovacích pracích v záúnorem rozvratné působení souvodech. Na stavbách ČSZ je nekromých podnikatelů. Jiným nedodostatek dělníků. Odstranění čerstatkem stavebnictví před únorem ných mezd zjevných i skrytých, bylo, že o plánování v závodech které stále ještě rozvracejí proi na stavbách nebylo v naprosté covní morálku a odvádějí dělníky většině potuchy, a konečně další ze staveb, je úkolem nezbytným a závadou bylo, že se stavební manaléhavým. Rovněž většího porozteriál dostával a do značné míry umění pro potřeby znárodněného ještě dnes se dostává na stavbu stavebního průmyslu při spolutak složitými cestami, že v celých práci s jinými výrobními obory, svazcích nepřehledných právních i mezi soukromým řemeslným sekto-",
            "živnostnictvo je málo podporováno, takže neplatí již přísloví: „Řemeslo má zlaté dno“. Zvláště vylíčil živnost pekařskou jako nejtěžší a zdraví škodlivou. Pekaře poškozují nejvíce mlynáři, pokouce chleba na úkor pekařů. Odporučuje organisaci a vybízí ku protestu. Pan Faust mluvil o obligatorních mistrovských pokladnách nemocenských a starobním pojišťování. Odporučuje dobrovolné pojišťování. Pan Dvořák (klempíř) z Příbora mluvil o opravě živnost. řádu. Stěžuje si, že dopouští živnost. řád libovolný výklad úředníků. Řemeslo provozují lidé, kteří se mu ani neučili; proto žádá, by před výborem k tomu účelu sestaveným provedl každý výrobek a předložil jej ku prozkoumání. Při rozhovoru mluvili pánové: Faust, Hrdý (hodinář) z Místku, posl. dr. Parma z Frenštátu, c. k. inspektor Jos. Mňuk z Pří-",
            "dr. Šlemr obchodně politický referát, finační rada Wagner podal referát finanční a promluvil o nových daňových předlohách, dr. Verunáč zmínil se pak o mzdové situaci ve stavebním průmyslu, jakož i o všeobecných sociálně politických otázkách. Sekretář Ing. Beneš přednesl pak ku konci schůze návrh resoluce, jež byla jednomyslně přijata. V této resoluci se m. j. praví: „Průmysl staviv ocitá se nyní vlivem neutěšených poměrů výrobních i odbytových v těžké krisi. Naprostá stagnace ve stavebnictví zaviňuje houfné omezování a zastavování práce v našich továrnách a přivádí průmyslu staviv, dělnictvu i státu nenahraditelné škody materielní. Průmysl staviv žádá v otázkách výrobních: 1. Zlevnění životních potřeb, aby větší měrou umožněno bylo dělnictvu snížení mzdo-",
            "úřadů i vynikajících korporací. Předsedající stavitel Hlavaj pravil, že v současné době slovenské živnostnictvo se nachází ve velmi nepříznivé hospodářské situaci a také jeho požadavky kulturní jsou daleko ještě nesplněny. V nejbídnějším stavu se nachází slovenské obuvnictví. Bylo usneseno, aby na rozhodujících místech byla žádáná pomoc. Velikou pozornost vzbudila zpráva o stavu vzdělání řemeslnické mládeže. Bylo konstatováno, že řemeslnickému dorostu se až dosud věnovalo málo péče po stránce ideové. Stejnou pozornost vzbudila žaloba na nemocenské pojišťovny, které vymáháním příspěvků ničí živnostnictvo beztak chudé. Tu ovšem jest třeba si uvědomiti, že na nemocenských pojišťovnách jest závislo také a především dělnictvo. I živnostníci na Slovensku si musí uvědomiti, že zákonná nezbytnost velí, participovati na nákladech na nemocenské pojištění."
        ],
        "response":"Podle kontextu, kritická situace stavebních živnostníků vedla k \"houfnému omezování a zastavování práce v továrnách a přivádí průmyslu staviv, dělnictvu i státu nenahraditelné škody materiální\" [doc 7]. Text zmiňuje, že v Rumunsku trvalo království, ale dříve vládla šlechta, která byla \"téměř jedním živlem v parlamentu\" [doc 1]. Text dále uvádí, že v Rumunsku Maďaři žádali dalších 100.000 tun slezského uhlí [doc 1]. Text se však nezmiňuje o politických změnách na Ukrajině.",
        "reference":"Důsledky kritické situace stavebních živnostníků, na kterou poukázali řečníci jako stavitel Havlena a tajemník Pekárek, nejsou v textu přímo uvedeny, a jejich souvislost s politickými změnami v Rumunsku a Ukrajině není explicitně zmíněna. Text se zaměřuje na různé problémy a politické situace v různých zemích, ale přímé propojení mezi těmito událostmi a situací stavebních živnostníků v textu chybí.",
        "faithfulness":1.0,
        "answer_relevancy":0.0,
        "answer_correctness":0.2281033446,
        "context_precision":0.2261904762,
        "context_recall":0.3333333333,
        "context_sufficiency":0.0
    },
    {
        "user_input":"Jaké byly hlavní překážky, kterým čelil státní film v Československu před únorem 1948, a jak únorové události přispěly k jejich odstranění a následné konsolidaci filmového průmyslu?",
        "retrieved_contexts":[
            "1 week ago - Neomezená vláda komunistické strany v Československu trvala až do pádu východního bloku v roce 1989. Únorový převrat a jeho výklad se za předlistopadového režimu stal oblíbenou látkou pro umění socialistického realismu a námětem oficiální státní propagandy, především filmu. Prvním snímkem zobrazujícím dobu únorových událostí je krátkometrážní dokument Vítězný lid, natočený režisérem Drahoslavem Holubem v roce 1949, při příležitosti prvního výročí.\nDecember 11, 2025 - Už v průběhu války české intelektuální kruhy diskutovaly o možnosti zestátnění filmového průmyslu, někteří umělci v tomto kroku viděli naději na nezávislost tvorby na komerčních zájmech producentů. K zestátnění došlo krátce po osvobození, ještě před komunistickým převratem.\nAugust 6, 2025 - Jednalo se o hlavní podnik, který pod sebe integroval jednotlivé součásti filmového průmyslu v Československu. Roku 1945 byla Benešovým dekretem česká kinematografie znárodněna. Roku 1948 vznikla organizace Československý státní film, která fungovala do období politického tání v roce 1956.\n3 weeks ago - Chronologický seznam českých filmů, před rokem 1918\/1919 také rakousko-uherských s účastí tvůrců z českých zemí, v letech 1918–1939 a 1945–92\/93 filmů československých, v letech 1939–1945 českých a německých s účastí tvůrců z českých zemí.\nMay 8, 2024 - Seznam českých filmů od roku 1946, jejichž děj je zasazen do doby druhé světové války. …a pátý jezdec je Strach, Zbyněk Brynych, 1964 ... Nabarvené ptáče, Václav Marhoul, 2019, česko-polsko-slovensko-ukrajinský film – chystaný film ... Kamil Fila: České válečné filmy: ..."
        ],
        "response":"Omlouvám se, ale na tuto otázku nemohu odpovědět pouze na základě poskytnutého kontextu.",
        "reference":"Hlavní překážky, kterým čelil státní film v Československu před únorem 1948, zahrnovaly nedostatečnou a nedokonalou právní úpravu, která vedla k odporu některých držitelů provozních prostředků proti jejich předání, popírání účinnosti dekretu o zestátnění filmu na Slovensku, nemožnost převodu nemovitostí v pozemkových knihách, právní nejistotu, snahy o vynětí některých kin ze zestátnění, organizační nejednotnost a nesoulad mezi složkami státního filmu, které bránily řádnému plánování investic a vývoje. Únor 1948 tyto nepříznivé podmínky a podvratné snahy zlikvidoval, což umožnilo rychlou a cílevědomou konsolidaci státního filmu.",
        "faithfulness":0.0,
        "answer_relevancy":0.0,
        "answer_correctness":0.1951266447,
        "context_precision":0.9999999999,
        "context_recall":1.0,
        "context_sufficiency":0.0
    },
    {
        "user_input":"Jaké byly důsledky zrušení právní subjektivity jednotlivých zplnomocněnců a úsekových ředitelů na konsolidaci a jednotné řízení filmového průmyslu v Československu po únoru 1948?",
        "retrieved_contexts":[
            "Domů Stav řízení . Stav řízení . Načítavání obsahu.\nWebový portál Národního filmového archivu, který přináší komplexní informace o české kinematografii a audiovizi.Kromě zplnomocněnců v něm zasedali dva zástupci Svazu českých filmových pracovníků.\nPojem právní subjektivity – jeden z centrálních pojmů právní teorie – dodnes nemá jasný a jednoznačný obsah.Autor od rozboru jednotlivých teorií právnických osob přechází k deduktivnímu vymezení právní subjektivity a pracuje s pojmem nedokonalé subjektivity .\nPrávní subjektivita , v současném občanském zákoníku označovaná jako právní osobnost, je schopnost účastnit se právních jednání, provádět právní akty, jednat, vystupovat v řízení před soudem atd.\nTohle už společnost bez právní subjektivity neumožňuje a tím ztrácí největší důvod, proč se dříve sdružení živnostníků používalo."
        ],
        "response":"Omlouvám se, ale na tuto otázku nemohu odpovědět [Sorry, I can´t answer the question.].",
        "reference":"Zrušení právní subjektivity jednotlivých zplnomocněnců a úsekových ředitelů umožnilo sjednocení a jednotné řízení veškeré činnosti v oblasti filmu, což vedlo k rychlé a cílevědomé konsolidaci státního filmu v Československu po únoru 1948.",
        "faithfulness":0.0,
        "answer_relevancy":0.0,
        "answer_correctness":0.1896948178,
        "context_precision":0.0,
        "context_recall":1.0,
        "context_sufficiency":0.0
    },
    {
        "user_input":"Jaké byly důsledky změn ve složení stromového patra Boubínského pralesa mezi lety 1972 a 1996, zejména s ohledem na pokles zastoupení jedle a nárůst buku, a jaké managementové kroky byly navrženy pro budoucí obnovu populace jedle bělokoré a smrku?",
        "retrieved_contexts":[
            "December 14, 2025 - Toto přemnožení má za následek decimaci nižšího stromového patra, protože zvěř okusuje, a tím poškozuje mladé stromky, především jedli bělokorou (Abies alba) a javor klen (Acer pseudoplatanus). Z důvodu ochrany před zvěří a i turisty byl kolem nejcennější části pralesa vystavěn plot, který je nicméně na několika místech poškozen a tedy průchozí. Jako další obranný mechanismus v 80. letech 20.\nCílové skladby hospodářského lesa přírodě bližšího, stabilnějšího a hospodářsky výhodného (trvalá produkce, přirozená obnova) jsou zatím kompromisem mezi únosným zastoupením (např. smrku) a nutnou příměsí tzv. melioračních a zpevňujících dřevin (např. buku a jedle). Pralesovité porosty se vyskytují v jedlobukovém až smrkovém lesním vegetačním stupni, s výjimkou lužních lanžhotských pralesů, v pahorkatině chybí. V letech 1971-1979 jsem provedl první šetření na celé ploše 13 pralesovitých porostů o celkové výměře 330 ha (zaměření všech stromů od 10 cm výčetního průměru, fytocenologické zápisy, půdní analýzy, typologické mapování, zakreslení přirozené obnovy, vyhodnocování stromového patra).\n1). Ze snímků dále vyplývá ústup buku lesního (Fagus sylvatica), smrku ztepilého (Picea abies) a jedle bělokoré (Abies alba) z etáží dřevin vyšších než 1\/2 hlavní úrovně (spojená etáž I+II+III) (obr. 2). Zatímco buk vykazuje pouze mírný pokles pokryvnosti, jedle ve stromových etážích téměř vymizela. Zastoupení smrku v porovnání s rokem 1975 se výrazně snížilo. Důvodem jsou větrné disturbanční události v minulých letech a bezpochyby také gradační vlny kůrovce.\nJune 19, 2020 - Boubínský prales tvoří kombinace buku, smrku a jedlí a je nejzachovalejším zbytkem původních rozsáhlých šumavských smíšených horských lesů. ČTK Sdílet na Facebooku Sdílet na Twitteru Sdílet na LinkedIn Tisknout Kopírovat ...\nMay 1, 2015 - Na ploše dnes zapojeného lesa, jenž byl v roce 1938 otevřeným\/strukturovaným, stojí o 48,0 % těchto stromů více, než by odpovídalo rovnoměrnému zastoupení podle rozlohy. Současná intenzita těžby dříví a způsob hospodaření negativně ovlivňuje prostorovou a věkovou strukturu lesa a vytváří extinkční dluh. Pro zachování biodiverzity území je nutno začít uplatňovat management, pro nějž mohou být touto prací získané informace podkladem: zejména rozvolnění porostů, snížení intenzity těžby dřeva a její vhodné prostorové umísťování."
        ],
        "response":"Mezi lety 1972 a 1996 došlo k ústupu buku lesního (Fagus sylvatica), smrku ztepilého (Picea abies) a jedle bělokoré (Abies alba) z etáží dřevin vyšších než 1\/2 hlavní úrovně [doc 1]. Zastoupení smrku v porovnání s rokem 1975 se výrazně snížilo [doc 1]. Pro zachování biodiverzity území je nutno začít uplatňovat management, pro nějž mohou být touto prací získané informace podkladem: zejména rozvolnění porostů, snížení intenzity těžby dřeva a její vhodné prostorové umísťování [doc 1].",
        "reference":"Důsledkem změn ve složení stromového patra Boubínského pralesa mezi lety 1972 a 1996 byl výrazný pokles zastoupení jedle, který byl nahrazen zvýšenou účastí buku, přičemž dominantní postavení si udržel smrk. Počet živých stromů mírně klesl, ale objem kmenů živých stromů stoupl. Celkem 30 % plochy pralesa je pokryto souvislým nárostem s dominancí buku, zatímco na vhodných místech mimo bukové nárosty se úspěšně zmlazuje jedle i smrk s doprovodem dalších vtroušených dřevin. Pro budoucí obnovu populace jedle bělokoré a smrku byl navržen další management rezervace.",
        "faithfulness":0.6666666667,
        "answer_relevancy":0.8341252978,
        "answer_correctness":0.4916935013,
        "context_precision":0.9999999999,
        "context_recall":0.25,
        "context_sufficiency":0.0
    },
    {
        "user_input":"Jaké jsou důsledky výrazného poklesu zastoupení jedle bělokoré a zvýšené účasti buku na strukturu a stabilitu Boubínského pralesa, a jaké opatření bylo navrženo k zajištění jeho přirozeného vývoje?",
        "retrieved_contexts":[
            "plochu pralesa, a to přesto, že na řadě míst došlo k náhlým rozpadům stávajícího porostu, dochází k výraznému stárnutí a odumírání populace jedle bělokoré apod. Tato skutečnost potvrzuje jedinečnost Boubínského pralesa a dokazuje životaschopnost a stabilitu pralesovitých útvarů, ponechaných samovolnému vývoji na dostatečně velké souvislé ploše. Došlo k výraznému poklesu zastoupení jedle a tento úbytek byl nahrazen zvýšenou účastí buku. Dominantní postavení si v pralese udržel smrk. Počet živých stromů mírně klesl. Naopak stoupl objem kmenů živých stromů, což svědčí o celkovém stárnutí pralesa. Celkem 30 % plochy je však pokryto souvislým nárostem s dominancí buku. Tyto nárosty jsou zatím pod registrační hranicí dendrometrických šetření, v budoucnu však dojde k větší",
            "strukturální diferenciaci pralesa a k vyrovnání některých ukazatelů (počet stromů versus jejich objem apod.). Na vhodných místech mimo bukové nárosty se úspěšně zmlazuje jedle i smrk s doprovodem dalších vtroušených dřevin. Lze předpokládat, že postupně dojde k obnově populace jedle bělokoré i k obnově smrku zdejšího horského ekotypu. Na základě výsledků opakovaných šetření je doporučeno: - I přes všechny diskutabilní důsledky, které přináší úplné oplocení pralesa, je to v současné době jediné řešení,  zajišťující jeho relativně přirozený samovolný vývoj. Proto je třeba trvale udržovat oplocení v provozuschopném stavu a podle možností lovit či vytlačovat ven zvěř, která se do pralesa dostane. V pralese by neměly být prováděny žádné úmyslné zásahy. Do bezzásahového režimu je možné zařadit porosty nad",
            "pokládaného zastoupení dřevin v lesích ČR po uplynutí 10 a 50 let. Výsledky dokládají, že během deseti let nemůže dojít ke zřetelným změnám proti současnému zastoupení dřevin, ať již podle koncepce modelů, nebo SLHP 1993. Výraznější, ale ne příliš razantní změny se projevují až po uplynutí 50 let, ale pouze podle modelů hospodářských opatření (1991), a to jen u jedle bělokoré a buku lesního. U jedle by se zastoupení proti současnému stavu zvýšilo asi čtyřnásobně, tj. na 4,1 %, podíl buku téměř na dvojnásobek, tj. na 10,3 %. Zastoupení smrku by podle obou koncepcí pokleslo za 50 let (ve srovnání se současným stavem) jen málo, asi o 4,5 %. S ohledem na tyto skutečnosti byla v rámci prací spojených s prognózami vývoje stavu lesů a lesního hospodářství zpracována jako etapa řešení studie Mož-",
            "Rychlost postupu 2 až 3 m, někdy 4 až 5 m ročně, jak uvádí např. Köstler (1955), představuje odsun porostní stěny o 30 m za 15 až 10 let, popř. již za 7 až 6 let. Tato doba je však příliš krátká, než aby mohla zajistit nejen zastoupení jedle, ale i předpoklady jejího dalšího vývoje v konkurenci rychle odrůstajícího smrku. Pomalejší okrajový postup však na druhé straně není dosti dobře možný s ohledem na ekonomické a výnosové momenty, zvláště ve stejnověkých porostech. Pro studium vzájemných vztahů jedle a buku v průběhu obnovy se ve zkoumané oblasti nepodařilo nalézt vhodný objekt. Šetření ve středoslovenských poměrech (Korpel, Vinš 1965) i v Jeseníkách (Kadlus 1966a) však ukázalo, že i ve vztahu k buku je jedle znevýhodňována nadměrně silným a rychlým prosvětlováním mateřského porostu.",
            "Received 17 June 2001  Boubínský prales po 24 letech (1972-1996) — vývoj stromového patra  T. VRŠKA', L. HORT2, P. ODEHNALOVÁ?, D. HORAL2, D. ADAM2  Správa Národního parku Podyjí, Znojmo, Česká republika 2Agentura ochrany přírody a krajiny ČR, detašované pracoviště Brno, Česká republika  ABSTRAKT: V roce 1996 byla provedena opakovaná měření taxačních, typologických a porostních charakteristik v národní přírodní rezervaci Boubínský prales. Tyto úkony následovaly po výzkumu provedeném v roce 1972 s použitím stejné metodiky a následným vyhodnocením změn, k nimž ve sledované oblasti došlo. Došlo k výraznému poklesu zastoupení jedle a tento úbytek byl nahrazen zvýšenou účastí buku. Dominantní postavení si v pralese udržel smrk. Počet živých stromů mírně klesl, naopak stoupl objem kmenů živých stromů. Celkem 30 % plochy pralesa je pokryto souvislým nárostem s dominancí buku. Na vhodných místech mimo bukové nárosty se úspěšně zmlazuje jedle i smrk s doprovodem dalších vtroušených dřevin. Lze předpokládat, že postupně dojde k obnově populace jedle bělokoré i k obnově smrku. Je navržen další management rezervace."
        ],
        "response":"Výrazný pokles zastoupení jedle bělokoré a zvýšená účast buku vedly k výraznému stárnutí a odumírání populace jedle bělokoré [doc 1], a také ke strukturální diferenciaci pralesa [doc 2]. Celkem 30 % plochy je pokryto souvislým nárostem s dominancí buku [doc 1, doc 5]. K zajištění jeho přirozeného vývoje je doporučeno trvale udržovat oplocení v provozuschopném stavu a podle možností lovit či vytlačovat ven zvěř, která se do pralesa dostane [doc 2]. Je také navrženo, že by v pralese neměly být prováděny žádné úmyslné zásahy [doc 2].",
        "reference":"Výrazný pokles zastoupení jedle bělokoré a zvýšená účast buku vedly k tomu, že dominantní postavení si v pralese udržel smrk, a došlo k celkovému stárnutí pralesa, což se projevilo mírným poklesem počtu živých stromů, ale zvýšením objemu kmenů živých stromů. K zajištění přirozeného vývoje Boubínského pralesa bylo navrženo trvale udržovat oplocení v provozuschopném stavu a podle možností lovit či vytlačovat ven zvěř, která se do pralesa dostane, a v pralese by neměly být prováděny žádné úmyslné zásahy.",
        "faithfulness":0.5714285714,
        "answer_relevancy":0.7910755154,
        "answer_correctness":0.5623333562,
        "context_precision":1.0,
        "context_recall":1.0,
        "context_sufficiency":1.0
    },
    {
        "user_input":"Jaké byly důvody a možné důsledky odporu knížete Bedřicha Schwarzenberga a Řiditelstva Ústřední společnosti hospodářské proti zamýšlené stavbě vodních drah, a jak tento odpor souvisí s ekonomickými zájmy velkostatkářů a průmyslových kapitalistů?",
        "retrieved_contexts":[
            "— je jisto, že původní rozpočty budou jako obyčejně značně překročeny — se nechá velice mnoho vydělat. Sumy ty velice zúrodní vypráhlé lány průmyslu. Ale nad radostnou náladou pánů kapitalistů stahují se černé mraky. Vedle kapitalistů průmyslových máme ještě jiné kapitalisty. A tito jsou mnohem mocnější, než ti různí komínoví baroni. Jsou to naši počestní velkostatkáři. První blesk již vyslali. Byl to sice prozatím jen blesk papírový, ale je na něm podepsán kníže Schwarzenberg a proto bude míti dalekosáhlé účinky. Dost možná, že ochromení celé akce. Řiditelstvo Ústřední společnosti hospodářské, jejímž předsedou je kníže Bedřich Schwarzenberg rozeslalo hospodářským spolkům provolání, v němž se rozhodně staví proti zamýšlené stavbě vodních drah. Nečiní",
            "dářské, jejímž předsedou je kníže Bedřich Schwarzenberg rozeslalo hospodářským spolkům provolání, v němž se rozhodně staví proti zamýšlené stavbě vodních drah. Nečiní to arciť přímo, ale to na věci nic nemění V provolání se praví: „Ačkoli nutno návrh zákona na zřízení průplavů pokládati za prospěšný veškeré výrobě a tržbě, má Ústřední společnost hospodářská za to, že nelze odlučovati stavbu těchto kanálů vůbec od celkové úpravy našeho vodního hospodářství a že projektované průplavy nabyly by pravého významu pro domácí výrobu a tržbu teprve po předcházející soustavně provedené úpravě řek a toků a řádném provedení všech úkolů a potřeb melioračních.“ A že úkol tento nebude snadným, to se přiznává v provolání bez obalu: „Organisace  LIDU Redakce a administrace nalézá se",
            "Tomáši Štěpánkovi z Nezamyslic. — Schůze konány budou na Kanovsku, v Kokorách a v Kojetíně. Z Ústřední společnosti hospodářské. Řiditelstvo Ústřední společnosti hospodářské konalo schůzi svou za předsednictví J. J. dra Bedřicha knížete Schwarzenberga dne 18. ledna t. r., řiditelstva podán byl sněmu pamětní spis o krisi zemědělské se žádostí, aby sněm uvážil příčiny tísně zemědělské, vyšetřil poměry a potřeby obyvatelstva zemědělského a připravil podrobný hospodářský program pro nastávající šestileté období činnosti sněmovní. Současně rozeslán byl pamětní spis všem hosp. spolkům s vyzváním, aby se k němu připojily. Ku sjezdu rolnickému v Pardubicích delegováni byli jako zástupci společnosti pánové J Markalous, statkář v Třebosicích a F. Udržal, starosta v Dol. Rovni. C. k. finančnímu mini-",
            "Z Ústřední společnosti hospodářské pro král. České. Řiditelstvo Ústřední společnosti hospodářské konalo schůzi svou dne 17. března za předsednictví JUDra Bedřicha knížete Schwarzenberga a u přítomnosti 23 členů. Předseda zahájiv schůzi, vyslovil politování své nad různými zprávami o pokusech s ječmeny, kterými se jakost ječmene i pokusů v Čechách podnikaných z jisté strany zlehčuje, jakož i záslužná působnost zem. insp. Dra Sitenského tendenčně posuzuje. Společnost je povinna ohraditi se proti tendenčnímu tvrzení, jako by kvalita ječmene se zhoršila a to na základě výzkumů a výsledků pokusů přesně vědecky vykonaných. S vývody předsedovými vyslovují plný souhlas pp. R. Jahn a St. Kubr, kteří odmítají neodůvodněné útoky, kterými se pracuje cizině do rukou a zároveň ostře kritisují lehkovážné jednání, kterým",
            "z prací a agitačních statí dr. Russa a jiných. Varovného hlasu v té příčině pozdvihla (14. dubna) v Praze Ústřední hospodářská společnost, kde kníže Bedřich Schwarzenberg hájil prospěchů zemských v ten rozum, aby především zamezeny byly škody, které rozvodňováním přítoků Vltavy a Labe každého roku zemědělství se způsobují, a pak teprve aby se přikročilo k zřizování velkých průplavů. Ohromný kapitál má býti vložen do průplavů těch, a není dnes jisto, zda by nesloužily jen prospěchům kapitalistickým, neotevřely příchod cizozemské výrobě a nezaplavovaly naše země hospodářskými plodinami z Uher a zemí Balkánských. Napřed regulování řek a meliorace, potom průplavy, v tom smyslu přijata byla jednomyslně resoluce. Z důvodů, aby přítomnost něčeho získala, ujednalo české poselstvo na říšské radě trojí junctim s vládou, jak z projevu dr. Pa-"
        ],
        "response":"Kníže Bedřich Schwarzenberg a Řiditelstvo Ústřední společnosti hospodářské vyjádřili odpor proti zamýšlené stavbě vodních drah z několika důvodů [doc 1], [doc 2], [doc 3], [doc 3], [doc 4], [doc 5]. Především se obávali škod, které by rozvodňováním přítoků Vltavy a Labe mohlo způsobit zemědělství [doc 1], [doc 5]. Dále se obávali, že by stavba vodních drah mohla sloužit pouze prospěchu kapitalistů a otevřít cestu pro dovoz cizozemských zemědělských plodin z Uher a zemí Balkánských [doc 5].\n\nKníže Schwarzenberg hájil prospěchy zemské a navrhoval, aby se nejprve zaměřilo na regulaci řek a meliorace, a teprve poté na stavbu vodních drah [doc 1], [doc 5]. Tento odpor souvisí s ekonomickými zájmy velkostatkářů, protože regulace řek a meliorace by prospěla jejich zemědělským aktivitám [doc 3]. Obavy z dovozu levných zemědělských plodin by také chránily zájmy velkostatkářů [doc 5].",
        "reference":"Odpor knížete Bedřicha Schwarzenberga a Řiditelstva Ústřední společnosti hospodářské proti zamýšlené stavbě vodních drah byl motivován ekonomickými zájmy velkostatkářů, kteří jsou považováni za mocnější než průmysloví kapitalisté. Tento odpor souvisí s obavami, že stavba vodních drah by mohla ohrozit jejich ekonomické zájmy, zatímco průmysloví kapitalisté vidí v projektu příležitost k zisku. Schwarzenbergův podpis na provolání proti stavbě naznačuje, že odpor může mít dalekosáhlé účinky a potenciálně ochromit celou akci.",
        "faithfulness":0.7,
        "answer_relevancy":0.9305236776,
        "answer_correctness":0.6864540276,
        "context_precision":0.8666666666,
        "context_recall":1.0,
        "context_sufficiency":1.0
    },
    {
        "user_input":"Jaké byly důvody a možné důsledky nesouhlasu Ústřední společnosti hospodářské, vedené knížetem Bedřichem Schwarzenbergem, se zamýšlenou stavbou vodních drah, a jak tento nesouhlas ovlivnil politickou situaci a reakce kapitalistů v kontextu plánů vlády Körbrovy?",
        "retrieved_contexts":[
            "školní; dnes ještě otřásá se sama obloha srdcelomným . Nikdo si nemyslil, že jest naše finanční postavení růnářkem ústaváků nad bolestmi porodními, které jim působí již i pouhá osnova zákona o zavedení civilního žové a poukázání na schodek nebylo nikomu nic nového a neočekávaného; ale rozbor finanční naší minumanželství! losti může nás naplniti důvěrou v naši finanční moA což ta zdárná činnost vůči hospodářské tísni! houcnost!“ Jaké kroky byly v tomto oboru podniknuty? Hubené Věru, vládní žurnalistika má v této těžké době jest pouhé to vypočítání oněch opatření, která se stala vůči hospodářské krisi se strany státu a ještě hubemnoho rozmaru; černé dovede mistrně barvit na růžovo! Kdo tomu uvěří, bude spasen! nější ta činnost vlády! Zákon, kterým se usnadňuje",
            "níka do Protivina bude moci snadno být na všechny strany dopravováno. Komora jest přesvědčena, že by průplav se nemohl vyplácet a kapitál — byť i ciní — v něm uložený, přišel by buď zcela buď z části v ohledu hospodářském na zmar. Ostatně jest projekt podnikatelů těch nejasné naznačen, že nelze nní určit, má-li jit kanál řečištěm Vltavy a Labe, neb mimo řečiště. V případě posledním nelze soohlasiti s projektem proto, že by při stale klesajícím množství vody práva pobřežních průmyslníků a statkářů mohla být ohrožena. Komora má za to, že spíše by bylo záhodno všemi prostředky etarati se o to, aby země česká poznenáhla nevysýchala. Ničení velkých lesů českých jednak pohromami živelními n hmyzem, jednak následkem vad lesního zákona může být pro hospodářské ba i zdravotní poměry",
            "aby nebyli zvoleni mužové, kteří proti federaci a proti vládě pracovati by chtěli. Svou dobou uveřejníme kandidáty strany naší.  Beseda k oslavení diplomu říjnového. Jak se z bezpečného pramenu dovídáme, zařídí brněnský sl. zpěvácký spolek dne 19. října b. r. velkolepou besedu k oslavení diplomu říjnového. Vyzýváme venkovské spolky zpěvácké, aby za příkladem tímto besedami oslavily den, v který byla vydána císařská listina, jejížto zásady se mají státi nyní úplně vodícími zásadami nynější vlády. ANa ústřední výbor c. kr. m. sl. hospodářské společnosti mateřské v Brně docházejí nás od filiálek stížnosti mnohé, že výbor tento korresponduje s filiálkami v češtině, jížto tyto skutečně nerozumí. Tak nám byly zaslány listiny české, vydané od ústředního výboru, v nichžto",
            "býti, zásady oboustrannosti svědomitě šetřiti se musí. — Uzná-li se toto co pravda nepopíratelná, pak nebude těžko vyložiti a sobě jasně představiti, jaké následky mohou míti nařízení navržená, a jaké by ovšem musely míti pro příslušníky i jedné i druhé národnosti nařízení opáčná, kdyby v skutku měla přivésti se k platnosti. Jelikož časopisetvo o tomto návrhu zákona již mnohostranně se vyslovilo a jej ostré kritice podrobilo, bylo komisi možné i jeho ú vahy na přetřes vzíti. Nejvážnější námitky činěny kromě komise samé proti §. 9. a 11. Co se týče nařízení §. 9., že na příště nemá při úřadch a soudech zeměpanských v Čechách nikdo ustanoven býti za úřadníka konceptního, kdož by nebyl mocen obou jazyků zemských, není toto nařízení žádným novotář-",
            "za dovolení, aby možnost a výhody kanalisování Labe až k Pardubicům a Vítavy až k Rožmberka prozkoumáno býti mohlo. Komora se vyslovuje, aby podnikatelům bylo dáno povolení ku předběžnému prozkoumání projekta, však s udělením dotyčné koncesa nesouhlasí. Zminěný průplav dle zdání komory postrádal by téměř úplně praktické důležitosti. Unelná kutiště u Sianého, Kladna, Rakovníku a Plzně neposkytují ani četným drahám, které v končinách těch značně jsou již rozšířeny, tak velkého množství uhlí k dopravě, aby draby ty nemohly ještě dvojnásobného množství zboží dopraviti. Úhlí alánské, buštěhradské a kladenské má do Prahy, Kralap a Smichova již cestu nejsn levnou nýbrž i velmi přihodnou; abývalo by toliko unli rakovnické a křivoklátské, však i to po brzkém vystavění dráhy z Rakov-",
            "Uroš Kneževič ministra financí a zahraničných záležitostí v tento smysl: „Byl jsem zpraven, že se Rozenu (žid to a hlavní duch denníka „Vidov dan1) vydaly ze státní kasy 3000 dukátů za jakési jeho politické články“, proto klade ministrům několikero otázek, jak věci se mají a kdo za to odpovídá (žid Rozen zatím na nějaký čas odcestoval). Týž poslanec interpeloval vládu, že předešlá (před Rističem) vláda darovala značnou sumu vídeňské „Neue fr. Presse“, aby tato hájila a zastupovala srbské zájmy v cizině; i tázal se, jaké sumy na čí schválení onomu listu vyplaceny. Znamenitější ještě byla však interpelace Markoviče, Bogosavljeviče a soudruhů: „Dokud má státi tolik národního vojska ve zbrani u Alexince, když se nepozoruje, že by politické okolnosti byly takové, aby to býti muselo?“ Nevím, zdaliž této",
            "jak již roku loňského byla učinila. O Nový železniční projekt v Čechách. Přednosta vrchní inšpekce nad dráhami rakouskými rada Pischof přimlouvá se prý vřele za zřízení nové dráhy pošumavské, kteráž dotýkajíc se Volar, Horní Plané a Haslachu, vedla by k Dunaji a připojila by se u Velsu k dráze západní. O Spojení Dunaje s Odrou. S. r. ústřední výbor hospodářské společnosti usnesl se podati ministerstvu orby a místodržitelství dolnorakouskému spis, týkající se stavby průplavu dunajsko-oderského. V témž spisu má dokázáno býti, že se stavbou jmenovanou učiní projekt zaplavení moravského ne-li nemožný, tož tak nesnadný, že se jen s větším nákladem menší sady založiti mohou. O Venkovští listonoši. Dle doslechu budou prý při rakouských poštách zavedeni venkovští listonoši, kteří budou po všech vesnicích a samotách vybírati a dodávati psaní a zásylky a tak prostředkovati spojení s místy, kde pošty se nacházejí. Místo služného budou míti právo požadovati od každého psaní 1 kr. od větších zásylek a ž do 6 kr. dopravného."
        ],
        "response":"Ústřední společnost hospodářská, vedená knížetem Bedřichem Schwarzenbergem, nesouhlasila se zamýšlenou stavbou vodních drah z několika důvodů [doc2], [doc5]. Komora se vyslovila proti kanalisování Labe až k Pardubicím a Vítavy až k Rožmberku, protože dle jejich zdání postrádaly praktické důležitosti [doc5]. Dále se obávali, že projekt by postrádal praktické důležitosti a kapitál by byl zbytečně ztracen [doc2]. Projekt také postrádal jasné určení, zda má kanál vést řečištěm Vltavy a Labe, nebo mimo něj [doc2]. Nesouhlas s projektem byl motivován obavami o práva pobřežních průmyslníků a statkářů, pokud by množství vody klesalo [doc4].\n\nDůsledkem nesouhlasu mohlo být ovlivnění politické situace a reakcí kapitalistů. Komora se vyslovila proti navrženým opatřením, která by mohla vést k negativním dopadům na příslušníky obou národností [doc4]. Projekt postrádal jasné určení, zda má kanál vést řečištěm Vltavy a Labe, nebo mimo něj [doc2].",
        "reference":"Ústřední společnost hospodářská, vedená knížetem Bedřichem Schwarzenbergem, nesouhlasila se zamýšlenou stavbou vodních drah, protože se domnívala, že tyto kanály nelze oddělit od celkové úpravy vodního hospodářství a že by měly pravý význam pro domácí výrobu a tržbu až po předcházející soustavně provedené úpravě řek a toků a řádném provedení všech úkolů a potřeb melioračních. Tento nesouhlas mohl ochromit celou akci a ovlivnil politickou situaci tím, že vláda Körbrova čelila potížím s národními štvanicemi, zatímco kapitalisté, zejména z Brna, vyjádřili podporu vládnímu plánu a přijali resoluci, která vítala vládní předlohu o vodních drahách jako počátek splnění vládních slibů.",
        "faithfulness":0.625,
        "answer_relevancy":0.0,
        "answer_correctness":0.41427983,
        "context_precision":0.5428571428,
        "context_recall":1.0,
        "context_sufficiency":0.0
    },
    {
        "user_input":"Jaké byly důvody a důsledky znovuzavedení krajkářství ve Vamberku a okolních oblastech na konci 19. století, a jakou roli v tomto procesu hrály místní instituce a jednotlivci jako Ant. Selichar?",
        "retrieved_contexts":[
            "stvo jest přesvědčeno, že únorová užší rada říšská sehnat se nedí, jelikož všecky neněmecké národy od ní se odvrátí. A snad má o tom rozhodovat n'jaká znovu utvořená delegace zemí korunních, v níž budou-li ve většině Slované, odejlou Němci, a budou-li ve většině Němci, odejdou Slované. Či snad to rozhodnutí připadne koruně a novému manifostu císařskému, který by naznačil jaké záležitosti přiděleny budou samosprávě zemí korunních? Jak vidíme, mimo obtíž v smíření s Uury jsou ještě nemenší obtíže v provedení organizace druhé polovici mocnářství. Vystoupí teprv nyní v celém dosaha svém.“  FEUILLETON.  Nové hádky. ADivné, divné věci, ba až překvapující! Nikdo by sobě nebyl pomyslil, že v druhé polovici devatenáctého století navštíví nás ještě jednou páteři jesuité, a",
            "stvo jest přesvědčeno, že únorová užší rada říšská sehnat se nedí, jelikož všecky neněmecké národy od ní se odvrátí. A snad má o tom rozhodovat n'jaká znovu utvořená delegace zemí korunních, v níž budou-li ve většině Slované, odejlou Němci, a budou-li ve většině Němci, odejdou Slované. Či snad to rozhodnutí připadne koruně a novému manifostu císařskému, který by naznačil jaké záležitosti přiděleny budou samosprávě zemí korunních? Jak vidíme, mimo obtíž v smíření s Uury jsou ještě nemenší obtíže v provedení organizace druhé polovici mocnářství. Vystoupí teprv nyní v celém dosaha svém.“  FEUILLETON.  Nové hádky. ADivné, divné věci, ba až překvapující! Nikdo by sobě nebyl pomyslil, že v druhé polovici devatenáctého století navštíví nás ještě jednou páteři jesuité, a",
            "stvo jest přesvědčeno, že únorová užší rada říšská sehnat se nedí, jelikož všecky neněmecké národy od ní se odvrátí. A snad má o tom rozhodovat n'jaká znovu utvořená delegace zemí korunních, v níž budou-li ve většině Slované, odejlou Němci, a budou-li ve většině Němci, odejdou Slované. Či snad to rozhodnutí připadne koruně a novému manifostu císařskému, který by naznačil jaké záležitosti přiděleny budou samosprávě zemí korunních? Jak vidíme, mimo obtíž v smíření s Uury jsou ještě nemenší obtíže v provedení organizace druhé polovici mocnářství. Vystoupí teprv nyní v celém dosaha svém.“  FEUILLETON.  Nové hádky. ADivné, divné věci, ba až překvapující! Nikdo by sobě nebyl pomyslil, že v druhé polovici devatenáctého století navštíví nás ještě jednou páteři jesuité, a",
            "hospodářské školy v Táboře. Program: 1. Čtení protokolu z předešlé valné hromady. 2. Zpráva jednatelská a pokladnická za čas od předešlé valné hromady. 3. Volba jednatele a pokladníka, pak dvou členů výboru. 4. Jak má rolník půdu zkoumati a pak dle potřeby mísiti, a jaká umělá hnojiva vedle mrvy chlévské upotřebiti, aby ji dokonale zlepšil? 5. Jaké jsou hlavní příčiny zanedbávání ovocnářství v naši krajině? 6. Jakými prostředky by se zalesnění strání a pastvišť neúrodných docílilo? 7. Má-li se zastavený „Věstník spolků hospodářských“ zase pro údy vydávati? 8. Přijímání příspěvků spolkových. 9. Volné návrhy. Jeho lasnost kníže Jan Švarcenberk slavil dne 19. t. m. 40leté jubileum nastoupení vlády na svých panstvích, jež převzal po svém otci knížeti Josefu Švarcenberkovi. Z té příčiny oslavena byla",
            "Město Bělí bývalo dříve sídlem kvetoucího průmyslu soukennického, sukna bělská byla pro svou molidnost a pěknou úpravu hledána. Zařízením továren klesl tento průmysl v městě nalem úplněAčkoliv cech soukennický v středu svém měl muže zámožné, nepomýšleno tenkráta na zařízení společného závoda soukemmického, který by s prospěchem byl konkurovati mohl s továrnami německými. Následek toho byl, že ze samostatných fprůmyslníků stali se z většího dílu dělníci v továrnách libereckých. Nyní ještě pracuje značný počet soukenníků bělakých v Liberci; o vycvičené síly pracovni pro novou továrnu v Bělé jest tedy úplně postaráno. I čas nynějšího spolčování jest k zařízení továrny soukemnické velmi příhodný. — Právě v době novější zařízen velký počet společenských obchodů ve ztřížném zboží",
            "ličné umělé práce sítařské. Ve výstavě je zvláště bohatě zastoupeno umělé vyšívání a háčkování. Pravým dílem uměleckým jsou dva polštáře oltářní vyšívané zlatem a hedbávím, jakož i neméně nadherné antipendium. Práce ty vystavila učitelka sl. Am. Kühnlova. Krásné vyšívání bílého prádla a pletení, pak ženské modní zboží všelikého druhu zaslaly na výstavu: Jul. Reinlová z Karlových Varů, M. Hájková z Březníka, M. Neradtová z Liberce. Al. Germářová z Prahy, El. Diamantová z Kolína, El. Poláčková z Dolních Beřkovic, A. Zentnerová a Em. Schmiedtová z Prahy, M. Anderschová z Hrádku (u Chrástavy), M. Kalašová ze sv. Hippolytu, M. Bartaková z Prahy. A. Enzelová z Teplic, Em. Pospíšilová z Prahy, B. Schichtová z Liberce, Jos. Trmalová z Turnova a F. Fritzová ze Zářečí (u Poličky). Ručních prací ženských",
            "již od dřívějška o věrnosti a oddanosti vaší a doufám, že i budoucně v tom se nezklamu.“ Císař vyptával se pak na škodu, jakou obec utrpěla v době války. Místní farář P. Dohnal oslovil při té příležitosti též císaře a řekl: V. V. dá-li bůh dobré leto a požehnání své, aby rány utrpěné úplně byly zaceleny, pak každý Rakušan bude k obětem ochoten. Z okolí blízkého shromážděných starostů vyptával se císař také v podobném směru a stráviv takto v Rousinově nějakou chvíli, odejel při provolávání slávy a zvucích rakouské hymny, kterou obecní hudebníci hráli.  (0O.) Z Vídně, 20. října. (Pův. dop.) Konáme dnes tichou památku diplomu z r. 1860, kterýž svého času vzbudil nejkrásnější naděje v mysli národův rakouských. Posud nedospěli jsme k tomu cíli, z kterého dále měli jsme pracovati, posud nejsme",
            "men, továrník v Komárově, Julius Seifert, c. k. notář v Hořovicích, Karel Hejl, poštmistr v Příbrami a p. Alois Kulhánek, městský pokladník v Příbrami, stalo se usnešení že se bude k tomu působiti, aby byly v každé farní osadě okresu hořovického, zbirovského a příbramského, kde veliká část obyvatelstva řemeslo hřebíčkářské provozuje, hřebíčkářské spolky na spůsob onoho v Hluboši zařízeny a aby p. farář Kohout vládou k zavádění těchto jednot oprávněn byl. Po boku těchto spolků má státi akcijní společnost s jistinon 50.000 zl. která by jim všemožnou samostatnost zabezpečila, dodávajíc členům jednoty co nejlacinější železo k zdělávání a odebírajíc vedlé toho výrobky hotové. Dále by bylo účelem této společnosti hřebičkáře znenáhla k jinému průmyslu převáděti. Společnost má se jmenovati: „Akcijní spo-",
            "nad poddanými svými v mezích právního poměru, jejž sám ustanovil mezi sebou a nimi, úplnou moc. On soudil rozepře mezi nimi o statky nemovité, avšak jen takové; které na něm závisely; soudy však ve věcech trestních, jakož i rozepře mezi poddanými rozličných vrchností vyhraženy byly soudům župním. Teprvé během času byli od vrchností ustanovováni místní představení, jimž vrchnosť část moci své postoupila. Tím teprv původ svůj vzala obecní zřízení v jednotlivých osadách. Toť v hlavních obrysech společenské poměry v podhradích a jiných osadách v století XI. a XII. Byly-li poměry tyto, jak jsme již svrchu napověděli, všude v podstatě stejné, můžeme je zajisté přenésti také na naše Podklášteří a na jiné osady ku klášteru Třebickému patřící.  Hlava pátá.  Klášter Třebický až po Otakara II. (1253). Opatové:",
            "ústav! Shromáždění provolalo hlučně Na zdar a vzdalo díky zařizujícímu výboru povstáním. Na to sdělil pan Makovský výsledek volby. Prošla jednohlasně kandidátní listina zařizujícím výborem sestavena a sice jsou zvoleni co výborové: Jan Beneš, krejčí (firma J. Beneš a syn), Josef Čermák, železník (firma Čermák & Bernard), František Fišer, výbor zlatnického gremin, J. Hampel, lakýrník, Jan Häusler, kloboučník, Antonín Klíma, pekař, František Krámeš, starší obuvnické jednoty, Dr. Frant. Lirš, úředník hypoteční banky, František Makovský, knihař, Karel Makovský, barvíř nedbáví, Josef Neuman, majitel domu, Tomáš Novotný, předseda ústředního výboru záloženského, Eduard Šiffner, starší jednoty kožešnické, Otakar Skřivan, obchodník (firma Vacin & Skřivau), Josef",
            "September 30, 2025 - Koncem 19. století nastal úpadek ručního krajkářství, především následkem tlaku konkurence strojní výroby krajek. V roce 1889 byla ve Vamberku založena krajkářská škola, na které bylo v 1. polovině 20.\nJuly 5, 2025 - Krajky se od druhé poloviny 19. do začátku 20. století ve Vamberku vyráběly téměř v každé domácnosti. Poptávka po ručně paličkované krajce začala slábnout, když se v 19. století začala krajka vyrábět strojně. V roce 1889 zde byla zřízena krajkářská škola, která výrazně napomohla udržet a rozvíjet vysokou úroveň místního krajkářství.\nKaždý rok na konci června se nemalá krajkářská obec soustředí do východočeského Vamberku a blízkého okolí. A proč právě Vamberk? Kde jinde než v samotném centru českého krajkářství by se mělo konat mezinárodní setkání krajkářek... Krajkářství na Vamberecku má silnou a bohatou, více než čtyřsetletou tradici. Archivní prameny se o vamberecké krajce zmiňují poprvé v roce 1642, ale počátky sahají do doby mnohem starší. Polovina 17. století je připomínána především v souvislosti s Magdalenou Grambovou, belgickou šlechtičnou, která jako držitelka zdejšího panství s sebou přinesla belgické krajkové vzory a zavedla nový způsob paličkování na podušce - herduli.\nOctober 9, 2024 - Dvě generace krajkářek, konec 19. století\nDecember 26, 2021 - „Hradec byl natolik důležitým střediskem, že výrobcům stálo za to být na tomto trhu. Není divu, že poptávka byla i po kvalitní keramice ze vzdálenějších oblastí,“ řekl ČTK Bláha. Na Vamberecku šlo o výrobu běžné stolní keramiky, jejíž spotřeba byla ve vrcholném středověku značná. „Není náhoda, že nadregionální hrnčířské centrum na začátku 14. století vzniklo právě ve Vamberku a okolí."
        ],
        "response":"Z textu vyplývá, že na konci 19. století došlo k úpadku ručního krajkářství ve Vamberku a okolí kvůli konkurenci strojní výroby. Aby se tomu zabránilo a tradiční řemeslo udrželo, byla v roce 1889 založena krajkářská škola ve Vamberku. Tato škola výrazně přispěla k udržení a rozvoji místního krajkářství.\n\nText neuvádí konkrétní informace o Ant. Selicharu, ani o dalších institucích, které se na znovuzavedení krajkářství podílely.",
        "reference":"Důvody znovuzavedení krajkářství ve Vamberku a okolních oblastech na konci 19. století zahrnovaly těžkou bídu, která doléhala na horský lid po několika neúrodných letech, a hrozbu částečného vylidnění nejchudších obcí, kde obyvatelé opouštěli své domovy hledajíce zaměstnání jinde. Důsledkem znovuzavedení krajkářství bylo vytvoření nového pramene výživy pro místní obyvatele, kteří dříve spoléhali na zaniklé domácké tkaní a výrobu nítěných knoflíků. Místní instituce a jednotlivci, jako Ant. Selichar, hráli klíčovou roli v tomto procesu tím, že navrhli znovuzavedení krajkářství a za pomoci učitelstva a státní i zemské podpory se snažili oživit tuto tradiční řemeslnou činnost.",
        "faithfulness":1.0,
        "answer_relevancy":0.0,
        "answer_correctness":0.4179230703,
        "context_precision":0.0909090909,
        "context_recall":0.6666666667,
        "context_sufficiency":0.0
    },
    {
        "user_input":"Jaké byly důsledky zavedení ústřední tržnice krajek v Hradci Králové na rozvoj krajkářství v Žamberku a jaké překážky musely být překonány, aby se zajistil kvalitní materiál pro výrobu?",
        "retrieved_contexts":[
            "místní výrobní družstvo krajkářské, usneseno, aby další vedení celé akce podpůrné převzalo městské průmyslové museum v Hradci Králové. Účele mělo býti dosaženo: 1. Dodáváním nových vzorů moderních a zejména národních (tím přispěti se mělo ku svérázu domácí výroby žamberecké). 2. Dodáváním materiálu v cenách továrních. 3. Péčí o rozšíření odbytu prostředkováním prodeje, hledáním nových pramenův odbytových i nákupních. 4. Péčí o dokonalé technické provádění a zvelebování výroby pořádáním občasných kursů. 5. Zřízením ústřední tržnice krajek v Hradci Králové. 6. Vydáváním plastického vzorníku původních krajek žambereckých a rozšířením jeho v kruzích odběratelů. Zkrátka využiti všeho, co by přispělo k rozšíření odbytu krajek, pokud to v mezích stanov průmyslového musea jest",
            "vzhledem k nedostatečným finančAkce krajkářská ním prostředkům musejním připadla v r. 1910 téměř cele na tržnici palíčkovaných krajek orlických v Hradci Králové. Není úmyslem docílený úspěch podpůrné akce zdejší tržnice, řízené neúnavnou pí. M. Klumparovou, připisovati museu, zmíníme-li se na tomto místě o jejím působení. Tržnice zřízena byla na popud musea v r. 1903 po nezdařeném pokusu sdružovacím v Žamberku. Zprvu umístěna byla prodejna v soukromém bytě, následkem stoupajícího odbytu a pro snadnější příležitost k nakoupení přenesena do krámu nejprvé v ulici Palackého a nyní do útulného a vkusně upraveného krámu na Velké podsíni. Výkladní skříně svým obsahem jsou stálou výstavkou krajek i jiných uměleckých ženských ručních prací. Předměty ve skříních stále novými vzory doplňované a",
            "o 5000 svazcích a 67000 předloh. Museum mimo to pořádalo 3 kursy (85 účastníků), 6 výstav s celkovou návštěvou 5868 osob a 10 přednášek, jež vyslechlo 832 posluchačů; sbírky musejní samy prohlédlo si as 500 návštěvníků. Se stanoviska lidopisného má největší význam akce na podporu lidového krajkářství, která se snaží udržet a fruktifikovat starou tradiční technickou dovednost lidu při výrobě krajek. Dnes převzala řízení akce, k níž vyšel popud a prvá organisace z musea, ústřední tržnice paličkovaných krajek orlických v Hradci Kr. Tržnice ovšem stará se nejen o odbyt, nýbrž má i snahy vzdělávací a zvelebovací (dodává pracovníkům vzory a návrhy krajek, doporučuje jejich vhodnou aplikaci na věci moderní, současné potřeby). Odbyt svůj neomezuje tržnice na trh domácí;",
            "Řízení a zastupování tržnice od jejího založení v únoru 1904 ochotně a se zdarem vede pí M. Klumparová. Do konce roku 1904 odebráno od krajkářek krajek za K 9431.70; v téže době prodáno za K 5206.30. Krajkářkám většinou na úvěr dodáno a jimi zpracováno materiálu (příze a hedvábí) za 780 K. Měly-li výrobky vyhověti po každé stránce, bylo nutno užívati ku zpracování i dobrého materiálu. Upotřebeno tudíž krajky i švýcarského a francouzského hedvábí. Veškeré pokusy nahraditi potřebu tohoto materiálu doma, ukázaly se dosud bezvýslednými. Ústřední tržnice zaměstnává nyní na 80 krajkářek, poskytujíc jim slušný výdělek. Ovšem že musel býti prodej nutně rozšířen. Největším odbytištěm byla Vídeň (Ústřední kurs krajkářský a Spolek ku podporování krajkářství v Rakousku), dále Karlovy Vary, Olomouc,",
            "zást. zemského výboru  zástupcové obce  dvor. tov. J. Červený. řed. J. Pazourek Pí. M. Klumparová zúčastnila se činně jednání výborových jako zástupkyně »Ústřední tržnice žambereckých krajek«. Tajemníkem a knihovníkem musea byl p. M. Oehm. Výbor konal 8 schůzí, v nichž vyřízena řada nejvážnějších událostí. Mimo to uspořádána poradní schůze o stavu lidového průmyslu na Žamberecku v Něm. Rybné, jejímž výsledkem bylo založení Ústřední tržnice žambereckých krajek v Hradci Králové. Řízení její převzala na své jméno ochotně pí. M. Klumparová. Nezištnou a neúnavnou činností zmíněné dámy dosaženo již v prvním roce trvání tržnice slušného úspěchu, tak že trvání její do budoucna zdá se býti zabezpečeno. Agenda musejní značně stoupla, neboť oproti 868 číslům v r. 1903 vykazuje protokol 1265 čísel zapsaných a vyřízených."
        ],
        "response":"Zavedení ústřední tržnice krajek v Hradci Králové následovalo po neúspěšném pokusu o sdružování v Žamberku [doc 2, doc 3, doc 3, doc 4, doc 5]. Dokumenty neuvádějí přímý dopad na rozvoj krajkářství v Žamberku, ale zmiňují, že tržnice následovala neúspěšný pokus v Žamberku [doc 2, doc 3, doc 3, doc 4, doc 5]. Pro zajištění kvalitního materiálu pro výrobu bylo nutné používat i švýcarské a francouzské hedvábí, protože pokusy nahradit tuto potřebu domácím materiálem byly bezvýsledné [doc 4]. Řízení tržnice ochotně převzala pí M. Klumparová [doc 4, doc 5].",
        "reference":"Zavedení ústřední tržnice krajek v Hradci Králové vedlo k zaměstnání přibližně 80 krajkářek, kterým poskytovala slušný výdělek, a rozšíření prodeje, přičemž největším odbytištěm byla Vídeň. Překážkou bylo zajištění kvalitního materiálu pro výrobu, protože pokusy nahradit švýcarské a francouzské hedvábí domácími zdroji byly bezvýsledné, což znamenalo nutnost používat dovážené materiály.",
        "faithfulness":0.8333333333,
        "answer_relevancy":0.8846697493,
        "answer_correctness":0.5327541251,
        "context_precision":1.0,
        "context_recall":1.0,
        "context_sufficiency":1.0
    },
    {
        "user_input":"Jaké byly důvody a důsledky snahy polských úřadů vyjít vstříc české menšině na Volyňsku v oblasti školství a kultury, a jak to souvisí s demografickými změnami a politickými aktivitami v regionu?",
        "retrieved_contexts":[
            "Aktivity příslušníků polské národnostní menšiny v České Republice jsou organizovány několika institucemi. Cílem polské menšiny je zachovat etnickou identitu a kulturní dědictví Poláků v ČR a to v oblastech kultury , umění, tradic, osvět, výchovy mládeže a školství .\n„Národnostní menšina je společenství občanů České republiky žijících na území současné České republiky, kteří se odlišují od ostatních občanů zpravidla společným etnickým původem, jazykem, kulturou a tradicemi...\n3. Jaké jsou podle Vás hlavní výzvy v příštích 20 letech v souvislosti s demografickými změnami a stárnutím? 4. Jaké jsou prioritní opatření pro tvůrce politik do budoucna, aby vytvořili společnosti, ve kterých je stárnutí pozitivní zkušeností?\nNa české liberální scéně převládlo přesvědčení, že popsanou demagogii mají na svědomí propagandistické kanály Kremlu. Ten s ní bezesporu na celoplanetární úrovni pracuje a příkladně ji šíří, ale to vše by vyšlo naprázdno...\nJeden aspekt představovaly důsledky protestantské tradice, dalším a důležitějším byl český nacionalismus a oživení husitské tradice, které znamenalo rozchod s katolickou vírou."
        ],
        "response":"Sorry, I can´t answer the question.",
        "reference":"Polské úřady se snažily vyjít vstříc české menšině na Volyňsku v oblasti školství a kultury, protože na Volyni za ruské vlády existovaly pouze ruské školy, zatímco v září 1924 tam bylo 22 českých škol, dvě polsko-české a řada škol s češtinou jako vyučovacím předmětem, což ukazuje na snahu polských úřadů podporovat kulturní a vzdělávací potřeby české menšiny. Tato snaha souvisí s demografickými změnami, kdy polská statistika uvádí nárůst počtu Čechů na Volyni z 20.000 na 25.000, a s politickými aktivitami, které ukazují tendenci polských úřadů podporovat menšiny v regionu.",
        "faithfulness":0.0,
        "answer_relevancy":0.0,
        "answer_correctness":0.1744097055,
        "context_precision":0.0,
        "context_recall":1.0,
        "context_sufficiency":0.0
    },
    {
        "user_input":"Jaké byly důsledky nedostatečné právní úpravy a organizační nejednotnosti na rozvoj československého státního filmu před únorem 1948 a jak únor 1948 přispěl k jejich odstranění?",
        "retrieved_contexts":[
            "1 week ago - Únor 1948 (též únorový převrat, únorový puč, v komunistické terminologii a historiografii Vítězný únor či jen Únor) je pojmenování komunistického státního převratu v Československu, který proběhl mezi 17. a 25. únorem 1948. Po roce 1990 jsou únorové události vnímány ...\nAugust 6, 2025 - Roku 1948 vznikla organizace Československý státní film, která fungovala do období politického tání v roce 1956. V roce 1957 vznikla Hlavní správa Československého státního filmu, ze které pak v roce 1962 vznikl státní podnik Československý film.\nDne 25. února 1948 vznikl v zestátněném filmu Akční výbor Národní fronty přejmenovaný záhy na Akční výbor Československé filmové společnosti (sedmičlenné předsednictvo řídil Leo Wetzler) a nedlouho poté začaly čistky.[17] Dne 26. února 1948 byly zrušeny funkce všech zbývajících zplnomocněnců[18] a právní subjektivita úsekových ředitelů[19] a jejich pravomoci byly přeneseny na náměstky ústředního ředitele.[20] Do konce března bylo propuštěno 442 osob a zrušen byl Syndikát československých filmových umělců a techniků.\núnoru 1948. Archiválie jsou řazeny podle jednotlivých sekcí a oddělení Československé · filmové společnosti. Likvidace soukromých filmových společností, ke které došlo po vydání · dekretu prezidenta republiky č. 50\/1945, jsou uloženy pod vlastní uměle vytvořenou sérií · (ref. ozn. 16). Na likvidaci se nejvíce podílel vedoucí právního oddělení sekce distribuce\nAugust 10, 2015 - „V oboru vládne chaos, nelze zjistiti spolehlivě, kde ztráty vznikají, a celý obor je čím dále tím více zbyrokratizován,“ kritizoval například v prosinci 1946 lidovecký poslanec Cyril Charvát v parlamentu nedostatečné pokroky ve státní správě filmového průmyslu. Pevnější obrysy začala znárodněná kinematografie dostávat dva měsíce po únoru 1948, kdy vláda zřídila Československý státní film (ČSF), zahrnující prakticky veškeré podnikání v oboru."
        ],
        "response":"Lidovecký poslanec Cyril Charvát kritizoval v prosinci 1946 nedostatečné pokroky ve státní správě filmového průmyslu, a poukázal na chaos a byrokratizaci [doc 1]. Po únoru 1948 vláda zřídila Československý státní film (ČSF), který zahrnoval prakticky veškeré podnikání v oboru [doc 1]. Po únoru 1948 začaly čistky v zestátněném filmu [doc 1].",
        "reference":"Nedostatečná právní úprava a organizační nejednotnost vedly k právní nejistotě, bránily konstituování stabilní základny filmového podnikání a znemožňovaly řádné plánování investic a vývoje, což udržovalo filmové podnikání ve stavu, který bránil jeho zdravému rozvoji a pokroku. Únor 1948 zlikvidoval tyto nepříznivé podmínky a podvratné snahy, což umožnilo rychlou a cílevědomou konsolidaci státního filmu.",
        "faithfulness":1.0,
        "answer_relevancy":0.8236144286,
        "answer_correctness":0.6954522831,
        "context_precision":0.9999999999,
        "context_recall":1.0,
        "context_sufficiency":0.0
    },
    {
        "user_input":"Jaké byly důsledky zrušení právní subjektivity jednotlivých zplnomocněnců a úsekových ředitelů pro konsolidaci a jednotné řízení filmového průmyslu v Československu po únoru 1948?",
        "retrieved_contexts":[
            "Zakládejte místní skupiny Jednotného svazu českých zemědělců. Demokratický Jednotný svaz českých zemědělců bude ve jménu zemědělského lidu zasahovat do všech zemědělských otázek v obci, okresu a zemi.\nWebový portál Národního filmového archivu, který přináší komplexní informace o české kinematografii a audiovizi.Kromě zplnomocněnců v něm zasedali dva zástupci Svazu českých filmových pracovníků.\nDomů Stav řízení . Stav řízení . Načítavání obsahu.\nPojem právní subjektivity – jeden z centrálních pojmů právní teorie – dodnes nemá jasný a jednoznačný obsah.\nPrávní subjektivita , v současném občanském zákoníku označovaná jako právní osobnost, je schopnost účastnit se právních jednání, provádět právní akty, jednat, vystupovat v řízení před soudem atd."
        ],
        "response":"Sorry, I can´t answer the question.",
        "reference":"Zrušení právní subjektivity jednotlivých zplnomocněnců a úsekových ředitelů umožnilo sjednocení a jednotné řízení veškeré činnosti v oblasti filmu, což vedlo k rychlé a cílevědomé konsolidaci státního filmu a vytvoření nezbytných podmínek pro pokrokový vývoj ve filmové výrobě a distribuci.",
        "faithfulness":0.0,
        "answer_relevancy":0.0,
        "answer_correctness":0.1719902116,
        "context_precision":0.0,
        "context_recall":0.0,
        "context_sufficiency":0.0
    },
    {
        "user_input":"Jakým způsobem ovlivnila první francouzská republika a Napoleon I. vojenské strategie Prusů, zejména generála Moltkeho, a jaké důsledky to mělo pro vojenskou kulturu a přístup k válce v Prusku?",
        "retrieved_contexts":[
            "ních vítězů u Jeny a Borodina, „Viva Italia, viva Garibaldi“ garibaldistů a „Urá“ Rusů nebo Prusů. — Republika francouzská vyměnila záhy frygickou čepici svobody za vojenský klobouk, stala se státem vojenským, jakým nyní Prusko. Pravým zástupcem jejím byl tedy vojin, a proto mohla na něm vymáhati, by věděl vše, čeho u válce věděti třeba, by se pokládal za šťastna, že smí vše, co mu uloží, vykonávati. Ona však mu vštípila jen přesvědčení, že vše dovede, dadouc mu do pole toto naučení: „Ničemu nezvykej, leda tomu, bys ničemu neuvyknul a žádné překážky se nehrozil. Jen nevoják, zbabělec a zrádce vlastí zná a miluje slovo: „nemožné!“ První francouzská republika a Napoleon I. naučil Prusy, a zvláště generála Moltkeho velmi mnohému; předce však bylo by lze, od obou ještě více",
            "užíti dovedli. Byloť vojsko jakoby kouzlem v massách postaveno, a jednalo se jen o to, zužitkovati je ve válce, aby vycvičené pravidelné vojsko nahradilo a účelům veliké války vyhovělo. Toho dosíci, bylo úkolem genialní hlavy; bylť však ve výboru válečném za nové vlády Carnot, jehož duch nic skrovného mysleti nedovedl, jehož orlí hled letmo poměry prohlížel a jimi ovládal, a jehož záměry byly velké, ohromné, jako palčivý dech revoluce. Carnot seznal, že třeba, nevycvičenými četami strategicky tak pohybovati, by nedostatek taktiky zúplna nahražen byl; velikými kombinacemi vojenskými hodlal způsobiti, aby prozatím lze bylo odříci se vojenských podrobností. Bylť Carnot Moltkem první revoluce francouzské. Současník jeden líčí tehdejší činnost onoho zvlášt-",
            "vojska mohlo tu však náramně škoditi. Jenerál Moltke nemohl se však již tak dalece překonati, aby city, které jej tak trapně dojímaly, před jistýma očima zcela utajil, které již po nějaký čas, totiž od oné chvíle, když bitva k neblahému výsledku chýliti se počala, se zvláštní napnutostí a s výrazem nejživější obavy jej pozorovaly. Byly to oči předsedy ministerstva, hraběte Bismarka, a v skutku měl také tento odvážlivý muž se svým dvojnásobným a též dvojnásobně nebezpečným heslem: „Krví a železem“ — a: „Násilí přemáhá právo!“ všecku příčinu, nešťastného výsledku bitvy se strachovati; neboť by byla porážka pruského vojska bezpochyby i pád jeho co předsedy ministerstva za  následek měla, a kletba veškerého pruského národa byla by jej v jeho samotu pronásledovala.",
            "všeobecně v ten smysl, že znamená tolik co válku proti Prusku. Opravami získali si totiž pp. Thiers a Olivier značnou půdu a budou tudíž moci vydatněji dále pracovati v záměrech svých proti Prusku, jehož úhlavními nepřátely jsou, čelících, i budou v tom podporováni také těmi, kteří ve válce s Německem doufají shledati prostředek k seslabení dynastické moci Napoleonovců. Loni Napoleon tyto záměry obratně prohlídl a bude bez pochyby opětně odporovat, pokud bude moci, aby konečně přece, ač nerad, postoupil válku, ke které donucen bude jako druhdy byl donucen Cavourem k válce italsko-rakouské. — V latinské čtvrti, kde od doby pře líčení Café de la Renaissance panuje jakési rozčilení, zmocnila se satyrická pocsie vděčné látky nových oprav. — Proti církevním obřadům při pohřbech sbírají se nyní podpisy",
            "všeobecně v ten smysl, že znamená tolik co válku proti Prusku. Opravami získali si totiž pp. Thiers a Olivier značnou půdu a budou tudíž moci vydatněji dále pracovati v záměrech svých proti Prusku, jehož úhlavními nepřátely jsou, čelících, i budou v tom podporováni také těmi, kteří ve válce s Německem doufají shledati prostředek k seslabení dynastické moci Napoleonovců. Loni Napoleon tyto záměry obratně prohlídl a bude bez pochyby opětně odporovat, pokud bude moci, aby konečně přece, ač nerad, postoupil válku, ke které donucen bude jako druhdy byl donucen Cavourem k válce italsko-rakouské. — V latinské čtvrti, kde od doby pře líčení Café de la Renaissance panuje jakési rozčilení, zmocnila se satyrická pocsie vděčné látky nových oprav. — Proti církevním obřadům při pohřbech sbírají se nyní podpisy"
        ],
        "response":"První francouzská republika a Napoleon I. naučili Prusy mnoha věcem, zejména generála Moltkeho [doc 1]. Carnot, který byl spojen s francouzskou revolucí, se snažil strategicky pohybovat nevycvičenými jednotkami, aby nahradil pravidelné vojsko a vyhověl potřebám války [doc 2].  Carnot se snažil způsobit, aby bylo možné odříci se vojenských detailů pomocí velkých kombinací vojenských strategií [doc 2].  Jenerál Moltke se však musel překonat, aby utajil city, které ho trápily, a to zejména v okamžiku, kdy bitva směřovala k nešťastnému výsledku [doc 3].",
        "reference":"První francouzská republika a Napoleon I. naučili Prusy, a zvláště generála Moltkeho, velmi mnohému, což mělo za následek, že Prusko se stalo vojenským státem, kde voják byl pravým zástupcem státu a bylo na něm vymáháno, aby věděl vše potřebné k válce a vykonával vše, co mu bylo uloženo, s přesvědčením, že vše dovede.",
        "faithfulness":0.8888888889,
        "answer_relevancy":0.8927662074,
        "answer_correctness":0.342068817,
        "context_precision":0.8666666666,
        "context_recall":1.0,
        "context_sufficiency":1.0
    },
    {
        "user_input":"Jaké byly důsledky slavnosti, které se účastnil velkokníže Nikolaj Nikolajevič, na vztahy mezi českými účastníky a ruskými důstojníky a generály, a jak se tato událost odrazila na vnímání českého národa?",
        "retrieved_contexts":[
            "nili. Tím přirozeně mohla býti tato událost ukončena. Kdo chtěl paňácovat v jemu jednotou zaplaceném kroji, dobrá. Ale nyní ozve se žvanivý plátek konopišťského zámku. Všichni, kteří súčastnili se slavnosti a veřejně hájili národní požadavky českého národa, jsou praví velikáni, sláva jim; ti pak, kteří nepřišli v základech shnilý »Sokol« zdejší ohraditi, nesúčastnili se na tak významné slavnosti, jsou špatní vlastenci, ven s nimi z národa. Dnes každý rozumný člověk vidí, že zdejší »Sokol« přiznaně národněsociální, jest pro každou opravdovou práci nemožný jistě ještě tak dlouho, dokavad jeho členové (a zvláště výbor) nepochopí rozdíl mezi skutečnou prácí národní a mezi duchaprázdným fángličkářstvím! Jaké právo má tedy odsuzovati pisatel ty, kteří viděli v slav-",
            "starodružiníků a Ústředního sdružení Čechů a Slováků z Ruska konala se včera po 17. hod. v ruském kostele svatého Mikuláše na Staroměstském náměstí panichyda k uctění památky velkokníž. Nikolaje Nikolajeviče. Přítomni byli m. j. četné význačné osobnosti ruské, žijící v Praze. Za kancelář presidenta republiky byl přítomen náčelník vojenské kanceláře gen. čeček, za min. zahraničí vyslanec dr. Wellner, za min. nár. obrany gen. Syrový. Dále se jí zúčastnili šéf francouzské vojenské mise generál Faucher a četní čsl. vysocí důstojníci a velmi četné význačné osobnosti v čele s posl. drem Kramářem. * Společenský čaj Sdružení posluchačů novinářské školy. Dne 17. ledna pořádalo Sdružení posluchačů novinářské školy vstupní společenský čaj o 20. hodině v Národním domě na Smíchově, jenž měl zdařilý prů-",
            "velikého carství. Po uplynulé hodině odebrali se do zadních místností továrny k banketu, jenž připraven byl v jednom oddělení pro pozvané a v druhém sousedním pro dělnictvo. Síně byly slavnostně ozdobeny, a carská hudba, přišedší schválně z hradu, hrála ruské, české a jihoslovanské písně. Také mezi banketem musil přijímati p. Krnka nesčíslná blahopřání (slavnost celá zvána vůbec jeho jmenovinami) a když za šumotu šampaňského pronešen byl přípitek císaři a císařské rodině, vstal velkokníže Nikolaj Nikolajevič, a  podav ruku p. Krnkovi, děkoval mu jménem císaře za výtečné pušky a náboje, jež on Čech celému ruskému carstvu daroval, a pil potom na jeho zdraví a na krnkovky. Přípitek velkoknížete Nikolaje byl nekonečným „Urá“ a voláním „Sláva“ opětován. Hned potom vmísilo se do",
            "Volkszeitungu Moravců. okresu ratibořského podél starých rakouských hranic žijí nepatrné zbytky zvláštního kmene, který v základních vrstvách je skutečně moravský. — Dopisovatel praví: To není pravda. Nežijí tam jen nepatrné zbytky, nýbrž přes 60.000 a jejich kraj jde podél hranice 9—17 km do šířky. Nesprávné je, že lid jen v základních vrstvách je moravský, na Ratiboř ku jsou všechny vrstvy moravské. Moodtrženou větví slovanského kmene, českého národa. Moravská řeč není de tvrzení memoranda české řeči příbuzná, nýbrž českým nářečím. Tím Nikolaj Nikolajevič pokusí se o převrat v Rusku. Z Berlína, 26. srpna. Čtk. Gorriere dela Sera uveřejňuje anglické zprávy, dle nichž není vyloučeno, že velkokníže Nikolaj Nikolajevič, jehož příjezd očekává se tyto dny v Londýně, pokusí se v Rusku o podobný převrat jako arcivévoda Josef v Pešti.",
            "a vědomí kmenové souvislosti živě se probudilo u všech národů slovanských. V Čechách pobyt vojsk ruských způsobil rozhodný obrat ve prospěch národa českého. Lid český rozuměl vojínům ruským a tito rozuměli lidu českému. V Praze, kdo jen trochu uměl česky, snažil se dorozuměti se s vojíny a důstojníky ruskými. Od Němců v Praze Rusové se odvraceli a jen společnosť českou vyhledávali. To nejen českému lidu lichotilo, nýbrž dodávalo mu i odvahy, když viděl, že vítězové nad Napoleonem a věrní spojenci císaře rakouského a krále pruského, jej vyznamenávali, aby vážil si svého jazyka a věnoval pěstování své národnosti větší než dosud pozornost. Že styků Čechů s Rusy vytryskla na půdě české vzájemnosť slovanská, která k obrození českému přispěla více, než dosud se uznává. Marek byl nad-"
        ],
        "response":"Podle dostupných dokumentů pobyt ruských vojáků v Čechách způsobil rozhodný obrat ve prospěch národa českého [doc 1]. Lidé, kteří uměli česky, se snažili dorozumět se s vojíny a důstojníky ruskými [doc 1]. Češi se odvraceli od Němců a vyhledávali společnost ruskou [doc 1]. Tato vzájemnost slovanská, která z této události vyplynula, přispěla k obrození českého národa více, než se dosud uznává [doc 1].",
        "reference":"Slavnost, které se účastnil velkokníže Nikolaj Nikolajevič, posílila vztahy mezi českými účastníky a ruskými důstojníky a generály, neboť došlo k přátelským gestům, jako bylo tisknutí rukou a přípitky na zdar českého národa, což vedlo k nadšení a uznání českého národa, jak bylo patrné z volání „Urá“ a „Sláva“ na jeho počest.",
        "faithfulness":1.0,
        "answer_relevancy":0.9032709199,
        "answer_correctness":0.7576767038,
        "context_precision":0.95,
        "context_recall":1.0,
        "context_sufficiency":0.0
    },
    {
        "user_input":"Jaké byly důsledky touhy tvůrčího Geniuse stát se tvůrcem a vyrovnat se bohu, a jak se tato touha projevila v jeho interakci s lidmi a jejich následném chování?",
        "retrieved_contexts":[
            "Člověk pozbyl tvůrčího ducha, zbloudil na scestí a hyne; žíti pak mohou pouze ti, jichž duše jsou uchváceny touhou po Bohu, kterýž bude s nimi a je oživí, neboť Bůh jest nekonečná touha po dokonalosti. K otázce, kdo jest jeho Bůh, spisovatel odpověděti neumí a smutně přemítá o tom, jak srdce jeho jest chladno, ba mrtvo, jak rozum jeho spí, obrazotvornost děsí se přízraků a celé nitro jest zmítáno pochybnostmi, že tam jen časem sálá hněv zářným plamenem, ač jest přeplněno nenávistí, která tam stále doutná. „A takto, jsa slep, něm a hluch, trávím dlouhé dni a noci, po ničem netouže, ničemu nerozuměje; tehdy se mně zdá, že jsem už mrtvolou ... Hrůza takého života ještě se zvyšuje přesvědčením, že musím žíti, neboť ve smrti jest ještě méně smyslu, ještě více tmy.“ Potom čtenář porovnává současné spisovatele s dřívějšími: „Kdysi v našem středu žili velicí mistři slova, jemní znalci života a lidské",
            "nemoc, pro kterou není ani nemocnic ani lékařů. I v blázinci jsou zdravější lidé, než ubohá tato zvěř. A když jsou i výjimky, neznamenají mnoho. Bývají obyčejně bez síly, bez talentu a vlivu. Proto míjím skoro generaci přítomnou a obracím se k příští, dosud snad neporušené části. Co na přítomnosti upraviti se dá, dá, co nedá — nedá Bůh s ní. Ale starost o tu příští je na prvním místě.  Nejen jednotlivci, ale celému národu nic tak nesluší jako touha: relativní cenu člověka mezi lidmi a národa mezi národy hnát k absolutní výši. Absolutního snad nikdy dosaženo nebude a dosaženo býti nemůže —; proto důraz položen na slovo touha a ne slovo absolutní. Dosíci absolutního není snad dopřáno nikomu, ale touhy po absolutním může se stát účastným každý, nechybí-li mu jinak potřebného — na-",
            "vaným mečem jal se zabíjet bratra svého, dar Geniův změnil se v kletbu pro člověka. Poznav tak krutou bolest, šel dál Genius a spatřil, jak lidé stvořili si modly, bludy, prázdnou víru a tu chtěje vésti je ku spáse ve znamení kříže dal jim učení čisté lásky. Co však zbylo z něho po krátké době? Ve jmenu lásky začali se vražditi lidé, křížem hubiti nepřátelé, ve jménu učení zapalovali hranice a ničili požáry města. Vyhledal tedy Genius lidi, kteří ne znali ještě nenávisti a přinesl jim čistou lásku. Ale láska zvrhla se v osudnou kletbu, člověk opil se vášní a ubíjel dar Geniův v pustých orgiích těla. V bídě a lopotování podal Genius lidem zlato a zase vše se počalo pro dar jeho navzájem vražditi. Zklamán Genius vrátil se do bývalého ráje, leč marně tloukl na brány jeho",
            "Přátelství a osobnost . . . . . . . . . . . . 57 Touha po ženě . . . . . Jak se vyvíjí cítění v pudu pohlavním . . . . 69 Původ a užívání pohlaví . . . . . . . . . . 78 Láska a vášeň . . . . . . . . . . . . . . . 87 Monogamie a povaha . . . . . . . . . . . 89 Sebedráždění . . . . . . . . . . . . . . . . 95 Touha po dětech . . . . . . . . . . . . . 105 Láska otcovská a mateřská . . . . . . . . . 107 V čem záleží dobrý otec . . . . . . . . . . 115 Touha po bohu . . . . . . . . . . . . . . 119  DVA VYŠŠÍ MOTIVY.  s ☞ .l . z — 8. . a . s ☞  HLAD ŽALUDKU A HLAD SRDCE. Touhy, nebo žádosti, lze zhruba rozděliti do dvou tříd: 1. Ony, jež vyhledávají prospěchu vlastního já — říká se jim někdy potřeby žaludku — nebo Hlad, a 2. ony, jež vyhledávají prospěchu bližních —",
            "sofování s laciným pesimismem, k němuž zesláblá ruka bez ohně, bez dramatického vzruchu a bez tvůrčí síly načrtla několik hubených. mdlých a neživotných ilustrací. Veršovec (B. Kaminský) doprovodil tyto mdlé listy studenými a bledými slokami. Po sedmi dnech díla Tvůrcova, kdy andělé pěli slávu a zněly modlitby prvních lidí, jediný jen duch vzpíral se slávě Onoho. Prvním nesouladem zachvěl se ráj, neboť on, tvůrčí Genius, zůstával nepohnut, touže po něčem větším, než aby s cheruby pěl hosanna jinému: sám chtěl býti tvůrcem, vyrovnat se bohu silou tvůrčí, ráj stvořit lidem. A proto odešel ze středu andělů, odešel k člověku právě vyhnanému z ráje. Našel člověka slabého v boji s dravci, a aby mu pomohl daroval mu meč ze železa. Leč čeho se dočkal! Člověk daro-"
        ],
        "response":"Podle dokumentu, touha tvůrčího Geniuse stát se tvůrcem a vyrovnat se Bohu vedla k tomu, že opustil anděly a šel k vyhnanému člověku, aby mu pomohl [doc 5]. Genius daroval člověku meč ze železa [doc 5]. Následkem toho, člověk zneužil dar a začal zabíjet [doc 5]. Genius také přinesl lidem zlato, ale i to vedlo k vraždění [doc 5].",
        "reference":"Touha tvůrčího Geniuse stát se tvůrcem a vyrovnat se bohu vedla k tomu, že odešel od andělů k člověku, kterému daroval meč ze železa, aby mu pomohl v boji. Tento dar se však změnil v kletbu, protože člověk začal zabíjet svého bratra. Genius se snažil vést lidi ke spáse učením čisté lásky, ale lidé začali ve jménu lásky a kříže vraždit, hubit nepřátele a ničit města požáry.",
        "faithfulness":1.0,
        "answer_relevancy":0.8337435832,
        "answer_correctness":0.4905235974,
        "context_precision":0.95,
        "context_recall":1.0,
        "context_sufficiency":0.0
    }
]