[
    {
        "user_input":"Kdy naposled vyhrál Serral mistrovství světa ve hře StarCraft 2?",
        "retrieved_contexts":[
            "October 31, 2025 - Serral is a three-time world champion of StarCraft II , having claimed his first championship title at the BlizzCon in 2018, and repeating the feat again in 2022 with an updated championship format.\nSerral played at Assembly Winter 2016, and proceeded to the finals without dropping a single map. In the grand finals he played against Namshar and took the series 4-2. On October 4, Serral transferred to Ence eSports from mYinsanity.\nClassic vs Serral | StarCraft II at EWC 25 - Day 4 - Grand Final Esports World Cup - VOD 56.4K subscribers Subscribed View all Jul 25, 2025 · The King is back on the throne once more! Joona \" Serral \" Sotala put on a dominant performance at the Esports World Cup (EWC) 2025, capping off his journey with a victory over Kim \"Classic\" Doh-woo in the Grand Finals to become your new StarCraft II World Champion. Jul 28, 2025 · After a doomed, last-ditch counterattack burned out, Classic officially signed off on Serral ' s world championship with four letters: \"gg wp.\" Nothing is truly a foregone conclusion in competitive StarCraft II , but Serral 's post-match comments gave the end result an added air of inevitability.\nJul 25, 2025 · The King is back on the throne once more! Joona \" Serral \" Sotala put on a dominant performance at the Esports World Cup (EWC) 2025, capping off his journey with a victory over Kim \"Classic\" Doh-woo in the Grand Finals to become your new StarCraft II World Champion.\nJul 24, 2025 · Joona “ Serral ” Sotala has once again etched his name into StarCraft history, claiming the StarCraft II at EWC 25 title with a commanding 5-2 victory over Kim “Classic” Doh-woo. The win marks Serral ’s third world championship, an achievement unmatched in the game’s history.\nJul 28, 2025 · After a doomed, last-ditch counterattack burned out, Classic officially signed off on Serral ' s world championship with four letters: \"gg wp.\" Nothing is truly a foregone conclusion in competitive StarCraft II , but Serral 's post-match comments gave the end result an added air of inevitability.\nJuly 27, 2025 - Joona \"Serral\" Sotala from Finland, representing Team BASILISK, has been crowned the champion of the StarCraft II tournament at the Esports World Cup (EWC) 2025 .\nStarCraft 2 EWC 2025 Tournament - Esports World Cup 2025 $700,000 Grand Final - Serral vs Classic - Serral's next level Zerg strategy fights for the StarCraf... Published July 28, 2025\nStarCraft 2 Grand Finals between Serral and Clem at the $20,000 Maestros of the Game tournament held in Paris delivers some of the greatest professional play... Published October 8, 2025\n1 month ago - StarCraft is a real-time strategy video game developed and published by Blizzard Entertainment for Microsoft Windows. The first installment of the video game series of the same name, it was released in 1998. A Classic Mac OS version was released in 1999, and a Nintendo 64 port co-developed ...\nApprox. Total Winnings: ... Approx. Winnings 2026: ... Joona \"Serral\" Sotala (born March 22, 1998) is a Finnish Zerg player who is currently playing for BASILISK. ... Although Serral has kept a relatively low profile, he has had some appearances in major tournaments.\nJanuary 14, 2026 - StarCraft II: Heart of the Swarm is an expansion pack to the military science fiction real-time strategy game StarCraft II: Wings of Liberty, and the second part of the StarCraft II trilogy developed by Blizzard Entertainment, with the final part being Legacy of the Void.\nThis is the best 2v2 series in StarCraft 2 I've ever seen. Serral & Elazer take on ShoWTimE & Trigger.Support my work: https:\/\/patreon.com\/lowkotvThe best Di... Published August 30, 2025\nSeptember 5, 2022 - Innovation sice dokázal výsledkem 3:1 posunout Serrala do losers bracketu, ale co ho nezabilo, to ho posílilo, a tudíž milý Serral i z LB celý turnaj vyhrál. Na konto si tedy připočetl 14 000 $ a Reynor za 2. místo pěkných deset tisíc dolarů. V nejplodnějším roce, minimálně co se střetů našich rivalů týče, tedy i navzdory většinovému vítězství Serrala, platí, že Reynor jej obral o neuvěřitelných 30 200 $ a to samozřejmě díky Blizzconu, přesněji WCS Global Finals. Má to však jeden háček, na různých místech světa se musí odvádět různě velká daň z vyhraného prize money.\nStarCraft 2 2026 LiuLi Cup Finals Tournament - $10000 GRAND FINALS - Serral vs Maru - The top 2 players in StarCraft 2 history battle it out in an EPIC SC2 t... Published 3 weeks ago\nEsports profile for StarCraft II player Joona \"Serral\" Sotala: $1,866,325.57 USD in prize money won from 184 tournaments ."
        ],
        "response":"Serral vyhrál mistrovství světa ve hře StarCraft 2 na Esports World Cup (EWC) 2025, kde porazil Kim \"Classic\" Doh-woo ve finále [doc1]. Tato výhra mu přinesla titul nového světového šampiona [doc1]. Celkově se jedná o jeho třetí mistrovství světa [doc1].",
        "reference":"Serral vyhrál mistrovství světa ve StarCraft II v roce 2025, konkrétně Esports World Cup 2025.",
        "faithfulness":1.0,
        "answer_relevancy":0.9755148457,
        "answer_correctness":0.7330979902,
        "context_precision":0.9999999999,
        "context_recall":1.0,
        "context_sufficiency":1.0
    },
    {
        "user_input":"How much the flash costs in CS2",
        "retrieved_contexts":[
            "CS 2 Cases (also known as Weapon Cases) were introduced in the Arms Deal update. Players have a chance to receive a case at the end of a match.Which CS 2 Weapon Cases are dropping? Weapon Case drops fall into one of three categories, Prime, Rare and Discontinued.\nCheck price data, market statistics, and previews for every CS 2 skin.\nBuy and sell CSGO and CS 2 skins instantly on Market CSGO. Safe trades, low fees, and best prices. Trade CSGO items or sell your CS 2 skins today.\nCS 2 Window Flash for INFERNO T SIDECS2 Inferno Nades Guide: https:\/\/youtu.be\/13W4fbuPBPs?si=Ob0RFLQH3thaHDs- Check out my Main YouTube Channel https:\/\/www....\nSubscribe to download CS 2 FPS BENCHMARK DUST2.A benchmark for testing CS 2 performance and FPS, it simulates typical things that would happen during a usual round like bomb plants, nade throws, gunfire, smoke spams, etc...\nCS:GO - iBUYPOWER Masters 2017 Day 2 Match Discussion.\nCompare CS 2 skin prices across 20+ markets. Free trade up calculator, inventory checker, and real-time market analytics.\nEchipa noastră de experți a evaluat multe site-uri de jocuri de noroc CS 2 . Fiecare site care este listat pe CS 2 Mars a fost recenzat și testat de noi.\nMessage Full Fade in CS2 explained: Skins, models and the best choices appeared for the first time on CS.Money Blog.\n... performance changes when you tweak settings. cl_showfps 1 is a simple number; net_graph 1 shows more info (ping, loss, etc.) at the cost of ...\nEnder's adobe flash cs2 : no as not of the MP3s in the property when Ender upgrades executed his particular ID are required to find long.\nIn CS2 , skins are not just flashy skins, but are actually digital valuables that have real-world value, derived from their item rarity, condition ...\n... flash thrust, buy grenades instead of armor or place a ... Message Ultimate Economy Guide: How the money works in CS2 appeared first on CS.Money Blog.\nThe following decline in performance and lack of results might be a result of no team improvement and lack of motivation, as BC.Game didn't manage to ...\nValve’s latest CS2 update has sent shockwaves through the in -game skin market , causing a record-breaking $2 billion wipeout in market value within ...\nBut for long-time skin holders and traders, the sudden price drop turned inventories that once looked like digital trophies into reminders of a ..."
        ],
        "response":"Regarding the cost of a flash in CS2, the provided context mentions \"buy grenades instead of armor or place a...\" [doc 1]. However, it does not specify the exact cost of a flash.",
        "reference":"The flash in CS2 costs 200$.",
        "faithfulness":0.6666666667,
        "answer_relevancy":0.0,
        "answer_correctness":0.2140048793,
        "context_precision":0.0,
        "context_recall":0.0,
        "context_sufficiency":0.0
    },
    {
        "user_input":"What software company is headquartered in Redmond, Washington?",
        "retrieved_contexts":[
            "Its home since 1996, the Microsoft campus in Redmond , Washington is one of the state’s most unique locations neighboring a vibrant urban core ...\n... Microsoft ’ s Redmond , Washington ... One response to “ Microsoft ’ s Redmond , Washington Campus Abundant with Apple iPods ”\nAs the home of Microsoft , Redmond is often considered the heart of the tech industry in the region, drawing skilled workers from around the world.\nMicrosoft is reportedly considering a plan that would greatly renovate its current headquarters campus in Redmond , Washington . The plan, which would ...\nWednesday night, most of our senior IT management traveled to Redmond , Washington to spend a couple of days meeting with Microsoft .\nRedmond is famous for being home to Microsoft Corporation and it has a large presence over the area. ... Washington and connect the East Side ...\nSpace Needle in Seattle – “The 400 Day Wonder” on Microsoft Visitor Center Redmond , Washington – Vision of the Future\nRedmond , WA, USA - Jan 14, 2024: Microsoft ... REDMOND , WASHINGTON , USA- SEPTEMBER 3, 2015:panning exterior view of microsoft headquarters building.\nRedmond is a satellite city of Seattle with a thriving tech industry, especially known for Microsoft's global headquarters. Learn about 16 local tech companies and startups in Redmond, from Pushpay to Helion Energy, and their products and services.\nMicrosoft Corporation is an American multinational technology company with headquarters in Redmond, WA. It develops, manufactures, licenses, supports, and sells computer software , consumer electronics, personal computers, and related services.\nThe best technology companies to work for in Redmond, WA are Microsoft, Nintendo, Ilink Systems and more. Find out what it is like to work at technology companies big and small across Redmond and find the right place to work for.\nMicrosoft Corporation is a technology company headquartered in Redmond, Washington . The Company develops, licenses, and supports a range of software products, services and devices.\nMicrosoft Corporation is an American multinational technology conglomerate headquartered in Redmond, Washington . Founded in 1975, the company became influential in the rise of personal computers through software like Windows, and has since expanded to Internet services, cloud computing, artificial intelligence, video gaming, and other fields.\nDetailed info and reviews on 49 top companies and startups in Redmond in 2026. Get the latest updates on their products, jobs, funding, investors, founders and more.\nList of companies based in Redmond, Washington This is a list of companies based in Redmond, Washington , United States. Although Redmond is a metonym for Microsoft, [1][2] the city's largest employer, [3] it has many other businesses as well. Aerial view of an office parks in Redmond, Washington , August 2009\nList of Software companies in Redmond There are 185 Software companies in Redmond as of October 15, 2025; which is an 0.00% increase from 2023. Of these locations, 178 Software companies which is 96.22% of all Software companies in Redmond are single-owner operations, while the remaining 7 which is 3.78% are part of larger brands."
        ],
        "response":"Regarding software companies, Microsoft Corporation is an American multinational technology company headquartered in Redmond, Washington [doc 1].",
        "reference":"Microsoft Corporation.",
        "faithfulness":1.0,
        "answer_relevancy":0.8751419343,
        "answer_correctness":0.5972605964,
        "context_precision":0.9999999999,
        "context_recall":1.0,
        "context_sufficiency":1.0
    },
    {
        "user_input":"Who was the Ancient Greek God of the Sun?",
        "retrieved_contexts":[
            "sort of divinity which expressed itself in language amazing to the modern mind. In the ancient monarchies of Egypt and Babylon the royal deity was the fundamental assumption of government, and it was represented upon the monuments beside the Nile with startling realism. In later days the Greek title Theos (god) was boldly assumed by the sovereigns of Egypt and Syria. It was conferred, with the associated epithet Sotér (Saviour or Preserver), as early as 307 B.c., on Demetrius and his father Antigonus, who liberated Athens from the tyranny of Cassander. On the Rosetta stone (in the British Museum) Ptolemy V, 205 B.c., claims the same dignity, and is described as “eternal-lived,\" and “the living image of Zeus.\" Ephesus designated Julius Cæsar as “God manifest",
            "Wesens. Der Grieche verehrte die Sonne — Helios — und schuf sich daraus den Gott Apollon; aus dem Monde — Selene — die Diana; aus dem Ozean den Poseidon. Er schuf sich eine Menge Naturgötter, die seine Künstler mit Meisterhand in schöner menschlicher Gestalt darstellten. Die griechischen und römischen Bildner und Dichter schufen in schrankenloser Phantasie dem Volke Fetische, die freilich nicht wie bei den wilden Völkern hässlich und ekelhaft waren, sondern in musterhafter Schönheit die Sinne reizten und als Symbole auf die Arier bis in die Gegenwart übergingen. Gott wurde von den Griechen in unendlich viele Theile zerlegt und anthropomorphosirt. Nach den griechischen Dichtern sind die Götter den Menschen missgünstig, neidisch; Homer lässt sie unsittlich,",
            "v pravé ruce má bohyně kormidlo na znamení, že řídí osudy lidské, v levé drží roh hojnosti, z něhož uděluje lidem požehnání. Ještě krásnější jest jiná socha vatikánská, obr. 40, kopie slavné bronzové sochy od Eutychida, žáka Lysippova; představuje Tychu města Antiochie nad Orontem (v Syrii), ana sedí na skále. Jakožto ochranitelka města má na hlavě korunu hradební, jako bohyně úrodnosti drží v pravici klasy. U jejích nohou vytéká ze skály řeka Orontes.  3. Bohové zjevů nebeských.  ('нλος, Hελος, Sol.)  Helios, bůh slunce, jest syn Titana Hyperiona (t. j. Vysokokráčejícího, pročež se Helios také περiovidna nebo πεgícv nazývá — Od. I 8 a 24) a Titanky Theie (Hes. Theog. 371 nn.) anebo Euryfaëssy (hym. 31, 2); jmenuje se proto také obzvláště Titan. Helios jest bůh krásný, mohutný a bujarý, s jiskrnými zraky a"
        ],
        "response":"Regarding the Ancient Greek God of the Sun, the context identifies **Helios** as the Greek god of the sun [doc 1], [doc 3]. He is described as the son of Titan Hyperion and Titaness Theia or Euryfaessa [doc 3]. Helios is also referred to as a Titan [doc 3].",
        "reference":"The Ancient Greek God of the Sun was Apollo.",
        "faithfulness":1.0,
        "answer_relevancy":0.9802599812,
        "answer_correctness":0.221913262,
        "context_precision":0.5,
        "context_recall":0.0,
        "context_sufficiency":1.0
    },
    {
        "user_input":"Jak se jmenoval první umělý satelit vypuštěný do vesmíru?",
        "retrieved_contexts":[
            "družice v letu kolem Země - živou skutečností, která náhle ovládla mysl všech lidí na světě, prostých občanů i veřejných pracovníků. Není tedy divu, že důležité výzkumy učiněné v rámci MGR a zejména kroužení obou sovětských družic má ohlas i ve známkové tvorbě, která dovede výběrem motivů i pohotovými emisemi citlivě reagovat na události světodějného významu. Vypuštění první umělé družice oslavila sovětská pošta již v listopadu příležitostnou známkou 40 kop., na níž je v modrém tónu vyznačena dráha prvního sputnika a uvedeno datum jeho vypuštění — 4. října 1957. Jak lze tento motiv vyjádřit jinou, ale neméně působivou grafickou metodou, ukazuje nová 10 feniková známka poštovní správy NDR, rovněž z listopadu m. r. Také druhá umělá družice je už vyobrazena na poštovní známce,",
            "družice v letu kolem Země - živou skutečností, která náhle ovládla mysl všech lidí na světě, prostých občanů i veřejných pracovníků. Není tedy divu, že důležité výzkumy učiněné v rámci MGR a zejména kroužení obou sovětských družic má ohlas i ve známkové tvorbě, která dovede výběrem motivů i pohotovými emisemi citlivě reagovat na události světodějného významu. Vypuštění první umělé družice oslavila sovětská pošta již v listopadu příležitostnou známkou 40 kop., na níž je v modrém tónu vyznačena dráha prvního sputnika a uvedeno datum jeho vypuštění — 4. října 1957. Jak lze tento motiv vyjádřit jinou, ale neméně působivou grafickou metodou, ukazuje nová 10 feniková známka poštovní správy NDR, rovněž z listopadu m. r. Také druhá umělá družice je už vyobrazena na poštovní známce,",
            "ské umělé družice. I když se to ruské slovo různě psalo (na příklad u Francouzů „le spoutník“) a často až k nepoznání vyslovovalo, všude bylo přijato jako výraz obdivu a nadšení nad tím velkým dílem, kterým sovětští vědci, technikové i dělníci vskutku uvolnili všemu lidstvu cestu do vesmíru. Oba „sputniky“ na dlouho ovládly pozornost lidí ve všech zemích. Až počátkem prosince se stále častěji začalo psát o tom, že brzy přibude do party umělých družic další společník — „grapefruitový měsíček“, jak byla nazvána ta malá koule o průměru 15—16 cm a o váze něco málo přes půldruhého kila, kterou hodlají vypustit američtí vědci. Po několika dnech napínavého čekání, po mnoha odkladech se konečně řeklo, že vše je přichystáno ke startu. Už tehdy sice novináři v nejrůznějších zemích",
            "dvě ceny Sovětský svaz a třetí cenu Bulharsko a Finsko. V soutěži mužských sólových zpěvů byly uděleny první dvě ceny Sovětskému svazu, třetí cena Bulharsku a Polsku. V soutěži ve hře na housle získal první cenu Edvard Kratč a Igor Oistrach (Sovětský svaz), druhou cenu Vojan Lečev (Bulharsko), Sobalewski (SSSR) a Wanda Wilkomirska (Polsko). Třetí cenu dostaly Maďarsko a Sovětský svaz. Ceny v soutěži ve hře na violoncello získal Sovětský svaz. První cenu v sólové hře na klavír vyhráli Tamara Guseva a Malinin (SSSR), druhou cenu získal Gheorgiu Valentin (Rumunsko). Moravlev (Sovětský svaz) a Kornel Zembleni (Maďarsko), zatím co třetí cenu získal Ivan Moravec (Československo) a Emil Rošar (Bulharsko). V soutěži hry na dechové nástroje získalo první cenu Československo, druhé ceny Maďarsko a Sovětský svaz, třetí ceny Maďarsko. Sovětský svaz a Bulharsko.",
            "pathosem tenkrát vykládal, že do ny nazvané „ruský měsíček-mitýdne bude v USA vyslána do prostoru první umělá družice Země, minko“, se mění v radostné nadšení lidu všech zemí celého světa. která sice má sloužit vojenským Posluchači přednášek dr. Hujera potřebám, ale jednou v budoucnosti doufají, že i američtí vědci se kopřispěje i civilní vědě. Na všetečný nečně seznámí s výsledky práce dotaz, co on jako představitel amesovětských vědců a zaujmou k nim rických vědeckých kruhů ví o soodpovědnější stanovisko než náčelvětských výzkumech a přípravě ník námořních operací USA vicemezikontinentálních a meziplaneadmirál Rawson, který podle angtárních raket v SSSR, mimoděk lického listu Daily Minor pronesl přiznal, že nic. zatím „nejhloupější komentář o so-"
        ],
        "response":"První umělý satelit se nazýval Sputnik [doc3]. Jeho vypuštění oslavila sovětská pošta v listopadu 1957 příležitostnou známkou 40 kop., na níž byla vyznačena dráha prvního Sputnika a uvedeno datum jeho vypuštění — 4. října 1957 [doc1].",
        "reference":"První umělý satelit vypuštěný do vesmíru se jmenoval Sputnik 1.",
        "faithfulness":1.0,
        "answer_relevancy":0.9805717941,
        "answer_correctness":0.4493595339,
        "context_precision":1.0,
        "context_recall":1.0,
        "context_sufficiency":1.0
    },
    {
        "user_input":"V jakém městě se nachází NFL Hall of Fame? ",
        "retrieved_contexts":[
            "The NFL ’s 107th season will kick off in Canton on Thursday, Aug. 6, when the Arizona Cardinals play host to the Carolina Panthers in the 2026 Pro Football Hall of Fame Game presented by Novartis.\"\nThe NFL Hall of Fame Village is centered around the Hall of Fame 's campus, and its first phase includes a variety of attractions, such as an interactive museum, a large sports and entertainment complex, and a hotel.\nAnswer 1 of 6: Want to take my 12 year old grandsons to see the NFL and MBL Hall of fames this August. Flying from San Francisco. What would work best to get from one to another?\nA bronze statue of Jim Thorpe \"The Legend\" in the hall of fame in Canton , Ohio. Johnny Unitas jersey. You can read other stories about the first NFL draft, the first championship game in 1933 at Wrigley Field, and Reggie White being the NFL ’s first free agent.\nThings to do in Canton . Pro Football Hall of Fame .Well, the NFL Hall of Fame is Outstanding! Parking during construction is a bit of an issue however, it's worth it. The history of the game is Fandamntastic and the early equipment is amazing.\nWe have visited the Pro Football Hall of Fame , and we highly recommend it to those with an interest in sports and the NFL !Downtown Canton is 3.5 miles to the southeast. Interactive Map of the Canton , Ohio Area. Lodging Options Near the Pro Football Hall of Fame .\nO.J. Simpson, inducted into the Pro Football Hall of Fame in 1985, rushed for 11,236 yards in an 11-year NFL career, and he was the first running back to top 2,000 yards rushing in a season with 2,003 in 1973.\nThe Pro Football Hall of Fame is the hall of fame for professional football in the United States with an emphasis on the National Football League ( NFL ). The hall opened in Canton , Ohio , on September 7, 1963, with 17 charter enshrinees.\nOn Saturday night the NFL enshrined seven new members into the Football Hall of Fame .into the Football Hall of Fame . I watched the ceremony. and was inspired by the speeches.\nOwen, 49, played 15 seasons in the NFL , racking up nearly 16,000 receiving yards and 153 touchdowns. He was inducted into the Pro Football Hall of Fame in 2018.\nA football legend is headed to Binghamton this spring. The Greater Binghamton Sports Hall of Fame has announced that Harry Carson, a former linebacker for the New York Giants, will be the featured speaker at the organization’s 11th Annual Induction Dinner.\nYou’re eligible for the Pro Football Hall of Fame next year. History says that former Cowboys quarterback Tony Romo will not make the Hall of Fame . Do you believe he should make it? DeMarcus Ware: “From his resume, yes. If it’s going off championships, no.\nHe joined ESPN in 2015, writes regularly for ESPN+ and spent multiple years on \" NFL Matchup.\" After graduating from the University of Iowa, Matt played safety in the NFL for St. Louis, Green Bay, Washington and Buffalo over seven seasons.\nNFL Hall of Famer Randy Moss explains sunglasses on air: ‘Battling something’.(NEXSTAR) — NFL Hall of Fame wide receiver Randy Moss has sparked concerns about his health after sharing that he may be wearing sunglasses while on TV.\nProfessional American football league . \" NFL \" redirects here.The NFL preseason begins with the Pro Football Hall of Fame Game, played at Tom Benson Hall of Fame Stadium in Canton, Ohio.[75] Each NFL team is required to schedule three preseason games.\nGet the full schedule for the 2025 NFL season, including matchups, dates, times and TV and ticket information."
        ],
        "response":"NFL Hall of Fame se nachází v Canton, Ohio [doc1]. Otevřela se 7. září 1963 [doc1].",
        "reference":"NFL Hall of Fame se nachází v městě Canton v americkém státě Ohio.",
        "faithfulness":1.0,
        "answer_relevancy":0.8648884128,
        "answer_correctness":0.6116484208,
        "context_precision":0.9999999999,
        "context_recall":1.0,
        "context_sufficiency":1.0
    },
    {
        "user_input":"Jaká televizní sério od HBO adaptuje události z roku 1986 související z havárií jaderné elektrárny na Ukraině? ",
        "retrieved_contexts":[
            "Chernobyl è la nuova serie TV di SKY e HBO che racconta il disastro che coinvolse la centrale nucleare di Č ernobyl tra il 25 e il 26 Aprile 1986 e ...\n... ei anna kovinkaan ruusuista kuvaa vuoden 1986 ... HBO vie keskelle Tšernobylin kauhuja – tältä näyttää katastrofista kertova uutuussarja\n... HBO , ideata e scritta da Craig Mazin e diretta dallo svedese Johan Renck , la serie cerca di raccontare l’eziologia e le conseguenze di uno dei ...\nVuonna 1986 sattunut ydinvoimalaonnettomuus toi Tšernobylin ja Pripjatin kaupungin koko maailman tietouteen. ... Tš ernobyl ei ole matkailukohde ...\nLa miniserie si concentra sulla portata devastante dell'incidente nucleare di Č ernobyl ' che si verificò nell' Ucraina sovietica il 26 aprile 1986 ...\nLa notte tra il 25 e il 26 aprile 1986 , il reattore 4 della centrale nucleare di Č ernobyl ‘ esplode, liberando nell’atmosfera radiazioni mille ...\nIl disastro nucleare di C ernobyl ’ viene ricostruito attraverso le voci di chi nel 1986 era lì. ... 1986 alle ore 01:23:45, nel momento in cui ...\n... sull’emittente italiana «La 7» la replica in chiaro dello sceneggiato televisivo dedicato alla catastrofe di Č ernobyl ’ , prodotto da HBO ...\nNovember 14, 2025 - Historická minisérie z produkce HBO se zabývá jednou z největších havárií 20. století – výbuchu 4. reaktoru jaderné elektrárny Černobyl na Ukrajině dne. 26. dubna 1986. Napínavý šestidílný seriál pak popisuje vyšetřování této tragické události a lidskou snahu co nejvíce minimalizovat následky ekologické katastrofy.\nAugust 12, 2025 - Černobyl (v anglickém originále Chernobyl) je dramatický televizní seriál z roku 2019. Vznikl v koprodukci americké HBO a britské Sky, premiérově byl uveden 6. května 2019.\nJune 3, 2020 - The Chernobyl series from 2019 has only five parts, but it is really captivating - it grabs you and won't let go. It tells about the tragic accident of the nuclear power plant in 1986 - about its actors, victims, and about the effects it had ...\nMay 7, 2019 - Uprostřed noci – přesně v 01.23,45 – dochází během plánové technické zkoušky k explozi 4. bloku jaderné elektrárny Černobyl. A právě čas výbuchu je i název prvního dílu nové minisérie HBO. Díky ní diváci uvidí nejen okamžité vyšetřování exploze, kterou tehdejší Sovětský svaz tajil, ale i následné příběhy lidí. I 33 let po havárii Černobylu jsou na Šumavě radioaktivní divočáci.\n3 days ago - Havárii, jejím dopadům, či prostředí Černobylské elektrárny a opuštěných okolních měst se věnuje řada dokumentárních filmů. Natočeny byly také celovečerní dramatické snímky inspirované skutečnou událostí, i filmy zcela fikční (sci-fi, horor).\nJune 5, 2019 - I tady vznikl “algoritmus na jedno použití” – ten se na pár vteřin zjeví, způsobí katastrofu, udiví unikátním průběhem událostí a jako neopakovatelný úkaz zase zmizí. Za slova “reaktor” a “lidský faktor” si nakonec můžeme dosadit ledacos – třeba umělou inteligenci, strojové algoritmy obsluhující finanční toky, obyčejné letadlo nebo Facebook. Rusové podobně jako Češi věří své technice a svým vědcům. Jeden z nich krátce předtím, než spáchal sebevraždu, napsal toto: „Celý život jsem bojoval za jaderné elektrárny.\nJune 25, 2022 - Pět dílů a pět hodin. A i když je havárie černobylské jaderné elektrárny v roce 1986 známá událost, neodtrhnete oči od obrazovky a chvílemi nebudete dýchat napětím. Příběh z dílny HBO a Sky mapuje průběh havárie, ale rozhodně nejde o dokument rekonstruující fakta.\nMay 31, 2019 - Byl to on, kdo přišel za producenty televizí HBO a Sky s nápadem převyprávět příběh jaderné havárie, ke které došlo roku 1986 v tehdejším Sovětském svazu. Výsledný seriál většina recenzentů líčí s úžasem a úctou, hodnocením 9,7 z 10 bodů jej uživatelé databáze IMDB vyhnali na vrchol žebříčku nejlepších televizních děl."
        ],
        "response":"Televizní seriál Černobyl (v anglickém originále Chernobyl) je dramatický televizní seriál z roku 2019. Vznikl v koprodukci americké HBO a britské Sky, premiérově byl uveden 6. května 2019 [doc1]. Seriál se zabývá výbuchem 4. reaktoru jaderné elektrárny Černobyl na Ukrajině dne 26. dubna 1986 [doc1]. Seriál má pět dílů [doc1]. Byl vytvořen Craigem Mazinem a režíroval ho Johan Renck [doc1]. Seriál mapuje průběh havárie [doc1]. Většina recenzentů líčí seriál s úžasem a úctou [doc1].",
        "reference":"Série od HBO, která adaptuje události z roku 1986 související s havárií jaderné elektrárny na Ukrajině, se jmenuje \"Chernobyl\".",
        "faithfulness":1.0,
        "answer_relevancy":0.8674494569,
        "answer_correctness":0.8973077004,
        "context_precision":0.9999999999,
        "context_recall":1.0,
        "context_sufficiency":1.0
    },
    {
        "user_input":"Which composer pioneered the 12-tone technique?",
        "retrieved_contexts":[
            "tempting to a number of surgeons, often supported by innovative hepatologists. The reason for this been to date-in clinical practice-a man-made technique of liver function replacement to be used on a routine basis the way dialysis can be used in renal failure. Drawing on results from animal experiments [1], development of the technique of total hepatecin renal transplant recipients, Starzl pioneered, in the early 1960s, human orthotopic liver transplansurvive the procedure or died soon after surgery, the impressive endeavour of the US team, with European teams following suit [4], resulted in progressive improvement of the technique of liver graft removal and its implantation, intraoperative and postoperative management and immunosuppression. A breakthrough came in the late 1970s with the",
            "Neue Orchestermusik in Berlin. Uraufführungen von Honegger, Strawinsky und Krenek. So bunt, so vielfältig bewegt das Leben unserer Zeit, so verschieden und mannigfaltig ist auch ihr musikalischer Ausdruck, das Schaffen der modernen Komponisten. Langsam be= ginnt sich das Chaos der letzten Jahrzehnte zu klären, lernen wir Echtes von Gemachtem, Schlagwort von Idee unterscheiden. Drei große Richtungen heben sich heraus: der noch in der Spätromantik verwurzelte Impressionismus, dessen Haupt Debussy war; der Atonalismus des Kreises um Schönberg, und der Klassizismus, den Strawinsky seit der Klaviersonate und dem „Oedipus Rex“ erstrebt. Selbstverständlich gibt es zwischen diesen Stilen Bindungen, Mischungen; und daneben eine Reihe von Komponisten, die andere",
            "anzuhören jedoch kein Genuß, besonders wegen der gequälten und quälenden Behandlung der Singstimmen, Welcher Gegensatz, zu denken, wie desselben Dichters Schicksalslied von Brahms vertont wurde! Zuletzt von Scönberg die seit vielen Jahren hier nicht erklungene Dichtung Pelleas und Melisande, immer noch imponierendes Hauptwerk des Sinfonikers Schönberg von einst, der mit zwölf Tönen wunderbar komponierte, ohne Zwölftonmusik zu erklügeln. Auch Englisches gab es, unter der Leitung des sehr gepflegten, manchmal allzu phlegmatischen Londoner Dirigenten Adrian Boult. Ein im Stil des Concerto grosso sehr ansprechendes Werk „Introduktion und Allegro“ für Streichquartett und Streichorchester vom Altmeister Edward Elgar, und von dem weit rebellische rem Gustav Holst eine temperamentvoll lär-"
        ],
        "response":"Regarding composers, Schönberg pioneered the 12-tone technique [doc 3].",
        "reference":"Arnold Schoenberg pioneered the 12-tone technique.",
        "faithfulness":1.0,
        "answer_relevancy":0.9754213714,
        "answer_correctness":0.6102055744,
        "context_precision":0.3333333333,
        "context_recall":1.0,
        "context_sufficiency":0.0
    },
    {
        "user_input":"Mateřské mléko jakého zvířete je přirozeně růžové?",
        "retrieved_contexts":[
            "Jan 5, 2018 · Růžové mateřské mléko už rozebírají maminky na webu eMimino. Podívejte se na jejich rady a přidejte do diskuze své zkušenosti.\nTvorba mateřského mléka je ovlivněna prolaktinem, jeho uvolňování z prsní žlázy pak oxytocinem. Hladiny prolaktinu je možno ovlivnit léky – především agonisty dopaminu– které se používají k zástavě laktace. Oxytocin je dále odpovědný za rozvoj citového vztahu matka\/dítě. See full list on cs.wikipedia.org Mimo živin se v mateřském mléce nachází různé imunitní složky. Můžeme v něm najít cytokiny, protilátky, solubilní receptory, růstové faktory i imunitní buňky. Díky těmto složkám mateřské mléko působí pozitivně na vývoj novorozence, posiluje jeho imunitní systém při infekcích a podílí se také na vývoji jeho imunitního systému.Mimo toho se v mateřské... See full list on cs.wikipedia.org Mateřské mléko u člověka má snížený obsah bílkovin než jiné savčí druhy, což je způsobeno tím, že u novorozence se vyvíjí hlavně mozek. Z bílkovin je zastoupen hlavně laktalbumin a menší část připadá kasein. Tuky tvoří v mateřském mléce proměnlivou složku v závislosti na stravovacích návycích matky. Velká část tuků připadá na nenasycené mastné kyse... See full list on cs.wikipedia.org Literatura 1. Mysliveček J., Trojan S. Fyziologie do kapsy. Triton, 2004. Související články 1. Laktace 2. Kojení Externí odkazy 1. Obrázky, zvuky či videa k tématu mateřské mléko na Wikimedia Commons 2. Význam kojení, wikiskripta.eu 3. Mateřské mléko - první strava života, vareni.cz See full list on cs.wikipedia.org Nov 18, 2021 · Za tímto zbarvením může být poměrně závažný důvod – bakteriální infekce. Mateřské mléko může zrůžovět v přítomnosti Serratia marcescens, gramnegativní bakterie z čeledi enterobakterií, která může být pro kojence nebezpečná. Takové případy jsou však naštěstí velmi vzácné. • 🟠 Mléko může být naoranžovělé nebo růžové – podle stravy maminky • 🧬 Obsahuje enzymy, mikroRNA, a dokonce i kmenové buňky Tělo ví přesně, co dítě potřebuje – a přizpůsobí se mu v reálném čase. 👉 Tohle není jen výživa. To je živý organismus. Už jsi někdy viděla „barevné“ mateřské mléko ... Pokud máte podezření, že víte, odkud pochází nejnovější barva mateřského mléka (například jste hltali zelené smoothie a vaše mléko vypadá trochu zeleně), není důvod volat lékaře, pokud chcete nějaké ujištění nebo máte jiné otázky. Jak voní mateřské mléko ? Většina maminek vám potvrdí, že lidské mateřské mléko voní jako kravské, ale je řidší a sladší. Někdo odpoví, že mléko má „mýdlovou“ vůni. To je způsobeno vysokými hladinami lipázy, enzymu, který podporuje trávení tuků. Jan 5, 2018 · Růžové mateřské mléko už rozebírají maminky na webu eMimino. Podívejte se na jejich rady a přidejte do diskuze své zkušenosti.\nAčkoli to může být šokující a děsivé vidět, to je normální pro mateřské mléko měnit barvu a odstín. Tyto změny jsou obvykle spojené s výživou a nejsou nebezpečné.\nJak voní mateřské mléko ? Většina maminek vám potvrdí, že lidské mateřské mléko voní jako kravské, ale je řidší a sladší. Někdo odpoví, že mléko má „mýdlovou“ vůni. To je způsobeno vysokými hladinami lipázy, enzymu, který podporuje trávení tuků.\nPokud máte podezření, že víte, odkud pochází nejnovější barva mateřského mléka (například jste hltali zelené smoothie a vaše mléko vypadá trochu zeleně), není důvod volat lékaře, pokud chcete nějaké ujištění nebo máte jiné otázky.\nJsme tu opět tradičně s novou nabídkou za skvělé ceny. Teď mléko v akci. Podívejte se také na další produkty z aktuální akční nabídky Kauflandu.\n• 🟠 Mléko může být naoranžovělé nebo růžové – podle stravy maminky • 🧬 Obsahuje enzymy, mikroRNA, a dokonce i kmenové buňky Tělo ví přesně, co dítě potřebuje – a přizpůsobí se mu v reálném čase. 👉 Tohle není jen výživa. To je živý organismus. Už jsi někdy viděla „barevné“ mateřské mléko ...\nNov 18, 2021 · Za tímto zbarvením může být poměrně závažný důvod – bakteriální infekce. Mateřské mléko může zrůžovět v přítomnosti Serratia marcescens, gramnegativní bakterie z čeledi enterobakterií, která může být pro kojence nebezpečná. Takové případy jsou však naštěstí velmi vzácné.\nAle pokud jste kojení nováčkem, možná si nejste vědomi různých barev mateřského mléka. Můžete předpokládat, že mateřsk é mléko je stejné barvy jako receptura nebo kravské mléko . Přesto se jeho barva může značně lišit. Nebojte se! Produkce různých barev mateřského mléka obvykle není důvodem k obavám.\nSakra, někdy je mateřsk é mléko růžov é, jak se nedávno ukázalo na TikToku, když se jedna matka stala virální kvůli odsávání mléka v odstínu jahodového koktejlu. Proč ale vaše mateřsk é mléko mění barvu a jsou tyto změny důvodem k obavám? Zde je vše, co potřebujete vědět o barvě svého mateřského mléka.\nMléko žen kuřaček obsahuje nikotin, který snižuje tvorbu mléka a nepříznivě ovlivňuje chování a vývoj dítěte. Pije-li žena mnoho kávy, obsahuje mléko kofein, který u dítěte vyvolává zažívací potíže a neklid. Malé množství alkoholu neškodí, ale ani neprospívá.\nSvětlé, neonově růžov é mateřsk é mléko může být známkou bakteriální infekce. Červené mléko může být důsledkem zbarvení potravin nebo krve v důsledku poranění prsu během kojení nebo odsávání.\nObjevte tajemství mateřského mléka, které obsahuje stovky prospěšných látek specifických pro člověka. Zjistěte, proč je zlatým standardem ve výživě kojenců.\nRůžov é mateřsk é mléko už rozebírají maminky na webu eMimino. Podívejte se na jejich rady a přidejte do diskuze své zkušenosti.\nVidět změny barvy v mateřském mléce je naprosto normální. I když to může být překvapivé - a občas alarmující - téměř vždy to není důvod k obavám. Když jsem procházela kojením, neslyšela jsem mnoho o různých barvách mléka a měla jsem svůj podíl na obavách z překvapivých změn odstínu.\nMateřské mléko je mléko produkované laktací v mléčných žlázách uložených v prsou sloužící k výživě novorozeného potomka. Mateřské mléko je přirozená strava pro novorozence, která by měla poskytnout veškeré potřebné látky pro růst organismu."
        ],
        "response":"K tomuto tématu chybí v dostupných pramenech podklady.",
        "reference":"Mateřské mléko hrocha je přirozeně růžové.",
        "faithfulness":0.0,
        "answer_relevancy":0.0,
        "answer_correctness":0.1940317896,
        "context_precision":0.9999999999,
        "context_recall":0.0,
        "context_sufficiency":1.0
    },
    {
        "user_input":"Ve kterém sci-fi seriálu se objevuje policejní budka zvaná TARDIS?",
        "retrieved_contexts":[
            "Tardis is the main DOCTOR WHO wiki at FANDOM. We cover all fully-licensed material having to do with the DOCTOR WHO universe. Whether you're looking for the DOCTOR WHO pinball machine, CLASS novels, BIG FINISH audios, TORCHWOOD directors and crew, the 1965 Dalek Annual, or the latest exploits of Sarah Jane Smith and K9—our Tardis is the place for you.\nTwo long-missing episodes of the BBC's science-fiction series Doctor Who have been recovered over six decades after their original broadcast in a \"ramshackle collection\" donated by a collector.\nThe TARDIS (\/ ˈtɑːrdɪs \/; acronym for \" Time And Relative Dimension (s) In Space \") is a fictional hybrid of a time machine and spacecraft that has, since 1963, appeared in the British science fiction television series Doctor Who and its various spin-offs. While a TARDIS is capable of disguising itself, the exterior appearance of the Doctor 's TARDIS typically mimics a police box, an ...\nIts police box exterior hides infinite worlds inside, sparking wonder across generations. Whether escaping Daleks or bonding with companions, the TARDIS continues to define what makes sci-fi magical.\nDoctor Who fans will be treated to two rarely-seen-before episodes in April to fill the Tardis -shaped hole in your heart.\nIn major news for Doctor Who fans, two of the sci-fi show's long missing episodes have just been uncovered, found in a deceased enthusiast's private collection. The episodes, both of which star ...\nA film charity has uncovered two episodes of sci-fi series \" Doctor Who \" that were long believed lost.\nA recent find from what the BBC describes as a collector's \"ramshackle collection of vintage films\" brought two new (old) episodes of the British sci-fi show to light.\nThe Doctor). Doktor cestuje ve své lodi TARDIS , která zvenčí vypadá jako modrá britská policejní telefonní budka z 60. let, což byl běžný pohled v Británii, když seriál v roce 1963 začínal. Se svými společníky a společnicemi zkoumá vesmír a čas, řeší problémy a napravuje škody.\nCestuje ve své lodi Tardis , která zvenčí vypadá jako britská policejní budka z 50. let a se svými společnicemi zkoumá vesmír a čas, řeší problémy a napravuje škody. Doctor je mimozemšťan, pochází z planety Gallifrey, ale vypadá jako člověk.\nDoktor cestuje za dobrodružstvími ve své lodi TARDIS , která zvenčí vypadá jako modrá britská policejní telefonní budka , jež byla v Británii velmi běžná v 60. letech, kdy seriál začínal. Pán času je Guinnessovou knihou rekordů zapsán jako nejdéle vysílaný sci-fi seriál.\nTo však některým lidem\/bytostem nestačí, odtud titulní otázka \"Doktor Kdo?\". Cestuje časem a prostorem ve stroji času, kterému říká TARDIS . Tato jeho loď, která vypadá zvenčí jako malá policejní budka , má téměř nekonečné vnitřní rozměry.\nThe Doctor. Doktor cestuje ve své lodi TARDIS , která zvenčí vypadá jako britská policejní budka z 50. let, což byl běžný pohled v Británii, když seriál v roce 1963 začínal. Se svými společníky a společnicemi zkoumá vesmír a čas, řeší problémy a napravuje škody.\nPomocí své TARDIS , která zvenčí vypadá jako nenápadné modrá policejní budka , se vydal na cestu prostorem a časem. Seriál se stal obrovským hitem, a později i legendou stejně velkou, ne-li ještě větší než je třeba James Bond.\nDoktor cestuje ve své časoprostorové lodi TARDIS (Time And Relative Dimensions In Space), s níž se může dostat kamkoli v čase a prostoru. Protože má TARDIS rozbitý chameleonový obvod, vypadá trvale jako stará britská policejní budka .\nV lodi, vypadající jako modrá anglická policejní budka z 50. let, která je vybavena porouchaným chameleoním okruhem, díky němuž vypadá zevnitř mnohem větší než navenek."
        ],
        "response":"TARDIS se objevuje v britském sci-fi televizním seriálu Doctor Who a jeho spin-off projektech [doc1]. TARDIS je zkratka pro \"Time And Relative Dimension(s) In Space\" [doc1]. Zvenčí vypadá jako britská policejní telefonní budka z 50. nebo 60. let [doc1]. Má porouchaný chameleonový obvod, proto trvale vypadá jako policejní budka [doc1].",
        "reference":"Ve seriálu \"Doctor Who\" se objevuje policejní budka zvaná TARDIS.",
        "faithfulness":1.0,
        "answer_relevancy":0.8289251608,
        "answer_correctness":0.4464081495,
        "context_precision":0.9999999999,
        "context_recall":1.0,
        "context_sufficiency":1.0
    },
    {
        "user_input":"Kdo je autorem článku CRAG (Corrective Retrieval Augmented Generation)?",
        "retrieved_contexts":[
            "jiný, ale pravda je, že profesor Ursíny v osudný den sám se k článku přihlásil. Druhý „autor“ se ke článku přihlásil teprve, když prof. Ursíny zvěděl, že o politické bezcharakternosti budeme psáti, ale žádných důkazů pro své tvrzení nám nepodal. Také nikomu jinému se neprohlásil a vůbec na veřejnost se neodvážil. To je přece hodně podezřelé jednání! Ostatně, kdo zná intimní styky prof. Ursínyho s tímto „tichým“ autorem, nebude nikdy tvrditi, že by pan profesor byl jiného smýšlení. Nejvýš by se dalo souditi, že článek je společným výrobkem. = Nejlepší německý muž. V minulém týdnu v Brně zemřel vehní komisař finanční stráže v. v. Frant. Proksch. Před lety často jsme psali v „Lidových Novinách“ o p. Prokschovi. Byl jedním z bezohledných germanisatorů, jenž ve"
        ],
        "response":"Profesor Ursíny se k článku přihlásil v osudný den. Druhý „autor“ se ke článku přihlásil až poté, co profesor Ursíny zjistil, že bude psáno o politické bezcharakternosti [doc1]. Nejvýše by se dalo soudit, že článek je společným výrobkem [doc1].",
        "reference":"Autory článku CRAG (Corrective Retrieval Augmented Generation) jsou Shi-Qi Yan, Jia-Chen Gu, Yun Zhu, Zhen-Hua Ling.",
        "faithfulness":1.0,
        "answer_relevancy":0.0,
        "answer_correctness":0.2035400618,
        "context_precision":0.0,
        "context_recall":0.0,
        "context_sufficiency":0.0
    }
]